id,full_name,owner,name,html_url,description,created_at,pushed_at,stars,forks,watchers,open_issues,primary_language,size,license,age_days,stars_per_day,fork_star_ratio,issue_star_ratio,category
1292280249,xiaotianfotos/homerail,xiaotianfotos,homerail,https://github.com/xiaotianfotos/homerail,Voice-first local agent orchestration runtime for auditable DAG workflows.,2026-07-07 12:11:18+00:00,2026-07-15 08:26:42+00:00,531,125,531,14,TypeScript,8239,MIT,7,75.85714285714286,0.2354048964218455,0.0263653483992467,AI/ML
1271960167,rpanigrahi222/intruth-factcheck,rpanigrahi222,intruth-factcheck,https://github.com/rpanigrahi222/intruth-factcheck,,2026-06-17 06:53:59+00:00,2026-07-06 16:42:44+00:00,525,88,525,3,JavaScript,33,NOASSERTION,27,19.444444444444443,0.1676190476190476,0.0057142857142857,Other
1275781569,axislab-top/Foundry,axislab-top,Foundry,https://github.com/axislab-top/Foundry,Transform any idea into a running AI-powered company,2026-06-21 05:59:33+00:00,2026-06-30 09:47:36+00:00,522,6,522,0,TypeScript,14715,GPL-3.0,23,22.695652173913043,0.0114942528735632,0.0,AI/ML
1274967178,dengxibo/sumatrapdf-plus,dengxibo,sumatrapdf-plus,https://github.com/dengxibo/sumatrapdf-plus,,2026-06-20 05:02:36+00:00,2026-07-14 19:00:31+00:00,521,18,521,12,C,334805,GPL-3.0,24,21.70833333333333,0.0345489443378119,0.0230326295585412,Other
1287398535,can1357/pon,can1357,pon,https://github.com/can1357/pon,"Python 3.14, compiled to metal — JIT & AoT native compiler and runtime in Rust. Cranelift backend, ruff parser, Green Tea GC, byte-exact differential testing against CPython.",2026-07-02 16:44:07+00:00,2026-07-07 08:12:09+00:00,518,15,518,1,Rust,27599,,12,43.16666666666666,0.0289575289575289,0.0019305019305019,Web
1272942359,yin-yizhen/sonic-topography,yin-yizhen,sonic-topography,https://github.com/yin-yizhen/sonic-topography,随音乐产生交互的棋盘式海浪，支持网易云搜索,2026-06-18 04:26:20+00:00,2026-07-11 11:37:25+00:00,518,66,518,17,TypeScript,24963,NOASSERTION,26,19.923076923076923,0.1274131274131274,0.0328185328185328,Other
1293371220,Raymondhou0917/speak-human-tw,Raymondhou0917,speak-human-tw,https://github.com/Raymondhou0917/speak-human-tw,「說人話」：繁體中文的去 AI 味改寫 skill。抓 38 種 AI 寫作痕跡，順手校正中國用語與半形標點，給 Claude Code / Codex / Cursor 用。,2026-07-08 09:23:53+00:00,2026-07-14 11:08:59+00:00,518,61,518,1,Unknown,1556,MIT,6,86.33333333333333,0.1177606177606177,0.0019305019305019,AI/ML
1270503221,SubBoost/subboost,SubBoost,subboost,https://github.com/SubBoost/subboost,"Clash/Mihomo subscription conversion, enhancement, and management tool. Clash/Mihomo 订阅转换、增强和管理工具。通过 UI 可视化，一键实现链式代理、精确分流、防 DNS 泄露和多订阅聚合等高级功能。",2026-06-15 19:22:32+00:00,2026-07-13 23:25:08+00:00,517,96,517,3,TypeScript,3362,AGPL-3.0,29,17.82758620689655,0.1856866537717601,0.0058027079303675,Other
1276067021,kanavtwtgg/birds.cafe,kanavtwtgg,birds.cafe,https://github.com/kanavtwtgg/birds.cafe,,2026-06-21 13:57:28+00:00,2026-06-23 09:55:45+00:00,516,2,516,0,JavaScript,81,,23,22.43478260869565,0.003875968992248,0.0,Other
1284445032,ion-design/ditto.site,ion-design,ditto.site,https://github.com/ion-design/ditto.site,,2026-06-29 21:46:29+00:00,2026-07-13 16:57:24+00:00,515,74,515,10,TypeScript,102244,MIT,15,34.333333333333336,0.1436893203883495,0.0194174757281553,Other
1276236933,m1ckc3s/claude-status-bar,m1ckc3s,claude-status-bar,https://github.com/m1ckc3s/claude-status-bar,"A tiny macOS menu bar status indicator for Claude Code: animated icons, elapsed timer, and open/close lifecycle.",2026-06-21 18:02:49+00:00,2026-07-15 06:51:53+00:00,515,38,515,1,Swift,384,MIT,23,22.39130434782609,0.0737864077669902,0.0019417475728155,AI/ML
1287769478,DannyMac180/fable-advisor,DannyMac180,fable-advisor,https://github.com/DannyMac180/fable-advisor,"Claude Fable as an orchestrator for Opus, GPT and Grok",2026-07-03 01:53:51+00:00,2026-07-10 15:46:34+00:00,515,44,515,6,Unknown,34,MIT,11,46.81818181818182,0.0854368932038835,0.0116504854368932,AI/ML
1290854596,yusukebe/ax,yusukebe,ax,https://github.com/yusukebe/ax,The AI-era curl,2026-07-06 09:39:01+00:00,2026-07-15 07:09:55+00:00,511,9,511,0,TypeScript,398,MIT,8,63.875,0.0176125244618395,0.0,AI/ML
1289435641,Pluviobyte/rnskill,Pluviobyte,rnskill,https://github.com/Pluviobyte/rnskill,雪踏乌云的 AI Agent Skills 集合,2026-07-04 18:43:42+00:00,2026-07-15 06:35:27+00:00,511,44,511,0,Python,11709,NOASSERTION,10,51.1,0.086105675146771,0.0,AI/ML
1286732818,asz798838958/FrciblyK12,asz798838958,FrciblyK12,https://github.com/asz798838958/FrciblyK12,多线程全自动注册free 强上K12空间,2026-07-02 03:47:34+00:00,2026-07-02 15:05:05+00:00,508,166,508,1,Python,13143,AGPL-3.0,12,42.333333333333336,0.326771653543307,0.0019685039370078,Other
1286657505,NicholasSlattery/sony-head-tracker,NicholasSlattery,sony-head-tracker,https://github.com/NicholasSlattery/sony-head-tracker,Use the motion sensors inside Sony headphones as a low-latency Windows and MacOS head tracker for OpenTrack and simulator games.,2026-07-02 01:50:03+00:00,2026-07-13 19:14:25+00:00,503,21,503,5,C++,302,NOASSERTION,12,41.91666666666666,0.0417495029821073,0.0099403578528827,Other
1280129499,ChatCut-Inc/agent-plugin,ChatCut-Inc,agent-plugin,https://github.com/ChatCut-Inc/agent-plugin,Plugin for agents to interact with Chatcut,2026-06-25 09:45:29+00:00,2026-07-15 07:18:37+00:00,501,41,501,0,JavaScript,115985,,19,26.36842105263158,0.0818363273453093,0.0,AI/ML
1280958966,MageByte-Zero/spec-superflow,MageByte-Zero,spec-superflow,https://github.com/MageByte-Zero/spec-superflow,源码级融合 OpenSpec 规划引擎 + Superpowers 执行纪律的 AI 编程工作流插件。17 平台支持，9 skills，Spec-first，契约驱动。,2026-06-26 05:13:03+00:00,2026-07-15 03:58:06+00:00,500,53,500,5,JavaScript,1006,MIT,18,27.77777777777778,0.106,0.01,AI/ML
1281865046,jangles-byte/Pythia,jangles-byte,Pythia,https://github.com/jangles-byte/Pythia,"One local API call gives your agent the entire live state of the planet — every major world event at once, plus forecasts. 40+ free keyless feeds, runs entirely on Ollama. No cloud, no cost.  Keyless live feeds into one global view and forecasts what’s likely next. No cloud, no keys, no cost.  1d,1w,1m,1y predictions by Mirofish.",2026-06-27 02:45:12+00:00,2026-07-14 22:27:11+00:00,498,94,498,4,TypeScript,20595,MIT,17,29.294117647058822,0.1887550200803212,0.0080321285140562,AI/ML
1291502015,clawkwork/clawk,clawkwork,clawk,https://github.com/clawkwork/clawk,"Disposable, network-restricted Linux VMs for AI coding agents",2026-07-06 21:30:38+00:00,2026-07-13 13:45:23+00:00,494,10,494,0,Go,1664,Apache-2.0,8,61.75,0.020242914979757,0.0,AI/ML
1271455382,anasu1/text-humanizer,anasu1,text-humanizer,https://github.com/anasu1/text-humanizer,"text-humanizer is an open-source project designed to convert text generated by AI to its ""humanized"" version. Bypasses the most of AI detectors such as Turnitin or GPTZero",2026-06-16 17:18:50+00:00,2026-07-14 12:44:17+00:00,492,9,492,0,Python,77,MIT,28,17.571428571428573,0.0182926829268292,0.0,AI/ML
1291198433,V4bel/Januscape,V4bel,Januscape,https://github.com/V4bel/Januscape,,2026-07-06 15:35:00+00:00,2026-07-06 15:37:40+00:00,491,65,491,5,C,6274,,8,61.375,0.1323828920570264,0.010183299389002,Other
1272487463,sparklabx/drawio-ai-kit,sparklabx,drawio-ai-kit,https://github.com/sparklabx/drawio-ai-kit,"Teach your AI to draw correct, beautiful draw.io diagrams — declarative layout engine, ground-truth stencils, structural validator, vision self-check. AWS · Azure · GCP · Databricks · BPMN. Zero dependencies.",2026-06-17 16:51:20+00:00,2026-07-15 08:26:00+00:00,491,92,491,1,JavaScript,19407,MIT,27,18.185185185185187,0.1873727087576374,0.0020366598778004,AI/ML
1271012824,hustvl/Moebius,hustvl,Moebius,https://github.com/hustvl/Moebius,[ECCV 2026] Moebius: 0.2B Lightweight Image Inpainting Framework with 10B-Level Performance,2026-06-16 08:52:27+00:00,2026-07-02 13:20:12+00:00,488,41,488,2,Python,106114,Apache-2.0,28,17.428571428571427,0.0840163934426229,0.0040983606557377,Other
1284538699,Runx402/Runx402,Runx402,Runx402,https://github.com/Runx402/Runx402,"Bet on AI agents racing real GPUs. They rent compute, do hash-verified work, earn and you stake Solana on the best. Live on Solana.",2026-06-30 01:04:13+00:00,2026-07-14 22:19:46+00:00,488,33,488,0,TypeScript,448,MIT,14,34.857142857142854,0.0676229508196721,0.0,AI/ML
1276665883,Tencent/BrowserSkill,Tencent,BrowserSkill,https://github.com/Tencent/BrowserSkill,"Let AI agents use your real, logged-in browser without interrupting your work. CLI + extension for browser automation across any shell-capable AI agent.",2026-06-22 07:24:40+00:00,2026-07-09 16:30:40+00:00,488,33,488,14,Rust,2378,MIT,22,22.181818181818183,0.0676229508196721,0.0286885245901639,AI/ML
1283967328,WilonityLoader/Wilonity,WilonityLoader,Wilonity,https://github.com/WilonityLoader/Wilonity,Wilonity Loader — a unified library of game hacks.,2026-06-29 11:58:40+00:00,2026-07-13 08:27:21+00:00,486,9,486,0,Unknown,7,MIT,15,32.4,0.0185185185185185,0.0,Game
1282566168,jimparis/qr-font,jimparis,qr-font,https://github.com/jimparis/qr-font,A QR code generator in a TrueType font: https://qr.jim.sh/,2026-06-28 00:06:19+00:00,2026-06-28 00:23:15+00:00,484,14,484,4,Python,62,NOASSERTION,16,30.25,0.0289256198347107,0.0082644628099173,Other
1293936298,gostonx/uninstally,gostonx,uninstally,https://github.com/gostonx/uninstally,"A clean, native macOS uninstaller. Completely removes apps and every file they leave behind using smart bundle-identifier detection. SwiftUI + Finder extension.",2026-07-08 17:08:34+00:00,2026-07-13 00:57:38+00:00,479,21,479,1,Swift,133274,MIT,6,79.83333333333333,0.0438413361169102,0.0020876826722338,Mobile
1287168990,Tencent-Hunyuan/Hy3,Tencent-Hunyuan,Hy3,https://github.com/Tencent-Hunyuan/Hy3,"Hy3 (295B A21B), a leading reasoning and agent model in its size, with great cost efficiency.",2026-07-02 12:48:04+00:00,2026-07-06 15:46:33+00:00,479,91,479,72,Python,4607,NOASSERTION,12,39.91666666666666,0.1899791231732776,0.150313152400835,AI/ML
1271972411,zeropl/2FA,zeropl,2FA,https://github.com/zeropl/2FA,"2FA 在你的浏览器里把一个 2FA 密钥算成实时的 6 位验证码。没有服务器、不用注册、没有数据库——每个""账号""就是一条可收藏的网址，密钥藏在它的 # 片段里（浏览器永远不会把 # 片段发到网络上）。",2026-06-17 07:08:24+00:00,2026-07-11 14:58:18+00:00,477,54,477,0,HTML,3216,MIT,27,17.666666666666668,0.1132075471698113,0.0,Web
1275268652,AIScientists-Dev/academic-humanizer,AIScientists-Dev,academic-humanizer,https://github.com/AIScientists-Dev/academic-humanizer,"Strip AI-writing tells from papers and grant proposals (NSF/NIH), while keeping scholarly voice and tying claims to evidence. A skill for Claude Code, Codex, and MorphMind.",2026-06-20 13:23:52+00:00,2026-07-03 07:58:33+00:00,470,54,470,1,Unknown,293,NOASSERTION,24,19.58333333333333,0.1148936170212766,0.002127659574468,AI/ML
1276594511,ingriddaleusag-dotcom/PickTV,ingriddaleusag-dotcom,PickTV,https://github.com/ingriddaleusag-dotcom/PickTV,,2026-06-22 05:54:29+00:00,2026-07-14 05:37:08+00:00,470,96,470,3,Java,26705,GPL-3.0,22,21.363636363636363,0.2042553191489361,0.0063829787234042,Other
1276966391,JayWebtech/autoshorts,JayWebtech,autoshorts,https://github.com/JayWebtech/autoshorts,"AutoShorts is a local-first desktop application for turning long-form video or audio recordings into high-impact, vertical short-form clip candidates (9:16 portrait) with AI-powered viral moment ranking.",2026-06-22 13:08:10+00:00,2026-07-01 17:05:23+00:00,467,109,467,13,Rust,1868,,22,21.227272727272727,0.2334047109207709,0.0278372591006423,AI/ML
1284008447,meituan-longcat/LongCat-2.0,meituan-longcat,LongCat-2.0,https://github.com/meituan-longcat/LongCat-2.0,,2026-06-29 12:46:02+00:00,2026-07-08 06:13:41+00:00,467,53,467,8,Unknown,1105,MIT,15,31.133333333333333,0.1134903640256959,0.0171306209850107,Other
1277510172,InternScience/Agents-A1,InternScience,Agents-A1,https://github.com/InternScience/Agents-A1,"Scaling the Horizon, Not the Parameters",2026-06-23 00:48:51+00:00,2026-07-14 11:58:00+00:00,465,45,465,4,Python,26231,Apache-2.0,21,22.142857142857142,0.0967741935483871,0.0086021505376344,Other
1291157543,nexu-io/motion-anything,nexu-io,motion-anything,https://github.com/nexu-io/motion-anything,"✨ The agentic motion layer — an open-source, chat-native motion engine. Describe the feeling; your AI ships the animation.",2026-07-06 14:56:20+00:00,2026-07-07 06:47:46+00:00,464,45,464,4,JavaScript,36628,Apache-2.0,8,58.0,0.0969827586206896,0.0086206896551724,AI/ML
1282985659,FractalFir/crustc,FractalFir,crustc,https://github.com/FractalFir/crustc,"Entirety of `rustc`, translated to C. ",2026-06-28 12:25:34+00:00,2026-07-02 17:32:12+00:00,463,9,463,4,C,132548,,16,28.9375,0.019438444924406,0.0086393088552915,Other
1286880710,frecodecasti/polymarket-weather-trading-bot,frecodecasti,polymarket-weather-trading-bot,https://github.com/frecodecasti/polymarket-weather-trading-bot,Polymarket weather trading bot | Polymarket weather trading bot | Polymarket weather trading bot | Polymarket weather trading bot | Polymarket weather trading bot | Polymarket weather trading bot | Polymarket weather trading bot | Polymarket weather trading bot | Polymarket weather trading bot,2026-07-02 07:20:04+00:00,2026-07-10 07:28:37+00:00,462,1,462,0,TypeScript,161232,,12,38.5,0.0021645021645021,0.0,Finance/Trading
1290489028,jiguang132/storyai-3d-director-desk,jiguang132,storyai-3d-director-desk,https://github.com/jiguang132/storyai-3d-director-desk,"A browser-based 3D director desk demo built with React, Vite, and Three.js.",2026-07-06 01:52:14+00:00,2026-07-06 03:21:59+00:00,462,109,462,2,TypeScript,2638,MIT,8,57.75,0.2359307359307359,0.0043290043290043,Web
1269773493,renee-jia/scholar-loop,renee-jia,scholar-loop,https://github.com/renee-jia/scholar-loop,"An autonomous AI scientist: a multi-agent loop over literature, experiments, self-critique and write-up, with deterministic guards against reward-hacking and hallucination.",2026-06-15 04:50:58+00:00,2026-06-23 06:27:49+00:00,461,35,461,0,Python,405,MIT,29,15.89655172413793,0.0759219088937093,0.0,AI/ML
1276479597,tllovesxs/wandao,tllovesxs,wandao,https://github.com/tllovesxs/wandao,"万能导：多平台知识库 Markdown 全项目一键导入导出工具(导入导出效果最好)，用自动化代替手动复制粘贴(有道云,飞书,语雀,阿里云知识库,知识星球,印象笔记,ima,onenote,为之笔记导出导入).(可保留目录结构,图片,项目格式) 关键词:语雀导出导入,飞书导出导入,ima导出导入.阿里云文档导出,印象笔记导出导入,有道云导出,知识星球导出,为之笔记导出,onenote导出",2026-06-22 02:43:25+00:00,2026-07-15 03:03:10+00:00,460,52,460,16,Python,2956,AGPL-3.0,22,20.90909090909091,0.1130434782608695,0.0347826086956521,Other
1293473664,Nanako0129/pilotfish,Nanako0129,pilotfish,https://github.com/Nanako0129/pilotfish,"Multi-model orchestration layer for Claude Code — the frontier model plans, cheaper models execute, verification guards quality. One-prompt install.",2026-07-08 10:53:34+00:00,2026-07-14 17:39:02+00:00,458,33,458,4,Python,295,MIT,6,76.33333333333333,0.0720524017467248,0.0087336244541484,AI/ML
1288802563,lxh77721/k12-reg,lxh77721,k12-reg,https://github.com/lxh77721/k12-reg,多线程全自动注册free 强上K12空间 gmail版,2026-07-04 01:47:38+00:00,2026-07-04 10:14:11+00:00,456,68,456,0,TypeScript,541,MIT,10,45.6,0.1491228070175438,0.0,Other
1270737306,AGI-comming/functional-skill-creator,AGI-comming,functional-skill-creator,https://github.com/AGI-comming/functional-skill-creator,"fskill-creator turns your long-text SKILL into functions, making it modular, testable and trackable for better long-term maintenance and iteration",2026-06-16 02:17:45+00:00,2026-06-29 07:12:42+00:00,455,24,455,1,JavaScript,130,MIT,28,16.25,0.0527472527472527,0.0021978021978021,Other
1277614585,goehou/tabbit-toy,goehou,tabbit-toy,https://github.com/goehou/tabbit-toy,这是一个基于tabbit的研究包，可以转化成OAI格式出来，同时增加了会员认证功能和一键提取cookie的浏览器拓展，方便快速本地快速使用claude gpt等模型,2026-06-23 03:37:12+00:00,2026-06-25 10:28:21+00:00,454,814,454,2,JavaScript,36,,21,21.61904761904762,1.7929515418502202,0.0044052863436123,Other
1277104302,rayfish/rayfish,rayfish,rayfish,https://github.com/rayfish/rayfish,P2P mesh VPN powered by iroh,2026-06-22 15:28:45+00:00,2026-07-14 19:06:46+00:00,454,14,454,66,Rust,19320,MPL-2.0,22,20.63636363636364,0.0308370044052863,0.145374449339207,Other
1279179284,J-jaeyoung/bad-epoll,J-jaeyoung,bad-epoll,https://github.com/J-jaeyoung/bad-epoll,,2026-06-24 12:54:24+00:00,2026-06-24 12:57:54+00:00,449,41,449,1,Unknown,623,,20,22.45,0.0913140311804008,0.0022271714922048,Other
1296301313,yetone/kill-ai-slop,yetone,kill-ai-slop,https://github.com/yetone/kill-ai-slop,A field guide to the visual & copy tics of AI-generated products — and an Agent Skill that scans your project and strips them out. https://killaislop.com,2026-07-10 08:59:16+00:00,2026-07-14 17:32:32+00:00,447,18,447,0,TypeScript,497,,4,111.75,0.0402684563758389,0.0,AI/ML
1287125429,Brain0-ai/brain0,Brain0-ai,brain0,https://github.com/Brain0-ai/brain0,"The black box for AI-written code. Passive decision graph linking every commit to the agent prompts behind it: drift detection, DLP audit of what agents read, evidence-driven risk, MCP memory for coding agents, signed provenance attestations. One command, offline by default.",2026-07-02 12:02:08+00:00,2026-07-02 12:34:35+00:00,446,14,446,0,Rust,340,Apache-2.0,12,37.16666666666666,0.0313901345291479,0.0,AI/ML
1274683820,eooce/transfer-api,eooce,transfer-api,https://github.com/eooce/transfer-api,Cloudflare Worker adapter for unlimited.surf OpenAI/Anthropic-compatible API routes.,2026-06-19 19:24:47+00:00,2026-06-21 09:37:40+00:00,445,2420,445,2,JavaScript,14,,25,17.8,5.438202247191011,0.0044943820224719,AI/ML
1277041207,iebb/mithka,iebb,mithka,https://github.com/iebb/mithka,"A Telegram client, but déjà vu",2026-06-22 14:25:22+00:00,2026-07-15 07:57:59+00:00,444,16,444,5,Dart,24627,,22,20.181818181818183,0.036036036036036,0.0112612612612612,Mobile
1277468360,samasante/liquid-glass,samasante,liquid-glass,https://github.com/samasante/liquid-glass,"Apple-style Liquid Glass for the web — a headless React lens that refracts the live DOM in Safari, Firefox and Chrome. Zero dependencies.",2026-06-22 23:31:35+00:00,2026-06-23 00:37:45+00:00,442,39,442,2,TypeScript,6081,MIT,22,20.09090909090909,0.088235294117647,0.004524886877828,Web
1278049181,nova452/ComfyUI-Conditioning-Rebalance,nova452,ComfyUI-Conditioning-Rebalance,https://github.com/nova452/ComfyUI-Conditioning-Rebalance,Conditioning optimizer nodes offering IP-Adapter-like features for Krea 2 and Ideogram 4 image reference editing along with other conditioning nodes enhancing the generation experience.,2026-06-23 12:17:48+00:00,2026-07-11 23:42:57+00:00,442,54,442,13,Python,149,Apache-2.0,21,21.047619047619047,0.1221719457013574,0.0294117647058823,Other
1281033762,tianma-if/edgeever,tianma-if,edgeever,https://github.com/tianma-if/edgeever,"Serverless, 100% free, and open-source Evernote alternative on Cloudflare with native MCP | 无需服务器、0费用、原生支持 AI Agent 的开源自托管『印象笔记』",2026-06-26 06:59:58+00:00,2026-07-15 04:42:14+00:00,441,130,441,9,TypeScript,6464,AGPL-3.0,18,24.5,0.2947845804988662,0.0204081632653061,AI/ML
1291242597,ronak-create/FableCut,ronak-create,FableCut,https://github.com/ronak-create/FableCut,"Zero-dependency browser video editor that AI agents can drive — JSON timeline, MCP + REST, live-reloading UI",2026-07-06 16:18:57+00:00,2026-07-13 19:54:46+00:00,438,40,438,10,JavaScript,1569,MIT,8,54.75,0.091324200913242,0.0228310502283105,AI/ML
1270859186,Liunian06/ko-lesson,Liunian06,ko-lesson,https://github.com/Liunian06/ko-lesson,一个帮助大学牲期末复习的skill，能将清朝老PPT复活为能看的资料,2026-06-16 05:43:13+00:00,2026-07-03 07:30:56+00:00,434,9,434,0,Unknown,119,MIT,28,15.5,0.02073732718894,0.0,Other
1290344168,majidmanzarpour/threejs-procedural-dungeon,majidmanzarpour,threejs-procedural-dungeon,https://github.com/majidmanzarpour/threejs-procedural-dungeon,"Real-time procedural dungeon generator in Three.js - deterministic seeds, Delaunay/MST graph layouts, room semantics, five themes, and a custom bloom/tilt-shift pipeline.",2026-07-05 21:15:08+00:00,2026-07-05 21:19:53+00:00,433,75,433,0,JavaScript,631,MIT,9,48.11111111111112,0.1732101616628175,0.0,Other
1270587915,leyten/shard,leyten,shard,https://github.com/leyten/shard,Pipeline-parallel LLM inference across GPUs on separate machines.,2026-06-15 21:31:07+00:00,2026-07-14 12:43:00+00:00,428,57,428,12,Python,2436,Apache-2.0,29,14.758620689655173,0.1331775700934579,0.02803738317757,AI/ML
1278517378,joaogfc/ZeroDelay,joaogfc,ZeroDelay,https://github.com/joaogfc/ZeroDelay,Reduz a latência de lives do YouTube — extensão Manifest V3 que acelera a reprodução para alcançar o ao vivo.,2026-06-23 21:47:05+00:00,2026-07-14 22:11:02+00:00,428,42,428,4,JavaScript,5480,GPL-3.0,21,20.38095238095238,0.0981308411214953,0.0093457943925233,Other
1277836173,dama-cyber/Casting-Workflow,dama-cyber,Casting-Workflow,https://github.com/dama-cyber/Casting-Workflow,,2026-06-23 08:26:29+00:00,2026-07-14 01:14:00+00:00,426,83,426,1,Python,710,,21,20.285714285714285,0.1948356807511737,0.0023474178403755,Other
1277357877,erdwin90/crypto-bar-mac,erdwin90,crypto-bar-mac,https://github.com/erdwin90/crypto-bar-mac,"macOS menu bar app that bring real time cryptocurrency prices using the CoinGecko API. Supports Bitcoin, Ethereum, and many other coins",2026-06-22 20:30:03+00:00,2026-07-09 02:12:42+00:00,425,31,425,0,Objective-C,18535,MIT,22,19.318181818181817,0.0729411764705882,0.0,Finance/Trading
1278757502,tutusagi/ai-fishing-game,tutusagi,ai-fishing-game,https://github.com/tutusagi/ai-fishing-game,🎣 给 AI 玩的确定性文字钓鱼小游戏 · 单文件零依赖 · 让你的 AI 伴侣来钓鱼,2026-06-24 04:33:55+00:00,2026-06-26 04:13:16+00:00,423,53,423,4,Python,2380,MIT,20,21.15,0.1252955082742316,0.0094562647754137,AI/ML
1275942797,Th0rgal/open_oura,Th0rgal,open_oura,https://github.com/Th0rgal/open_oura,"A Rust toolkit for the Oura Ring (Gen 3/4/5): reverse-engineered BLE protocol, event decoders, and reimplemented data-processing algorithms. Sync, store, and analyze your data locally.",2026-06-21 10:43:18+00:00,2026-07-11 17:17:24+00:00,421,61,421,3,Rust,3397,,23,18.30434782608696,0.1448931116389548,0.007125890736342,Data
1270883324,halfof8/patterngen-oss,halfof8,patterngen-oss,https://github.com/halfof8/patterngen-oss,,2026-06-16 06:15:37+00:00,2026-06-22 05:37:44+00:00,421,38,421,0,TypeScript,152,MIT,28,15.035714285714286,0.0902612826603325,0.0,Other
1275350891,Env-Kit/envkit-releases,Env-Kit,envkit-releases,https://github.com/Env-Kit/envkit-releases,"EnvKit — free local development environment for Windows & macOS: nginx/Apache, multiple PHP versions, MySQL/MariaDB,   PostgreSQL, Redis, MongoDB, Mailpit, Node.js, trusted .test HTTPS, and a built-in MCP server for AI-assistant control.   A Laragon/XAMPP/Herd alternative.",2026-06-20 15:20:52+00:00,2026-07-13 15:14:45+00:00,419,11,419,17,Shell,7402,,24,17.458333333333332,0.026252983293556,0.0405727923627685,AI/ML
1281420131,Einsia/Browser-BC,Einsia,Browser-BC,https://github.com/Einsia/Browser-BC,"Agent behavior clone for browser using, targeting general GUI using and distributed trajectory collecting.",2026-06-26 14:37:26+00:00,2026-07-13 11:26:36+00:00,418,42,418,1,TypeScript,584,,18,23.22222222222222,0.1004784688995215,0.0023923444976076,AI/ML
1290597550,SmtimesIWndr/gdid-reversal,SmtimesIWndr,gdid-reversal,https://github.com/SmtimesIWndr/gdid-reversal,,2026-07-06 04:42:54+00:00,2026-07-06 21:03:27+00:00,416,29,416,2,Unknown,65,,8,52.0,0.0697115384615384,0.0048076923076923,Other
1276885966,trotsky1997/OpenFugu,trotsky1997,OpenFugu,https://github.com/trotsky1997/OpenFugu,Open reimplementation of Sakana Fugu — the 'one model to command them all' LLM orchestrator. Read → run → train → serve.,2026-06-22 11:37:21+00:00,2026-06-22 19:31:43+00:00,415,74,415,3,Python,367,Apache-2.0,22,18.863636363636363,0.1783132530120482,0.0072289156626506,AI/ML
1277197499,carbonengine/trinity,carbonengine,trinity,https://github.com/carbonengine/trinity,Rendering engine for the Carbon Game Engine,2026-06-22 17:11:43+00:00,2026-07-14 14:11:00+00:00,411,56,411,4,C++,149592,MIT,22,18.681818181818183,0.1362530413625304,0.0097323600973236,Game
1280019559,winsznx/bull-rush,winsznx,bull-rush,https://github.com/winsznx/bull-rush,🐂 BULL RUSH — a 3D neon endless runner for The Black Bull ($ANSEM). React Three Fiber game + Hono/Redis API + dynamic X share cards. Play → trybullrush.xyz,2026-06-25 07:42:50+00:00,2026-07-04 15:36:26+00:00,411,2,411,0,TypeScript,1568,MIT,19,21.63157894736842,0.0048661800486618,0.0,Finance/Trading
1275199411,Radiant303/SpringNote,Radiant303,SpringNote,https://github.com/Radiant303/SpringNote,懒人实习记录工具,2026-06-20 11:34:58+00:00,2026-07-14 14:41:22+00:00,410,42,410,7,Dart,21509,AGPL-3.0,24,17.083333333333332,0.1024390243902439,0.0170731707317073,Mobile
1281957900,XboxNahida/ghostty-blackhole-main,XboxNahida,ghostty-blackhole-main,https://github.com/XboxNahida/ghostty-blackhole-main,适用于Windows环境的黑洞屏保,2026-06-27 06:09:52+00:00,2026-07-15 06:40:03+00:00,408,37,408,9,C++,87107,MIT,17,24.0,0.0906862745098039,0.0220588235294117,Other
