id,full_name,owner,name,html_url,description,created_at,pushed_at,stars,forks,watchers,open_issues,primary_language,size,license,age_days,stars_per_day,fork_star_ratio,issue_star_ratio,category
1255180606,pewdiepie-archdaemon/odysseus,pewdiepie-archdaemon,odysseus,https://github.com/pewdiepie-archdaemon/odysseus,Self-hosted AI workspace. ,2026-05-31 14:05:51+00:00,2026-06-19 22:50:15+00:00,74579,9626,74579,1374,Python,32604,AGPL-3.0,19,3925.2105263157896,0.1290711862588664,0.0184234167795223,AI/ML
1266797999,DietrichGebert/ponytail,DietrichGebert,ponytail,https://github.com/DietrichGebert/ponytail,Makes your AI agent think like the laziest senior dev in the room. The best code is the code you never wrote.,2026-06-12 00:52:37+00:00,2026-06-19 08:50:56+00:00,40784,1956,40784,54,JavaScript,1702,MIT,7,5826.285714285715,0.0479599843075716,0.001324048646528,AI/ML
1265025028,XiaomiMiMo/MiMo-Code,XiaomiMiMo,MiMo-Code,https://github.com/XiaomiMiMo/MiMo-Code,MiMo Code: Where Models and Agents Co-Evolve,2026-06-10 11:52:41+00:00,2026-06-19 16:07:03+00:00,9997,921,9997,513,TypeScript,53234,MIT,9,1110.7777777777778,0.0921276382914874,0.0513153946183855,AI/ML
1246839757,anthropics/defending-code-reference-harness,anthropics,defending-code-reference-harness,https://github.com/anthropics/defending-code-reference-harness,"Skills for threat modeling, scanning, triage, patching, plus an autonomous scanning harness you can /customize",2026-05-22 16:00:56+00:00,2026-06-15 17:14:59+00:00,6104,462,6104,8,Python,781,NOASSERTION,28,218.0,0.0756880733944954,0.001310615989515,Security
1264986626,shadcn/improve,shadcn,improve,https://github.com/shadcn/improve,Use your most capable model to audit your codebase and write plans for cheaper models to execute.,2026-06-10 11:06:58+00:00,2026-06-15 06:18:39+00:00,5696,221,5696,7,Unknown,82,MIT,9,632.8888888888889,0.0387991573033707,0.0012289325842696,Other
1251775733,helloianneo/ian-xiaohei-illustrations,helloianneo,ian-xiaohei-illustrations,https://github.com/helloianneo/ian-xiaohei-illustrations,中文小黑怪诞正文配图生成 Skill | 16:9 白底手绘 | 少量红橙蓝批注 | Codex Skill,2026-05-27 22:47:56+00:00,2026-06-03 11:35:43+00:00,5374,624,5374,7,Unknown,13189,MIT,23,233.65217391304347,0.1161146259769259,0.0013025679196129,AI/ML
1248194723,AprilNEA/OpenLogi,AprilNEA,OpenLogi,https://github.com/AprilNEA/OpenLogi,"⚡️A native, local-first alternative to Logitech Options+, written in Rust 🦀 — remap buttons, DPI, and SmartShift over HID++. No account, no telemetry.",2026-05-24 10:10:36+00:00,2026-06-18 02:04:35+00:00,5170,98,5170,74,Rust,4678,Apache-2.0,26,198.84615384615384,0.0189555125725338,0.0143133462282398,Other
1246010662,EpicGames/lore,EpicGames,lore,https://github.com/EpicGames/lore,"Lore is a next-generation, open source version control system",2026-05-21 19:32:07+00:00,2026-06-20 02:28:50+00:00,4817,179,4817,33,Rust,4573,MIT,29,166.10344827586206,0.0371600581274652,0.0068507369732198,Other
1254038692,zgwl/chinese-buy-us-stock-guide,zgwl,chinese-buy-us-stock-guide,https://github.com/zgwl/chinese-buy-us-stock-guide,美股指南,2026-05-30 04:27:25+00:00,2026-06-18 18:18:57+00:00,4745,729,4745,0,Unknown,645,,20,237.25,0.1536354056902002,0.0,Other
1246625636,open-gsd/gsd-core,open-gsd,gsd-core,https://github.com/open-gsd/gsd-core,Git. Ship. Done - Core,2026-05-22 11:36:21+00:00,2026-06-20 07:24:48+00:00,4563,278,4563,59,JavaScript,28585,MIT,28,162.96428571428572,0.0609248301555993,0.0129300898531667,AI/ML
1245699721,KunAgent/Kun,KunAgent,Kun,https://github.com/KunAgent/Kun,AI agent workspace with Code and Write modes built into your application.,2026-05-21 13:22:06+00:00,2026-06-20 05:26:24+00:00,4538,401,4538,7,TypeScript,224874,NOASSERTION,29,156.48275862068965,0.0883649184662847,0.001542529748788,AI/ML
1266212515,omnigent-ai/omnigent,omnigent-ai,omnigent,https://github.com/omnigent-ai/omnigent,"Omnigent is an open-source AI agent framework and meta-harness: orchestrate Claude Code, Codex, Cursor, Pi, and custom agents — swap harnesses without rewriting, enforce policies and sandboxing, and collaborate in real time from any device.",2026-06-11 12:18:13+00:00,2026-06-20 08:19:24+00:00,4109,463,4109,215,Python,46075,Apache-2.0,8,513.625,0.1126794840593818,0.0523241664638598,AI/ML
1251263546,op7418/guizang-social-card-skill,op7418,guizang-social-card-skill,https://github.com/op7418/guizang-social-card-skill,"🪧 Claude Code / Codex skill — generate Xiaohongshu carousels & WeChat 21:9+1:1 cover pairs. Editorial × Swiss visual systems, 28 layouts, 10 themes, single-file HTML → PNG. 小红书图文 + 公众号封面对",2026-05-27 12:05:05+00:00,2026-05-27 16:58:08+00:00,3796,333,3796,5,HTML,1933,AGPL-3.0,23,165.04347826086956,0.0877239199157007,0.0013171759747102,AI/ML
1246399437,OpenBMB/PilotDeck,OpenBMB,PilotDeck,https://github.com/OpenBMB/PilotDeck,Task-oriented AI Agent productivity platform,2026-05-22 06:50:28+00:00,2026-06-18 11:48:34+00:00,3571,364,3571,115,TypeScript,17734,AGPL-3.0,28,127.53571428571428,0.1019322318678241,0.0322038644637356,AI/ML
1259415257,diffusionstudio/lottie,diffusionstudio,lottie,https://github.com/diffusionstudio/lottie,Generate production-ready Lottie animations with Claude Code or Codex,2026-06-04 13:39:32+00:00,2026-06-15 18:21:25+00:00,3495,186,3495,0,TypeScript,4814,MIT,15,233.0,0.0532188841201716,0.0,AI/ML
1250822765,nexu-io/html-video,nexu-io,html-video,https://github.com/nexu-io/html-video,"Programmatic video for coding agents — HTML to video on your laptop. Turn HTML, CSS & data into real MP4s with pluggable render engines, 21 templates, AI soundtrack. Apache-2.0, no per-render fees. An official project by the Open Design team.",2026-05-27 02:08:11+00:00,2026-06-17 10:13:37+00:00,3342,406,3342,36,HTML,9690,Apache-2.0,23,145.30434782608697,0.1214841412327947,0.0107719928186714,AI/ML
1253077206,Gloridust/WechatOnCloud,Gloridust,WechatOnCloud,https://github.com/Gloridust/WechatOnCloud,云微WOC，云微信，自由连接,2026-05-29 06:14:13+00:00,2026-06-18 18:12:42+00:00,2997,717,2997,8,TypeScript,1933,,21,142.71428571428572,0.2392392392392392,0.0026693360026693,Other
1257699593,cpaczek/skylight,cpaczek,skylight,https://github.com/cpaczek/skylight,"Project the aircraft passing overhead onto your ceiling in real time, from an RTL-SDR — with a live sky layer (sun, moon, stars, ISS) and where each plane is headed.",2026-06-02 23:40:28+00:00,2026-06-11 20:14:44+00:00,2806,317,2806,19,TypeScript,6158,MIT,17,165.05882352941177,0.1129722024233784,0.0067712045616536,Web
1257155061,b-nnett/goose,b-nnett,goose,https://github.com/b-nnett/goose,Goose Swift proof-of-concept README,2026-06-02 12:16:37+00:00,2026-06-02 12:40:14+00:00,2578,638,2578,35,Rust,8090,,17,151.64705882352942,0.247478665632273,0.0135764158262218,Mobile
1246459259,MoonshotAI/kimi-code,MoonshotAI,kimi-code,https://github.com/MoonshotAI/kimi-code,Kimi Code CLI  —  The Starting Point for Next-Gen Agents,2026-05-22 08:02:03+00:00,2026-06-19 15:35:24+00:00,2574,309,2574,299,TypeScript,14437,MIT,28,91.92857142857144,0.12004662004662,0.1161616161616161,AI/ML
1254681752,V0id-v2/Void-Tools-v2.0,V0id-v2,Void-Tools-v2.0,https://github.com/V0id-v2/Void-Tools-v2.0,"Python terminal multitool — OSINT, Discord, web & network utilities. Rich TUI, 13 themes, remote updates. Educational use only.",2026-05-30 21:57:30+00:00,2026-06-17 21:15:49+00:00,2413,30,2413,3,Python,949,,20,120.65,0.0124326564442602,0.001243265644426,Web
1252526989,ideogram-oss/ideogram4,ideogram-oss,ideogram4,https://github.com/ideogram-oss/ideogram4,Ideogram 4: Open image model at the forefront of design,2026-05-28 15:56:47+00:00,2026-06-04 15:44:03+00:00,2148,219,2148,25,Python,10448,Apache-2.0,22,97.63636363636364,0.1019553072625698,0.0116387337057728,Other
1251186402,GordenSun/GordenPPTSkill,GordenSun,GordenPPTSkill,https://github.com/GordenSun/GordenPPTSkill,"AI-friendly PPT builder skill: 17 hand-polished Chinese PPTX templates + non-destructive text-only editing tools (python-pptx based). Pick a template, write edits.json, build a real .pptx with the layout intact. Personal/research use only.",2026-05-27 10:25:58+00:00,2026-06-17 09:29:11+00:00,2144,200,2144,0,Python,86213,NOASSERTION,23,93.21739130434784,0.0932835820895522,0.0,AI/ML
1269156190,tamnd/kage,tamnd,kage,https://github.com/tamnd/kage,"Shadow any website for offline viewing, with the JavaScript stripped out",2026-06-14 11:21:55+00:00,2026-06-20 08:53:32+00:00,2120,64,2120,10,Go,1405,MIT,5,424.0,0.030188679245283,0.0047169811320754,Other
1265265111,BuilderIO/skills,BuilderIO,skills,https://github.com/BuilderIO/skills,Skills for coding agents,2026-06-10 16:04:20+00:00,2026-06-17 23:30:10+00:00,2120,109,2120,2,JavaScript,4364,MIT,9,235.55555555555557,0.0514150943396226,0.000943396226415,AI/ML
1245402600,Tong89/smartNode,Tong89,smartNode,https://github.com/Tong89/smartNode,,2026-05-21 07:31:35+00:00,2026-06-02 04:04:50+00:00,1985,174,1985,3,Python,16837,MIT,29,68.44827586206897,0.0876574307304785,0.0015113350125944,Other
1252289708,Sophomoresty/gemini-web2api,Sophomoresty,gemini-web2api,https://github.com/Sophomoresty/gemini-web2api,"Convert Google Gemini web into OpenAI-compatible API. Zero auth, cross-platform, single file.",2026-05-28 11:25:55+00:00,2026-06-06 11:33:43+00:00,1824,436,1824,6,Python,156,MIT,22,82.9090909090909,0.2390350877192982,0.0032894736842105,AI/ML
1252583707,MatinSenPai/SenPaiScanner,MatinSenPai,SenPaiScanner,https://github.com/MatinSenPai/SenPaiScanner,"A light-weight scanner for Cloudflare IPs, written in Golang",2026-05-28 17:02:54+00:00,2026-06-19 13:31:51+00:00,1773,97,1773,45,Go,1239,MIT,22,80.5909090909091,0.0547095318668922,0.0253807106598984,Other
1262173643,NoopApp/noop,NoopApp,noop,https://github.com/NoopApp/noop,"Offline WHOOP companion — pair your strap over Bluetooth, keep all data on your own device. No cloud, no account, no subscription.",2026-06-07 17:03:02+00:00,2026-06-20 09:20:37+00:00,1730,731,1730,15,Swift,88476,NOASSERTION,12,144.16666666666666,0.422543352601156,0.0086705202312138,Data
1271113810,vercel/eve,vercel,eve,https://github.com/vercel/eve,The Framework for Building Agents,2026-06-16 10:51:20+00:00,2026-06-20 05:02:53+00:00,1720,111,1720,61,TypeScript,3735,Apache-2.0,3,573.3333333333334,0.0645348837209302,0.0354651162790697,AI/ML
1261650101,JimLiu/baoyu-design,JimLiu,baoyu-design,https://github.com/JimLiu/baoyu-design,"Run Claude Design locally as an Agent Skill — Cursor, Claude Code & more. Produce polished UI mockups, prototypes, decks & wireframes as self-contained HTML, without claude.ai/design. Best with Opus 4.8.",2026-06-07 01:16:18+00:00,2026-06-19 18:07:10+00:00,1651,125,1651,0,JavaScript,7630,MIT,12,137.58333333333334,0.0757116898849182,0.0,AI/ML
1256728599,jd-opensource/JoyAI-Echo,jd-opensource,JoyAI-Echo,https://github.com/jd-opensource/JoyAI-Echo,JoyAI-Echo: Pushing the Frontier of Long Audio-Visual Generation,2026-06-02 03:25:51+00:00,2026-06-16 07:39:38+00:00,1613,145,1613,8,Python,23177,NOASSERTION,17,94.88235294117646,0.0898946063236205,0.0049597024178549,Other
1267357207,lenucksi/aur-malware-check,lenucksi,aur-malware-check,https://github.com/lenucksi/aur-malware-check,Detection tools for the June 2026 atomic-lockfile AUR supply-chain attack. Consolidated from community Gists.,2026-06-12 13:17:07+00:00,2026-06-16 17:46:16+00:00,1612,35,1612,14,Shell,115,,7,230.28571428571428,0.021712158808933,0.0086848635235732,CLI/Tooling
1248955957,code-yeongyu/lazycodex,code-yeongyu,lazycodex,https://github.com/code-yeongyu/lazycodex,"The one and only agent harness for complex codebases. Project memory, planning, execution, and verified completion inside Codex.",2026-05-25 07:56:45+00:00,2026-06-20 03:43:32+00:00,1555,86,1555,2,TypeScript,22531,MIT,25,62.2,0.0553054662379421,0.0012861736334405,AI/ML
1269395331,Waishnav/devspace,Waishnav,devspace,https://github.com/Waishnav/devspace,Turn ChatGPT into Codex,2026-06-14 16:57:27+00:00,2026-06-17 18:49:00+00:00,1516,137,1516,16,TypeScript,1473,MIT,5,303.2,0.0903693931398416,0.0105540897097625,AI/ML
1245361579,run-liyi/wechatpay,run-liyi,wechatpay,https://github.com/run-liyi/wechatpay,微信账单分析工具 - 基于Electron的可视化账单分析应用,2026-05-21 06:40:00+00:00,2026-05-29 22:56:08+00:00,1492,138,1492,1,JavaScript,281,,29,51.44827586206897,0.0924932975871313,0.0006702412868632,Other
1247201816,study8677/awesome-architecture,study8677,awesome-architecture,https://github.com/study8677/awesome-architecture,"🧭 Architecture-first system design: 26 bilingual tutorials, 25 architecture templates, and 6 end-to-end cases covering distributed systems, AI-native systems, RAG, coding Agents, and production trade-offs.",2026-05-23 02:44:43+00:00,2026-06-20 03:00:20+00:00,1456,154,1456,3,Vue,1430,MIT,27,53.92592592592592,0.1057692307692307,0.0020604395604395,AI/ML
1265107923,SkyBlue997/enableMacosAI,SkyBlue997,enableMacosAI,https://github.com/SkyBlue997/enableMacosAI,国行 Mac 一键开启完整 Apple 智能(端侧 + Private Cloud Compute 云端)· macOS 27 / Apple Silicon,2026-06-10 13:23:39+00:00,2026-06-13 07:28:36+00:00,1447,80,1447,25,Shell,29,,9,160.77777777777777,0.055286800276434,0.0172771250863856,CLI/Tooling
1245803238,microsoft/WindowsDeveloperConfig,microsoft,WindowsDeveloperConfig,https://github.com/microsoft/WindowsDeveloperConfig,Automate the setup and configuration of your Windows development environment.,2026-05-21 15:13:35+00:00,2026-06-19 19:41:38+00:00,1381,111,1381,12,PowerShell,561,MIT,29,47.62068965517241,0.0803765387400434,0.0086893555394641,Other
1264312494,MSNightmare/RoguePlanet,MSNightmare,RoguePlanet,https://github.com/MSNightmare/RoguePlanet,RoguePlanet Windows Defender Vulnerability,2026-06-09 19:10:18+00:00,2026-06-09 19:58:22+00:00,1323,545,1323,7,C++,303,MIT,10,132.3,0.4119425547996976,0.0052910052910052,Security
1249866465,ace-trump-tech/DeltaForce-OBS-Locker,ace-trump-tech,DeltaForce-OBS-Locker,https://github.com/ace-trump-tech/DeltaForce-OBS-Locker,三角洲行动OBS锁头插件 – 基于OBS渲染注入的智能锁头辅助，支持QQ音乐/网易云联精准骨骼识别、平滑自瞄、压枪抑制，稳定过检，提升击杀效率。5L2G5YW25a6e5Lul5LiK5YWo5piv6aqX5L2g55qE77yM6L+Z5Y+q5piv5Liq5biu5L2g5a6J6KOF5pqX5Yy656qB5Zu055qE5Y+N5L2c5byK6aG555uu572i5LqG,2026-05-26 05:24:10+00:00,2026-06-19 02:10:24+00:00,1310,1183,1310,47,Unknown,29565,,24,54.583333333333336,0.903053435114504,0.0358778625954198,Other
1248769131,luolangaga/tubatools,luolangaga,tubatools,https://github.com/luolangaga/tubatools,图吧工具箱 winUI3 版,2026-05-25 03:15:04+00:00,2026-06-18 07:51:30+00:00,1274,32,1274,12,C#,418369,GPL-3.0,25,50.96,0.0251177394034536,0.0094191522762951,Other
1265847218,loc567/loc567,loc567,loc567,https://github.com/loc567/loc567,loc567 是一款完全开源免费的纯网页端iOS模拟定位工具。在线体验地址：https://loc567.com,2026-06-11 06:05:29+00:00,2026-06-19 04:13:24+00:00,1230,156,1230,11,C,540,LGPL-2.1,8,153.75,0.1268292682926829,0.0089430894308943,Other
1255412388,ClaudioDrews/memory-os,ClaudioDrews,memory-os,https://github.com/ClaudioDrews/memory-os,"A 7-layer memory operating system for Hermes Agent — persistent memory with Qdrant, structured facts, fabric recall, auto-curated wiki, and surgical context injection. Runs locally, any LLM provider.",2026-05-31 19:50:25+00:00,2026-06-10 10:40:43+00:00,1171,111,1171,6,Python,448,MIT,19,61.63157894736842,0.0947907771135781,0.0051238257899231,AI/ML
1268186785,EEliberto/IPA-Download,EEliberto,IPA-Download,https://github.com/EEliberto/IPA-Download,一款用于安装 IPA 历史版本的工具，适用于获取旧版应用并自动捕获数据包。下载后，可直接通过 AirDrop 传输至 iPhone、iPad 上并安装并使用。,2026-06-13 08:32:39+00:00,2026-06-15 17:21:43+00:00,1129,61,1129,1,Swift,67307,Apache-2.0,6,188.16666666666663,0.054030115146147,0.0008857395925597,Mobile
1249261520,baoweise-bot/aimili-vpngate,baoweise-bot,aimili-vpngate,https://github.com/baoweise-bot/aimili-vpngate,aimili-vpngate是一个借助vpngate.net让Linux用干净ip出站的代理工具。,2026-05-25 14:13:24+00:00,2026-06-19 21:17:08+00:00,1121,388,1121,17,Python,158,NOASSERTION,25,44.84,0.3461195361284567,0.0151650312221231,Other
1262142501,GordenSun/GordenSuperPPTSkills,GordenSun,GordenSuperPPTSkills,https://github.com/GordenSun/GordenSuperPPTSkills,AI PPT赛道终结者，史上最最最强 PPT Skill！！！  使用GPT生成豪华的图片格式PPT，然后转换为完全可编辑的PPTX文件。,2026-06-07 16:20:13+00:00,2026-06-07 16:26:51+00:00,1087,102,1087,1,Python,19531,,12,90.58333333333331,0.0938362465501379,0.0009199632014719,AI/ML
1264478656,plannotator/effective-html,plannotator,effective-html,https://github.com/plannotator/effective-html,"Agent skill for elegant and simple html plans, architecture diagrams, or whatever else you can think of.",2026-06-09 23:24:51+00:00,2026-06-19 20:54:33+00:00,1084,75,1084,2,HTML,153,MIT,10,108.4,0.0691881918819188,0.0018450184501845,AI/ML
1262530182,apple/coreai-models,apple,coreai-models,https://github.com/apple/coreai-models,"Model export recipes, Python primitives, and Swift runtime utilities for on-device AI",2026-06-08 04:32:27+00:00,2026-06-18 20:47:10+00:00,1075,83,1075,18,Swift,6298,BSD-3-Clause,11,97.72727272727272,0.0772093023255813,0.0167441860465116,AI/ML
1246534911,s0xDk/ghostty-blackhole,s0xDk,ghostty-blackhole,https://github.com/s0xDk/ghostty-blackhole,"Ghostty Blackhole puts a real, ray-traced black hole inside your terminal. It grows as Claude Code's context window fills up, live. A fresh session is a quiet hole in the corner. A full one swallows half your screen. You'll always see /compact coming.",2026-05-22 09:36:37+00:00,2026-06-11 19:05:37+00:00,1070,89,1070,5,GLSL,18451,MIT,28,38.21428571428572,0.0831775700934579,0.0046728971962616,AI/ML
1257823581,nevertoday/zhongguo-traditional-colors,nevertoday,zhongguo-traditional-colors,https://github.com/nevertoday/zhongguo-traditional-colors,中华传统色演示、色卡浏览与颜色知识科普开源项目,2026-06-03 03:26:16+00:00,2026-06-19 17:09:10+00:00,1056,100,1056,4,HTML,1082790,MIT,16,66.0,0.0946969696969697,0.0037878787878787,Web
1264716916,levy-street/world-of-claudecraft,levy-street,world-of-claudecraft,https://github.com/levy-street/world-of-claudecraft,,2026-06-10 05:55:59+00:00,2026-06-20 09:26:30+00:00,1045,294,1045,158,TypeScript,197803,MIT,9,116.11111111111111,0.2813397129186603,0.1511961722488038,Other
1255939927,Fullive-AI/Anima,Fullive-AI,Anima,https://github.com/Fullive-AI/Anima,Make Every Hardware Intelligent — an open-source Agent OS for hardware intelligence,2026-06-01 10:06:21+00:00,2026-06-03 16:00:26+00:00,1012,28,1012,9,Python,6775,Apache-2.0,18,56.22222222222222,0.0276679841897233,0.008893280632411,AI/ML
1250575980,boona13/image-extender,boona13,image-extender,https://github.com/boona13/image-extender,"Seamlessly extend any image in any direction with AI. Open-source web app powered by Gemini via OpenRouter, with Poisson-blended seams and best-of-3 variant picker.",2026-05-26 19:11:44+00:00,2026-05-31 19:39:52+00:00,1011,113,1011,2,TypeScript,1198,MIT,24,42.125,0.1117705242334322,0.0019782393669634,AI/ML
1260901035,unicity-astrid/book,unicity-astrid,book,https://github.com/unicity-astrid/book,"The canonical reference for Astrid OS: kernel, capsules, host ABI, the bus, and the security model.",2026-06-06 02:16:50+00:00,2026-06-17 12:20:30+00:00,995,4,995,0,Perl,245,Apache-2.0,13,76.53846153846153,0.0040201005025125,0.0,Security
1260901078,unicity-astrid/handbook,unicity-astrid,handbook,https://github.com/unicity-astrid/handbook,"How to work on Astrid: the polyrepo, the kernel-is-dumb law, the RFC trigger, contribution tiers, and the release process.",2026-06-06 02:16:56+00:00,2026-06-06 02:46:02+00:00,990,5,990,0,Unknown,36,Apache-2.0,13,76.15384615384616,0.005050505050505,0.0,Other
1252258448,2aronS/Duel-Agents,2aronS,Duel-Agents,https://github.com/2aronS/Duel-Agents,"CLI, SDK, and IDE plugins for Duel Agents",2026-05-28 10:45:44+00:00,2026-06-15 16:54:25+00:00,986,22,986,1,TypeScript,82,MIT,22,44.81818181818182,0.0223123732251521,0.0010141987829614,AI/ML
1251648409,opengeos/GeoLibre,opengeos,GeoLibre,https://github.com/opengeos/GeoLibre,"A lightweight, cloud-native GIS platform for visualizing, exploring, and analyzing geospatial data across desktop and web environments, with a responsive layout for mobile screens.",2026-05-27 19:34:31+00:00,2026-06-20 06:53:50+00:00,984,134,984,7,TypeScript,7692,MIT,23,42.78260869565217,0.1361788617886178,0.0071138211382113,Data
1252751767,Michaelliv/pi-dynamic-workflows,Michaelliv,pi-dynamic-workflows,https://github.com/Michaelliv/pi-dynamic-workflows,,2026-05-28 20:46:15+00:00,2026-05-31 07:20:33+00:00,973,53,973,14,TypeScript,179,,22,44.22727272727273,0.0544707091469681,0.014388489208633,Other
1246440630,sybil-solutions/codex-shim,sybil-solutions,codex-shim,https://github.com/sybil-solutions/codex-shim,Local Responses-API shim that exposes Factory BYOK models (and optional ChatGPT GPT-5.5 passthrough) to Codex Desktop.,2026-05-22 07:38:07+00:00,2026-06-13 01:14:13+00:00,966,93,966,11,Python,109,MIT,28,34.5,0.0962732919254658,0.0113871635610766,AI/ML
1250957639,withkynam/vibecode-pro-max-kit,withkynam,vibecode-pro-max-kit,https://github.com/withkynam/vibecode-pro-max-kit,"Your AI forgets. This remembers. Spec-driven coding harness for vibecoders, product owners, CEOs and real builders — self-improving context memory, 15 agents, 33 skills working with /goal, agent-team, & workflow on autopilot loops with 0 need for human gate. Kills context rot, ships features, not spaghetti. Claude Code & Codex. Any stack",2026-05-27 05:46:25+00:00,2026-06-20 06:09:27+00:00,951,205,951,19,JavaScript,14948,MIT,23,41.34782608695652,0.2155625657202944,0.0199789695057833,AI/ML
1250283885,Yeachan-Heo/gajae-code,Yeachan-Heo,gajae-code,https://github.com/Yeachan-Heo/gajae-code,Gajae Code MVP,2026-05-26 13:33:33+00:00,2026-06-20 08:59:57+00:00,928,129,928,4,TypeScript,58130,MIT,24,38.66666666666666,0.1390086206896551,0.0043103448275862,Other
1255852666,agent0ai/dox,agent0ai,dox,https://github.com/agent0ai/dox,Self-documenting AGENTS.md,2026-06-01 08:25:21+00:00,2026-06-02 06:48:12+00:00,925,123,925,3,Unknown,74,MIT,18,51.388888888888886,0.1329729729729729,0.0032432432432432,AI/ML
1257533286,superloglabs/superlog,superloglabs,superlog,https://github.com/superloglabs/superlog,Open-source observability tool that uses AI agents to self-heal your software,2026-06-02 19:13:48+00:00,2026-06-20 00:07:52+00:00,901,65,901,18,TypeScript,12759,Apache-2.0,17,53.0,0.0721420643729189,0.0199778024417314,AI/ML
1252578748,alexmcdonnell-airtable/hyperagent-public-skills,alexmcdonnell-airtable,hyperagent-public-skills,https://github.com/alexmcdonnell-airtable/hyperagent-public-skills,Free skills from the Hyperagent team,2026-05-28 16:57:22+00:00,2026-06-16 20:47:52+00:00,893,67,893,2,Unknown,168,,22,40.59090909090909,0.0750279955207166,0.0022396416573348,Other
1253322436,bytedance/Bernini,bytedance,Bernini,https://github.com/bytedance/Bernini,Bernini is a unified framework for video generation and editing that combines an MLLM-based semantic planner with a DiT-based renderer.,2026-05-29 10:51:54+00:00,2026-06-12 11:07:07+00:00,892,72,892,15,Python,100839,Apache-2.0,21,42.47619047619048,0.0807174887892376,0.0168161434977578,Other
1258607058,nubjs/nub,nubjs,nub,https://github.com/nubjs/nub,The all-in-one Node.js toolkit,2026-06-03 18:36:21+00:00,2026-06-20 07:11:04+00:00,888,9,888,1,Rust,9062,MIT,16,55.5,0.0101351351351351,0.0011261261261261,Other
1256125546,tiantianGPU/reg-factory,tiantianGPU,reg-factory,https://github.com/tiantianGPU/reg-factory,谷歌邮箱注册,2026-06-01 13:38:37+00:00,2026-06-11 21:19:19+00:00,872,415,872,0,Python,756,,18,48.44444444444444,0.4759174311926605,0.0,Other
1249107749,UditAkhourii/adhd,UditAkhourii,adhd,https://github.com/UditAkhourii/adhd,"ADHD — a skill for coding agents. Tree-of-thought with pruning, built on the Claude & Codex Agent SDK. Fans out parallel divergent thoughts under different cognitive frames, scores, prunes traps, deepens the survivors. The no-brainer skill for creative and interdisciplinary work.",2026-05-25 11:06:35+00:00,2026-06-04 14:54:33+00:00,854,44,854,13,TypeScript,1874,MIT,25,34.16,0.0515222482435597,0.0152224824355971,AI/ML
1251086916,yb2460/harness-anything,yb2460,harness-anything,https://github.com/yb2460/harness-anything,"Harness Anything - AI agent control hub: WPS, MS Office, Zotero, Photoshop, 47 CLI commands, 27 academic skills, SVG-to-PPTX",2026-05-27 08:25:28+00:00,2026-06-12 03:16:49+00:00,853,47,853,3,Python,4947,MIT,23,37.08695652173913,0.0550996483001172,0.003516998827667,AI/ML
1248026928,msitarzewski/brew-browser,msitarzewski,brew-browser,https://github.com/msitarzewski/brew-browser,Homebrew is the standard package manager on macOS. brew-browser gives it a real native GUI.,2026-05-24 04:58:59+00:00,2026-06-19 19:13:38+00:00,853,23,853,9,Rust,24365,MIT,26,32.80769230769231,0.0269636576787807,0.0105509964830011,Other
1261422007,amElnagdy/guard-skills,amElnagdy,guard-skills,https://github.com/amElnagdy/guard-skills,"Guard skills for coding agents, quality gates that catch AI-generated failure modes in code, tests, and docs",2026-06-06 16:59:27+00:00,2026-06-07 11:46:54+00:00,840,99,840,1,Unknown,77,MIT,13,64.61538461538461,0.1178571428571428,0.0011904761904761,AI/ML
1266923310,nolangz/pixel2motion,nolangz,pixel2motion,https://github.com/nolangz/pixel2motion,"AI logo animation skill: turn raster logos into smooth SVG animation, animated HTML demos, GIF/video previews, and motion QA evidence.",2026-06-12 04:25:17+00:00,2026-06-18 02:29:56+00:00,833,77,833,4,Python,3549,MIT,7,119.0,0.0924369747899159,0.0048019207683073,AI/ML
