id,full_name,owner,name,html_url,description,created_at,pushed_at,stars,forks,watchers,open_issues,primary_language,size,license,age_days,stars_per_day,fork_star_ratio,issue_star_ratio,category
1245628663,panxiaogong/MemGuard,panxiaogong,MemGuard,https://github.com/panxiaogong/MemGuard,,2026-05-21 12:00:24+00:00,2026-05-31 15:50:58+00:00,174,16,174,0,Python,389,MIT,11,15.818181818181818,0.0919540229885057,0.0,Other
1240111587,v9ai/ai-engineer-roadmap,v9ai,ai-engineer-roadmap,https://github.com/v9ai/ai-engineer-roadmap,,2026-05-15 19:27:38+00:00,2026-06-02 10:30:56+00:00,173,5,173,0,TypeScript,51209,,17,10.176470588235292,0.0289017341040462,0.0,Other
1245952606,ningzimu/image-to-editable-ppt-skill,ningzimu,image-to-editable-ppt-skill,https://github.com/ningzimu/image-to-editable-ppt-skill,"Codex skill for converting slide images, PDFs, and image-based PPTX files into editable PowerPoint decks.",2026-05-21 18:14:26+00:00,2026-05-29 13:33:44+00:00,173,10,173,0,Python,15423,MIT,11,15.727272727272728,0.0578034682080924,0.0,AI/ML
1238052114,Siigari/claude-heartbeat,Siigari,claude-heartbeat,https://github.com/Siigari/claude-heartbeat,Keep Claude Code alive and autonomous without -p. Heartbeat hook + inbox/outbox pattern.,2026-05-13 19:08:36+00:00,2026-05-14 11:45:55+00:00,173,25,173,0,JavaScript,32,MIT,19,9.105263157894736,0.1445086705202312,0.0,AI/ML
1256326603,gothic-remake/Gothic-1-Remake-Release,gothic-remake,Gothic-1-Remake-Release,https://github.com/gothic-remake/Gothic-1-Remake-Release,gothic 1 remake release date free download windows global launch times thq nordic alkimia interactive unreal engine 5 steam pc ps5 xbox series x s gameplay system requirements trailer pre order collectors edition official launch 2026,2026-06-01 17:10:20+00:00,2026-06-01 17:21:24+00:00,173,0,173,1,TypeScript,11,MIT,1,173.0,0.0,0.0057803468208092,Game
1234816868,Sidenai/hyperion-disassembler,Sidenai,hyperion-disassembler,https://github.com/Sidenai/hyperion-disassembler,"Native multi-arch disassembler & decompiler - PE/ELF/Mach-O, x86/x64/ARM64, Lua scripting, RTTI recovery",2026-05-10 17:18:38+00:00,2026-05-22 19:15:42+00:00,172,21,172,3,C++,394,,22,7.818181818181818,0.1220930232558139,0.0174418604651162,Other
1252434124,mudler/parakeet.cpp,mudler,parakeet.cpp,https://github.com/mudler/parakeet.cpp,Parakeet implementation in C++ with ggml,2026-05-28 14:13:27+00:00,2026-06-01 23:31:27+00:00,172,8,172,0,C++,9458,MIT,4,43.0,0.0465116279069767,0.0,Other
1251875798,modelstudioai/cli,modelstudioai,cli,https://github.com/modelstudioai/cli,"Official Model Studio CLI（阿里云百炼 CLI）built for AI Agent frameworks, exposing models, search, multimodal, and workflow capabilities as structured tool calls.",2026-05-28 01:46:10+00:00,2026-06-02 10:05:09+00:00,172,9,172,1,TypeScript,354,Apache-2.0,4,43.0,0.0523255813953488,0.005813953488372,AI/ML
1231611426,mito753/Kernel-Exploit-Dojo,mito753,Kernel-Exploit-Dojo,https://github.com/mito753/Kernel-Exploit-Dojo,"CTF kernel exploitation notes, PoCs, exploits, and writeups.",2026-05-07 05:56:25+00:00,2026-06-02 06:16:31+00:00,172,27,172,0,C,1582496,,25,6.88,0.1569767441860465,0.0,Other
1234947296,firstbatchxyz/watchmen,firstbatchxyz,watchmen,https://github.com/firstbatchxyz/watchmen,,2026-05-10 21:02:28+00:00,2026-06-02 10:31:03+00:00,171,10,171,8,Python,5258,MIT,22,7.772727272727272,0.0584795321637426,0.0467836257309941,Other
1241441590,aqua5230/usage,aqua5230,usage,https://github.com/aqua5230/usage,"macOS menu bar app pinning Claude Code & Codex quota, tokens, and cost to your screen. Local-only, zero API calls. HTML reports, 9 themes.",2026-05-17 11:52:27+00:00,2026-06-02 10:12:21+00:00,171,34,171,0,Python,18848,AGPL-3.0,15,11.4,0.1988304093567251,0.0,AI/ML
1247881802,Astraltenprosper/uncensored-ai-image-video-generator,Astraltenprosper,uncensored-ai-image-video-generator,https://github.com/Astraltenprosper/uncensored-ai-image-video-generator,AI tool for generating uncensored images and videos (18+),2026-05-23 22:55:11+00:00,2026-05-23 23:10:56+00:00,171,22,171,2,Python,22,MIT,9,19.0,0.1286549707602339,0.0116959064327485,AI/ML
1256465100,PackAshReside79/TG-WS-Proxy-v1.7.0,PackAshReside79,TG-WS-Proxy-v1.7.0,https://github.com/PackAshReside79/TG-WS-Proxy-v1.7.0,,2026-06-01 20:01:01+00:00,2026-06-01 20:03:02+00:00,170,0,170,0,Python,1605,MIT,1,170.0,0.0,0.0,Other
1231464982,NodePassProject/Everywhere,NodePassProject,Everywhere,https://github.com/NodePassProject/Everywhere,One app. Three networking engines. Your rules.,2026-05-07 01:44:28+00:00,2026-06-01 05:42:46+00:00,170,6,170,1,Swift,1981,GPL-3.0,25,6.8,0.0352941176470588,0.0058823529411764,Mobile
1228405179,pixelxzen/phantom-motion,pixelxzen,phantom-motion,https://github.com/pixelxzen/phantom-motion,"Phantom-Motion is an incredibly powerful, epic interactive dynamic visual storytelling generator. Its capabilities are limited only by the bounds of your imagination! 它是一个极其硬核的史诗级交互式动态视觉叙事生成器。它的实力只取决于你的想象力高低！",2026-05-04 01:27:04+00:00,2026-05-14 02:03:22+00:00,170,23,170,0,HTML,110572,Apache-2.0,28,6.071428571428571,0.1352941176470588,0.0,Web
1252814323,K-Dense-AI/science-superpowers,K-Dense-AI,science-superpowers,https://github.com/K-Dense-AI/science-superpowers,Composable computational-science methodology skills for AI research agents — pre-registration over TDD. A science-domain reimplementation of Superpowers.,2026-05-28 22:37:52+00:00,2026-06-01 18:26:33+00:00,170,15,170,2,Shell,969,NOASSERTION,4,42.5,0.088235294117647,0.0117647058823529,AI/ML
1242502853,DeFiCryptoBots/CryptoBots-Solana-Sniper-PumpFun-Free,DeFiCryptoBots,CryptoBots-Solana-Sniper-PumpFun-Free,https://github.com/DeFiCryptoBots/CryptoBots-Solana-Sniper-PumpFun-Free,Our Free Solana Sniper for Pumpfun with multiple strategies,2026-05-18 13:38:23+00:00,2026-05-23 20:37:43+00:00,169,11,169,1,JavaScript,707,,14,12.071428571428571,0.0650887573964497,0.0059171597633136,Finance/Trading
1231607252,gainubi/note-slides,gainubi,note-slides,https://github.com/gainubi/note-slides,把一篇长文、一个长 PDF，转为可读的精美 Slides。,2026-05-07 05:50:00+00:00,2026-05-08 08:48:50+00:00,169,13,169,0,HTML,80,NOASSERTION,25,6.76,0.0769230769230769,0.0,Web
1239423873,tszdanger/RealMythos,tszdanger,RealMythos,https://github.com/tszdanger/RealMythos,"Public reconstruction of Claude Mythos as an open cybersecurity reasoning stack: datasets, models, reproducible environments, and trace infrastructure.",2026-05-15 04:40:16+00:00,2026-05-30 15:27:41+00:00,169,21,169,0,Python,263,,17,9.941176470588236,0.1242603550295858,0.0,AI/ML
1229218228,enmanuelmag/agent-harness-kit,enmanuelmag,agent-harness-kit,https://github.com/enmanuelmag/agent-harness-kit,A provider-agnostic scaffolding kit for running structured multi-agent workflows in your codebase.,2026-05-04 20:26:43+00:00,2026-05-30 13:45:08+00:00,169,7,169,0,TypeScript,620,NOASSERTION,28,6.035714285714286,0.0414201183431952,0.0,AI/ML
1245318831,Margele/OpenZen,Margele,OpenZen,https://github.com/Margele/OpenZen,打得过Zen,2026-05-21 05:44:45+00:00,2026-06-01 08:00:15+00:00,168,65,168,0,Java,50398,,11,15.272727272727272,0.3869047619047619,0.0,Other
1253667120,rasoir0591/Crosshair-X,rasoir0591,Crosshair-X,https://github.com/rasoir0591/Crosshair-X,crosshair x steam download custom crosshair free overlay extension torrent valorant cs2 apex pro settings windows ,2026-05-29 17:38:57+00:00,2026-05-29 17:45:38+00:00,168,1,168,1,TypeScript,15,MIT,3,56.0,0.0059523809523809,0.0059523809523809,Other
1239482897,zyf2007/ChatAPI,zyf2007,ChatAPI,https://github.com/zyf2007/ChatAPI,把你自己装进 OpenAI responses API 里面，扮演 Assistant 和用户聊天（,2026-05-15 06:17:00+00:00,2026-05-31 15:23:37+00:00,168,19,168,7,Python,536,AGPL-3.0,17,9.882352941176473,0.1130952380952381,0.0416666666666666,AI/ML
1235182474,RUC-NLPIR/Rubrics_Survey,RUC-NLPIR,Rubrics_Survey,https://github.com/RUC-NLPIR/Rubrics_Survey,,2026-05-11 04:55:38+00:00,2026-06-01 12:23:12+00:00,168,0,168,0,Unknown,3606,,21,8.0,0.0,0.0,Other
1228493290,Ethan-YS/project-brain,Ethan-YS,project-brain,https://github.com/Ethan-YS/project-brain,One folder. Every session knows where you left off. — An open-source methodology for AI-assisted projects.,2026-05-04 04:30:40+00:00,2026-05-19 15:51:05+00:00,167,11,167,0,Shell,3920,MIT,28,5.964285714285714,0.0658682634730539,0.0,AI/ML
1228982152,lukeed/comptime,lukeed,comptime,https://github.com/lukeed/comptime,"A Zig-inspired build-time evaluation primitive, exposed as Vite and Rolldown plugins",2026-05-04 15:21:08+00:00,2026-05-07 19:25:37+00:00,167,2,167,3,TypeScript,157,MIT,28,5.964285714285714,0.0119760479041916,0.0179640718562874,Web
1228931313,liangdabiao/Fashion-AI,liangdabiao,Fashion-AI,https://github.com/liangdabiao/Fashion-AI,电商 AI 生图爆款流水线 — 输入新品平铺图，自动检索相似爆款、分析风格，生成专业宣传图。  ## 项目简介  跨境电商场景中，商家每出一款新品都需要制作宣传图（模特穿着商品的照片）。传统方式需要请模特、搭场景、拍摄修图，成本高、周期长。  本项目实现了一套全自动的 AI 生图流水线,2026-05-04 14:23:37+00:00,2026-05-06 03:08:00+00:00,167,47,167,1,Python,7430,,28,5.964285714285714,0.281437125748503,0.0059880239520958,AI/ML
1232550277,skycryptsite/SkyCrypt,skycryptsite,SkyCrypt,https://github.com/skycryptsite/SkyCrypt,"Official SkyCrypt website — a Hypixel SkyBlock stats viewer for checking player profiles, skills, net worth, dungeons, slayers, accessories, collections, pets, armor, weapons, and progression using public Hypixel API data.",2026-05-08 03:28:13+00:00,2026-05-09 03:06:14+00:00,167,0,167,0,Svelte,26240,MIT,24,6.958333333333333,0.0,0.0,Data
1239681676,daehyeonmun2021/react-native-skia-lab,daehyeonmun2021,react-native-skia-lab,https://github.com/daehyeonmun2021/react-native-skia-lab,Beautiful react-native-skia demo built by Daehyeon Mun,2026-05-15 10:33:11+00:00,2026-05-15 12:28:23+00:00,167,16,167,0,TypeScript,206679,,17,9.823529411764708,0.0958083832335329,0.0,Web
1246839757,anthropics/defending-code-reference-harness,anthropics,defending-code-reference-harness,https://github.com/anthropics/defending-code-reference-harness,"Skills for threat modeling, scanning, triage, patching, plus an autonomous scanning harness you can /customize",2026-05-22 16:00:56+00:00,2026-06-01 20:40:25+00:00,166,19,166,0,Python,820,NOASSERTION,10,16.6,0.1144578313253012,0.0,Security
1227754484,aiskyhub/codex_with_cc,aiskyhub,codex_with_cc,https://github.com/aiskyhub/codex_with_cc,codex穷鬼大救星,2026-05-03 05:48:52+00:00,2026-05-20 02:37:00+00:00,166,23,166,8,Python,395,,29,5.724137931034483,0.1385542168674698,0.0481927710843373,Other
1238996909,ZJU-REAL/SDAR,ZJU-REAL,SDAR,https://github.com/ZJU-REAL/SDAR,"Official code for ""Self-Distilled Agentic Reinforcement Learning""",2026-05-14 16:54:03+00:00,2026-05-27 04:27:16+00:00,164,14,164,6,Python,39242,Apache-2.0,18,9.11111111111111,0.0853658536585365,0.0365853658536585,Other
1255174587,rstagit/rstaspoof,rstagit,rstaspoof,https://github.com/rstagit/rstaspoof,ابزار دور زدن DPI با جعل SNI — پشتیبانی از Termux/Android/Linux,2026-05-31 13:56:58+00:00,2026-06-01 18:32:20+00:00,164,30,164,4,Go,16442,,1,164.0,0.1829268292682926,0.024390243902439,Mobile
1228366354,UfukNode/Noustiny,UfukNode,Noustiny,https://github.com/UfukNode/Noustiny,An agent native video creation pipeline that runs on top of Hermes Agent,2026-05-03 23:53:15+00:00,2026-05-04 01:24:44+00:00,164,18,164,1,TypeScript,4884,,29,5.655172413793103,0.1097560975609756,0.0060975609756097,AI/ML
1244664769,OpenYSMDev/OpenYSM,OpenYSMDev,OpenYSM,https://github.com/OpenYSMDev/OpenYSM,A mod that modifies the vanilla player model,2026-05-20 13:31:18+00:00,2026-05-22 14:53:20+00:00,164,12,164,10,Java,186457,MIT,12,13.666666666666666,0.073170731707317,0.0609756097560975,Other
1248216427,uu201/character-arc,uu201,character-arc,https://github.com/uu201/character-arc,弧光 · AI 小说创作桌面应用，集项目设定、角色关系、剧情大纲、章节写作与多模型 AI 协作于一体,2026-05-24 10:49:16+00:00,2026-06-02 08:38:25+00:00,164,21,164,5,TypeScript,7408,MIT,8,20.5,0.1280487804878048,0.0304878048780487,AI/ML
1241473098,dancinlab/sidecar,dancinlab,sidecar,https://github.com/dancinlab/sidecar,,2026-05-17 12:41:01+00:00,2026-06-02 10:05:50+00:00,164,84,164,2,Shell,4483,MIT,15,10.933333333333334,0.5121951219512195,0.0121951219512195,CLI/Tooling
1241183189,ronaldo-avalos/Maya,ronaldo-avalos,Maya,https://github.com/ronaldo-avalos/Maya,"🖥️ 📱 ▶️ Wrap your iPhone screen recordings in a beautiful device frame, add cinematic zoom moments, and export ready-to-share videos.",2026-05-17 04:00:39+00:00,2026-05-22 19:52:33+00:00,163,19,163,0,Swift,22323,MIT,15,10.866666666666667,0.1165644171779141,0.0,Mobile
1228293041,rkeisler/keisler-2022,rkeisler,keisler-2022,https://github.com/rkeisler/keisler-2022,"Graph neural network weather forecasting, from Keisler 2022",2026-05-03 21:00:34+00:00,2026-05-04 02:42:56+00:00,163,25,163,0,Python,36462,MIT,29,5.620689655172414,0.1533742331288343,0.0,AI/ML
1231368425,Hawzen/I-found-a-seashell-in-the-middle-of-the-desert,Hawzen,I-found-a-seashell-in-the-middle-of-the-desert,https://github.com/Hawzen/I-found-a-seashell-in-the-middle-of-the-desert,,2026-05-06 22:33:44+00:00,2026-06-02 05:02:49+00:00,163,1,163,0,Jupyter Notebook,764198,,26,6.269230769230769,0.0061349693251533,0.0,Other
1229374702,mkbhardwas12/pwned-deps,mkbhardwas12,pwned-deps,https://github.com/mkbhardwas12/pwned-deps,"Lockfile-first scanner for compromised npm/PyPI/Maven/Cargo/Go/RubyGems packages — OSV + curated extras feed, SLSA L3, locked-container CI",2026-05-05 01:25:24+00:00,2026-05-05 21:51:51+00:00,163,172,163,0,Python,3211,Apache-2.0,27,6.037037037037037,1.0552147239263805,0.0,Security
1245904814,Boob025/peace-equalizer-APO,Boob025,peace-equalizer-APO,https://github.com/Boob025/peace-equalizer-APO,peace best  audio equalizer apo app pc windows 11 spotify  download audio sound booster bass boost headphones gaming preset config profile realtek parametric eq gui,2026-05-21 17:13:12+00:00,2026-05-23 15:26:16+00:00,163,1,163,3,TypeScript,14,MIT,11,14.818181818181818,0.0061349693251533,0.0184049079754601,Other
1244549017,ChiryanOY/MimicPolymarket,ChiryanOY,MimicPolymarket,https://github.com/ChiryanOY/MimicPolymarket,,2026-05-20 11:20:43+00:00,2026-05-21 05:48:20+00:00,163,16,163,0,TypeScript,542,ISC,12,13.583333333333334,0.0981595092024539,0.0,Other
1230797184,snowmanzhuang/yixueAIganhuo-PPT,snowmanzhuang,yixueAIganhuo-PPT,https://github.com/snowmanzhuang/yixueAIganhuo-PPT,"AI workflow (base on gpt-image-2 and paddle ocr v5) for generating PPT decks from papers, PDFs, figures, screenshots, and prepared materials, then rebuilding editable PPTX files.",2026-05-06 10:28:47+00:00,2026-05-15 07:14:34+00:00,163,32,163,1,Python,554089,NOASSERTION,26,6.269230769230769,0.1963190184049079,0.0061349693251533,AI/ML
1232036878,agegr/mindmap-ppt,agegr,mindmap-ppt,https://github.com/agegr/mindmap-ppt,,2026-05-07 14:25:02+00:00,2026-05-15 10:12:06+00:00,163,27,163,1,JavaScript,4962,,25,6.52,0.1656441717791411,0.0061349693251533,Other
1235098353,ai-twinkle/Hub,ai-twinkle,Hub,https://github.com/ai-twinkle/Hub,Twinkle Hub — community feedback / feature requests for hub.twinkleai.tw,2026-05-11 02:26:38+00:00,2026-05-11 04:30:11+00:00,162,13,162,2,Unknown,220,,21,7.714285714285714,0.0802469135802469,0.0123456790123456,Other
1230365005,Dragolone/robot-charging-station-miniprogram,Dragolone,robot-charging-station-miniprogram,https://github.com/Dragolone/robot-charging-station-miniprogram,"  微信小程序 · 机器人远程管理与实时遥控平台 · uni-app (Vue 3) + uniCloud 云函数    + IoT 网关 (MQTT/WebSocket) | WeChat Mini Program for real-time remote robot     fleet management & teleoperation. Built with uni-app (Vue 3), uniCloud           serverless backend, and an MQTT/WebSocket IoT gateway.   ",2026-05-05 23:38:43+00:00,2026-05-07 03:20:45+00:00,162,17,162,0,JavaScript,857,MIT,27,6.0,0.1049382716049382,0.0,Web
1250772522,GOROman/nullevi03,GOROman,nullevi03,https://github.com/GOROman/nullevi03,,2026-05-27 00:38:28+00:00,2026-05-27 00:56:36+00:00,162,9,162,0,Shell,3,,5,32.4,0.0555555555555555,0.0,CLI/Tooling
1246280805,TencentYoutuResearch/T2I-L2P,TencentYoutuResearch,T2I-L2P,https://github.com/TencentYoutuResearch/T2I-L2P,"Code for ""L2P: Unlocking Latent Potential for Pixel Generation""",2026-05-22 03:33:26+00:00,2026-05-23 08:06:18+00:00,162,10,162,0,Python,81,,10,16.2,0.0617283950617283,0.0,Other
1233550493,ngaut/agent-git-service,ngaut,agent-git-service,https://github.com/ngaut/agent-git-service,Reimplement GitHub for Agents.,2026-05-09 04:46:31+00:00,2026-05-30 15:20:10+00:00,162,4,162,0,Go,16590,Apache-2.0,23,7.043478260869565,0.0246913580246913,0.0,AI/ML
1241933969,limin112/wechat-publish-template,limin112,wechat-publish-template,https://github.com/limin112/wechat-publish-template,,2026-05-18 01:28:52+00:00,2026-05-18 01:37:21+00:00,161,18,161,0,HTML,124,,14,11.5,0.1118012422360248,0.0,Web
1236276147,keon/jepa,keon,jepa,https://github.com/keon/jepa,implementing minimal versions of joint-embedding predictive architecture (JEPA),2026-05-12 05:26:49+00:00,2026-05-19 23:37:00+00:00,161,14,161,0,Python,77416,,20,8.05,0.0869565217391304,0.0,AI/ML
1235313065,PorunC/CodeWiki,PorunC,CodeWiki,https://github.com/PorunC/CodeWiki,"CodeWiki is a knowledge platform that analyzes repositories into AST graphs, builds GraphRAG indexes, and generates source-grounded developer wikis with FastAPI, React, and LiteLLM.",2026-05-11 07:52:42+00:00,2026-05-31 14:25:02+00:00,161,11,161,0,Python,10292,MIT,21,7.666666666666667,0.0683229813664596,0.0,Web
1242620513,Patdolitse/piia-engram,Patdolitse,piia-engram,https://github.com/Patdolitse/piia-engram,"One memory. Every AI tool. Yours to keep. Local-first, MCP-compatible, Apache 2.0.",2026-05-18 15:38:43+00:00,2026-06-01 17:00:39+00:00,161,8,161,2,Python,3852,Apache-2.0,14,11.5,0.0496894409937888,0.0124223602484472,AI/ML
1246341681,elyelysiox/recaptcha,elyelysiox,recaptcha,https://github.com/elyelysiox/recaptcha,Documentation and reverse engineering of reCAPTCHA,2026-05-22 05:26:53+00:00,2026-05-31 05:49:30+00:00,160,26,160,1,JavaScript,1630,,10,16.0,0.1625,0.00625,Other
1240364388,zimingttkx/QuantumFlow,zimingttkx,QuantumFlow,https://github.com/zimingttkx/QuantumFlow,"QuantumFlow - Distributed LLM inference scheduling framework with multi-backend support (vLLM, TGI, SGLang), adaptive scheduling strategies, and cluster management.",2026-05-16 03:51:46+00:00,2026-06-01 06:03:04+00:00,160,0,160,0,Python,1881,MIT,16,10.0,0.0,0.0,AI/ML
1232414163,dwisiswant0/next-16.2.4-pocs,dwisiswant0,next-16.2.4-pocs,https://github.com/dwisiswant0/next-16.2.4-pocs,"Next.js v16.2.4 Security PoC Collection (CVE-2026-23870, CVE-2026-44575, CVE-2026-44579, CVE-2026-44574, CVE-2026-44578, CVE-2026-44573, CVE-2026-44581, CVE-2026-44580, CVE-2026-44577, CVE-2026-44576, CVE-2026-44582, CVE-2026-44572)",2026-05-07 23:00:40+00:00,2026-05-12 04:28:18+00:00,160,33,160,1,Python,259,,25,6.4,0.20625,0.00625,Security
1229107163,pnegahdar/nano,pnegahdar,nano,https://github.com/pnegahdar/nano,One file. Under 200 lines. Zero dependencies. It's a coding agent.,2026-05-04 17:52:55+00:00,2026-05-17 16:19:34+00:00,159,4,159,0,Python,848,,28,5.678571428571429,0.0251572327044025,0.0,AI/ML
1241641320,666shen/tcp-dashboard,666shen,tcp-dashboard,https://github.com/666shen/tcp-dashboard,VPS的TCP深度调优面板,2026-05-17 16:32:50+00:00,2026-05-17 16:43:12+00:00,159,21,159,0,Shell,16,MIT,15,10.6,0.1320754716981132,0.0,CLI/Tooling
1230533510,chrismoos/1xbts,chrismoos,1xbts,https://github.com/chrismoos/1xbts,CDMA2000 Open Source Cellular Network ,2026-05-06 04:56:59+00:00,2026-05-29 22:57:04+00:00,159,20,159,7,Rust,7483,Apache-2.0,26,6.115384615384615,0.1257861635220125,0.0440251572327044,Other
1232061850,Develp10/rust-roadmap-ru,Develp10,rust-roadmap-ru,https://github.com/Develp10/rust-roadmap-ru,🦀 Полный roadmap по изучению Rust на русском + большой список ресурсов. Telegram: t.me/rust_code,2026-05-07 14:51:49+00:00,2026-05-17 21:01:47+00:00,159,18,159,1,Unknown,725,MIT,25,6.36,0.1132075471698113,0.0062893081761006,Other
1236024834,minghe36/haoone-app,minghe36,haoone-app,https://github.com/minghe36/haoone-app,新一代 AI 专业字幕软件，支持 mac 与 Windows。中英转录识别准确率超过 96%，词语音频对齐率 98%，基于 Qwen3-ASR 。带有专业字幕编辑器、命令行工具、Skill，达芬奇字幕插件，PR 字幕插件，本地转录、远程转录、文稿匹配、智能拆行、AI校正、AI 智能热词、翻译、双语字幕、专业字幕编辑器、字幕合成、自定义大模型 API...,2026-05-11 22:04:28+00:00,2026-06-01 10:38:16+00:00,158,0,158,0,MDX,7553,,21,7.523809523809524,0.0,0.0,AI/ML
1231413949,theta-machines/DEV-G2-NANO,theta-machines,DEV-G2-NANO,https://github.com/theta-machines/DEV-G2-NANO,,2026-05-07 00:05:23+00:00,2026-05-12 00:03:29+00:00,158,13,158,1,Unknown,2011,CERN-OHL-P-2.0,25,6.32,0.0822784810126582,0.0063291139240506,Other
1236313121,BBuf/kernel-pilot,BBuf,kernel-pilot,https://github.com/BBuf/kernel-pilot,,2026-05-12 06:19:26+00:00,2026-06-02 08:22:57+00:00,158,25,158,1,Python,130753,,20,7.9,0.1582278481012658,0.0063291139240506,Other
1235098228,ddeverill/SteamlessController,ddeverill,SteamlessController,https://github.com/ddeverill/SteamlessController,Support for the 2026 Steam Controller in Non-Steam games,2026-05-11 02:26:22+00:00,2026-05-25 15:41:30+00:00,157,4,157,13,C++,106,MIT,21,7.476190476190476,0.0254777070063694,0.0828025477707006,Other
1256080504,VAST-AI-Research/TripoSplat,VAST-AI-Research,TripoSplat,https://github.com/VAST-AI-Research/TripoSplat,"TripoSplat converts a single 2D image into high-quality and variable number of 3D Gaussians, developed by TripoAI.",2026-06-01 12:50:21+00:00,2026-06-02 08:47:41+00:00,157,9,157,0,Python,4749,MIT,1,157.0,0.0573248407643312,0.0,Other
1227691444,Cyrene963/hermes-patches,Cyrene963,hermes-patches,https://github.com/Cyrene963/hermes-patches,Hermes Agent 社区补丁合集 - Community patches for Hermes Agent,2026-05-03 03:07:41+00:00,2026-06-01 15:49:47+00:00,157,16,157,1,Python,12525,,29,5.413793103448276,0.1019108280254777,0.0063694267515923,AI/ML
1229751246,huggingface/Repo2RLEnv,huggingface,Repo2RLEnv,https://github.com/huggingface/Repo2RLEnv,Convert any Repo into an RL Environment ,2026-05-05 10:54:18+00:00,2026-06-02 05:35:48+00:00,157,19,157,7,Python,1217,Apache-2.0,27,5.814814814814815,0.1210191082802547,0.0445859872611464,Other
1245933910,LUPUL64348/NTE-cheat,LUPUL64348,NTE-cheat,https://github.com/LUPUL64348/NTE-cheat,nte Neverness To Everness cheat download pc auto fish ray tracing bot teleport esp speedhack  macro script unlocker config windows 11,2026-05-21 17:49:54+00:00,2026-05-21 17:55:18+00:00,157,0,157,2,C#,171,MIT,11,14.272727272727272,0.0,0.0127388535031847,Other
1241798106,hossein8360/cdn-ip-finder,hossein8360,cdn-ip-finder,https://github.com/hossein8360/cdn-ip-finder,CDN IP finder for ShirOKhorshid domain fronting,2026-05-17 20:36:39+00:00,2026-05-18 12:51:21+00:00,156,64,156,3,HTML,943,,15,10.4,0.4102564102564102,0.0192307692307692,Web
1233021136,Eriemon/verilog-generator,Eriemon,verilog-generator,https://github.com/Eriemon/verilog-generator,Agent skill for Verilog-2001 RTL generation and FPGA design workflows.,2026-05-08 14:04:10+00:00,2026-05-29 08:48:02+00:00,156,4,156,0,Python,678,Apache-2.0,24,6.5,0.0256410256410256,0.0,AI/ML
1232763235,chencore/autoresearch-crypto,chencore,autoresearch-crypto,https://github.com/chencore/autoresearch-crypto,autoresearch-crypto,2026-05-08 08:43:45+00:00,2026-05-10 01:23:47+00:00,156,34,156,0,Python,24762,MIT,24,6.5,0.2179487179487179,0.0,Finance/Trading
1247242073,aa0101181514/tw-legal-rag,aa0101181514,tw-legal-rag,https://github.com/aa0101181514/tw-legal-rag,"Open-source CLI for semantic Taiwan legal judgment retrieval. Search judgments, package them for your own AI (ChatGPT/Claude/Gemini), and run a bundle-level citation check. Bring your own LLM; retrieval-only.",2026-05-23 04:12:36+00:00,2026-05-27 12:23:30+00:00,155,26,155,11,Python,92,MIT,9,17.22222222222222,0.1677419354838709,0.0709677419354838,AI/ML
1246276785,aliyun/alibabacloud-ecs-troubleshoot-skills,aliyun,alibabacloud-ecs-troubleshoot-skills,https://github.com/aliyun/alibabacloud-ecs-troubleshoot-skills,Troubleshooting skills for Alibaba Cloud ECS,2026-05-22 03:26:46+00:00,2026-06-02 03:35:01+00:00,155,13,155,0,Python,10833,Apache-2.0,10,15.5,0.0838709677419354,0.0,AI/ML
1242538068,CWS6206/easynetworkscanner,CWS6206,easynetworkscanner,https://github.com/CWS6206/easynetworkscanner,"Easy Network Scanner ist eine portable Windows-11-App fuer LAN-, WLAN- und Performance-Diagnose.",2026-05-18 14:13:40+00:00,2026-05-20 06:45:18+00:00,155,41,155,0,C#,67,GPL-3.0,14,11.071428571428571,0.2645161290322581,0.0,Other
1229268651,fitchmultz/pi-cursor-sdk,fitchmultz,pi-cursor-sdk,https://github.com/fitchmultz/pi-cursor-sdk,"Run Cursor models inside the pi coding agent via local Cursor SDK agents, with native model selection, thinking controls, fast/plan modes, image input, and MCP-bridged pi tools.",2026-05-04 21:49:35+00:00,2026-06-01 22:16:39+00:00,154,6,154,6,TypeScript,2141,MIT,28,5.5,0.0389610389610389,0.0389610389610389,AI/ML
1233646374,saileaxh/iida-mcp,saileaxh,iida-mcp,https://github.com/saileaxh/iida-mcp,"Faster, with excellent architecture, stronger performance, and kernel access support — an ida-mcp tool",2026-05-09 07:23:02+00:00,2026-05-15 22:31:57+00:00,154,19,154,4,Python,171,,23,6.695652173913044,0.1233766233766233,0.0259740259740259,AI/ML
