id,full_name,owner,name,html_url,description,created_at,pushed_at,stars,forks,watchers,open_issues,primary_language,size,license,age_days,stars_per_day,fork_star_ratio,issue_star_ratio,category
1275484609,FFF686868/proxypin-wloc-spoofer,FFF686868,proxypin-wloc-spoofer,https://github.com/FFF686868/proxypin-wloc-spoofer,ProxyPin script for authorized iOS Apple WLOC response rewriting tests,2026-06-20 18:47:23+00:00,2026-06-29 17:49:53+00:00,254,40,254,4,JavaScript,2024,MIT,18,14.11111111111111,0.1574803149606299,0.0157480314960629,Mobile
1266977227,craftzdog/tmux-claude-session-manager,craftzdog,tmux-claude-session-manager,https://github.com/craftzdog/tmux-claude-session-manager,"Run many Claude Code sessions across your projects, each in its own tmux session — then list them, see which are done vs. still working, and jump to one from a single popup.",2026-06-12 05:46:11+00:00,2026-07-09 07:36:35+00:00,253,33,253,0,Shell,1306,MIT,26,9.73076923076923,0.1304347826086956,0.0,AI/ML
1274967178,dengxibo/sumatrapdf-plus,dengxibo,sumatrapdf-plus,https://github.com/dengxibo/sumatrapdf-plus,,2026-06-20 05:02:36+00:00,2026-07-08 15:08:29+00:00,253,14,253,7,C,333496,GPL-3.0,18,14.055555555555555,0.0553359683794466,0.0276679841897233,Other
1274708755,scottstts/Threejs-Awesome-Graphics-Agent-Skills,scottstts,Threejs-Awesome-Graphics-Agent-Skills,https://github.com/scottstts/Threejs-Awesome-Graphics-Agent-Skills,A three.js agent skills for producing awesome graphics for scenes and games,2026-06-19 20:04:15+00:00,2026-07-04 13:36:29+00:00,253,30,253,0,JavaScript,75456,MIT,19,13.31578947368421,0.1185770750988142,0.0,AI/ML
1270492601,Derssa/Torollo,Derssa,Torollo,https://github.com/Derssa/Torollo,"Torollo is an open-source interactive visual playground designed to learn system design and networking, all locally.",2026-06-15 19:07:48+00:00,2026-07-09 03:47:53+00:00,253,26,253,5,TypeScript,1707,MIT,23,11.0,0.1027667984189723,0.0197628458498023,DevOps
1285808809,easylink-ai-open/agent-runtime,easylink-ai-open,agent-runtime,https://github.com/easylink-ai-open/agent-runtime,"Standalone agent runtime core with neutral LLM types, provider clients, tool loop, and extension protocols.",2026-07-01 06:57:21+00:00,2026-07-01 07:10:31+00:00,253,44,253,0,Python,75,Apache-2.0,7,36.142857142857146,0.1739130434782608,0.0,AI/ML
1281327178,realchendahuang/sub-store-cloudflare,realchendahuang,sub-store-cloudflare,https://github.com/realchendahuang/sub-store-cloudflare,一个部署在 Cloudflare Workers 上的订阅聚合与规则配置工具。它把订阅源、节点处理、组合订阅和分流规则模板放在云端，客户端只需要订阅最终生成的链接。,2026-06-26 12:49:51+00:00,2026-06-28 17:11:40+00:00,253,40,253,1,TypeScript,1371,AGPL-3.0,12,21.08333333333333,0.1581027667984189,0.0039525691699604,Other
1276771230,Q-Future/Q-ReAlign,Q-Future,Q-ReAlign,https://github.com/Q-Future/Q-ReAlign,"Q-Align-style framework with lightweight LMMs, including 0.8B, 4B, and 9B checkpoints, dataset builders, caching, scoring, and CLI workflows.",2026-06-22 09:22:51+00:00,2026-06-24 08:48:57+00:00,252,2,252,0,Python,4032,,16,15.75,0.0079365079365079,0.0,CLI/Tooling
1279489980,FishCodeTech/muteki,FishCodeTech,muteki,https://github.com/FishCodeTech/muteki,Project Muteki (無敵): autonomous multi-model CTF-solving AI agent swarm,2026-06-24 18:30:32+00:00,2026-07-03 06:40:55+00:00,249,31,249,1,Python,12741,AGPL-3.0,14,17.785714285714285,0.1244979919678714,0.0040160642570281,AI/ML
1283537404,adam-s/car-diagnosis,adam-s,car-diagnosis,https://github.com/adam-s/car-diagnosis,"Diagnose a car fault from its sound — an honest, end-to-end audio-ML pipeline (scrape → clean → CLAP → calibrated triage). Proof of concept.",2026-06-29 02:41:58+00:00,2026-07-05 17:38:54+00:00,249,26,249,2,Python,44278,MIT,9,27.666666666666668,0.1044176706827309,0.0080321285140562,AI/ML
1269598644,oalanicolas/claude-design-premium,oalanicolas,claude-design-premium,https://github.com/oalanicolas/claude-design-premium,Claude Design starter kit for premium design systems,2026-06-14 23:00:30+00:00,2026-06-19 04:13:56+00:00,248,64,248,1,JavaScript,475,MIT,24,10.333333333333334,0.2580645161290322,0.0040322580645161,AI/ML
1278798595,JotaDev66/WaCalls,JotaDev66,WaCalls,https://github.com/JotaDev66/WaCalls,,2026-06-24 05:33:17+00:00,2026-07-09 07:38:04+00:00,247,105,247,6,Go,4465,MIT,14,17.642857142857142,0.4251012145748988,0.0242914979757085,Other
1268091750,lab421/forel,lab421,forel,https://github.com/lab421/forel,File automation for macOS. The open source Hazel alternative for macOS.,2026-06-13 06:11:12+00:00,2026-07-09 09:07:21+00:00,246,11,246,7,Swift,9738,GPL-3.0,25,9.84,0.0447154471544715,0.0284552845528455,Mobile
1267795511,amazon-far/abc,amazon-far,abc,https://github.com/amazon-far/abc,"ABC: Scalable Behavior Cloning with Open Data, Training, and Evaluation",2026-06-12 21:42:46+00:00,2026-07-02 16:55:43+00:00,246,14,246,8,Python,19508,Apache-2.0,26,9.461538461538462,0.056910569105691,0.032520325203252,Data
1286686612,Xingyu-Zheng/MrFlow,Xingyu-Zheng,MrFlow,https://github.com/Xingyu-Zheng/MrFlow,Multi-Resolution Flow Matching: Training-Free Diffusion Acceleration via Staged Sampling,2026-07-02 02:35:30+00:00,2026-07-07 08:32:32+00:00,244,16,244,2,Python,22562,Apache-2.0,6,40.66666666666666,0.0655737704918032,0.0081967213114754,AI/ML
1279325204,ZeKaiNie/universal-examprep-skill,ZeKaiNie,universal-examprep-skill,https://github.com/ZeKaiNie/universal-examprep-skill,,2026-06-24 15:25:04+00:00,2026-07-08 08:12:31+00:00,244,12,244,0,Python,3589,MIT,14,17.428571428571427,0.0491803278688524,0.0,Other
1278883735,gamedev-skills/awesome-gamedev-agent-skills,gamedev-skills,awesome-gamedev-agent-skills,https://github.com/gamedev-skills/awesome-gamedev-agent-skills,"Game-development Agent Skills for AI coding agents: install once and a master router loads the right skill for your engine and task. 66 original, version-pinned skills (plus a master router) in the portable SKILL.md format that runs across Claude Code, Cursor, Codex, Copilot, Gemini CLI and more, for Godot, Unity, Unreal, web and beyond.",2026-06-24 07:18:39+00:00,2026-06-27 08:36:50+00:00,243,15,243,1,Python,1991,Apache-2.0,14,17.357142857142858,0.0617283950617283,0.0041152263374485,AI/ML
1290703740,x4gKing/PasarGuard-Node,x4gKing,PasarGuard-Node,https://github.com/x4gKing/PasarGuard-Node,,2026-07-06 07:02:26+00:00,2026-07-09 08:26:37+00:00,243,544,243,1,Dockerfile,5,,2,121.5,2.2386831275720165,0.0041152263374485,Other
1291501023,oso95/scroll-world,oso95,scroll-world,https://github.com/oso95/scroll-world,"Claude Code skill/plugin: immersive scroll-scrubbed 'fly through the world' landing pages generated with Higgsfield (Emons-style diorama flights, seamless connectors, portable scrub engine).",2026-07-06 21:28:58+00:00,2026-07-09 01:06:56+00:00,243,16,243,0,JavaScript,61,MIT,2,121.5,0.0658436213991769,0.0,AI/ML
1263813956,InsiderX-Pro/SE-Bridge-TTS,InsiderX-Pro,SE-Bridge-TTS,https://github.com/InsiderX-Pro/SE-Bridge-TTS,,2026-06-09 09:39:05+00:00,2026-06-18 01:58:27+00:00,242,1,242,0,HTML,12858,,29,8.344827586206897,0.0041322314049586,0.0,Web
1284527967,mistydew/tokenicode-deepseek-alpha,mistydew,tokenicode-deepseek-alpha,https://github.com/mistydew/tokenicode-deepseek-alpha,TOKENICODE DeepSeek Alpha: a DeepSeek/CC Switch focused TOKENICODE fork,2026-06-30 00:41:56+00:00,2026-07-07 15:46:00+00:00,241,12,241,10,TypeScript,11065,Apache-2.0,8,30.125,0.0497925311203319,0.0414937759336099,Other
1293134522,x4gKing/3x-ui-Upgrade,x4gKing,3x-ui-Upgrade,https://github.com/x4gKing/3x-ui-Upgrade,,2026-07-08 06:13:23+00:00,2026-07-08 06:55:33+00:00,240,448,240,0,Dockerfile,9,,1,240.0,1.8666666666666667,0.0,Other
1264996500,Liafanx/MTproxy-reanimation,Liafanx,MTproxy-reanimation,https://github.com/Liafanx/MTproxy-reanimation,Telemt inbound SYN limiter + tuning manager,2026-06-10 11:18:57+00:00,2026-07-06 15:06:34+00:00,240,5,240,0,Shell,1041,MIT,28,8.571428571428571,0.0208333333333333,0.0,CLI/Tooling
1272228069,Tyxy-R/codex-referral-risk-research,Tyxy-R,codex-referral-risk-research,https://github.com/Tyxy-R/codex-referral-risk-research,,2026-06-17 12:08:33+00:00,2026-06-18 05:56:46+00:00,240,132,240,2,Python,64,MIT,21,11.428571428571429,0.55,0.0083333333333333,Other
1266611505,Goekdeniz-Guelmez/MLX-LoRA-Studio,Goekdeniz-Guelmez,MLX-LoRA-Studio,https://github.com/Goekdeniz-Guelmez/MLX-LoRA-Studio,"A native Mac App for LLM fine-tuning on Apple Silicon — fully on-device, fully open source.",2026-06-11 19:34:33+00:00,2026-06-22 10:01:51+00:00,239,23,239,0,Swift,30353,MIT,27,8.851851851851851,0.0962343096234309,0.0,AI/ML
1280809609,xiaohuailabs/xiaohu-ip-studio,xiaohuailabs,xiaohu-ip-studio,https://github.com/xiaohuailabs/xiaohu-ip-studio,开源中文配图技能 + IP 角色库:用「挑认知锚点→现编隐喻→反PPT自检」为中文深度文生成固定角色出演的正文配图,2026-06-26 00:49:42+00:00,2026-06-26 01:11:44+00:00,239,44,239,1,HTML,179584,MIT,12,19.916666666666668,0.1841004184100418,0.00418410041841,AI/ML
1267819000,Nintoryan/all-dpi-bypass-travel,Nintoryan,all-dpi-bypass-travel,https://github.com/Nintoryan/all-dpi-bypass-travel,"Универсальное решение для обхода любых сетевых ограничений: DPI-фильтров, белых списков операторов и региональных блокировок",2026-06-12 22:20:34+00:00,2026-07-06 08:50:57+00:00,239,12,239,14,Unknown,11,,26,9.192307692307692,0.0502092050209205,0.0585774058577405,Other
1276238183,umputun/agterm,umputun,agterm,https://github.com/umputun/agterm,Terminal for agentic flow,2026-06-21 18:04:52+00:00,2026-07-09 08:58:23+00:00,238,22,238,5,Swift,13957,MIT,17,14.0,0.0924369747899159,0.0210084033613445,AI/ML
1278082914,FlavioAdamo/openfit,FlavioAdamo,openfit,https://github.com/FlavioAdamo/openfit,Desktop dashboard and Codex-powered assistant for Fitbit data,2026-06-23 12:54:29+00:00,2026-06-26 17:29:06+00:00,238,30,238,6,TypeScript,1801,,15,15.866666666666667,0.1260504201680672,0.0252100840336134,AI/ML
1264152901,HSSkyBoy/BBZQ,HSSkyBoy,BBZQ,https://github.com/HSSkyBoy/BBZQ,由 Kotlin 全量编写的哔哩哔哩增强 Xposed 模组,2026-06-09 15:57:20+00:00,2026-07-06 06:01:59+00:00,237,19,237,5,Kotlin,986,NOASSERTION,29,8.172413793103448,0.080168776371308,0.0210970464135021,Mobile
1267028123,cha0upup/LeoAI,cha0upup,LeoAI,https://github.com/cha0upup/LeoAI,AI 驱动的后渗透综合管理平台，深度集成 LLM Agent，开箱即用。,2026-06-12 06:48:10+00:00,2026-07-07 01:29:31+00:00,237,24,237,5,Java,13696,GPL-3.0,26,9.115384615384617,0.1012658227848101,0.0210970464135021,AI/ML
1280439591,kentjuno/ainovel-cli,kentjuno,ainovel-cli,https://github.com/kentjuno/ainovel-cli,CLI sáng tác tiểu thuyết AI đa agent — Bản tiếng Việt của voocel/ainovel-cli,2026-06-25 15:28:12+00:00,2026-06-25 15:28:26+00:00,234,120,234,2,Go,6751,Apache-2.0,13,18.0,0.5128205128205128,0.0085470085470085,AI/ML
1270661532,shreyashankar/plain-writing-skill,shreyashankar,plain-writing-skill,https://github.com/shreyashankar/plain-writing-skill,"A plain-language writing skill for AI agents, with a revision view that shows what changed.",2026-06-15 23:49:32+00:00,2026-07-06 16:46:22+00:00,234,8,234,1,HTML,219,,23,10.173913043478262,0.0341880341880341,0.0042735042735042,AI/ML
1276785270,ccrpRepo/robot_retargeter,ccrpRepo,robot_retargeter,https://github.com/ccrpRepo/robot_retargeter,Motion retargeting pipeline from SMPL-X / source robots to target humanoid robots.,2026-06-22 09:38:19+00:00,2026-06-29 07:03:35+00:00,233,23,233,2,Python,599401,,16,14.5625,0.0987124463519313,0.0085836909871244,Other
1277561099,Yuuhann1999/codex-storyboard,Yuuhann1999,codex-storyboard,https://github.com/Yuuhann1999/codex-storyboard,本地多项目 Codex 视频分镜工作台，支持图片/视频生成任务、HyperFrames 与 Remotion 自动回填。Local multi-project storyboard workspace for Codex.,2026-06-23 02:09:36+00:00,2026-07-07 15:40:30+00:00,233,35,233,0,JavaScript,28430,MIT,15,15.533333333333331,0.1502145922746781,0.0,AI/ML
1290742768,kuskhan/jetendard,kuskhan,jetendard,https://github.com/kuskhan/jetendard,JetBrainsMono Nerd Font Mono rebuilt with Pretendard Korean glyphs for balanced Hangul monospace rendering.,2026-07-06 07:46:16+00:00,2026-07-07 02:08:15+00:00,233,7,233,0,Python,1417,NOASSERTION,2,116.5,0.0300429184549356,0.0,Other
1284596208,open-gigaai/giga-world-1,open-gigaai,giga-world-1,https://github.com/open-gigaai/giga-world-1,A Roadmap to Build World Models for Robot Policy Evaluation,2026-06-30 02:51:08+00:00,2026-07-07 07:28:33+00:00,232,14,232,2,Python,706808,Apache-2.0,8,29.0,0.0603448275862069,0.0086206896551724,Other
1281368037,zhaozhaozhiyi/XIAOCHUANGx,zhaozhaozhiyi,XIAOCHUANGx,https://github.com/zhaozhaozhiyi/XIAOCHUANGx,链接一切智能体的工作台,2026-06-26 13:39:28+00:00,2026-07-08 00:38:56+00:00,232,8,232,2,TypeScript,34463,MIT,12,19.33333333333333,0.0344827586206896,0.0086206896551724,Other
1266625409,itsinseong/value-for-fable,itsinseong,value-for-fable,https://github.com/itsinseong/value-for-fable,Opus에 근접한 품질을 Sonnet 단가에 — 가성비 AI 운영 모델을 직접 구축한 Claude Code 프로젝트,2026-06-11 19:54:14+00:00,2026-06-21 17:07:56+00:00,232,51,232,0,Python,229,AGPL-3.0,27,8.592592592592593,0.2198275862068965,0.0,AI/ML
1265379854,saiyam1814/kiac,saiyam1814,kiac,https://github.com/saiyam1814/kiac,"Local Kubernetes on Apple's container framework - every node is its own lightweight VM. Metrics, storage, and LoadBalancer included.",2026-06-10 18:10:36+00:00,2026-07-06 12:18:46+00:00,231,8,231,2,Go,8750,MIT,28,8.25,0.0346320346320346,0.0086580086580086,DevOps
1287378640,achrefelouafi/BuildingGeneratorThreeJS,achrefelouafi,BuildingGeneratorThreeJS,https://github.com/achrefelouafi/BuildingGeneratorThreeJS,,2026-07-02 16:22:34+00:00,2026-07-05 20:17:26+00:00,231,27,231,0,TypeScript,38601,MIT,6,38.5,0.1168831168831168,0.0,Other
1282103176,kerlenton/mcpsnoop,kerlenton,mcpsnoop,https://github.com/kerlenton/mcpsnoop,"Wireshark for MCP. A transparent proxy that shows every real tool call between your AI client and your MCP servers, live in your terminal.",2026-06-27 10:25:09+00:00,2026-07-08 19:52:00+00:00,231,13,231,3,Go,4577,MIT,11,21.0,0.0562770562770562,0.0129870129870129,AI/ML
1263914195,GuanhuaYe/codex-tmux-scroll,GuanhuaYe,codex-tmux-scroll,https://github.com/GuanhuaYe/codex-tmux-scroll,"Mouse-first fullscreen scrolling for Codex CLI, tuned for tmux workflows",2026-06-09 11:38:48+00:00,2026-06-10 11:32:07+00:00,231,13,231,0,Shell,62,Apache-2.0,29,7.9655172413793105,0.0562770562770562,0.0,AI/ML
1293496062,CWS6206/EasyLastSkill,CWS6206,EasyLastSkill,https://github.com/CWS6206/EasyLastSkill,"EasyLastSkill ist eine deutschsprachige Codex-/Agent-Skill fuer schnelle Recherchen zu den letzten Tagen eines Themas. Standardmaessig betrachtet sie die letzten 30 Tage und erstellt einen kompakten Bericht mit Quellen, Relevanzscore und Unsicherheiten.",2026-07-08 11:15:29+00:00,2026-07-08 11:35:51+00:00,230,31,230,0,Python,35,GPL-3.0,1,230.0,0.1347826086956521,0.0,AI/ML
1274566706,umacloud/umadev,umacloud,umadev,https://github.com/umacloud/umadev,"UmaDev: A coding agent that works like a real dev team, commanding the Claude Code / Codex / OpenCode you already use.",2026-06-19 16:43:11+00:00,2026-07-09 08:06:34+00:00,228,59,228,3,Rust,126597,MIT,19,12.0,0.2587719298245614,0.0131578947368421,AI/ML
1269047071,arvin341az-glitch/railway-x3ui,arvin341az-glitch,railway-x3ui,https://github.com/arvin341az-glitch/railway-x3ui,,2026-06-14 08:41:30+00:00,2026-07-05 18:27:39+00:00,227,1408,227,8,Dockerfile,56,,24,9.458333333333334,6.202643171806168,0.0352422907488986,Other
1274600688,Advai-X/advai-cli,Advai-X,advai-cli,https://github.com/Advai-X/advai-cli,"Unified CLI for local skills, external CLIs, and terminal AI chat.",2026-06-19 17:27:47+00:00,2026-07-07 07:29:39+00:00,227,4,227,0,Python,1681,MIT,19,11.947368421052632,0.0176211453744493,0.0,AI/ML
1269402869,agentsmill/age-of-agents,agentsmill,age-of-agents,https://github.com/agentsmill/age-of-agents,Age of Agents — watch your AI coding sessions grow a peaceful pixel-art realm. Run it with npx ai-of-agents.,2026-06-14 17:08:31+00:00,2026-06-24 20:48:08+00:00,226,35,226,11,TypeScript,6005,NOASSERTION,24,9.416666666666666,0.1548672566371681,0.0486725663716814,AI/ML
1287627066,tiliondev/fortress,tiliondev,fortress,https://github.com/tiliondev/fortress,"Stealth Chromium engine that stops scrapers and browser agents from getting blocked, with one line of code change.",2026-07-02 21:37:18+00:00,2026-07-09 00:45:28+00:00,225,10,225,2,Python,42403,NOASSERTION,6,37.5,0.0444444444444444,0.0088888888888888,AI/ML
1265730264,ahXN00/OwnTV,ahXN00,OwnTV,https://github.com/ahXN00/OwnTV,,2026-06-11 03:13:01+00:00,2026-07-08 21:41:29+00:00,225,34,225,1,Kotlin,16755,GPL-3.0,27,8.333333333333334,0.1511111111111111,0.0044444444444444,Mobile
1282025633,linxidnju/OpenTag,linxidnju,OpenTag,https://github.com/linxidnju/OpenTag,"Open-source, channel-native agent gateway for Slack. Route team threads to Claude Code, Codex, OpenCode, Docker, HTTP agents, and custom CLIs with policy, approvals, memory, audit logs, and artifacts.",2026-06-27 08:10:47+00:00,2026-07-02 07:51:55+00:00,225,0,225,0,JavaScript,4309,NOASSERTION,11,20.454545454545453,0.0,0.0,AI/ML
1270706314,alexchan197611/ai_media_assistant,alexchan197611,ai_media_assistant,https://github.com/alexchan197611/ai_media_assistant,AI-Powered Automate Self-Media Video Generation Tools‌,2026-06-16 01:20:58+00:00,2026-06-30 00:26:08+00:00,223,29,223,2,Python,34363,MIT,22,10.136363636363637,0.1300448430493273,0.0089686098654708,AI/ML
1269200194,jestasecurity/thumper,jestasecurity,thumper,https://github.com/jestasecurity/thumper,"Thumper is an open-source tripwire for the Shai-Hulud npm worm. Plant fake-but-realistic credentials where the worm scans - the instant one is read, you know the box might be breached. Free and built in the open by Jesta.",2026-06-14 12:28:02+00:00,2026-07-08 11:58:10+00:00,223,13,223,40,Python,2225,Apache-2.0,24,9.291666666666666,0.0582959641255605,0.179372197309417,Security
1272859739,databufflabs/databuff,databufflabs,databuff,https://github.com/databufflabs/databuff,AI-native OpenTelemetry APM with multi-agent troubleshooting. 5-minute Docker self-host.,2026-06-18 02:06:27+00:00,2026-07-08 14:20:54+00:00,222,39,222,0,Vue,11660,AGPL-3.0,20,11.1,0.1756756756756756,0.0,AI/ML
1278963617,ppxb/jm-boom,ppxb,jm-boom,https://github.com/ppxb/jm-boom,跨平台禁漫天堂第三方客户端,2026-06-24 08:47:44+00:00,2026-07-09 07:27:51+00:00,221,19,221,1,TypeScript,3326,MIT,14,15.785714285714286,0.085972850678733,0.004524886877828,Web
1269576423,mudler/depth-anything.cpp,mudler,depth-anything.cpp,https://github.com/mudler/depth-anything.cpp,A from-scratch C++17/ggml port of Depth Anything 3 (ByteDance),2026-06-14 22:09:08+00:00,2026-06-20 09:23:38+00:00,220,25,220,1,C++,6111,MIT,24,9.166666666666666,0.1136363636363636,0.0045454545454545,Other
1267764277,thebriangao/pebble,thebriangao,pebble,https://github.com/thebriangao/pebble,"The open-source alternative to Minecraft: Java Edition, a complete block-survival game in about 45,000 lines of Swift + Metal. Zero dependencies, fully deterministic, singleplayer for now. Not affiliated with Mojang or Microsoft.",2026-06-12 20:56:17+00:00,2026-07-03 06:24:00+00:00,220,38,220,5,Swift,27890,NOASSERTION,26,8.461538461538462,0.1727272727272727,0.0227272727272727,Mobile
1270936576,yehonathanlitman/Lift4D,yehonathanlitman,Lift4D,https://github.com/yehonathanlitman/Lift4D,Lift4D: Harmonizing Single-View 3D Estimation for 4D Reconstruction In-the-Wild,2026-06-16 07:21:42+00:00,2026-06-23 18:02:05+00:00,219,6,219,0,Unknown,4,,22,9.954545454545457,0.0273972602739726,0.0,Other
1269242217,YangyangQu/research-idea-scout,YangyangQu,research-idea-scout,https://github.com/YangyangQu/research-idea-scout,,2026-06-14 13:27:29+00:00,2026-06-14 15:24:15+00:00,219,12,219,1,Python,2389,MIT,24,9.125,0.0547945205479452,0.0045662100456621,Other
1270872206,dososo/chinese-traditional-patterns,dososo,chinese-traditional-patterns,https://github.com/dososo/chinese-traditional-patterns,开源的中国传统纹样图录项目 · 100 高清纹样(规划 800) · 中英日韩双语 · CC BY-NC 4.0 · https://wenyang.net,2026-06-16 06:01:05+00:00,2026-06-16 06:54:15+00:00,217,22,217,0,Unknown,250349,NOASSERTION,22,9.863636363636363,0.1013824884792626,0.0,Other
1280979277,Pengbinghui/pipeline-math,Pengbinghui,pipeline-math,https://github.com/Pengbinghui/pipeline-math,,2026-06-26 05:44:35+00:00,2026-07-09 03:07:21+00:00,217,16,217,3,Lean,3325,,12,18.08333333333333,0.0737327188940092,0.0138248847926267,Other
1291490166,OmarH-creator/Autonomous-Forge,OmarH-creator,Autonomous-Forge,https://github.com/OmarH-creator/Autonomous-Forge,"This repo is automated and is fully AI-built and AI-maintained project that continuously plans, codes, tests, and improves itself.",2026-07-06 21:12:03+00:00,2026-07-09 09:54:43+00:00,217,7,217,4,Python,1360,Apache-2.0,2,108.5,0.032258064516129,0.0184331797235023,AI/ML
1278082400,lemma-work/lemma-platform,lemma-work,lemma-platform,https://github.com/lemma-work/lemma-platform,The open-source workspace where humans and AI agents work as one team.,2026-06-23 12:53:55+00:00,2026-07-09 05:23:37+00:00,217,43,217,11,Python,39666,AGPL-3.0,15,14.466666666666669,0.1981566820276497,0.0506912442396313,AI/ML
1269122407,CortexPrism/cortex,CortexPrism,cortex,https://github.com/CortexPrism/cortex,CortexPrism — open-source AI agent operating system,2026-06-14 10:31:56+00:00,2026-06-25 23:47:48+00:00,215,117,215,0,TypeScript,8267,Apache-2.0,24,8.958333333333334,0.5441860465116279,0.0,AI/ML
1272668355,yeet-src/httpinspect,yeet-src,httpinspect,https://github.com/yeet-src/httpinspect,"top, but for the HTTP endpoints on your host — a live dashboard of the most active plaintext HTTP endpoints, right in the terminal.",2026-06-17 20:40:15+00:00,2026-07-02 21:00:29+00:00,215,14,215,2,JavaScript,721,,21,10.238095238095235,0.0651162790697674,0.0093023255813953,DevOps
1267079750,NoizAI/AudioX-Turbo,NoizAI,AudioX-Turbo,https://github.com/NoizAI/AudioX-Turbo,🚀 Fastest Anything-to-Audio Gen for conditioned sound and music creation.,2026-06-12 07:46:30+00:00,2026-06-22 09:49:06+00:00,214,31,214,1,Python,26542,NOASSERTION,26,8.23076923076923,0.1448598130841121,0.0046728971962616,Other
1271372403,yolfinance/yolfi-agent,yolfinance,yolfi-agent,https://github.com/yolfinance/yolfi-agent,"Yolfi Agent Kit SDK, CLI, and MCP server for AI coding agents.",2026-06-16 15:43:27+00:00,2026-07-06 22:09:27+00:00,214,1,214,0,JavaScript,200,MIT,22,9.727272727272728,0.0046728971962616,0.0,AI/ML
1292813857,sunflower-of-parchman/codex-hygiene,sunflower-of-parchman,codex-hygiene,https://github.com/sunflower-of-parchman/codex-hygiene,Codex skill for auditing and tuning Codex Desktop context/tool surfaces,2026-07-07 21:51:14+00:00,2026-07-08 05:24:58+00:00,213,6,213,0,Shell,23,MIT,1,213.0,0.028169014084507,0.0,AI/ML
1266138495,TradingAi666/worldcup2026-prediction-skill,TradingAi666,worldcup2026-prediction-skill,https://github.com/TradingAi666/worldcup2026-prediction-skill,"2026 世界杯 AI 预测引擎「绿茵神算」 — 经实战验证的大模型 system prompt,把 48 队资料库 + 评估方法论 + 严格 JSON 输出契约写死在单文件,任何 OpenAI 兼容接口即贴即用。",2026-06-11 10:58:44+00:00,2026-06-11 22:47:03+00:00,212,36,212,3,Unknown,26,MIT,27,7.851851851851852,0.1698113207547169,0.0141509433962264,AI/ML
1282159694,Ray-Code-Svg/SuperNovaAgent,Ray-Code-Svg,SuperNovaAgent,https://github.com/Ray-Code-Svg/SuperNovaAgent,"SuperNova is a Windows-first desktop AI Workbench that turns chat into traceable tasks. It combines a Tauri + React Workbench, Rust Product Runtime, typed protocol, and Process Kernel so actions can produce visible artifacts, runtime receipts, replayable evidence, and controlled workspace execution.",2026-06-27 11:58:48+00:00,2026-07-02 05:50:33+00:00,212,107,212,0,Rust,14283,Apache-2.0,11,19.272727272727277,0.5047169811320755,0.0,AI/ML
1289734986,karola3vax/CS2FOW,karola3vax,CS2FOW,https://github.com/karola3vax/CS2FOW,,2026-07-05 06:13:49+00:00,2026-07-09 04:04:51+00:00,211,10,211,0,C++,51736,MIT,3,70.33333333333333,0.0473933649289099,0.0,Other
1267220778,m1ckc3s/nullframe,m1ckc3s,nullframe,https://github.com/m1ckc3s/nullframe,PROJECT NULLFRAME — a live telemetry dashboard in the Nothing design language,2026-06-12 10:36:03+00:00,2026-06-20 13:46:21+00:00,211,21,211,0,TypeScript,60,MIT,26,8.115384615384615,0.0995260663507109,0.0,Data
1293473664,Nanako0129/pilotfish,Nanako0129,pilotfish,https://github.com/Nanako0129/pilotfish,"Multi-model orchestration layer for Claude Code — the frontier model plans, cheaper models execute, verification guards quality. One-prompt install.",2026-07-08 10:53:34+00:00,2026-07-09 03:41:14+00:00,210,12,210,0,Unknown,96,MIT,1,210.0,0.0571428571428571,0.0,AI/ML
1277530987,dreiachse-cyber/image-cockpit-for-codex-workflows,dreiachse-cyber,image-cockpit-for-codex-workflows,https://github.com/dreiachse-cyber/image-cockpit-for-codex-workflows,"Local cockpit for Codex imagegen, pixel art, image editing, animation, and sprite-sheet workflows.",2026-06-23 01:23:39+00:00,2026-07-08 08:23:27+00:00,209,28,209,0,TypeScript,320586,MIT,15,13.933333333333334,0.1339712918660287,0.0,AI/ML
1290728896,wassermanproductions/motion-previs-studio,wassermanproductions,motion-previs-studio,https://github.com/wassermanproductions/motion-previs-studio,"Open-source desktop app for AI-film motion, depth, pose, and camera-move previsualization.",2026-07-06 07:30:10+00:00,2026-07-08 05:05:51+00:00,209,32,209,0,TypeScript,17701,Apache-2.0,2,104.5,0.1531100478468899,0.0,AI/ML
