id,full_name,owner,name,html_url,description,created_at,pushed_at,stars,forks,watchers,open_issues,primary_language,size,license,age_days,stars_per_day,fork_star_ratio,issue_star_ratio,category
1225492439,chorus-codes/chorus,chorus-codes,chorus,https://github.com/chorus-codes/chorus,Multi-LLM peer review for code decisions. Bring your own CLI; Chorus convenes 2-4 other LLMs to review the work before you ship.,2026-04-30 10:33:16+00:00,2026-05-25 04:22:04+00:00,487,49,487,0,TypeScript,10236,Apache-2.0,24,20.291666666666668,0.1006160164271047,0.0,AI/ML
1242967652,basketikun/infinite-canvas,basketikun,infinite-canvas,https://github.com/basketikun/infinite-canvas,面向AI创作的开源无限画布工作台，集成 AI 生图、参考图编辑、画布编排、对话助手、提示词库和素材管理等功能。,2026-05-18 23:45:50+00:00,2026-05-25 03:21:22+00:00,486,93,486,5,TypeScript,688,AGPL-3.0,6,81.0,0.191358024691358,0.0102880658436214,AI/ML
1228217659,ScenemaAI/scenema-audio,ScenemaAI,scenema-audio,https://github.com/ScenemaAI/scenema-audio,"Zero-shot expressive voice cloning and speech generation. Generate anything from short clips to full-length audiobooks with realistic emotional delivery, pacing, and breath   control. Clone any voice from a 10-second reference and perform emotions the original speaker never recorded.",2026-05-03 18:44:50+00:00,2026-05-15 11:57:15+00:00,484,71,484,10,Python,114,MIT,21,23.047619047619047,0.146694214876033,0.0206611570247933,Other
1239210415,trong776/Roblox-Hub-2026,trong776,Roblox-Hub-2026,https://github.com/trong776/Roblox-Hub-2026,Developer utilities for Roblox game testing — Lua tools for exploring game mechanics and performance. MIT License.,2026-05-14 21:47:53+00:00,2026-05-14 21:49:37+00:00,481,50,481,1,Unknown,3,MIT,10,48.1,0.1039501039501039,0.002079002079002,Game
1222413951,RecursiveMAS/RecursiveMAS,RecursiveMAS,RecursiveMAS,https://github.com/RecursiveMAS/RecursiveMAS,"Offical Implementation for ""Recursive Multi-Agent Systems""",2026-04-27 10:45:06+00:00,2026-05-25 00:46:21+00:00,478,73,478,4,Python,21768,,27,17.703703703703702,0.1527196652719665,0.00836820083682,AI/ML
1238829177,S4rdenz/gta-5-mod-menu,S4rdenz,gta-5-mod-menu,https://github.com/S4rdenz/gta-5-mod-menu,"🚀 Dominate GTA V servers with this free, reliable FiveM mod menu featuring ESP, aimbot, and more, designed for Steam and Epic Games versions.",2026-05-14 13:48:33+00:00,2026-05-14 13:57:17+00:00,477,117,477,1,Unknown,7,MIT,10,47.7,0.2452830188679245,0.0020964360587002,Other
1221986048,zebangeth/PawPal,zebangeth,PawPal,https://github.com/zebangeth/PawPal,"一只住在你桌面上的小狗，提醒你休息、喝水、保持专注 | A little dog living on your desktop, reminding you to take breaks, stay hydrated, and keep focused.",2026-04-26 23:38:10+00:00,2026-05-07 00:14:11+00:00,477,64,477,13,TypeScript,241213,MIT,28,17.035714285714285,0.1341719077568134,0.0272536687631027,Other
1228881105,DadsMmoLab/dads-mmo-lab,DadsMmoLab,dads-mmo-lab,https://github.com/DadsMmoLab/dads-mmo-lab,"Offline MMO private servers on Steam Deck. Free guides, Docker scripts & shell installers for classic MMOs. No subscription. No internet. Forever. Visibility:       ✅ Public",2026-05-04 13:27:40+00:00,2026-05-16 14:47:36+00:00,477,35,477,24,Shell,334,,20,23.85,0.0733752620545073,0.050314465408805,DevOps
1231330338,mykolaharmash/notelet,mykolaharmash,notelet,https://github.com/mykolaharmash/notelet,SwiftUI component for displaying rich release notes inside an app,2026-05-06 21:26:47+00:00,2026-05-20 15:02:16+00:00,473,20,473,2,Swift,30136,MIT,18,26.27777777777778,0.0422832980972515,0.0042283298097251,Mobile
1225188401,Ontos-AI/knowhere,Ontos-AI,knowhere,https://github.com/Ontos-AI/knowhere,"Knowhere extracts, parses, and outputs structured chunks ready for AI Agents and RAG.",2026-04-30 03:13:10+00:00,2026-05-21 02:54:30+00:00,473,49,473,6,Python,138972,Apache-2.0,24,19.70833333333333,0.1035940803382663,0.0126849894291754,AI/ML
1242867671,evilsocket/audit,evilsocket,audit,https://github.com/evilsocket/audit,An 8-stage vulnerability-discovery agent.,2026-05-18 20:42:44+00:00,2026-05-23 11:29:28+00:00,470,64,470,0,Python,204,MIT,6,78.33333333333333,0.1361702127659574,0.0,AI/ML
1228093729,mingli30119/stock-analysis,mingli30119,stock-analysis,https://github.com/mingli30119/stock-analysis,一句话搞定一支个股的基本面分析,2026-05-03 15:32:23+00:00,2026-05-12 13:04:34+00:00,466,83,466,4,Python,3876,MIT,21,22.19047619047619,0.1781115879828326,0.0085836909871244,Other
1239811673,nkzw-tech/codiff,nkzw-tech,codiff,https://github.com/nkzw-tech/codiff,a fast local diff viewer,2026-05-15 13:17:31+00:00,2026-05-25 03:54:16+00:00,464,20,464,1,TypeScript,5658,MIT,9,51.55555555555556,0.043103448275862,0.0021551724137931,Other
1239522492,agentic-in/elephant-agent,agentic-in,elephant-agent,https://github.com/agentic-in/elephant-agent,Personal-Model First Self Evolving AI Agent 🐘,2026-05-15 07:08:17+00:00,2026-05-24 01:52:32+00:00,462,59,462,18,Python,182984,,9,51.333333333333336,0.1277056277056277,0.0389610389610389,AI/ML
1242719319,paradigmxyz/centaur,paradigmxyz,centaur,https://github.com/paradigmxyz/centaur,"Multiplayer, self-hosted, secure agents.",2026-05-18 17:30:29+00:00,2026-05-25 02:27:51+00:00,460,54,460,31,Python,30724,NOASSERTION,6,76.66666666666667,0.117391304347826,0.067391304347826,AI/ML
1238904811,Juwluuu/Subnautica-2-Release,Juwluuu,Subnautica-2-Release,https://github.com/Juwluuu/Subnautica-2-Release,"Subnautica 2: Early Access release, Have Multiplayer 4-player co-op multiplayer, Planet Zazura exploration, DNA BioMod system, Tadpole modular submersible, new Leviathans list, CICADA crash site lore. Xbox Game Pass, Steam preload, base building blueprints, ocean currents, crafting recipes",2026-05-14 15:08:34+00:00,2026-05-14 15:27:31+00:00,459,0,459,0,C++,62,MIT,10,45.9,0.0,0.0,Game
1239965927,trong776/gta-5-mod-menu,trong776,gta-5-mod-menu,https://github.com/trong776/gta-5-mod-menu,"External game enhancement for GTA V single-player. ImGui overlay, no injection, minimal FPS impact. Windows x64, C++17.",2026-05-15 16:18:35+00:00,2026-05-15 16:26:26+00:00,458,160,458,0,Unknown,180,MIT,9,50.888888888888886,0.3493449781659388,0.0,Game
1242450421,xw7872081123/wallpaper-engine-steam,xw7872081123,wallpaper-engine-steam,https://github.com/xw7872081123/wallpaper-engine-steam,"Free Wallpaper Engine Steam: download PC windows 11, steam workshop downloader bypass, high CPU RAM usage fix, android apk mobile sync. 4k anime live wallpaper, black screen crash on startup, corsair icue razer chroma integration, ui32.exe error solution, scene web wallpaper, mobile connection pin, custom playlist screensaver, ",2026-05-18 12:44:49+00:00,2026-05-18 12:50:58+00:00,456,0,456,1,TypeScript,9,MIT,6,76.0,0.0,0.0021929824561403,Web
1221700035,Jyy1529/claude-desktop_win-zh_cn,Jyy1529,claude-desktop_win-zh_cn,https://github.com/Jyy1529/claude-desktop_win-zh_cn,"Claude Desktop Windows 中文补丁 (zh-CN) - 12700+ keys 翻译 + JS chunk UI 标签汉化。安装python,以管理员身份启动claude-zh-cn.bat",2026-04-26 15:12:40+00:00,2026-05-23 00:06:44+00:00,454,40,454,9,Python,3428,MIT,28,16.214285714285715,0.0881057268722467,0.0198237885462555,AI/ML
1237942714,snoozinjs/Delta-exec,snoozinjs,Delta-exec,https://github.com/snoozinjs/Delta-exec,"Delta exec Roblox PC mobile game assistant Autofarm, automatic questing, item collector, world teleports, chest tracker. Supported modes: Blox Fruits, Pet Simulator 99, Anime Defenders, MM2, Sol’s RNG. Speed simulator, high jump, flight mode, infinite resources, mobile optimization, cloud configs.",2026-05-13 16:53:49+00:00,2026-05-13 17:01:19+00:00,454,0,454,0,C++,59,MIT,11,41.27272727272727,0.0,0.0,Mobile
1222978157,thinkwee/AwesomeOPD,thinkwee,AwesomeOPD,https://github.com/thinkwee/AwesomeOPD,Awesome List for On-Policy Distillation,2026-04-27 22:30:47+00:00,2026-05-23 19:18:34+00:00,452,6,452,1,Unknown,4336,,27,16.74074074074074,0.0132743362831858,0.0022123893805309,Other
1238930970,DARKHOLEUM/VoidStrap-For-Roblox,DARKHOLEUM,VoidStrap-For-Roblox,https://github.com/DARKHOLEUM/VoidStrap-For-Roblox,"VoidStrap: Roblox bootstrapper, launcher utility. FFlag Editor, FastFlags, FPS Unlocker, memory trimmer, CPU watcher. UI customization, Aero theme, AniWatch layout, Nvidia Profile Inspector, .NET 10. Font sharpening, skybox changer, Join-Game Notify, AppSettings JSON, client optimization.",2026-05-14 15:37:45+00:00,2026-05-14 15:58:40+00:00,452,1,452,1,C#,178,MIT,10,45.2,0.0022123893805309,0.0022123893805309,Game
1230498812,anthropics/cwc-workshops,anthropics,cwc-workshops,https://github.com/anthropics/cwc-workshops,,2026-05-06 03:53:01+00:00,2026-05-18 15:10:42+00:00,451,108,451,3,TypeScript,513,Apache-2.0,18,25.05555555555556,0.2394678492239468,0.0066518847006651,Other
1224647598,b3-fun/b3os,b3-fun,b3os,https://github.com/b3-fun/b3os,"B3OS is your automation platform for cross-chain workflows. Build automated strategies, schedule transactions, and execute complex on-chain operations.",2026-04-29 13:41:02+00:00,2026-05-21 19:27:03+00:00,450,9,450,0,TypeScript,300,MIT,25,18.0,0.02,0.0,CLI/Tooling
1237975140,pedrodg28/yuzu-emu,pedrodg28,yuzu-emu,https://github.com/pedrodg28/yuzu-emu,"Yuzu Emulator Switch Nintendo Pokemon Scarlet Violet, Mario Kart 8 Deluxe, firmware 18.1.0, prod.keys, shader stutter fix, FPS++ mod, save file importer, amiibo bin, motion control setup, local wireless LDN, multicore, handheld mode, docked mode, custom resolution, Joy-Con drift fix.",2026-05-13 17:32:38+00:00,2026-05-13 17:45:49+00:00,449,0,449,2,C++,59,MIT,11,40.81818181818182,0.0,0.0044543429844097,Game
1225594874,simchowitzlabpublic/nano-world-model,simchowitzlabpublic,nano-world-model,https://github.com/simchowitzlabpublic/nano-world-model,"A Minimalist, Batteries-included Repository for Advancing World Model Science.",2026-04-30 12:47:25+00:00,2026-05-22 04:31:00+00:00,448,24,448,2,Python,27400,MIT,24,18.666666666666668,0.0535714285714285,0.0044642857142857,Other
1232997470,HiDream-ai/HiDream-O1-Image,HiDream-ai,HiDream-O1-Image,https://github.com/HiDream-ai/HiDream-O1-Image,,2026-05-08 13:36:17+00:00,2026-05-20 09:02:45+00:00,447,26,447,6,Python,62992,MIT,16,27.9375,0.058165548098434,0.0134228187919463,Other
1229143132,BansheeSaboteurDarn/Minecraft-Vape-V4-Crack,BansheeSaboteurDarn,Minecraft-Vape-V4-Crack,https://github.com/BansheeSaboteurDarn/Minecraft-Vape-V4-Crack,⭐️ Minecraft-Vape-V4 Aimbot ESP WH | Speedhack Fly NoClip | Auto Farm AntiAFK | Mod Menu Loader Injector | Triggerbot NoRecoil Glow | Macro Cheat Menu Executor | HWID Spoofer Undetected | Latest Build 2026 | PC Windows 10/11 ⭐️,2026-05-04 18:39:47+00:00,2026-05-25 03:57:37+00:00,446,0,446,2,Unknown,62,NOASSERTION,20,22.3,0.0,0.0044843049327354,Other
1240535795,SubamanojJ-2004/gta-5-mod-menu,SubamanojJ-2004,gta-5-mod-menu,https://github.com/SubamanojJ-2004/gta-5-mod-menu,"Ultimate Enhancement Toolkit for GTA V — powerful mod menu with ESP, vehicle spawner, recovery features, and clean UI",2026-05-16 08:50:42+00:00,2026-05-16 10:48:23+00:00,445,61,445,0,Unknown,19,MIT,8,55.625,0.1370786516853932,0.0,Other
1226966899,matthart1983/syswatch,matthart1983,syswatch,https://github.com/matthart1983/syswatch,"Single-host system diagnostics TUI. Sibling to netwatch. Twelve tabs, plain-English insights, session scrubber. macOS + Linux.",2026-05-02 03:18:06+00:00,2026-05-24 01:09:53+00:00,443,18,443,0,Rust,6500,MIT,22,20.13636363636364,0.0406320541760722,0.0,CLI/Tooling
1242694525,AbhishekK130804/Claude-Mythos-AI-Anthropic-App,AbhishekK130804,Claude-Mythos-AI-Anthropic-App,https://github.com/AbhishekK130804/Claude-Mythos-AI-Anthropic-App,"Claude pro free Mythos design Opus Cowork  Sonnet AI Anthropic App: download free PC android apk iOS, Anthropic Claude API key setup, Claude roleplay mythos client, SillyTavern Claude prompt formatting, custom system prompt jailbreak, Mythos AI creative writing app, Claude 3.5 Sonnet Opus API cost, open source LLM frontend, Claude reverse proxy ",2026-05-18 17:01:42+00:00,2026-05-18 17:08:14+00:00,442,1,442,1,C#,174,MIT,6,73.66666666666667,0.002262443438914,0.002262443438914,AI/ML
1226446524,ynsmroztas/cPanelSniper,ynsmroztas,cPanelSniper,https://github.com/ynsmroztas/cPanelSniper,CVE-2026-41940 — cPanel & WHM Authentication Bypass via Session-File CRLF Injection,2026-05-01 12:09:26+00:00,2026-05-01 12:10:32+00:00,440,130,440,6,Python,278,,23,19.130434782608692,0.2954545454545454,0.0136363636363636,Security
1233569086,Sayhi-bzb/Agent-HTML,Sayhi-bzb,Agent-HTML,https://github.com/Sayhi-bzb/Agent-HTML,"AI-friendly semantic HTML architecture for better human-agent collaboration.Replacing long Markdown with stable, interactive artifacts.",2026-05-09 05:22:38+00:00,2026-05-24 12:25:23+00:00,439,14,439,0,TypeScript,4600,,15,29.266666666666666,0.0318906605922551,0.0,AI/ML
1233543984,nickvasilescu/hermes-desktop-os1,nickvasilescu,hermes-desktop-os1,https://github.com/nickvasilescu/hermes-desktop-os1,Hermes Desktop - OS1 Edition: native macOS workspace for Hermes Agent on Orgo cloud computers and SSH hosts,2026-05-09 04:32:48+00:00,2026-05-09 05:01:58+00:00,438,85,438,7,Swift,13898,MIT,15,29.2,0.1940639269406392,0.0159817351598173,AI/ML
1226393992,Ktovoz/Skiritai,Ktovoz,Skiritai,https://github.com/Ktovoz/Skiritai,AI-powered test automation framework that explores test paths with AI and generates replayable scripts for 30x faster execution.,2026-05-01 10:41:02+00:00,2026-05-17 18:17:05+00:00,435,20,435,1,Python,594,MIT,23,18.91304347826087,0.0459770114942528,0.0022988505747126,AI/ML
1230393704,WeritoP/BetterNitroDiscord,WeritoP,BetterNitroDiscord,https://github.com/WeritoP/BetterNitroDiscord,"BetterDiscord Plugin for Nitro features. Unlock screensharing modes, use cross-server and gif emotes and much more!",2026-05-06 00:39:25+00:00,2026-05-06 01:10:12+00:00,434,54,434,0,Unknown,8,,18,24.11111111111111,0.1244239631336405,0.0,Other
1239864142,shannhk/hermes-agent-control-room,shannhk,hermes-agent-control-room,https://github.com/shannhk/hermes-agent-control-room,Control Room-first template for managing Hermes agents from one VPS agent to specialist teams and orchestrated workflows,2026-05-15 14:18:45+00:00,2026-05-16 19:30:12+00:00,433,70,433,0,Shell,1781,MIT,9,48.11111111111112,0.161662817551963,0.0,AI/ML
1242676844,ZoyaMalhotra/DualSenseX-DSX-Steam-Edition,ZoyaMalhotra,DualSenseX-DSX-Steam-Edition,https://github.com/ZoyaMalhotra/DualSenseX-DSX-Steam-Edition,"DualSenseX Steam: DSX free download github, adaptive triggers test mod PC, audio to haptics setup, Xbox 360 DualShock 4 emulation. ViGEmBus driver error fix, Bluetooth audio latency, Cyberpunk 2077 controller mod, non-steam games controller not working, DS4Windows alternative. Paliverse crack bypass, BSOD crash fix, Steam Xbox Extended Feature",2026-05-18 16:41:06+00:00,2026-05-18 16:49:49+00:00,432,2,432,2,C++,53,MIT,6,72.0,0.0046296296296296,0.0046296296296296,Other
1222527844,ifixai-ai/iFixAi,ifixai-ai,iFixAi,https://github.com/ifixai-ai/iFixAi,"The open-source diagnostic for AI misalignment. 32 tests across fabrication, manipulation, deception, unpredictability, and opacity. Provider-agnostic. Runs against OpenAI, Anthropic, Bedrock, Azure, Gemini, and more. Letter grade in under 5 minutes, content-addressed manifest for bit-identical replay. Built by iMe.",2026-04-27 13:02:34+00:00,2026-05-22 11:52:19+00:00,431,76,431,2,Python,20939,Apache-2.0,27,15.962962962962964,0.1763341067285382,0.0046403712296983,AI/ML
1236667279,TheRunicDev/MaaNTE,TheRunicDev,MaaNTE,https://github.com/TheRunicDev/MaaNTE,"MaaNTE Neverness to Everness (NTE) MAAFramework  强力驱动！QQ交流群 异环小助手，由 Automation assistant for Neverness to Everness Auto fishing, auto-sell fish, auto-buy bait. Features: auto coffee making, cafe revenue extraction, auto-skip story dialogue, auto-claim daily rewards.",2026-05-12 13:10:07+00:00,2026-05-12 13:14:46+00:00,430,1,430,1,Unknown,4,MIT,12,35.833333333333336,0.0023255813953488,0.0023255813953488,CLI/Tooling
1246091920,Jawaz-Keyzor/FL-Studio-2026-Producer-Edition-Unlock,Jawaz-Keyzor,FL-Studio-2026-Producer-Edition-Unlock,https://github.com/Jawaz-Keyzor/FL-Studio-2026-Producer-Edition-Unlock,"Full feature activation for FL Studio 2026 Producer Edition. Enables all plugins, VST support, audio export without restrictions, and lifetime updates. Educational tool for studying DAW architecture.",2026-05-21 21:37:42+00:00,2026-05-21 21:41:14+00:00,429,371,429,1,Unknown,11,MIT,3,143.0,0.8648018648018648,0.0023310023310023,Other
1239622387,husu/loom,husu,loom,https://github.com/husu/loom,一个写接口文档的AI Agent。支持使用Vibe coding 的方式，编写接口文档，同时自带友好的文档查看工具与接口Mock工具,2026-05-15 09:19:02+00:00,2026-05-19 02:43:49+00:00,428,22,428,1,Unknown,51,,9,47.55555555555556,0.0514018691588785,0.0023364485981308,Other
1228395065,WeritoP/FL-STUDIO-PATCHER,WeritoP,FL-STUDIO-PATCHER,https://github.com/WeritoP/FL-STUDIO-PATCHER,Fl Stduio patch for lifetime works,2026-05-04 01:04:55+00:00,2026-05-04 01:06:17+00:00,428,56,428,0,Unknown,2,,20,21.4,0.1308411214953271,0.0,Other
1237319927,WantongC/journal-adapt-writing-skill,WantongC,journal-adapt-writing-skill,https://github.com/WantongC/journal-adapt-writing-skill,"Learn any journal's writing conventions from its published papers, then revise your manuscript to match — section by section.",2026-05-13 04:33:17+00:00,2026-05-15 03:18:22+00:00,427,28,427,0,Unknown,177,MIT,11,38.81818181818182,0.0655737704918032,0.0,AI/ML
1226088627,nateherkai/AIS-OS,nateherkai,AIS-OS,https://github.com/nateherkai/AIS-OS,"AI Operating System starter kit for Claude Code — three-skill kit (/onboard, /audit, /level-up) + 3Ms framework. Companion to the AIOS masterclass.",2026-05-01 00:53:01+00:00,2026-05-01 00:56:58+00:00,426,159,426,5,Unknown,28,NOASSERTION,23,18.52173913043478,0.3732394366197183,0.0117370892018779,AI/ML
1246571349,jskblue/Tomodachi-Island-Life-Remastered,jskblue,Tomodachi-Island-Life-Remastered,https://github.com/jskblue/Tomodachi-Island-Life-Remastered,New Tomodachi Life 2026 PC Edition 🏝️ Life Sim & Mii Creator for Windows 🎮,2026-05-22 10:23:31+00:00,2026-05-22 10:23:38+00:00,424,0,424,0,Unknown,7,,2,212.0,0.0,0.0,Other
1238989758,D7EAD/mkPIVM,D7EAD,mkPIVM,https://github.com/D7EAD/mkPIVM,"Generate polymorphic, position-independent virtual machines (PIVMs) from arbitrary x86/x64 shellcode.",2026-05-14 16:45:50+00:00,2026-05-24 10:21:37+00:00,424,11,424,0,C++,15691,MIT,10,42.4,0.025943396226415,0.0,Security
1246571655,NicoleK-M/Spoof-Matrix-Hardware,NicoleK-M,Spoof-Matrix-Hardware,https://github.com/NicoleK-M/Spoof-Matrix-Hardware,"Ultimate Hardware Spoofing Suite 2026 🔧 Bypass Detection, Mask Device ID, Change MAC",2026-05-22 10:23:54+00:00,2026-05-22 10:24:01+00:00,423,0,423,0,Unknown,5,,2,211.5,0.0,0.0,Other
1246568610,larajuniorlara/Claude-Design-Studio,larajuniorlara,Claude-Design-Studio,https://github.com/larajuniorlara/Claude-Design-Studio,🚀 Claude Design AI 2026: Ultimate UI/UX Generator & Plugin Suite – Free Download,2026-05-22 10:19:50+00:00,2026-05-22 10:19:57+00:00,422,0,422,0,Unknown,7,,2,211.0,0.0,0.0,AI/ML
1246596066,rafa450367/forza-horizon-6-community-edition,rafa450367,forza-horizon-6-community-edition,https://github.com/rafa450367/forza-horizon-6-community-edition,Forza Horizon 6 Premium Free Download 2026 – Steam PC Open Source Game,2026-05-22 10:57:22+00:00,2026-05-22 10:57:28+00:00,422,0,422,0,Unknown,5,,2,211.0,0.0,0.0,Game
1246570094,Lablez/Ping-Slayer-Network-Optimizer,Lablez,Ping-Slayer-Network-Optimizer,https://github.com/Lablez/Ping-Slayer-Network-Optimizer,Ultimate Free Network Optimizer 2026 🚀 Boost FPS & Fix Ping Instantly,2026-05-22 10:21:47+00:00,2026-05-22 10:21:54+00:00,422,0,422,0,Unknown,5,,2,211.0,0.0,0.0,Other
1246595784,pheejm/forza-horizon-6-ultimate-mod-pack,pheejm,forza-horizon-6-ultimate-mod-pack,https://github.com/pheejm/forza-horizon-6-ultimate-mod-pack,Forza Horizon 6 Best New CarPack Mods 2026 🚗🔥 Free Download & More Mods,2026-05-22 10:57:00+00:00,2026-05-22 10:57:06+00:00,422,0,422,0,Unknown,9,,2,211.0,0.0,0.0,Other
1246568904,muhammadqasimkalhoro94-blip/claude-zeroclaw-agentics,muhammadqasimkalhoro94-blip,claude-zeroclaw-agentics,https://github.com/muhammadqasimkalhoro94-blip/claude-zeroclaw-agentics,🚀 ZeroClaw Subagents 2026: AI Orchestration with Claude Code Router & MCP,2026-05-22 10:20:14+00:00,2026-05-22 10:20:21+00:00,421,0,421,0,Unknown,6,,2,210.5,0.0,0.0,AI/ML
1246572250,pierremichaeljensen/Yuzu-Switch-Emulation-Kit,pierremichaeljensen,Yuzu-Switch-Emulation-Kit,https://github.com/pierremichaeljensen/Yuzu-Switch-Emulation-Kit,Yuzu Nintendo Switch Emulator 2026 ⚡ Best Free PC Download & Vulkan Setup Guide,2026-05-22 10:24:40+00:00,2026-05-22 10:24:47+00:00,421,0,421,0,Unknown,3,,2,210.5,0.0,0.0,Other
1246596322,bollahouse/office-2024-pro-integration-suite,bollahouse,office-2024-pro-integration-suite,https://github.com/bollahouse/office-2024-pro-integration-suite,Microsoft Office 2026 Premium Free Download – Full Suite Installer 🚀,2026-05-22 10:57:44+00:00,2026-05-22 10:57:51+00:00,421,0,421,0,Unknown,4,,2,210.5,0.0,0.0,Other
1246595506,rayhayqal/Mythos-Claude-Skill-Forge,rayhayqal,Mythos-Claude-Skill-Forge,https://github.com/rayhayqal/Mythos-Claude-Skill-Forge,🚀 Claude Mythos AI 2026 – Build Autonomous Agent Skills & Plugins for Next-Gen Apps,2026-05-22 10:56:37+00:00,2026-05-22 10:56:44+00:00,421,0,421,0,Unknown,5,,2,210.5,0.0,0.0,AI/ML
1246569213,sofian160616/Delta-Inject-Workstation,sofian160616,Delta-Inject-Workstation,https://github.com/sofian160616/Delta-Inject-Workstation,Delta Executor 2026 ⚡ Ultimate Roblox PC Script Hub - Free Download New,2026-05-22 10:20:38+00:00,2026-05-22 10:20:44+00:00,421,0,421,0,Unknown,5,,2,210.5,0.0,0.0,Other
1246571975,ochoaochoa330-design/Aegis-V4-Client-2026,ochoaochoa330-design,Aegis-V4-Client-2026,https://github.com/ochoaochoa330-design/Aegis-V4-Client-2026,Minecraft Vape V4 Hack 2026 Client ☑️ Instant Download New KillAura ESP,2026-05-22 10:24:17+00:00,2026-05-22 10:24:24+00:00,421,0,421,1,Unknown,6,,2,210.5,0.0,0.002375296912114,Other
1246598426,teendriller0/AllMods-Subnautica-2,teendriller0,AllMods-Subnautica-2,https://github.com/teendriller0/AllMods-Subnautica-2,﻿Subnautica 2 Mod Manager 2026 – Ultimate Multiplayer Mods Download,2026-05-22 11:00:39+00:00,2026-05-22 11:00:47+00:00,421,0,421,0,Unknown,4,,2,210.5,0.0,0.0,Other
1246568334,danyy-svg/AutoCAD-Suite-Builder,danyy-svg,AutoCAD-Suite-Builder,https://github.com/danyy-svg/AutoCAD-Suite-Builder,🚀 AutoCAD 2026 Pro Full Crack + Plugins for 3D CAD & Architectural Design,2026-05-22 10:19:28+00:00,2026-05-22 10:19:34+00:00,421,0,421,0,Unknown,5,,2,210.5,0.0,0.0,Other
1246569525,hahavelhojoguinho/guild-advancement-automator,hahavelhojoguinho,guild-advancement-automator,https://github.com/hahavelhojoguinho/guild-advancement-automator,🚀 Discord Server Booster 2026 – Auto Join & Boost Tool with Token Manager,2026-05-22 10:21:01+00:00,2026-05-22 10:21:08+00:00,421,1,421,0,Unknown,5,,2,210.5,0.002375296912114,0.0,Other
1246570909,sikander12342/Subnautica-2-Nitrox-Deep-Dive,sikander12342,Subnautica-2-Nitrox-Deep-Dive,https://github.com/sikander12342/Subnautica-2-Nitrox-Deep-Dive,Subnautica 2 Release Date 2026 PS5 & Steam - Early Access Nitrox Multiplayer Guide,2026-05-22 10:22:56+00:00,2026-05-22 10:23:03+00:00,421,0,421,0,Unknown,5,,2,210.5,0.0,0.0,Other
1239202984,pamireddyb230690ar-hue/StarCitizen-Community-Localization-Toolkit,pamireddyb230690ar-hue,StarCitizen-Community-Localization-Toolkit,https://github.com/pamireddyb230690ar-hue/StarCitizen-Community-Localization-Toolkit,🚀 Star Citizen 2026 Localization Hub: Ultimate Modding Guide & Language Files,2026-05-14 21:35:02+00:00,2026-05-14 21:35:08+00:00,420,0,420,0,Unknown,6,,10,42.0,0.0,0.0,Other
1239193277,kshreya1323/Acrobat-Esprit-Edition,kshreya1323,Acrobat-Esprit-Edition,https://github.com/kshreya1323/Acrobat-Esprit-Edition,🚀 Acrobat Editor 2026 Pro DC — Ultimate PDF Breaker & Unleashed Utility Download,2026-05-14 21:19:08+00:00,2026-05-14 21:19:14+00:00,420,0,420,0,Unknown,5,,10,42.0,0.0,0.0,Other
1221048564,samyns/Unit-3,samyns,Unit-3,https://github.com/samyns/Unit-3,"Hyprland + Quickshell + Waybar rice for Arch Linux, NieR:Automata themed",2026-04-25 17:25:54+00:00,2026-05-14 13:02:52+00:00,420,11,420,0,QML,8730,MIT,29,14.482758620689657,0.0261904761904761,0.0,Other
1228550007,WeritoP/LInjector-FORKED-,WeritoP,LInjector-FORKED-,https://github.com/WeritoP/LInjector-FORKED-,🔨 LInjector. An open-source Luau Script IDE allowing easy integration with diverse purposes. Working version at the website below. ⬇️,2026-05-04 06:11:34+00:00,2026-05-04 06:18:19+00:00,420,0,420,0,Unknown,9,MIT,20,21.0,0.0,0.0,Other
1227339848,NyxFoundation/speca,NyxFoundation,speca,https://github.com/NyxFoundation/speca,SPECA: Specification-to-Checklist Agentic Auditing Framework,2026-05-02 14:48:32+00:00,2026-05-15 22:36:11+00:00,420,26,420,9,Python,305099,MIT,22,19.09090909090909,0.0619047619047619,0.0214285714285714,Other
1224797262,Cuimao777/cuimao-translator,Cuimao777,cuimao-translator,https://github.com/Cuimao777/cuimao-translator,一键将英文PDF翻译为流畅中文的Claude Code技能,2026-04-29 16:30:21+00:00,2026-04-29 16:43:53+00:00,418,37,418,1,Unknown,29,,25,16.72,0.0885167464114832,0.0023923444976076,Other
