id,full_name,owner,name,html_url,description,created_at,pushed_at,stars,forks,watchers,open_issues,primary_language,size,license,age_days,stars_per_day,fork_star_ratio,issue_star_ratio,category
1255180606,pewdiepie-archdaemon/odysseus,pewdiepie-archdaemon,odysseus,https://github.com/pewdiepie-archdaemon/odysseus,Self-hosted AI workspace. ,2026-05-31 14:05:51+00:00,2026-06-10 10:16:53+00:00,66147,8176,66147,1129,Python,29369,AGPL-3.0,9,7349.666666666667,0.1236034891983007,0.0170680454140021,AI/ML
1242346934,unicity-astrid/sdk-js,unicity-astrid,sdk-js,https://github.com/unicity-astrid/sdk-js,JavaScript / TypeScript SDK for building Astrid OS capsules. Companion to unicity-astrid/sdk-rust.,2026-05-18 10:47:45+00:00,2026-06-07 04:16:24+00:00,8253,36,8253,4,TypeScript,258,,22,375.1363636363636,0.0043620501635768,0.0004846722403974,Other
1235834494,FULU-Foundation/OrcaSlicer-bambulab,FULU-Foundation,OrcaSlicer-bambulab,https://github.com/FULU-Foundation/OrcaSlicer-bambulab,,2026-05-11 17:44:55+00:00,2026-05-12 18:58:00+00:00,6846,5163,6846,32,C++,124818,AGPL-3.0,29,236.06896551724137,0.7541630148992112,0.0046742623429739,Other
1235403234,nexu-io/html-anything,nexu-io,html-anything,https://github.com/nexu-io/html-anything,"✨ The agentic HTML editor — your local AI agent writes the HTML, you ship it. 🚀 75 Skills × 9 Surfaces (magazine · deck · poster · XHS / tweet · prototype · data report · Hyperframes) 🛡️ Sandboxed preview · 📤 1-click to WeChat / X / Zhihu / HTML / PNG 🔑 Zero API key — Claude Code / Cursor / Codex / Gemini / Copilot / OpenCode / Qwen / Aider.",2026-05-11 09:40:38+00:00,2026-06-02 06:27:04+00:00,6528,639,6528,47,HTML,15027,Apache-2.0,29,225.1034482758621,0.0978860294117647,0.0071997549019607,AI/ML
1241960226,alibaba/open-code-review,alibaba,open-code-review,https://github.com/alibaba/open-code-review,"Open-source & free — Battle-tested at Alibaba's scale. Hybrid architecture code review tool: deterministic pipelines + LLM Agent, precise line-level comments, built-in fine-tuned ruleset (NPE, thread-safety, XSS, SQL injection), OpenAI & Anthropic compatible.",2026-05-18 02:16:36+00:00,2026-06-10 09:50:08+00:00,5968,310,5968,22,Go,6330,Apache-2.0,22,271.27272727272725,0.0519436997319034,0.0036863270777479,AI/ML
1246839757,anthropics/defending-code-reference-harness,anthropics,defending-code-reference-harness,https://github.com/anthropics/defending-code-reference-harness,"Skills for threat modeling, scanning, triage, patching, plus an autonomous scanning harness you can /customize",2026-05-22 16:00:56+00:00,2026-06-02 20:53:33+00:00,5625,398,5625,6,Python,841,NOASSERTION,18,312.5,0.0707555555555555,0.0010666666666666,Security
1237031497,simplifaisoul/osiris,simplifaisoul,osiris,https://github.com/simplifaisoul/osiris,Open Source Global Intelligence Platform - Real-Time OSINT Dashboard - A Palantir Alternative,2026-05-12 20:09:25+00:00,2026-06-09 19:47:53+00:00,5178,1049,5178,9,TypeScript,3321,MIT,28,184.92857142857144,0.2025878717651603,0.0017381228273464,Data
1239996076,vercel-labs/zerolang,vercel-labs,zerolang,https://github.com/vercel-labs/zerolang,The Programming Language for Agents,2026-05-15 16:55:16+00:00,2026-06-10 06:02:50+00:00,4954,324,4954,131,C++,33021,Apache-2.0,25,198.16,0.0654016955995155,0.0264432781590633,AI/ML
1248194723,AprilNEA/OpenLogi,AprilNEA,OpenLogi,https://github.com/AprilNEA/OpenLogi,"⚡️A native, local-first alternative to Logitech Options+, written in Rust 🦀 — remap buttons, DPI, and SmartShift over HID++. No account, no telemetry.",2026-05-24 10:10:36+00:00,2026-06-10 05:41:14+00:00,4494,84,4494,72,Rust,4141,Apache-2.0,16,280.875,0.0186915887850467,0.0160213618157543,Other
1244911834,perplexityai/bumblebee,perplexityai,bumblebee,https://github.com/perplexityai/bumblebee,"Read-only developer endpoint scanner for on-disk package, extension, and developer-tool metadata, built to check exposure to known software supply-chain compromises.",2026-05-20 18:11:37+00:00,2026-06-06 11:31:36+00:00,4369,393,4369,29,Go,141,Apache-2.0,20,218.45,0.0899519340810254,0.0066376745250629,Other
1254038692,zgwl/chinese-buy-us-stock-guide,zgwl,chinese-buy-us-stock-guide,https://github.com/zgwl/chinese-buy-us-stock-guide,美股指南,2026-05-30 04:27:25+00:00,2026-06-04 16:54:32+00:00,4021,627,4021,13,Unknown,402,,10,402.1,0.1559313603581198,0.0032330266102959,Other
1239459981,microsoft/coreutils,microsoft,coreutils,https://github.com/microsoft/coreutils,Coreutils for Windows: Installer & Packaging,2026-05-15 05:42:32+00:00,2026-06-09 20:00:18+00:00,3807,59,3807,50,Rust,106,MIT,25,152.28,0.0154977672708169,0.0131337010769634,Other
1235056479,simonlin1212/a-stock-data,simonlin1212,a-stock-data,https://github.com/simonlin1212/a-stock-data,A股全栈数据工具包 — 7层架构 · 27端点 · 13数据源 · 零第三方依赖 | Full-stack China A-Share data toolkit for AI coding assistants,2026-05-11 01:08:15+00:00,2026-06-03 15:36:31+00:00,3761,764,3761,12,Unknown,240,Apache-2.0,29,129.68965517241378,0.2031374634405743,0.0031906407870247,AI/ML
1243496690,FoundZiGu/GuJumpgate,FoundZiGu,GuJumpgate,https://github.com/FoundZiGu/GuJumpgate,,2026-05-19 11:52:52+00:00,2026-06-10 01:37:11+00:00,3759,974,3759,22,JavaScript,4618,MIT,21,179.0,0.2591114658153764,0.00585262037776,Other
1251775733,helloianneo/ian-xiaohei-illustrations,helloianneo,ian-xiaohei-illustrations,https://github.com/helloianneo/ian-xiaohei-illustrations,中文小黑怪诞正文配图生成 Skill | 16:9 白底手绘 | 少量红橙蓝批注 | Codex Skill,2026-05-27 22:47:56+00:00,2026-06-03 11:35:43+00:00,3756,331,3756,6,Unknown,13189,MIT,13,288.9230769230769,0.0881256656017039,0.0015974440894568,AI/ML
1245699721,XingYu-Zhong/DeepSeek-GUI,XingYu-Zhong,DeepSeek-GUI,https://github.com/XingYu-Zhong/DeepSeek-GUI,"AI agent workspace for DeepSeek models, with Code and Claw modes built into your application.",2026-05-21 13:22:06+00:00,2026-06-10 01:45:34+00:00,3533,306,3533,55,TypeScript,197125,MIT,19,185.94736842105263,0.0866119445230682,0.0155675063685253,AI/ML
1246625636,open-gsd/gsd-core,open-gsd,gsd-core,https://github.com/open-gsd/gsd-core,Git. Ship. Done - Core,2026-05-22 11:36:21+00:00,2026-06-10 05:49:44+00:00,3439,213,3439,56,JavaScript,26713,MIT,18,191.05555555555557,0.0619366094794998,0.01628380343123,AI/ML
1241257629,datawhalechina/Agent-Learning-Hub,datawhalechina,Agent-Learning-Hub,https://github.com/datawhalechina/Agent-Learning-Hub,AI Agent 学习路线与资料库收集,2026-05-17 06:41:12+00:00,2026-06-05 08:28:50+00:00,3378,342,3378,2,HTML,54,MIT,23,146.8695652173913,0.1012433392539964,0.0005920663114268,AI/ML
1251263546,op7418/guizang-social-card-skill,op7418,guizang-social-card-skill,https://github.com/op7418/guizang-social-card-skill,"🪧 Claude Code / Codex skill — generate Xiaohongshu carousels & WeChat 21:9+1:1 cover pairs. Editorial × Swiss visual systems, 28 layouts, 10 themes, single-file HTML → PNG. 小红书图文 + 公众号封面对",2026-05-27 12:05:05+00:00,2026-05-27 16:58:08+00:00,3262,299,3262,4,HTML,1933,AGPL-3.0,13,250.92307692307693,0.0916615573267933,0.0012262415695892,AI/ML
1246399437,OpenBMB/PilotDeck,OpenBMB,PilotDeck,https://github.com/OpenBMB/PilotDeck,Task-oriented AI Agent productivity platform,2026-05-22 06:50:28+00:00,2026-06-10 09:08:12+00:00,3107,331,3107,80,TypeScript,18471,AGPL-3.0,18,172.61111111111111,0.1065336337302864,0.0257483102671387,AI/ML
1238391754,facebookresearch/vggt-omega,facebookresearch,vggt-omega,https://github.com/facebookresearch/vggt-omega,[CVPR 2026 Oral] VGGT Omega,2026-05-14 04:43:13+00:00,2026-05-18 15:56:12+00:00,2872,114,2872,24,Python,40622,NOASSERTION,26,110.46153846153848,0.0396935933147632,0.0083565459610027,Other
1241325722,WUBING2023/PaperSpine,WUBING2023,PaperSpine,https://github.com/WUBING2023/PaperSpine,"PaperSpine is a motivation-driven skill for learning from strong academic papers, building a paper’s central argument, and rewriting manuscripts through evidence-aware blueprints, revision matrices, and LaTeX-safe audits.",2026-05-17 08:37:31+00:00,2026-06-04 02:07:47+00:00,2776,110,2776,9,Python,40945,MIT,23,120.69565217391305,0.0396253602305475,0.0032420749279538,Other
1244095591,thananon/9arm-skills,thananon,9arm-skills,https://github.com/thananon/9arm-skills,,2026-05-20 00:49:37+00:00,2026-05-26 11:47:15+00:00,2723,375,2723,4,Shell,22,,20,136.15,0.1377157546823356,0.0014689680499449,CLI/Tooling
1250822765,nexu-io/html-video,nexu-io,html-video,https://github.com/nexu-io/html-video,"Programmatic video for coding agents — HTML to video on your laptop. Turn HTML, CSS & data into real MP4s with pluggable render engines, 21 templates, AI soundtrack. Apache-2.0, no per-render fees. An official project by the Open Design team.",2026-05-27 02:08:11+00:00,2026-06-10 09:17:49+00:00,2622,296,2622,19,HTML,9603,Apache-2.0,13,201.69230769230768,0.1128909229595728,0.0072463768115942,AI/ML
1244486617,MisoLabsAI/MisoTTS,MisoLabsAI,MisoTTS,https://github.com/MisoLabsAI/MisoTTS,"Miso TTS is an 8 billion, highly emotive text-to-speech model",2026-05-20 10:04:01+00:00,2026-06-09 20:41:00+00:00,2586,231,2586,16,Python,15,NOASSERTION,20,129.3,0.0893271461716937,0.0061871616395978,Other
1257699593,cpaczek/skylight,cpaczek,skylight,https://github.com/cpaczek/skylight,"Project the aircraft passing overhead onto your ceiling in real time, from an RTL-SDR — with a live sky layer (sun, moon, stars, ISS) and where each plane is headed.",2026-06-02 23:40:28+00:00,2026-06-10 03:23:44+00:00,2491,253,2491,5,TypeScript,6057,MIT,7,355.85714285714283,0.1015656362906463,0.0020072260136491,Web
1257155061,b-nnett/goose,b-nnett,goose,https://github.com/b-nnett/goose,Goose Swift proof-of-concept README,2026-06-02 12:16:37+00:00,2026-06-02 12:40:14+00:00,2378,572,2378,27,Rust,8090,,7,339.7142857142857,0.24053826745164,0.0113540790580319,Mobile
1253077206,Gloridust/WechatOnCloud,Gloridust,WechatOnCloud,https://github.com/Gloridust/WechatOnCloud,云微WOC，云微信，自由连接,2026-05-29 06:14:13+00:00,2026-06-05 18:21:55+00:00,2300,618,2300,18,TypeScript,1828,,11,209.0909090909091,0.268695652173913,0.0078260869565217,Other
1246459259,MoonshotAI/kimi-code,MoonshotAI,kimi-code,https://github.com/MoonshotAI/kimi-code,Kimi Code CLI  —  The Starting Point for Next-Gen Agents,2026-05-22 08:02:03+00:00,2026-06-10 10:11:15+00:00,2188,244,2188,159,TypeScript,9958,MIT,18,121.55555555555556,0.1115173674588665,0.0726691042047532,AI/ML
1235832354,deeplethe/forkd,deeplethe,forkd,https://github.com/deeplethe/forkd,"Fork() for AI agent microVMs. Spawn 100 children in ~100ms from a warm parent; BRANCH a live VM in ~150ms. KVM-isolated, snapshot CoW.",2026-05-11 17:42:24+00:00,2026-06-10 06:01:02+00:00,2035,154,2035,6,Rust,2896,Apache-2.0,29,70.17241379310344,0.0756756756756756,0.0029484029484029,AI/ML
1245402600,Tong89/smartNode,Tong89,smartNode,https://github.com/Tong89/smartNode,,2026-05-21 07:31:35+00:00,2026-06-02 04:04:50+00:00,1993,175,1993,1,Python,16837,MIT,19,104.89473684210526,0.087807325639739,0.0005017561465127,Other
1240191065,DenisSergeevitch/agents-best-practices,DenisSergeevitch,agents-best-practices,https://github.com/DenisSergeevitch/agents-best-practices,"Provider-neutral Agent Skill for Codex, Claude Code, and agentic harness design.",2026-05-15 21:32:21+00:00,2026-06-06 22:07:19+00:00,1893,162,1893,4,Unknown,385,MIT,25,75.72,0.0855784469096671,0.0021130480718436,AI/ML
1251186402,GordenSun/GordenPPTSkill,GordenSun,GordenPPTSkill,https://github.com/GordenSun/GordenPPTSkill,"AI-friendly PPT builder skill: 17 hand-polished Chinese PPTX templates + non-destructive text-only editing tools (python-pptx based). Pick a template, write edits.json, build a real .pptx with the layout intact. Personal/research use only.",2026-05-27 10:25:58+00:00,2026-06-09 03:22:22+00:00,1875,175,1875,2,Python,86209,NOASSERTION,13,144.23076923076923,0.0933333333333333,0.0010666666666666,AI/ML
1252526989,ideogram-oss/ideogram4,ideogram-oss,ideogram4,https://github.com/ideogram-oss/ideogram4,Ideogram 4: Open image model at the forefront of design,2026-05-28 15:56:47+00:00,2026-06-04 15:44:03+00:00,1855,179,1855,21,Python,10448,Apache-2.0,12,154.58333333333334,0.0964959568733153,0.0113207547169811,Other
1259415257,diffusionstudio/lottie,diffusionstudio,lottie,https://github.com/diffusionstudio/lottie,Generate production-ready Lottie animations with Claude Code or Codex,2026-06-04 13:39:32+00:00,2026-06-10 09:09:40+00:00,1847,91,1847,0,TypeScript,4116,MIT,5,369.4,0.049269085002707,0.0,AI/ML
1242107382,Doorman11991/smallcode,Doorman11991,smallcode,https://github.com/Doorman11991/smallcode,AI coding agent optimized for small LLMs. 87% benchmark with 4B-active model.,2026-05-18 06:19:44+00:00,2026-06-04 20:58:09+00:00,1818,137,1818,19,JavaScript,12028,MIT,22,82.63636363636364,0.0753575357535753,0.0104510451045104,AI/ML
1244071529,butterbase-ai/butterbase,butterbase-ai,butterbase,https://github.com/butterbase-ai/butterbase,"Open-source backend-as-a-service. Postgres, auth, storage, functions, AI gateway, MCP.",2026-05-20 00:06:03+00:00,2026-06-10 08:50:00+00:00,1808,142,1808,2,TypeScript,6015,Apache-2.0,20,90.4,0.0785398230088495,0.0011061946902654,AI/ML
1237911785,google-deepmind/science-skills,google-deepmind,science-skills,https://github.com/google-deepmind/science-skills,"GDM Science Skills to speed up agentic scientific workflows with better grounding and higher token efficiency. Integrate insights from AlphaGenome, AFDB, UniProt and 30+ other databases and tools.",2026-05-13 16:17:41+00:00,2026-06-08 17:58:56+00:00,1794,179,1794,0,Python,1830,Apache-2.0,27,66.44444444444444,0.0997770345596432,0.0,Other
1239119721,yetone/native-feel-skill,yetone,native-feel-skill,https://github.com/yetone/native-feel-skill,"An Agent Skill for designing cross-platform desktop apps that feel native — distilled from Raycast's 2.0 deep-dive and reverse engineering of Raycast Beta.app. Eight architectural tenets, four-layer architecture, WebKit/WebView2 survival guide, 75-item ship audit.",2026-05-14 19:28:43+00:00,2026-05-30 15:12:34+00:00,1776,71,1776,1,Unknown,84,MIT,26,68.3076923076923,0.0399774774774774,0.000563063063063,AI/ML
1239918790,Helvesec/rmux,Helvesec,rmux,https://github.com/Helvesec/rmux,"Universal Rust multiplexer with a typed SDK — drive any CLI or TUI app from code. Native on Linux, macOS, and Windows.",2026-05-15 15:22:10+00:00,2026-06-04 22:32:01+00:00,1689,79,1689,4,Rust,3549,Apache-2.0,25,67.56,0.0467732386027235,0.0023682652457075,AI/ML
1252289708,Sophomoresty/gemini-web2api,Sophomoresty,gemini-web2api,https://github.com/Sophomoresty/gemini-web2api,"Convert Google Gemini web into OpenAI-compatible API. Zero auth, cross-platform, single file.",2026-05-28 11:25:55+00:00,2026-06-06 11:33:43+00:00,1652,398,1652,6,Python,156,MIT,12,137.66666666666666,0.2409200968523002,0.0036319612590799,AI/ML
1254681752,V0id-v2/Void-Tools-v2.0,V0id-v2,Void-Tools-v2.0,https://github.com/V0id-v2/Void-Tools-v2.0,"Python terminal multitool — OSINT, Discord, web & network utilities. Rich TUI, 13 themes, remote updates. Educational use only.",2026-05-30 21:57:30+00:00,2026-06-02 13:55:09+00:00,1645,12,1645,3,Python,893,,10,164.5,0.0072948328267477,0.0018237082066869,Web
1235122687,HermannBjorgvin/Clawdmeter,HermannBjorgvin,Clawdmeter,https://github.com/HermannBjorgvin/Clawdmeter,ESP32 desk dashboard that shows Claude Code usage,2026-05-11 03:07:49+00:00,2026-06-08 16:46:23+00:00,1578,194,1578,32,C,11577,,29,54.41379310344828,0.1229404309252218,0.0202788339670468,AI/ML
1245361579,run-liyi/wechatpay,run-liyi,wechatpay,https://github.com/run-liyi/wechatpay,微信账单分析工具 - 基于Electron的可视化账单分析应用,2026-05-21 06:40:00+00:00,2026-05-29 22:56:08+00:00,1499,139,1499,1,JavaScript,281,,19,78.89473684210526,0.0927284856571047,0.000667111407605,Other
1237819660,zhaoxuya520/reverse-skill,zhaoxuya520,reverse-skill,https://github.com/zhaoxuya520/reverse-skill,逆向/渗透/安全技能路由包 - AI 自动路由 + 按需自举工具链 + 自动进化经验库 | 支持 Claude Code / Kiro / Cursor / Cline 等代码 AI 客户端,2026-05-13 14:37:57+00:00,2026-06-04 12:15:17+00:00,1458,298,1458,0,Shell,5798,MIT,27,54.0,0.2043895747599451,0.0,AI/ML
1252583707,MatinSenPai/SenPaiScanner,MatinSenPai,SenPaiScanner,https://github.com/MatinSenPai/SenPaiScanner,"A light-weight scanner for Cloudflare IPs, written in Golang",2026-05-28 17:02:54+00:00,2026-06-06 13:35:05+00:00,1414,79,1414,38,Go,1138,MIT,12,117.83333333333331,0.0558698727015558,0.0268741159830268,Other
1242967652,basketikun/infinite-canvas,basketikun,infinite-canvas,https://github.com/basketikun/infinite-canvas,面向AI创作的开源无限画布工作台，集成 AI 生图、参考图编辑、视频生成、画布编排、对话助手、提示词库和素材管理等功能、兼容OpenAI接口，支持chatgpt2api、grok2api、flow2api、newapi等接入。,2026-05-18 23:45:50+00:00,2026-06-08 07:59:39+00:00,1322,318,1322,5,TypeScript,902,AGPL-3.0,22,60.09090909090909,0.2405446293494705,0.0037821482602118,AI/ML
1236577034,ywnd1144/Gopay_plus_automatic,ywnd1144,Gopay_plus_automatic,https://github.com/ywnd1144/Gopay_plus_automatic,,2026-05-12 11:29:47+00:00,2026-05-30 09:16:18+00:00,1315,637,1315,5,Python,52744,,28,46.96428571428572,0.4844106463878327,0.0038022813688212,Other
1256728599,jd-opensource/JoyAI-Echo,jd-opensource,JoyAI-Echo,https://github.com/jd-opensource/JoyAI-Echo,JoyAI-Echo: Pushing the Frontier of Long Audio-Visual Generation,2026-06-02 03:25:51+00:00,2026-06-08 16:45:36+00:00,1314,113,1314,6,Python,23170,NOASSERTION,7,187.7142857142857,0.0859969558599695,0.0045662100456621,Other
1262173643,NoopApp/noop,NoopApp,noop,https://github.com/NoopApp/noop,"Offline WHOOP companion — pair your strap over Bluetooth, keep all data on your own device. No cloud, no account, no subscription.",2026-06-07 17:03:02+00:00,2026-06-10 09:56:24+00:00,1310,591,1310,5,Swift,1930,NOASSERTION,2,655.0,0.4511450381679389,0.0038167938931297,Data
1239371359,tinyfish-io/bigset,tinyfish-io,bigset,https://github.com/tinyfish-io/bigset,What if you had all the data in the world?,2026-05-15 03:06:23+00:00,2026-06-10 07:38:55+00:00,1293,135,1293,30,TypeScript,16128,AGPL-3.0,25,51.72,0.1044083526682134,0.0232018561484918,Data
1241425259,LiuMengxuan04/shushu-internship-tool,LiuMengxuan04,shushu-internship-tool,https://github.com/LiuMengxuan04/shushu-internship-tool,把岗位描述变项目，把项目变简历，把简历变面试。,2026-05-17 11:25:47+00:00,2026-06-02 09:32:53+00:00,1276,63,1276,0,Python,152,NOASSERTION,23,55.47826086956522,0.0493730407523511,0.0,AI/ML
1247201816,study8677/awesome-architecture,study8677,awesome-architecture,https://github.com/study8677/awesome-architecture,"🧭 Architecture-first system design: 26 bilingual tutorials, 25 architecture templates, and 6 end-to-end cases covering distributed systems, AI-native systems, RAG, coding Agents, and production trade-offs.",2026-05-23 02:44:43+00:00,2026-06-08 04:58:01+00:00,1265,140,1265,1,Vue,1260,MIT,17,74.41176470588235,0.1106719367588932,0.000790513833992,AI/ML
1237338198,feder-cr/invisible_playwright,feder-cr,invisible_playwright,https://github.com/feder-cr/invisible_playwright,Anti-Detect Browser that passes every bot detection test. Drop-in Playwright replacement.,2026-05-13 05:04:33+00:00,2026-06-10 09:21:38+00:00,1253,134,1253,3,Python,10358,MIT,27,46.407407407407405,0.1069433359936153,0.0023942537909018,CLI/Tooling
1237004640,gi-dellav/zerostack,gi-dellav,zerostack,https://github.com/gi-dellav/zerostack,"Minimal coding agent written in Rust, optimized for memory footprint and performance",2026-05-12 19:31:49+00:00,2026-06-09 17:22:42+00:00,1234,86,1234,1,Rust,1501,GPL-3.0,28,44.07142857142857,0.0696920583468395,0.0008103727714748,AI/ML
1239459771,bytedance/Lance,bytedance,Lance,https://github.com/bytedance/Lance,"A 3B-active-parameter native unified multimodal model for image and video understanding, generation, and editing.",2026-05-15 05:42:08+00:00,2026-06-03 08:27:12+00:00,1169,78,1169,14,Python,133006,Apache-2.0,25,46.76,0.0667236954662104,0.0119760479041916,Other
1241990700,sapientinc/HRM-Text,sapientinc,HRM-Text,https://github.com/sapientinc/HRM-Text,"HRM-Text is a 1B text generation model based on the HRM architecture, strengthened by task completion and latent space reasoning.",2026-05-18 03:10:52+00:00,2026-05-27 08:44:14+00:00,1147,104,1147,11,Python,3253,Apache-2.0,22,52.13636363636363,0.090671316477768,0.009590235396687,Other
1235082631,hero8152/Infinite-Canvas,hero8152,Infinite-Canvas,https://github.com/hero8152/Infinite-Canvas,Supports comfyui/API calls/modelscope calls,2026-05-11 01:58:39+00:00,2026-06-10 07:45:09+00:00,1143,224,1143,60,Python,25094,NOASSERTION,29,39.41379310344828,0.1959755030621172,0.0524934383202099,Web
1242316635,lynote-ai/humanize-text,lynote-ai,humanize-text,https://github.com/lynote-ai/humanize-text,"Free open-source AI text humanizer to convert AI-generated content into undetectable, human-like writing. Bypass Turnitin, GPTZero, and all major AI detectors. No sign-up required. Try our unlimited free online tool",2026-05-18 10:12:15+00:00,2026-06-08 04:04:54+00:00,1117,60,1117,12,Python,5334,MIT,22,50.77272727272727,0.0537153088630259,0.0107430617726051,AI/ML
1237174940,simonlin1212/TradingAgents-astock,simonlin1212,TradingAgents-astock,https://github.com/simonlin1212/TradingAgents-astock,"A股多Agent投研框架 — 适配A股数据源(龙虎榜/游资/解禁等)，7位分析师基于A股规则的辩论决策，基于TradingAgents深度改造，适配大A。A-share multi-agent investment research framework — 7 AI analysts, bull/bear debate, risk assessment。",2026-05-13 00:22:30+00:00,2026-06-03 16:04:08+00:00,1107,333,1107,29,Python,3444,Apache-2.0,27,41.0,0.3008130081300813,0.026196928635953,AI/ML
1239159840,zarazhangrui/lark-coding-agent-bridge,zarazhangrui,lark-coding-agent-bridge,https://github.com/zarazhangrui/lark-coding-agent-bridge,"Bot that bridges Feishu/Lark messenger with a local Claude Code or Codex CLI. Streaming cards, per-chat sessions, multiple workspaces",2026-05-14 20:26:46+00:00,2026-06-10 03:36:46+00:00,1091,159,1091,72,TypeScript,656,MIT,26,41.96153846153846,0.1457378551787351,0.0659945004582951,AI/ML
1255412388,ClaudioDrews/memory-os,ClaudioDrews,memory-os,https://github.com/ClaudioDrews/memory-os,"A 7-layer memory operating system for Hermes Agent — persistent memory with Qdrant, structured facts, fabric recall, auto-curated wiki, and surgical context injection. Runs locally, any LLM provider.",2026-05-31 19:50:25+00:00,2026-06-09 00:53:15+00:00,1058,98,1058,5,Python,438,MIT,9,117.55555555555556,0.0926275992438563,0.0047258979206049,AI/ML
1235483809,juanjuandog/FinSight-AI,juanjuandog,FinSight-AI,https://github.com/juanjuandog/FinSight-AI,"AI equity research agent with resilient workflows, Redis Lua single-flight, pgvector RAG, versioned reports, evidence tracing, and RAG evaluation.",2026-05-11 11:19:40+00:00,2026-05-26 01:39:47+00:00,1053,63,1053,0,Java,1842,MIT,29,36.310344827586206,0.0598290598290598,0.0,AI/ML
1238606716,rpamis/comet,rpamis,comet,https://github.com/rpamis/comet,Comet: agent skill harness phase-guarded automation from idea to archive,2026-05-14 09:22:35+00:00,2026-06-09 10:00:12+00:00,1036,124,1036,21,TypeScript,5098,MIT,26,39.84615384615385,0.1196911196911196,0.0202702702702702,AI/ML
1237570742,OpenNSWM-Lab/FAROS,OpenNSWM-Lab,FAROS,https://github.com/OpenNSWM-Lab/FAROS,,2026-05-13 09:56:01+00:00,2026-06-10 09:28:11+00:00,1026,172,1026,1,Python,4338,,27,38.0,0.1676413255360623,0.0009746588693957,Other
1249866465,ace-trump-tech/DeltaForce-OBS-Locker,ace-trump-tech,DeltaForce-OBS-Locker,https://github.com/ace-trump-tech/DeltaForce-OBS-Locker,三角洲行动OBS锁头插件 – 基于OBS渲染注入的智能锁头辅助，支持QQ音乐/网易云联精准骨骼识别、平滑自瞄、压枪抑制，稳定过检，提升击杀效率。5L2G5YW25a6e5Lul5LiK5YWo5piv6aqX5L2g55qE77yM6L+Z5Y+q5piv5Liq5biu5L2g5a6J6KOF5pqX5Yy656qB5Zu055qE5Y+N5L2c5byK6aG555uu572i5LqG,2026-05-26 05:24:10+00:00,2026-06-10 08:47:48+00:00,1009,898,1009,39,Python,20269,,14,72.07142857142857,0.889990089197225,0.0386521308225966,Other
1237239472,LocoreMind/locoagent,LocoreMind,locoagent,https://github.com/LocoreMind/locoagent,AI-powered social media agent with real browser automation,2026-05-13 02:16:45+00:00,2026-06-05 07:12:25+00:00,1006,48,1006,0,TypeScript,9710,MIT,27,37.25925925925926,0.0477137176938369,0.0,AI/ML
1252258448,2aronS/Duel-Agents,2aronS,Duel-Agents,https://github.com/2aronS/Duel-Agents,"CLI, SDK, and IDE plugins for Duel Agents",2026-05-28 10:45:44+00:00,2026-06-05 09:03:13+00:00,1005,19,1005,1,TypeScript,73,MIT,12,83.75,0.0189054726368159,0.0009950248756218,AI/ML
1249261520,baoweise-bot/aimili-vpngate,baoweise-bot,aimili-vpngate,https://github.com/baoweise-bot/aimili-vpngate,aimili-vpngate是一个借助vpngate.net让Linux用干净ip出站的代理工具。,2026-05-25 14:13:24+00:00,2026-06-08 17:23:45+00:00,1001,347,1001,15,Python,344,NOASSERTION,15,66.73333333333333,0.3466533466533466,0.0149850149850149,Other
1237979735,google-antigravity/antigravity-cli,google-antigravity,antigravity-cli,https://github.com/google-antigravity/antigravity-cli,,2026-05-13 17:38:00+00:00,2026-06-09 20:40:53+00:00,994,65,994,307,Unknown,24971,,27,36.81481481481482,0.0653923541247484,0.3088531187122736,Other
1238043239,nolanx-ai/nolanx.ai,nolanx-ai,nolanx.ai,https://github.com/nolanx-ai/nolanx.ai,"Nolanx, Open-sourced AI Netflix.",2026-05-13 18:57:15+00:00,2026-05-26 11:01:27+00:00,979,67,979,0,Python,16852,MIT,27,36.25925925925926,0.0684371807967313,0.0,AI/ML
