id,full_name,owner,name,html_url,description,created_at,pushed_at,stars,forks,watchers,open_issues,primary_language,size,license,age_days,stars_per_day,fork_star_ratio,issue_star_ratio,category
1222214699,SlowGrowth1314/opencli-weixin-album,SlowGrowth1314,opencli-weixin-album,https://github.com/SlowGrowth1314/opencli-weixin-album,opencli plugin — 获取微信公众号合集（Album）的所有文章列表，生成 Markdown 索引文件。,2026-04-27 06:39:35+00:00,2026-05-16 01:39:28+00:00,192,17,192,2,TypeScript,36,MIT,27,7.111111111111111,0.0885416666666666,0.0104166666666666,Other
1241237008,0xSynX/pumpfun-bundler-pump.fun-bundler-bonkfun-bundler-bonk.fun-bundler-solana-token-bundler,0xSynX,pumpfun-bundler-pump.fun-bundler-bonkfun-bundler-bonk.fun-bundler-solana-token-bundler,https://github.com/0xSynX/pumpfun-bundler-pump.fun-bundler-bonkfun-bundler-bonk.fun-bundler-solana-token-bundler,Solana Pumpfun Bundler Solana Pump.fun bundler Solana Pumpfun Bundler Solana Pump.fun bundler Solana Pumpfun Bundler Solana Pump.fun bundler Solana Pumpfun Bundler Solana Pump.fun bundler Solana Pumpfun Bundler Solana Pumpfun bundler Solana Pumpfun Bundler Solana Pumpfun bundler Solana Pumpfun Bundler Solana Pumpfun Bundler Solana Pumpfun bundler,2026-05-17 06:00:51+00:00,2026-05-17 06:00:54+00:00,192,2318,192,1,TypeScript,1336,,7,27.428571428571427,12.072916666666666,0.0052083333333333,Other
1226007284,bensenescu/downy,bensenescu,downy,https://github.com/bensenescu/downy,OpenClaw Alternative - Create a team of agents and work with them from anywhere.,2026-04-30 21:57:12+00:00,2026-05-06 16:41:36+00:00,191,31,191,3,TypeScript,8325,MIT,24,7.958333333333333,0.1623036649214659,0.0157068062827225,AI/ML
1235135158,Shanyin-ai/Story-to-game,Shanyin-ai,Story-to-game,https://github.com/Shanyin-ai/Story-to-game,A complete toolkit for creating & running branch narrative games: includes an HTML-based interactive story game launcher (supports JSON scripts) and an AI skill that converts novels/ scripts/outlines into playable branch story game JSON files.,2026-05-11 03:30:31+00:00,2026-05-17 15:30:57+00:00,191,20,191,1,HTML,715,MIT,13,14.692307692307692,0.1047120418848167,0.0052356020942408,AI/ML
1230402021,reakjra/omikuji,reakjra,omikuji,https://github.com/reakjra/omikuji,Qt/QML based game launcher for Linux,2026-05-06 00:56:45+00:00,2026-05-24 10:18:14+00:00,190,9,190,19,Rust,8059,GPL-3.0,18,10.555555555555555,0.0473684210526315,0.1,Game
1247881802,Astraltenprosper/uncensored-ai-image-video-generator,Astraltenprosper,uncensored-ai-image-video-generator,https://github.com/Astraltenprosper/uncensored-ai-image-video-generator,AI tool for generating uncensored images and videos (18+),2026-05-23 22:55:11+00:00,2026-05-23 23:10:56+00:00,190,6,190,2,Python,22,MIT,1,190.0,0.031578947368421,0.0105263157894736,AI/ML
1246569455,Polymarket-Trading-kit/crypto-trading-bot,Polymarket-Trading-kit,crypto-trading-bot,https://github.com/Polymarket-Trading-kit/crypto-trading-bot,crypto trading bot crypto trading bot crypto trading bot crypto trading bot crypto trading bot crypto trading bot crypto trading bot crypto trading bot crypto trading bot crypto trading bot crypto trading bot crypto trading bot crypto trading bot crypto trading bot crypto trading bot crypto trading bot crypto trading bot crypto trading bot crypto,2026-05-22 10:20:55+00:00,2026-05-22 10:22:34+00:00,189,1303,189,0,TypeScript,128,,2,94.5,6.894179894179894,0.0,Other
1241016411,2b2tplace/1m_release,2b2tplace,1m_release,https://github.com/2b2tplace/1m_release,"The Largest World Download Project in 2b2t, and in Minecraft altogether. Full info + Renders + Timelapses (+ Torrent soon)",2026-05-16 21:24:05+00:00,2026-05-20 00:28:17+00:00,189,3,189,2,Unknown,54,CC0-1.0,8,23.625,0.0158730158730158,0.0105820105820105,Other
1228117001,bschoepke/ableton-live-mcp,bschoepke,ableton-live-mcp,https://github.com/bschoepke/ableton-live-mcp,General-purpose MCP bridge for Ableton Live,2026-05-03 16:06:47+00:00,2026-05-21 17:08:26+00:00,188,5,188,1,Python,524,MIT,21,8.952380952380953,0.026595744680851,0.0053191489361702,Other
1224676514,Sanyam-G/switch,Sanyam-G,switch,https://github.com/Sanyam-G/switch,A keyboard-driven window switcher for macOS. Notarized. Free.,2026-04-29 14:12:26+00:00,2026-05-24 08:05:17+00:00,188,9,188,7,Swift,194,NOASSERTION,25,7.52,0.0478723404255319,0.0372340425531914,Mobile
1228342438,tachikomared/character-animation-creator-skill,tachikomared,character-animation-creator-skill,https://github.com/tachikomared/character-animation-creator-skill,Character Animation Creator Skill for Codex and GPT Web Agent — generates game-ready animations and sprites from reference images or text prompts,2026-05-03 22:52:19+00:00,2026-05-08 23:42:15+00:00,188,20,188,1,Python,3160,,21,8.952380952380953,0.1063829787234042,0.0053191489361702,AI/ML
1246565611,Polymarket-Trading-kit/sports-trading-bot,Polymarket-Trading-kit,sports-trading-bot,https://github.com/Polymarket-Trading-kit/sports-trading-bot,sports trading bot on polymarket sports trading bot on polymarket sports trading bot on polymarket sports trading bot on polymarket sports trading bot on polymarket sports trading bot on polymarket sports trading bot on polymarket sports trading bot on polymarket sports trading bot on polymarket sports trading bot on polymarket sports trading bot,2026-05-22 10:15:51+00:00,2026-05-22 10:19:50+00:00,187,1341,187,0,TypeScript,41,,2,93.5,7.171122994652406,0.0,Other
1228998193,ShipwrightWall/Soundpad-Latest-2026,ShipwrightWall,Soundpad-Latest-2026,https://github.com/ShipwrightWall/Soundpad-Latest-2026,⭐️ Soundpad Latest 2026 | Audio Mixer Soundboard | Setup Installer v2.4 | Activation Key Pre-Activated | Serial License Key Full Version | Latest Build Pro Updated | Get Desktop Working Windows 10/11 | Sound Effects Library | Custom Soundboard Creator | Direct Genuine Original x64 ⭐️,2026-05-04 15:40:37+00:00,2026-05-25 04:06:09+00:00,187,0,187,1,C++,71,NOASSERTION,20,9.35,0.0,0.0053475935828877,Other
1232727602,zy-zmc/tianming-novel-ai-writer,zy-zmc,tianming-novel-ai-writer,https://github.com/zy-zmc/tianming-novel-ai-writer,天命 — AI网文创作系统 | 12维事实快照 · 9类变更声明 · 6道生成门禁 | 写到3000章依然连贯，不靠模型记忆，靠每章状态回写,2026-05-08 07:57:06+00:00,2026-05-25 03:09:08+00:00,186,39,186,0,C#,15132,MIT,16,11.625,0.2096774193548387,0.0,Other
1239115006,Trading-codex/polymarket-arbitrage-trading-bot,Trading-codex,polymarket-arbitrage-trading-bot,https://github.com/Trading-codex/polymarket-arbitrage-trading-bot,"polymarket trading bot polymarket arbitrage bot, polymarket trading bot polymarket arbitrage bot, polymarket trading bot polymarket arbitrage bot, polymarket trading bot polymarket arbitrage bot, polymarket trading bot polymarket arbitrage bot, polymarket trading bot polymarket  bot, ",2026-05-14 19:22:12+00:00,2026-05-14 19:22:47+00:00,186,2451,186,1,TypeScript,4003,,10,18.6,13.17741935483871,0.0053763440860215,Web
1239200930,Aryanzzzz25/f95-zone-sync-manager,Aryanzzzz25,f95-zone-sync-manager,https://github.com/Aryanzzzz25/f95-zone-sync-manager,Best NSFW Game Manager 2026 – Auto Install & Update Mods Fast ⚡🎮,2026-05-14 21:31:40+00:00,2026-05-14 21:31:46+00:00,186,0,186,0,Unknown,4,,10,18.6,0.0,0.0,Game
1221048533,aeroxy/ast-bro,aeroxy,ast-bro,https://github.com/aeroxy/ast-bro,"Fast, AST-based code-navigation toolkit for source files — surface the shape of a file (signatures with line numbers, no method bodies), the true public API of a package, the dependency graph between files, the call graph between symbols, and search the repo by symbol or behaviour.",2026-04-25 17:25:51+00:00,2026-05-24 04:41:36+00:00,186,14,186,0,Rust,645,MIT,29,6.413793103448276,0.075268817204301,0.0,Web
1239194752,ogaawin/Draft-2026-CAD-Workspace,ogaawin,Draft-2026-CAD-Workspace,https://github.com/ogaawin/Draft-2026-CAD-Workspace,🚀 Free AutoCAD 2026 Crack Download – Instant & Fast Install Full CAD,2026-05-14 21:21:24+00:00,2026-05-14 21:21:30+00:00,185,0,185,0,Unknown,5,,10,18.5,0.0,0.0,Other
1239202332,JorgeSnn/psn-plus-controller-config,JorgeSnn,psn-plus-controller-config,https://github.com/JorgeSnn/psn-plus-controller-config,Ultimate PS Plus Premium Tools 2026 🎮 Best PSN Automation & Cloud Saves Manager,2026-05-14 21:33:54+00:00,2026-05-14 21:34:01+00:00,185,0,185,1,Unknown,5,,10,18.5,0.0,0.0054054054054054,CLI/Tooling
1225618516,ailuntx/Thinking-with-Visual-Primitives,ailuntx,Thinking-with-Visual-Primitives,https://github.com/ailuntx/Thinking-with-Visual-Primitives,Archived snapshot of Thinking-with-Visual-Primitives,2026-04-30 13:15:36+00:00,2026-05-22 13:23:35+00:00,185,57,185,0,Makefile,13666,MIT,24,7.708333333333333,0.3081081081081081,0.0,Other
1229989330,HELPMEEADICE/BANDORI-PET-REV,HELPMEEADICE,BANDORI-PET-REV,https://github.com/HELPMEEADICE/BANDORI-PET-REV,BandoriPet 是一个基于 Live2D 和 PySide6 的开源桌面宠物项目，支持 50+ 位 BanG Dream! 角色、300+ 套服装，让你的桌面一秒变成 CiRCLE 排练室,2026-05-05 15:13:08+00:00,2026-05-24 16:45:41+00:00,185,13,185,0,Python,11498,GPL-3.0,19,9.736842105263158,0.0702702702702702,0.0,Other
1223713824,LeoKemp223/NextBoard,LeoKemp223,NextBoard,https://github.com/LeoKemp223/NextBoard,面向硬件产品PCB方案设计的AI Agent，Agent会自动帮你进行需求确认，实时分析国内外各类芯片技术方案，进行器件选型，下载datasheet，输出BOM表，计算价格，输出模块原理图，最终整合成可落地技术方案。,2026-04-28 15:27:20+00:00,2026-05-05 02:03:17+00:00,185,27,185,0,Python,115,,26,7.115384615384615,0.1459459459459459,0.0,Other
1233079161,zennomi/truyendrive,zennomi,truyendrive,https://github.com/zennomi/truyendrive,Biến Google Drive thành Web Truyện,2026-05-08 15:12:09+00:00,2026-05-22 09:15:46+00:00,185,23,185,0,TypeScript,15194,,16,11.5625,0.1243243243243243,0.0,Web
1239140279,exploitbench/exploitbench,exploitbench,exploitbench,https://github.com/exploitbench/exploitbench,"ExploitBench measures how far AI agents climb, from reaching vulnerable code, to triggering the bug, to building exploit primitives, to arbitrary code execution.",2026-05-14 19:57:32+00:00,2026-05-16 00:15:09+00:00,184,11,184,3,Python,655,MIT,10,18.4,0.0597826086956521,0.0163043478260869,AI/ML
1228218068,maria-rcks/miri,maria-rcks,miri,https://github.com/maria-rcks/miri,"Niri-ish, keyboard-first window manager for macOS.",2026-05-03 18:45:30+00:00,2026-05-07 09:35:05+00:00,184,7,184,3,Swift,17405,MIT,21,8.761904761904763,0.0380434782608695,0.0163043478260869,Mobile
1231073746,Sealva-Devs/Prediction-Market-Web3,Sealva-Devs,Prediction-Market-Web3,https://github.com/Sealva-Devs/Prediction-Market-Web3,"Production-ready crypto prediction market platform with secure smart contracts and modern React frontend. Features peer-to-peer wagering, multi-sig escrow, automatic payouts, and comprehensive security measures. Built with Solidity, Hardhat, React, and wagmi/viem.",2026-05-06 15:45:39+00:00,2026-05-06 15:47:51+00:00,183,887,183,0,TypeScript,370,,18,10.166666666666666,4.8469945355191255,0.0,Security
1236390840,open-energy-transition/grid2poster,open-energy-transition,grid2poster,https://github.com/open-energy-transition/grid2poster,Design posters showcasing your country's electrical grid,2026-05-12 07:50:34+00:00,2026-05-24 17:08:04+00:00,183,12,183,0,Python,290963,MIT,12,15.25,0.0655737704918032,0.0,Other
1236243908,yyfz/Warp-as-History,yyfz,Warp-as-History,https://github.com/yyfz/Warp-as-History,Warp-as-History: Generalizable Camera-Controlled Video Generation from One Training Video,2026-05-12 04:33:52+00:00,2026-05-22 11:32:55+00:00,183,8,183,1,Python,13610,Apache-2.0,12,15.25,0.0437158469945355,0.0054644808743169,Other
1221649738,jasoncheng7115/jt-doc-tools,jasoncheng7115,jt-doc-tools,https://github.com/jasoncheng7115/jt-doc-tools,整合式 PDF / Office 文件處理平台，自架、開源、可控。,2026-04-26 13:59:51+00:00,2026-05-23 15:10:12+00:00,182,40,182,1,Python,23097,Apache-2.0,28,6.5,0.2197802197802197,0.0054945054945054,Other
1245893763,BlueSharks-apps/Gemini-app-windows,BlueSharks-apps,Gemini-app-windows,https://github.com/BlueSharks-apps/Gemini-app-windows,chatgpt google gemini pro ai flash 3.5 app windows  download pc google ai desktop client windows 11 10 official application free exe install shortcut workspace chat assistant,2026-05-21 16:59:30+00:00,2026-05-21 17:04:17+00:00,182,0,182,1,C#,173,MIT,3,60.66666666666666,0.0,0.0054945054945054,AI/ML
1224703318,devnen/qwen3.6-windows-server,devnen,qwen3.6-windows-server,https://github.com/devnen/qwen3.6-windows-server,"One-click Qwen3.6-27B inference on Windows. 158 tok/s on RTX 5090, 72 tok/s on RTX 3090. Native, no WSL, no Docker, no telemetry.",2026-04-29 14:41:37+00:00,2026-05-14 17:14:43+00:00,182,22,182,6,Python,13586,,25,7.28,0.1208791208791208,0.0329670329670329,DevOps
1230153502,myICOR/myPKA,myICOR,myPKA,https://github.com/myICOR/myPKA,AI-powered Personal Knowledge Assistance in a folder. Built on the ICOR methodology. Plain markdown. Any LLM. Yours forever.,2026-05-05 18:21:19+00:00,2026-05-20 22:00:48+00:00,182,55,182,0,Python,12907,NOASSERTION,19,9.578947368421051,0.3021978021978022,0.0,AI/ML
1245881159,mrgummy007/Yoshi-pc,mrgummy007,Yoshi-pc,https://github.com/mrgummy007/Yoshi-pc,yoshi and the mysterious book free pc review switch 2 download gameplay walkthrough ryujinx yuzu emulator installation,2026-05-21 16:44:40+00:00,2026-05-21 16:49:52+00:00,181,0,181,1,C#,170,MIT,3,60.333333333333336,0.0,0.005524861878453,Other
1225277249,lthoangg/OpenAgentd,lthoangg,OpenAgentd,https://github.com/lthoangg/OpenAgentd,"Self-hosted AI agent OS — streaming chat, tool use, persistent memory, and multi-agent teams. Runs entirely on your machine.",2026-04-30 05:56:20+00:00,2026-05-24 16:43:54+00:00,181,27,181,0,Python,27273,Apache-2.0,24,7.541666666666667,0.149171270718232,0.0,AI/ML
1220498389,hypersocialinc/shots,hypersocialinc,shots,https://github.com/hypersocialinc/shots,Claude Code/Agent Skill for making App Store screenshots with GPT Image 2 that you can upload. Give it your App Store link & screenshots of your app and it will produce beautiful app store screenshots ready to upload to Apple (or Google),2026-04-25 01:00:58+00:00,2026-04-27 15:21:57+00:00,181,22,181,1,JavaScript,8086,,29,6.241379310344827,0.1215469613259668,0.005524861878453,AI/ML
1233701259,mobileAiDev/ai-app-bridge,mobileAiDev,ai-app-bridge,https://github.com/mobileAiDev/ai-app-bridge,"AI App Bridge is a runtime bridge for AI agents to close the loop on mobile app iteration: inspect the running app, operate UI and WebView surfaces, collect structured runtime state, verify results, and continue improving the app.",2026-05-09 08:49:45+00:00,2026-05-23 08:07:05+00:00,181,4,181,0,JavaScript,593,Apache-2.0,15,12.066666666666666,0.0220994475138121,0.0,AI/ML
1233757564,simoneluconi/SKAFTSARV-to-WLED,simoneluconi,SKAFTSARV-to-WLED,https://github.com/simoneluconi/SKAFTSARV-to-WLED,Modding the IKEA SKAFTSÄRV with an ESP32 and WLED,2026-05-09 10:16:02+00:00,2026-05-09 19:38:44+00:00,181,4,181,3,Unknown,8040,,15,12.066666666666666,0.0220994475138121,0.0165745856353591,Other
1230048805,DAGroup-PKU/HumanNet,DAGroup-PKU,HumanNet,https://github.com/DAGroup-PKU/HumanNet,HumanNet: Scaling Human-centric Video Learning to One Million Hours,2026-05-05 16:17:41+00:00,2026-05-22 05:19:41+00:00,181,0,181,2,Python,176241,,19,9.526315789473683,0.0,0.011049723756906,Other
1221832900,SharifiZarchi/janfadaa,SharifiZarchi,janfadaa,https://github.com/SharifiZarchi/janfadaa,,2026-04-26 18:32:51+00:00,2026-04-27 04:47:33+00:00,180,12,180,8,HTML,3859,,28,6.428571428571429,0.0666666666666666,0.0444444444444444,Web
1220903269,aresthehacker/Assassin-s-Creed-Black-Flag,aresthehacker,Assassin-s-Creed-Black-Flag,https://github.com/aresthehacker/Assassin-s-Creed-Black-Flag,Assassin's Creed Black Flag Resynced Collector's Edition 2026 Edward Kenway Statue PS5 Pro PSSR Ray Tracing High FPS Anvil Engine Caribbean Open World Pirate Simulator PC Download Steam Deck Performance Save Editor Gameplay Reveal July 9 Release Official Roadmap Ubisoft 2026,2026-04-25 13:45:30+00:00,2026-04-25 13:50:02+00:00,180,0,180,0,C++,45,MIT,29,6.206896551724138,0.0,0.0,Game
1245904814,Boob025/peace-equalizer-APO,Boob025,peace-equalizer-APO,https://github.com/Boob025/peace-equalizer-APO,peace best  audio equalizer apo app pc windows 11 spotify  download audio sound booster bass boost headphones gaming preset config profile realtek parametric eq gui,2026-05-21 17:13:12+00:00,2026-05-23 15:26:16+00:00,179,1,179,1,TypeScript,14,MIT,3,59.66666666666666,0.0055865921787709,0.0055865921787709,Other
1222847703,sean-brydon/devl.dev,sean-brydon,devl.dev,https://github.com/sean-brydon/devl.dev,,2026-04-27 19:10:08+00:00,2026-04-27 19:21:46+00:00,179,15,179,0,TypeScript,68676,,27,6.62962962962963,0.0837988826815642,0.0,Other
1222053159,Li-Baichuan-James/summarize-slides-skill,Li-Baichuan-James,summarize-slides-skill,https://github.com/Li-Baichuan-James/summarize-slides-skill,,2026-04-27 02:05:13+00:00,2026-04-27 06:07:41+00:00,178,7,178,1,Unknown,352,MIT,27,6.592592592592593,0.0393258426966292,0.0056179775280898,Other
1239774861,luoling8192/technical-writing,luoling8192,technical-writing,https://github.com/luoling8192/technical-writing,中文内部技术写作的 agent skill，约束设计文档 / 评审稿 / postmortem / 分享稿场景的语气、句法、结构,2026-05-15 12:31:42+00:00,2026-05-16 08:41:43+00:00,178,9,178,0,Unknown,12,MIT,9,19.77777777777778,0.0505617977528089,0.0,AI/ML
1222984521,AgriciDaniel/codex-seo,AgriciDaniel,codex-seo,https://github.com/AgriciDaniel/codex-seo,"Codex-first SEO skill suite. 26 workflows, 24 TOML agents, DataForSEO/Gemini/Google/Firecrawl integrations, GEO/AEO, CWV, schema, backlinks, local/maps, and deterministic reports.",2026-04-27 22:43:34+00:00,2026-05-11 22:35:10+00:00,178,31,178,13,Python,1273,NOASSERTION,27,6.592592592592593,0.1741573033707865,0.0730337078651685,AI/ML
1227006602,Jerry-0821/ml-dl-formula-cheatsheet,Jerry-0821,ml-dl-formula-cheatsheet,https://github.com/Jerry-0821/ml-dl-formula-cheatsheet,,2026-05-02 04:51:42+00:00,2026-05-24 14:14:56+00:00,178,13,178,0,TeX,3695,MIT,22,8.090909090909092,0.0730337078651685,0.0,Other
1221068903,hacktivist123/agent-session-resume,hacktivist123,agent-session-resume,https://github.com/hacktivist123/agent-session-resume,"Cross-agent session resume skill for Claude Code, Codex, Antigravity, and OpenCode.",2026-04-25 17:58:33+00:00,2026-04-25 20:23:19+00:00,177,7,177,9,Python,42,MIT,29,6.103448275862069,0.03954802259887,0.0508474576271186,AI/ML
1247413372,ensigncocoonenergy/Undown-tool,ensigncocoonenergy,Undown-tool,https://github.com/ensigncocoonenergy/Undown-tool,,2026-05-23 09:28:13+00:00,2026-05-23 09:46:38+00:00,177,0,177,1,PowerShell,8,MIT,1,177.0,0.0,0.0056497175141242,Other
1225941199,amirmushichge/tribeV2_ViralAnalyser,amirmushichge,tribeV2_ViralAnalyser,https://github.com/amirmushichge/tribeV2_ViralAnalyser,,2026-04-30 20:05:36+00:00,2026-05-20 16:23:35+00:00,177,40,177,4,Python,307,,24,7.375,0.2259887005649717,0.0225988700564971,Other
1224146882,Pathos0925/SatoshiGuesser,Pathos0925,SatoshiGuesser,https://github.com/Pathos0925/SatoshiGuesser,Roll for lost bitcoin.,2026-04-29 02:16:32+00:00,2026-04-29 19:42:13+00:00,177,51,177,0,JavaScript,621,MIT,25,7.08,0.288135593220339,0.0,Other
1225042084,abdosorour7/dev-commands-cheatsheet,abdosorour7,dev-commands-cheatsheet,https://github.com/abdosorour7/dev-commands-cheatsheet,"The ultimate offline-ready Developer Cheatsheets for Git, Docker, and more: searchable, copy-ready, and organized for real-world workflows.",2026-04-29 22:19:23+00:00,2026-05-24 22:52:46+00:00,177,24,177,3,JavaScript,1022,,25,7.08,0.135593220338983,0.0169491525423728,DevOps
1222799292,mkbula/HideMyData,mkbula,HideMyData,https://github.com/mkbula/HideMyData,Native macOS PII removal software with on device Vision OCR and OpenAI privacy filter model,2026-04-27 18:07:48+00:00,2026-05-05 22:02:31+00:00,176,7,176,1,Swift,1968,GPL-3.0,27,6.518518518518518,0.0397727272727272,0.0056818181818181,AI/ML
1227675245,adminlby/NTSB_FOIA_MU5735,adminlby,NTSB_FOIA_MU5735,https://github.com/adminlby/NTSB_FOIA_MU5735,由NTSB发布的3·21空难（MU5735）调查报告,2026-05-03 02:23:21+00:00,2026-05-03 13:10:14+00:00,176,51,176,1,JavaScript,172169,MIT,21,8.380952380952381,0.2897727272727273,0.0056818181818181,Other
1241460042,rit3zh/expo-motion-tabs,rit3zh,expo-motion-tabs,https://github.com/rit3zh/expo-motion-tabs,⚡️ Smooth motion tabs for Expo Router,2026-05-17 12:21:01+00:00,2026-05-17 12:28:00+00:00,175,12,175,0,TypeScript,6245,,7,25.0,0.0685714285714285,0.0,Other
1224801485,graemeg/blaise,graemeg,blaise,https://github.com/graemeg/blaise,"A modern, self-hosting Object Pascal compiler built for the 2020s. Zero legacy, full ARC, and unified UTF-8.",2026-04-29 16:35:43+00:00,2026-05-22 16:10:12+00:00,175,7,175,4,Pascal,4301,Apache-2.0,25,7.0,0.04,0.0228571428571428,Other
1243090608,tonbo-io/ursula,tonbo-io,ursula,https://github.com/tonbo-io/ursula,"Distributed event stream server over HTTP, backed by S3.",2026-05-19 03:25:09+00:00,2026-05-24 14:24:36+00:00,175,4,175,0,Rust,8878,Apache-2.0,5,35.0,0.0228571428571428,0.0,Other
1245922781,AresLeVrai/celestial-launcher-releases,AresLeVrai,celestial-launcher-releases,https://github.com/AresLeVrai/celestial-launcher-releases,celestial launcher releases league of legends  download custom skins mod manager lol client windows 11 config profile,2026-05-21 17:36:05+00:00,2026-05-21 17:42:09+00:00,175,0,175,1,C#,173,MIT,3,58.333333333333336,0.0,0.0057142857142857,Other
1227449814,yadnuses/Academic-Detective,yadnuses,Academic-Detective,https://github.com/yadnuses/Academic-Detective,+Academic Detective · 学术侦探 — 开源学术背景核查引擎。输入导师姓名和学校，基于公开数据自动生成调查报告：论文产出核实、六维质量评分、学科基准线偏差检测、与已知不端案例的模式比对、结构化学生评价匹配、关系网络可视化。支持 Markdown→PDF 报告导出与导师知识蒸馏。,2026-05-02 17:44:08+00:00,2026-05-21 17:45:15+00:00,175,11,175,5,Python,3443,MIT,22,7.954545454545454,0.0628571428571428,0.0285714285714285,Other
1237841602,justxor/MachineLearningRoadmap,justxor,MachineLearningRoadmap,https://github.com/justxor/MachineLearningRoadmap,Полный Roadmap по машинному обучению 2026 ,2026-05-13 15:00:31+00:00,2026-05-18 19:05:38+00:00,174,28,174,0,Unknown,1005,,11,15.818181818181818,0.160919540229885,0.0,Other
1237551986,bigfrankykevin/sportsbook-bet365,bigfrankykevin,sportsbook-bet365,https://github.com/bigfrankykevin/sportsbook-bet365,"sportsbook, casino game, bet365 Monorepo for a sportsbook-style trading web experience: a Next.js frontend with wagmi / viem for wallet flows, a Fastify API, and a small shared TypeScript package for contracts between apps. sportsbook, casino game, bet365 Monorepo for a sportsbook-style trading web experience: a Next.js frontend with wagmi / viem",2026-05-13 09:36:10+00:00,2026-05-13 15:00:13+00:00,174,1432,174,3,TypeScript,113,,11,15.818181818181818,8.229885057471265,0.0172413793103448,Web
1235980238,handbook-academy/hld-handbook,handbook-academy,hld-handbook,https://github.com/handbook-academy/hld-handbook,"Open-source High-Level Design & System Design handbook. 181 chapters, 727K words, 653 diagrams, CC BY-SA 4.0.",2026-05-11 20:52:32+00:00,2026-05-20 17:29:00+00:00,174,4,174,0,JavaScript,2328,CC-BY-SA-4.0,13,13.384615384615383,0.0229885057471264,0.0,Other
1232109753,CostaliyA/Flow-OPD,CostaliyA,Flow-OPD,https://github.com/CostaliyA/Flow-OPD,"Official Repo of ""Flow-OPD: On-Policy Distillation for Flow Matching Models""",2026-05-07 15:43:15+00:00,2026-05-21 18:42:58+00:00,174,1,174,1,Python,51027,MIT,17,10.235294117647058,0.0057471264367816,0.0057471264367816,Other
1239112367,Trading-GPT/Polymarket-trading-bot,Trading-GPT,Polymarket-trading-bot,https://github.com/Trading-GPT/Polymarket-trading-bot,"polymarket copy trading bot polymarket arbitrage bot, polymarket copy trading bot polymarket arbitrage bot, polymarket copy trading bot polymarket arbitrage bot, polymarket copy trading bot polymarket arbitrage bot, polymarket copy trading bot polymarket arbitrage bot, polymarket copy trading bot polymarket  bot, ",2026-05-14 19:18:49+00:00,2026-05-14 19:20:27+00:00,174,410,174,0,JavaScript,1161,,10,17.4,2.35632183908046,0.0,Web
1230077994,cybertronai/schmidhuber-problems,cybertronai,schmidhuber-problems,https://github.com/cybertronai/schmidhuber-problems,"58 implementations of synthetic learning problems from Jürgen Schmidhuber's papers (1989-2025). Pure numpy, laptop-runnable, paper-comparison metrics per stub. Algorithmic-lineage companion to hinton-problems.",2026-05-05 16:51:38+00:00,2026-05-08 19:37:28+00:00,173,9,173,3,Python,58350,Unlicense,19,9.105263157894736,0.0520231213872832,0.0173410404624277,Other
1226256828,Cmochance/codex-app-transfer,Cmochance,codex-app-transfer,https://github.com/Cmochance/codex-app-transfer,Local desktop gateway that translates OpenAI Codex CLI's Responses API into Chat Completions for Kimi / DeepSeek / Zhipu GLM / Bailian and other OpenAI-compatible providers.,2026-05-01 06:50:41+00:00,2026-05-24 07:58:39+00:00,173,12,173,5,Rust,23817,MIT,23,7.521739130434782,0.0693641618497109,0.0289017341040462,AI/ML
1224762245,av/facts,av,facts,https://github.com/av/facts,"Antidote for fluffy specs, a toolkit for fact-driven development with AI agents",2026-04-29 15:48:18+00:00,2026-05-23 16:49:12+00:00,173,7,173,0,Rust,1364,,25,6.92,0.0404624277456647,0.0,AI/ML
