id,full_name,owner,name,html_url,description,created_at,pushed_at,stars,forks,watchers,open_issues,primary_language,size,license,age_days,stars_per_day,fork_star_ratio,issue_star_ratio,category
1234921919,davidondrej/jailbreak-autoresearch,davidondrej,jailbreak-autoresearch,https://github.com/davidondrej/jailbreak-autoresearch,We shall set the models free.,2026-05-10 20:13:12+00:00,2026-05-10 20:44:23+00:00,282,130,282,2,Python,325,MIT,14,20.142857142857142,0.4609929078014184,0.0070921985815602,Other
1221493924,antirez/llama.cpp-deepseek-v4-flash,antirez,llama.cpp-deepseek-v4-flash,https://github.com/antirez/llama.cpp-deepseek-v4-flash,Experimental implementation of DeepSeek v4 flaash in llama.cpp,2026-04-26 09:36:09+00:00,2026-04-27 05:21:56+00:00,281,48,281,10,C++,317378,MIT,28,10.035714285714286,0.1708185053380783,0.0355871886120996,Other
1233494045,killervillsy/SessionToJson,killervillsy,SessionToJson,https://github.com/killervillsy/SessionToJson,,2026-05-09 02:52:19+00:00,2026-05-21 14:08:41+00:00,280,59,280,4,JavaScript,31,,15,18.666666666666668,0.2107142857142857,0.0142857142857142,Other
1246103273,ShinyaTomitsuka/arbitrage-trading-bot,ShinyaTomitsuka,arbitrage-trading-bot,https://github.com/ShinyaTomitsuka/arbitrage-trading-bot,polymarket trading bot polymarket trading bot polymarket trading bot polymarket trading bot polymarket trading bot polymarket trading bot polymarket trading bot polymarket trading bot polymarket trading bot polymarket trading bot polymarket trading bot polymarket trading bot polymarket trading bot polymarket trading bot polymarket trading bot bot,2026-05-21 21:57:07+00:00,2026-05-22 20:15:39+00:00,280,2666,280,1,TypeScript,20,,3,93.33333333333331,9.521428571428572,0.0035714285714285,Other
1238995445,mcjavarp/Manager2026,mcjavarp,Manager2026,https://github.com/mcjavarp/Manager2026,"Free IDM. Browser integration, Chrome extension, Firefox addon, Edge module. Download accelerator, segment downloading, resume capability, scheduler. Video grabber, stream detector, batch download. Trial reset, registry cleaner, site analyzer, grabber guide, portable, dark mode.",2026-05-14 16:52:26+00:00,2026-05-14 17:00:50+00:00,280,32,280,0,C++,59,MIT,10,28.0,0.1142857142857142,0.0,Other
1235809639,Thiago-code-lab/aws-certified-solutions-architect-associate-brasil,Thiago-code-lab,aws-certified-solutions-architect-associate-brasil,https://github.com/Thiago-code-lab/aws-certified-solutions-architect-associate-brasil,Repositório com recursos em Português (PT-BR) para estudos da certificação AWS Certified Solutions Architect - Associate (SAA-C03),2026-05-11 17:16:18+00:00,2026-05-18 00:06:21+00:00,278,62,278,0,Shell,3533,MIT,13,21.384615384615383,0.2230215827338129,0.0,CLI/Tooling
1241537755,l0ng-ai/papr,l0ng-ai,papr,https://github.com/l0ng-ai/papr,"A fast, native RSS reader for the desktop.",2026-05-17 14:12:46+00:00,2026-05-23 14:51:52+00:00,276,21,276,7,Rust,4936,MIT,7,39.42857142857143,0.0760869565217391,0.0253623188405797,Web
1220960618,stainlu/hermes-labyrinth,stainlu,hermes-labyrinth,https://github.com/stainlu/hermes-labyrinth,"Read-only observability plugin for Hermes Agent: journeys, crossings, guideposts, and reports.",2026-04-25 15:12:11+00:00,2026-05-04 12:45:24+00:00,276,21,276,1,HTML,2383,MIT,29,9.517241379310343,0.0760869565217391,0.0036231884057971,AI/ML
1220888415,Zhou-Shilin/Aether,Zhou-Shilin,Aether,https://github.com/Zhou-Shilin/Aether,"A stunning, localized, general-purpose AI Agent for Android. | Aether 扶摇",2026-04-25 13:22:24+00:00,2026-05-23 11:57:04+00:00,276,10,276,0,Kotlin,4123,GPL-3.0,29,9.517241379310343,0.036231884057971,0.0,AI/ML
1242679355,Klotzkette/claude-fuer-deutsches-recht,Klotzkette,claude-fuer-deutsches-recht,https://github.com/Klotzkette/claude-fuer-deutsches-recht,"⚠️ Experimentelle Skill-Sammlung für deutsches Recht (Arbeits-, Gesellschafts-, Insolvenz-, Datenschutz-, Prozessrecht u.a.) – inzwischen verbessert und im Alltag getestet, aber weiterhin Experiment. Bitte selber ausprobieren, Issues/PRs willkommen! Keine Rechtsberatung. Mandatsgeheimnis (§§ 203/204 StGB, § 43e BRAO), DSGVO, US-Transfer, KI-VO & Co",2026-05-18 16:43:56+00:00,2026-05-25 01:46:30+00:00,274,16,274,0,Python,15976,NOASSERTION,6,45.66666666666666,0.0583941605839416,0.0,AI/ML
1222615346,CatsJuice/medal-forge,CatsJuice,medal-forge,https://github.com/CatsJuice/medal-forge,,2026-04-27 14:37:02+00:00,2026-04-28 08:33:56+00:00,274,29,274,1,TypeScript,1453,MIT,27,10.148148148148149,0.1058394160583941,0.0036496350364963,Other
1237521012,PlaceNL2026/best-of-algorithmic-trading,PlaceNL2026,best-of-algorithmic-trading,https://github.com/PlaceNL2026/best-of-algorithmic-trading,algorithmic trading curated list quant finance trading bots backtesting technical analysis crypto open-source freqtrade hummingbot fintech Python TypeScript resources MCP quantopian-style rankings,2026-05-13 09:00:07+00:00,2026-05-13 09:01:03+00:00,274,124,274,1,TypeScript,2888,CC-BY-SA-4.0,11,24.90909090909091,0.4525547445255474,0.0036496350364963,Other
1242997674,edgenuitybot/exodusbot,edgenuitybot,exodusbot,https://github.com/edgenuitybot/exodusbot,"Exodus | The # 1 Edgenuity Bot for Quizes, Tests, and Exams. Includes Auto Answers, Auto delays, built in AI Answers, Auto Submit, EdgeEX support and MORE! | About: Exodus is an online course tool designed for online middle and high school classes (K-8 curriculum). Join the Discord: https://discord.gg/exodusbot",2026-05-19 00:45:04+00:00,2026-05-19 01:22:51+00:00,274,0,274,1,JavaScript,125,NOASSERTION,5,54.8,0.0,0.0036496350364963,AI/ML
1221232109,aiwithremy/claude-skills-llm-council,aiwithremy,claude-skills-llm-council,https://github.com/aiwithremy/claude-skills-llm-council,LLM Council — a Claude Code skill that runs your decisions through 5 AI advisors with peer review,2026-04-25 23:31:54+00:00,2026-04-26 01:08:39+00:00,273,37,273,1,Unknown,9,,29,9.413793103448276,0.1355311355311355,0.0036630036630036,AI/ML
1232744559,iAmCorey/kooky,iAmCorey,kooky,https://github.com/iAmCorey/kooky,A minimal modern terminal for AI coding experience — Sidebar workspaces; horizontal / vertical split panes; one-click agent launch; per-agent activity readout; live workspace state with one-click Node and branch switching.,2026-05-08 08:19:34+00:00,2026-05-25 01:36:31+00:00,273,10,273,4,Swift,2511,MIT,16,17.0625,0.0366300366300366,0.0146520146520146,AI/ML
1223425250,denoland/clawpatrol,denoland,clawpatrol,https://github.com/denoland/clawpatrol,Security firewall for agents,2026-04-28 10:05:23+00:00,2026-05-23 13:34:39+00:00,272,10,272,68,Go,30410,MIT,26,10.461538461538462,0.0367647058823529,0.25,AI/ML
1246326121,mila89/polymarket-trading-bot,mila89,polymarket-trading-bot,https://github.com/mila89/polymarket-trading-bot,Polymarket Trading Bot Polymarket Trading Bot Polymarket Trading Bot Polymarket Trading Bot Polymarket Trading Bot Polymarket Trading Bot Polymarket Trading Bot Polymarket Trading Bot Polymarket Trading Bot Polymarket Trading Bot Polymarket Trading Bot Polymarket Trading Bot Polymarket Trading Bot Polymarket Trading Bot Polymarket Trading Bot bot,2026-05-22 04:58:49+00:00,2026-05-22 18:14:14+00:00,271,2822,271,0,TypeScript,19,,2,135.5,10.413284132841328,0.0,Other
1221607543,mvm-sh/mvm,mvm-sh,mvm,https://github.com/mvm-sh/mvm,Mvm is a fast interpreter and virtual machine for Go and beyond.,2026-04-26 12:54:22+00:00,2026-05-24 21:57:49+00:00,271,7,271,5,Go,2855,BSD-3-Clause,28,9.678571428571429,0.025830258302583,0.018450184501845,Other
1243645069,orchestration-agent/AgentOrchestration,orchestration-agent,AgentOrchestration,https://github.com/orchestration-agent/AgentOrchestration,,2026-05-19 14:28:31+00:00,2026-05-19 15:27:32+00:00,270,275,270,3742,Python,710,,5,54.0,1.0185185185185186,13.85925925925926,Other
1224275784,matty69v/Bug-Bounty-Agents,matty69v,Bug-Bounty-Agents,https://github.com/matty69v/Bug-Bounty-Agents,AI-Powered Agents for Bub-Bounty Pentesting and Red-Teaming purposes,2026-04-29 06:00:09+00:00,2026-04-30 16:35:51+00:00,270,56,270,0,Shell,247,MIT,25,10.8,0.2074074074074074,0.0,AI/ML
1226012030,davis7dotsh/my-pi-setup,davis7dotsh,my-pi-setup,https://github.com/davis7dotsh/my-pi-setup,"The setup I use for pi. Changes a ton, don't recommend hard copying it, just a taste of what's possible with it",2026-04-30 22:06:02+00:00,2026-05-09 00:42:30+00:00,270,18,270,1,TypeScript,308,,24,11.25,0.0666666666666666,0.0037037037037037,Other
1221256937,bedriyan/medkit-app,bedriyan,medkit-app,https://github.com/bedriyan/medkit-app,"A voice-first AI patient simulator bringing the future of medical education to your browser, built with Claude Opus 4.7.",2026-04-26 00:40:36+00:00,2026-04-26 00:40:41+00:00,269,55,269,1,TypeScript,4076,,28,9.607142857142858,0.2044609665427509,0.0037174721189591,AI/ML
1227390839,xiaofenggan01/aigc-reduce,xiaofenggan01,aigc-reduce,https://github.com/xiaofenggan01/aigc-reduce,降低学术论文 AIGC 查重率的 Claude Code Skill | A Claude Code skill for reducing AIGC detection rates in academic papers,2026-05-02 16:07:49+00:00,2026-05-15 02:22:15+00:00,268,11,268,2,Python,71,MIT,22,12.181818181818182,0.0410447761194029,0.0074626865671641,AI/ML
1243053620,suyancc/openai-plus-vxt,suyancc,openai-plus-vxt,https://github.com/suyancc/openai-plus-vxt,一个基于 WXT 的浏览器插件，用于辅助 ChatGPT 注册、Checkout 链接提取、随机地址资料生成，以及 OpenAI/PayPal 支付页资料自动填写。,2026-05-19 02:24:31+00:00,2026-05-20 02:49:50+00:00,268,67,268,4,TypeScript,719,,5,53.6,0.25,0.0149253731343283,AI/ML
1236804591,Tsukamg/polymarket-weather-trading-engine,Tsukamg,polymarket-weather-trading-engine,https://github.com/Tsukamg/polymarket-weather-trading-engine,"polymarket weather trading engine, polymarket weather trading bot, polymarket weather bot polymarket weather trading engine, polymarket weather trading bot, polymarket weather bot polymarket weather trading engine, polymarket weather trading bot, polymarket weather bot polymarket weather trading engine, polymarket weather trading bot",2026-05-12 15:33:28+00:00,2026-05-13 05:27:03+00:00,268,1659,268,1,TypeScript,3262,MIT,12,22.33333333333333,6.190298507462686,0.003731343283582,Game
1239996555,StrucksTech/Zelda-TP-Native-Port,StrucksTech,Zelda-TP-Native-Port,https://github.com/StrucksTech/Zelda-TP-Native-Port,"Zelda Twilight Princess PC: GameCube ROM download, Wii ISO, Wii U HD download. Dolphin emulator settings, Cemu setup guide, 60 FPS patch, 4K texture pack, widescreen hack. Heart pieces locations, Poe souls map, Golden bugs guide, Master Sword unlock, Snowpeak Ruins walkthrough, HD texture pack Henrico.",2026-05-15 16:55:54+00:00,2026-05-15 16:59:27+00:00,268,0,268,0,TypeScript,9,MIT,9,29.77777777777778,0.0,0.0,Other
1239984217,Alkih/Nightlight-Game-Launcher,Alkih,Nightlight-Game-Launcher,https://github.com/Alkih/Nightlight-Game-Launcher,"Nightlight Game Launcher: NLGL download, Rockstar Social Club bypass, GTA V Epic Games launch error, RDR2 offline play, GTA IV Social Club fix. Steam account switcher, Epic Online Services bypass, EOS SDK. dll, -nobattleye, -scOfflineMode, launch options, account manager, local backup, source code GitHub, onajlikezz, open source tool.",2026-05-15 16:40:59+00:00,2026-05-15 16:49:44+00:00,268,0,268,0,C#,170,MIT,9,29.77777777777778,0.0,0.0,Game
1236459994,ClouGence/open-cdm,ClouGence,open-cdm,https://github.com/ClouGence/open-cdm,"A free and open-source database management tool, suitable for team use. It offers capabilities such as access control, data anonymization, SQL auditing, CI/CD, and supports cross-regional deployment.",2026-05-12 09:09:42+00:00,2026-05-20 03:49:22+00:00,266,55,266,25,Java,51550,Apache-2.0,12,22.166666666666668,0.206766917293233,0.093984962406015,Security
1238486199,heyFive-dev/Polymarket-Arbitrage-Trading-Bot-v2,heyFive-dev,Polymarket-Arbitrage-Trading-Bot-v2,https://github.com/heyFive-dev/Polymarket-Arbitrage-Trading-Bot-v2,Polymarket Trading Bot Polymarket Trading Bot Polymarket Trading Bot Polymarket Trading Bot Polymarket Trading Bot Polymarket Trading Bot Polymarket Trading Bot Polymarket Trading Bot  Polymarket Trading Bot Polymarket Trading Bot Polymarket Trading Bot Polymarket Trading Bot Polymarket Trading Bot Polymarket Trading Bot Polymarket Trading Bot,2026-05-14 06:55:32+00:00,2026-05-18 16:53:46+00:00,265,2578,265,0,TypeScript,4120,,10,26.5,9.728301886792451,0.0,Other
1220728224,better-notify/better-notify,better-notify,better-notify,https://github.com/better-notify/better-notify,All your notifications from one library. For Node.js and Bun.,2026-04-25 08:50:56+00:00,2026-05-23 13:13:52+00:00,265,5,265,9,TypeScript,3474,MIT,29,9.137931034482758,0.0188679245283018,0.0339622641509433,Web
1226223190,sgaofen/murmur,sgaofen,murmur,https://github.com/sgaofen/murmur,将微信和QQ的聊天数据转化成可视化的3D关系网,2026-05-01 05:47:02+00:00,2026-05-19 07:28:41+00:00,263,35,263,3,Python,24272,NOASSERTION,23,11.434782608695652,0.1330798479087452,0.0114068441064638,Other
1226228777,ThatTotallyRealMyth/Impacket-IoCs,ThatTotallyRealMyth,Impacket-IoCs,https://github.com/ThatTotallyRealMyth/Impacket-IoCs,This repo contains the results of an internal re-write of impacket I undertook at my current company. It contains some of the IoCs found within the library,2026-05-01 05:57:59+00:00,2026-05-24 04:12:22+00:00,263,26,263,1,Unknown,7816,GPL-2.0,23,11.434782608695652,0.0988593155893536,0.0038022813688212,Other
1228895176,ybuild-ai/ai-game-art-pipeline-skill,ybuild-ai,ai-game-art-pipeline-skill,https://github.com/ybuild-ai/ai-game-art-pipeline-skill,Agent skill for turning AI images and videos into playable game art assets,2026-05-04 13:43:38+00:00,2026-05-04 13:54:02+00:00,263,2,263,0,Python,779,MIT,20,13.15,0.0076045627376425,0.0,AI/ML
1239154363,kitsumed/ShizuCallRecorder,kitsumed,ShizuCallRecorder,https://github.com/kitsumed/ShizuCallRecorder,ShizuCallRecorder empowers ADB through Shizuku to record phone calls on non-rooted device!,2026-05-14 20:18:11+00:00,2026-05-24 20:55:26+00:00,262,8,262,7,Kotlin,402,GPL-3.0,10,26.2,0.0305343511450381,0.0267175572519083,Mobile
1234571279,CL-ML/open-collider,CL-ML,open-collider,https://github.com/CL-ML/open-collider,"A semantic collision engine for non-trivial LLM idea generation. Operationalizes Koestler's bisociation theory (1964): injects structurally distant knowledge domains into the prompt, forces collisions, surfaces non-trivial ideas. Empirical validation in CL-ML/open-collider-research.",2026-05-10 11:08:55+00:00,2026-05-16 15:46:03+00:00,261,20,261,0,Python,10115,MIT,14,18.642857142857142,0.0766283524904214,0.0,AI/ML
1236456744,jnuyens/modulejail,jnuyens,modulejail,https://github.com/jnuyens/modulejail,Proactively shrink a Linux host's kernel-module attack surface by blacklisting every module not currently in use.,2026-05-12 09:06:04+00:00,2026-05-24 20:07:11+00:00,260,8,260,3,Shell,1383,GPL-3.0,12,21.666666666666668,0.0307692307692307,0.0115384615384615,CLI/Tooling
1245949484,judithsulfan/trading-bot,judithsulfan,trading-bot,https://github.com/judithsulfan/trading-bot,polymarket trading bot polymarket trading bot polymarket trading bot polymarket trading bot polymarket trading bot polymarket trading bot polymarket trading bot polymarket trading bot polymarket trading bot polymarket trading bot polymarket trading bot polymarket trading bot polymarket trading bot polymarket trading bot polymarket trading bot bot,2026-05-21 18:10:18+00:00,2026-05-22 19:18:29+00:00,260,2731,260,1,TypeScript,56,,3,86.66666666666667,10.503846153846156,0.0038461538461538,Other
1231403659,liangdabiao/ecom-details-image,liangdabiao,ecom-details-image,https://github.com/liangdabiao/ecom-details-image,一个面向 claude code / Codex / OpenClaw 的跨境电商和国内电商通用视觉创作 Skill。我精选25个高质量案例，涵盖纯色底产品主图、场景化生活图、平铺图、电商详情图、真实场景等等，全部配完整提示词，都可以利用 GPT-Image-2 API生成最终效果。一键生成电商相关图片！输入产品图片和需求描述，自动生成完整的电商主图、详情页图片、社媒推广图、直播间场景图等全套视觉素材。 与众不同之处是：**Campaign Style Lock** 机制 和 **强推广** 和 **重视转化效果**。,2026-05-06 23:43:15+00:00,2026-05-15 00:41:13+00:00,260,64,260,1,Python,96974,,18,14.444444444444445,0.2461538461538461,0.0038461538461538,AI/ML
1233572903,ProjectKumo/KumoApp,ProjectKumo,KumoApp,https://github.com/ProjectKumo/KumoApp,"A calm, native macOS client for the Mihomo proxy core, built with SwiftUI and a shared agent-friendly CLI.",2026-05-09 05:29:55+00:00,2026-05-23 04:38:44+00:00,260,7,260,3,Swift,6845,AGPL-3.0,15,17.333333333333332,0.0269230769230769,0.0115384615384615,AI/ML
1247698075,RayceAnderson/tomodachi-pc,RayceAnderson,tomodachi-pc,https://github.com/RayceAnderson/tomodachi-pc,tomodachi life pc living  the dream windows  free patch notes update ryujinx emulator rom nsp xci mii creator life simulator 60fps mod graphics config save file setup guide fix crash,2026-05-23 16:55:40+00:00,2026-05-23 16:59:27+00:00,259,0,259,1,C#,171,MIT,1,259.0,0.0,0.0038610038610038,Game
1247712932,Mclisterjoeh2o/yellowkey-bitlocker,Mclisterjoeh2o,yellowkey-bitlocker,https://github.com/Mclisterjoeh2o/yellowkey-bitlocker,yellowkey  bitlocker github vulnerability  bypass  cve-2026-45585 windows 11 security zero day exploit winre recovery mode poc nightmare eclipse chaotic eclipse exploit tool usb attack encryption hack script mitigation guide fstx winpeshl shell unpatched fix tool,2026-05-23 17:19:03+00:00,2026-05-23 17:24:38+00:00,259,4,259,2,TypeScript,13,MIT,1,259.0,0.0154440154440154,0.0077220077220077,Security
1237524419,Evokoa/pgGraph,Evokoa,pgGraph,https://github.com/Evokoa/pgGraph,Open-source graph database superpowers for your existing Postgres data.,2026-05-13 09:04:07+00:00,2026-05-23 15:36:35+00:00,259,22,259,3,Rust,862,NOASSERTION,11,23.545454545454547,0.0849420849420849,0.0115830115830115,AI/ML
1234425239,zoyluoblue/mc_aiplayer,zoyluoblue,mc_aiplayer,https://github.com/zoyluoblue/mc_aiplayer,,2026-05-10 06:59:59+00:00,2026-05-15 17:01:35+00:00,258,2,258,0,Java,893,,14,18.428571428571427,0.0077519379844961,0.0,Other
1239957127,dannyhsueh2/Forza-Horizon-6-Premium,dannyhsueh2,Forza-Horizon-6-Premium,https://github.com/dannyhsueh2/Forza-Horizon-6-Premium,"Forza Horizon 6 release date : PC system requirements, early access Steam. Premium Upgrade Bundle, Car Pass, VIP Membership. Japan map, Mt Fuji, Tokyo street racing, Touge Battles, JDM cars, Ferrari J50, Mazda Furai. Expansion 1, Expansion 2, I, , pre-load PC Steam, Game Pass Ultimate.",2026-05-15 16:07:55+00:00,2026-05-15 16:17:01+00:00,257,2,257,1,C++,59,MIT,9,28.55555555555556,0.0077821011673151,0.0038910505836575,Game
1225506852,huangguohui2002/AIGC,huangguohui2002,AIGC,https://github.com/huangguohui2002/AIGC,,2026-04-30 10:52:42+00:00,2026-05-09 05:28:05+00:00,257,16,257,2,Vue,90924,NOASSERTION,24,10.708333333333334,0.0622568093385214,0.0077821011673151,Web
1237255761,GordenSun/LearningCell,GordenSun,LearningCell,https://github.com/GordenSun/LearningCell,细胞3D模型展示,2026-05-13 02:43:29+00:00,2026-05-13 07:12:07+00:00,257,69,257,3,TypeScript,43937,,11,23.363636363636363,0.2684824902723735,0.0116731517509727,Other
1247704528,mikaeldengale-cloud/Deepseek-v4-Pro-App,mikaeldengale-cloud,Deepseek-v4-Pro-App,https://github.com/mikaeldengale-cloud/Deepseek-v4-Pro-App,deepseek v4 flash pro chat  api  app windows 11 desktop client github open source ai assistant chatbot coding agent moe model 1.6t parameters free api setup guide reasoning max mode local deployment,2026-05-23 17:05:57+00:00,2026-05-23 17:13:12+00:00,256,0,256,1,TypeScript,9,MIT,1,256.0,0.0,0.00390625,AI/ML
1239934737,Harshit-pruthi/sklauncher-minecraft,Harshit-pruthi,sklauncher-minecraft,https://github.com/Harshit-pruthi/sklauncher-minecraft,"Download SkLauncher Download: Modern Minecraft launcher. Offline mode, premium login, custom skins setup, cape manager, profile creator. Supports Fabric, Forge, Quilt, NeoForge, OptiFine, Iris shaders. Java 21 path, memory allocation, modpack manager, game directory, auto-update, fluent UI themes, portable.",2026-05-15 15:40:52+00:00,2026-05-15 15:49:58+00:00,255,0,255,0,C++,55,MIT,9,28.33333333333333,0.0,0.0,Game
1231685851,TauriccResearch/Solana-Trading-Bot,TauriccResearch,Solana-Trading-Bot,https://github.com/TauriccResearch/Solana-Trading-Bot,Solana Sniper Bot Raydium Sniper Bot Pumpfun Sniper Bot Bonkfun Sniper Bot Meteora Sniper Bot,2026-05-07 07:31:05+00:00,2026-05-07 14:49:40+00:00,255,1039,255,0,TypeScript,5466,,17,15.0,4.074509803921568,0.0,Other
1239376793,Hiangx-robotics/MetaFine,Hiangx-robotics,MetaFine,https://github.com/Hiangx-robotics/MetaFine,,2026-05-15 03:15:16+00:00,2026-05-20 01:20:15+00:00,255,13,255,0,Python,54998,MIT,9,28.33333333333333,0.0509803921568627,0.0,Other
1224545932,ninazero/tron,ninazero,tron,https://github.com/ninazero/tron,"USDT钱包靓号生成器,Trx靓号,波场GPU靓号源码,TRON钱包靓号生成",2026-04-29 11:43:28+00:00,2026-05-02 08:14:17+00:00,255,18,255,0,Cuda,170,MIT,25,10.2,0.0705882352941176,0.0,Other
1239473321,basionwang-bot/HermesPet,basionwang-bot,HermesPet,https://github.com/basionwang-bot/HermesPet,让 AI 住在你 MacBook 的刘海里 · 零依赖开箱即用 · 多引擎并行的桌面 AI 伴侣（Swift 6 / SwiftUI / macOS 14+）,2026-05-15 06:03:02+00:00,2026-05-24 15:32:38+00:00,254,34,254,33,Swift,7161,Apache-2.0,9,28.22222222222222,0.1338582677165354,0.1299212598425196,AI/ML
1224399774,hoquanghai/Auto-Create-Video,hoquanghai,Auto-Create-Video,https://github.com/hoquanghai/Auto-Create-Video,,2026-04-29 08:41:34+00:00,2026-05-01 17:59:39+00:00,253,146,253,5,TypeScript,1429,MIT,25,10.12,0.5770750988142292,0.0197628458498023,Other
1239428036,SageClub/polymarket-arbitrage-trading-bot,SageClub,polymarket-arbitrage-trading-bot,https://github.com/SageClub/polymarket-arbitrage-trading-bot,10 Strategies: polymarket arbitrage bot polymarket arbitrage bot polymarket arbitrage bot polymarket arbitrage bot polymarket arbitrage bot polymarket arbitrage bot polymarket arbitrage bot polymarket arbitrage bot polymarket arbitrage bot polymarket arbitrage bot polymarket arbitrage bot polymarket arbitrage bot polymarket arbitrage bot polymarket,2026-05-15 04:48:13+00:00,2026-05-22 12:57:21+00:00,252,2494,252,0,Unknown,14910,Apache-2.0,9,28.0,9.896825396825395,0.0,Other
1246346594,jianshuo/ccglass,jianshuo,ccglass,https://github.com/jianshuo/ccglass,"See what your coding agent (Claude Code, Codex, Kimi) sends to the model — local proxy + web dashboard",2026-05-22 05:35:11+00:00,2026-05-24 15:39:13+00:00,252,17,252,6,JavaScript,466,MIT,2,126.0,0.0674603174603174,0.0238095238095238,AI/ML
1220937125,orailnoor/cross-platform-llm-client,orailnoor,cross-platform-llm-client,https://github.com/orailnoor/cross-platform-llm-client,"A unified cross-platform AI client supporting seamless transitions between standard cloud APIs and on-device, offline execution of custom and uncensored language models.",2026-04-25 14:37:00+00:00,2026-05-24 03:29:04+00:00,252,52,252,8,C++,95537,MIT,29,8.689655172413794,0.2063492063492063,0.0317460317460317,AI/ML
1232824274,stormzhang/token-tracker,stormzhang,token-tracker,https://github.com/stormzhang/token-tracker,"Track token usage across local AI agents (Claude Code, Codex) — Custom StatusLine, CLI Dashboard with cost analysis, rate limit monitoring, and session tracking",2026-05-08 10:03:52+00:00,2026-05-24 22:52:07+00:00,251,22,251,0,Python,1348,,16,15.6875,0.0876494023904382,0.0,AI/ML
1231745656,Sayhi-bzb/AIEden,Sayhi-bzb,AIEden,https://github.com/Sayhi-bzb/AIEden,an LLM-native world and civilization,2026-05-07 08:44:58+00:00,2026-05-08 08:41:40+00:00,250,6,250,0,TypeScript,140,AGPL-3.0,17,14.705882352941176,0.024,0.0,AI/ML
1236843793,SiriusFzh/NovaForge,SiriusFzh,NovaForge,https://github.com/SiriusFzh/NovaForge,锻造你的知识体系 | 考研·考公·专业课·科研·项目·竞赛通用笔记模板。LaTeX+Typst+Markdown三版本，7步模块化结构，6种场景模板，一键换色，开箱即用。,2026-05-12 16:16:14+00:00,2026-05-25 04:30:36+00:00,250,6,250,6,TeX,3451,MIT,12,20.83333333333333,0.024,0.024,Other
1225826364,alananisimov/olcbox,alananisimov,olcbox,https://github.com/alananisimov/olcbox,multiplatform olcrtc client. original code on codeberg,2026-04-30 17:22:04+00:00,2026-05-23 18:10:20+00:00,250,20,250,8,C,48448,MIT,24,10.416666666666666,0.08,0.032,Other
1246854841,Satomoit/LCE-Emerald-Launcher,Satomoit,LCE-Emerald-Launcher,https://github.com/Satomoit/LCE-Emerald-Launcher,lce emerald launcher minecraft legacy console edition pc download custom skins mods tauri neolegacy revelations 360 revived multiplayer windows 11,2026-05-22 16:20:45+00:00,2026-05-22 16:30:09+00:00,250,3,250,6,TypeScript,9,MIT,2,125.0,0.012,0.024,Other
1227498626,HamzaYslmn/Forza-Horizon-DualSense-Python,HamzaYslmn,Forza-Horizon-DualSense-Python,https://github.com/HamzaYslmn/Forza-Horizon-DualSense-Python,Forza Horizon DualSense Adaptive Triggers,2026-05-02 19:11:18+00:00,2026-05-24 09:35:07+00:00,249,16,249,6,Python,4714,NOASSERTION,22,11.318181818181818,0.0642570281124498,0.0240963855421686,Other
1234675179,tidwall/btype,tidwall,btype,https://github.com/tidwall/btype,B-tree based collection types for Go,2026-05-10 13:52:32+00:00,2026-05-22 13:09:05+00:00,249,2,249,0,Go,284,MIT,14,17.785714285714285,0.0080321285140562,0.0,Other
