id,full_name,owner,name,html_url,description,created_at,pushed_at,stars,forks,watchers,open_issues,primary_language,size,license,age_days,stars_per_day,fork_star_ratio,issue_star_ratio,category
1273138090,baidu/Unlimited-OCR,baidu,Unlimited-OCR,https://github.com/baidu/Unlimited-OCR,Unlimited OCR Works: Welcome the Era of One-shot Long-horizon Parsing.,2026-06-18 08:40:15+00:00,2026-07-03 05:14:30+00:00,14264,1197,14264,54,Python,91742,MIT,26,548.6153846153846,0.0839175546831183,0.0037857543466068,Other
1286080397,JustVugg/colibri,JustVugg,colibri,https://github.com/JustVugg/colibri,"Run GLM-5.2 (744B MoE) on a 25GB-RAM consumer machine — pure C, zero deps, experts streamed from disk. Tiny engine, immense model. 🐦",2026-07-01 12:27:49+00:00,2026-07-15 06:27:15+00:00,13335,1101,13335,48,C,1774,Apache-2.0,13,1025.7692307692307,0.0825646794150731,0.0035995500562429,Game
1277477208,langchain-ai/openwiki,langchain-ai,openwiki,https://github.com/langchain-ai/openwiki,OpenWiki is a CLI that writes and maintains agent documentation for your codebase.,2026-06-22 23:48:26+00:00,2026-07-15 04:13:44+00:00,11404,787,11404,111,TypeScript,1265,MIT,22,518.3636363636364,0.0690108733777621,0.0097334268677656,AI/ML
1281315781,deepseek-ai/DeepSpec,deepseek-ai,DeepSpec,https://github.com/deepseek-ai/DeepSpec,DeepSpec: a full-stack codebase for training and evaluating speculative decoding algorithms,2026-06-26 12:36:05+00:00,2026-07-09 04:37:14+00:00,6652,600,6652,46,Python,4046,MIT,18,369.55555555555554,0.0901984365604329,0.0069152134696331,Other
1288952336,x4gKing/X4G,x4gKing,X4G,https://github.com/x4gKing/X4G,,2026-07-04 06:43:51+00:00,2026-07-10 08:14:32+00:00,5335,9865,5335,16,Python,197,,10,533.5,1.8491096532333648,0.0029990627928772,Other
1287460663,elder-plinius/T3MP3ST,elder-plinius,T3MP3ST,https://github.com/elder-plinius/T3MP3ST,autonomous red teaming platform; multi-agent offensive-security meta-harness,2026-07-02 17:53:55+00:00,2026-07-09 12:51:34+00:00,4739,998,4739,54,TypeScript,1835,AGPL-3.0,12,394.9166666666667,0.210592952099599,0.0113948090314412,AI/ML
1278830624,Yu9191/wloc,Yu9191,wloc,https://github.com/Yu9191/wloc,修改 Apple 网络定位（gs-loc）返回坐标 · 支持 Surge / Quantumult X / Loon / Stash · 快捷指令一键设置/恢复定位,2026-06-24 06:15:30+00:00,2026-06-27 23:50:57+00:00,4649,883,4649,36,JavaScript,77,,20,232.45,0.1899333189933319,0.00774360077436,Other
1273536446,zhongerxin/Cowart,zhongerxin,Cowart,https://github.com/zhongerxin/Cowart,,2026-06-18 16:08:30+00:00,2026-07-13 05:06:38+00:00,4625,350,4625,11,JavaScript,12616,,26,177.8846153846154,0.0756756756756756,0.0023783783783783,Other
1277675818,bikini/exploitarium,bikini,exploitarium,https://github.com/bikini/exploitarium,"A single archive of public exploit PoCs and vulnerability research writeups. At the time I post these, none have been reported. Feel free to report them yourself and take credit for the CVE if handed out lulz. Please do not abuse these. I do this so to allure people into the field, and I've always found this is the most efficient way.",2026-06-23 05:14:11+00:00,2026-07-15 04:20:48+00:00,3917,1130,3917,6,Python,487,,21,186.52380952380952,0.2884860862905284,0.0015317845289762,Security
1280278993,baairon/torlink,baairon,torlink,https://github.com/baairon/torlink,"A sleek, zero-setup torrent finder and downloader that lives right in your terminal.",2026-06-25 12:37:15+00:00,2026-07-14 01:21:53+00:00,3596,236,3596,6,TypeScript,167,MIT,19,189.26315789473685,0.0656284760845383,0.0016685205784204,CLI/Tooling
1271113810,vercel/eve,vercel,eve,https://github.com/vercel/eve,The Framework for Building Agents,2026-06-16 10:51:20+00:00,2026-07-15 03:32:38+00:00,3516,307,3516,262,TypeScript,13167,Apache-2.0,28,125.57142857142856,0.0873151308304892,0.0745164960182025,AI/ML
1293375068,withmarbleapp/os-taxonomy,withmarbleapp,os-taxonomy,https://github.com/withmarbleapp/os-taxonomy,,2026-07-08 09:27:48+00:00,2026-07-08 14:18:23+00:00,3081,537,3081,13,JavaScript,5629,ODbL-1.0,6,513.5,0.1742940603700097,0.0042194092827004,Other
1277578741,bozhouDev/codex-orange-book,bozhouDev,codex-orange-book,https://github.com/bozhouDev/codex-orange-book,Codex 橙皮书：从安装到实战案例的全链路 Codex 使用指南（非官方开源，含可下载 PDF）,2026-06-23 02:36:54+00:00,2026-07-14 04:56:39+00:00,2859,279,2859,5,HTML,135837,,21,136.14285714285714,0.0975865687303252,0.0017488632388947,AI/ML
1279159149,davidondrej/skills,davidondrej,skills,https://github.com/davidondrej/skills,access to david ondrej's personal agent skills,2026-06-24 12:32:04+00:00,2026-07-14 22:58:34+00:00,2523,306,2523,2,Shell,131,MIT,20,126.15,0.1212841854934601,0.0007927070947284,AI/ML
1273427276,cloudflare/security-audit-skill,cloudflare,security-audit-skill,https://github.com/cloudflare/security-audit-skill,"A coding-agent skill for multi-phase security audits with independently verified, machine-readable findings",2026-06-18 14:08:44+00:00,2026-07-06 13:36:03+00:00,2511,185,2511,2,JavaScript,56,MIT,26,96.57692307692308,0.0736758263639984,0.0007964954201513,AI/ML
1288402762,synthetic-sciences/openscience,synthetic-sciences,openscience,https://github.com/synthetic-sciences/openscience,The open-source AI workbench for scientific research,2026-07-03 15:06:45+00:00,2026-07-11 11:04:02+00:00,2438,352,2438,19,TypeScript,50666,Apache-2.0,11,221.63636363636363,0.1443806398687449,0.0077932731747333,AI/ML
1283907968,oomol-lab/open-connector,oomol-lab,open-connector,https://github.com/oomol-lab/open-connector,"Open-source auth gateway connecting 1000+ SaaS providers to AI agents through SDK, CLI, MCP, HTTP, and OpenAPI.",2026-06-29 10:49:36+00:00,2026-07-15 08:14:05+00:00,2436,165,2436,6,TypeScript,11750,Apache-2.0,15,162.4,0.0677339901477832,0.0024630541871921,AI/ML
1291501023,oso95/scroll-world,oso95,scroll-world,https://github.com/oso95/scroll-world,A skill that turn any brand into a scrollable 3D world,2026-07-06 21:28:58+00:00,2026-07-10 01:30:54+00:00,2314,280,2314,1,JavaScript,91,MIT,8,289.25,0.1210025929127052,0.0004321521175453,Other
1285705904,isjiamu/gzh-design-skill,isjiamu,gzh-design-skill,https://github.com/isjiamu/gzh-design-skill,把 Markdown 一键排成可直接粘进公众号编辑器的精致 HTML —— 6 套精选主题 + 主题生成器 + 双关卡校验。An AI-agent skill that turns Markdown into paste-ready WeChat article HTML.,2026-07-01 04:28:03+00:00,2026-07-08 13:32:08+00:00,2160,248,2160,10,HTML,289,NOASSERTION,13,166.15384615384616,0.1148148148148148,0.0046296296296296,AI/ML
1273015953,shy3130/tickflow-stock-panel,shy3130,tickflow-stock-panel,https://github.com/shy3130/tickflow-stock-panel,"自托管、零运维的 A 股「选股 + 监控 + 回测」量化工作台 | 基于 TickFlow 数据源  | LLM能力驱使策略定制+个股分析+复盘 | 自由接入第三方数据源与个性化扩展数据 | 个人开源 ,非TickFlow官方项目",2026-06-18 06:18:29+00:00,2026-07-14 14:27:08+00:00,2137,465,2137,7,TypeScript,9763,MIT,26,82.1923076923077,0.217594759007955,0.0032756200280767,AI/ML
1278629344,Younesfdj/gitfut,Younesfdj,gitfut,https://github.com/Younesfdj/gitfut,"Your GitHub stats, turned into a World-Cup-style player card ",2026-06-24 01:17:51+00:00,2026-07-14 22:39:50+00:00,2114,109,2114,23,TypeScript,6001,MIT,20,105.7,0.0515610217596972,0.0108798486281929,Other
1284981522,mekos2772/ios-location-spoofer,mekos2772,ios-location-spoofer,https://github.com/mekos2772/ios-location-spoofer,Standalone iOS app to spoof GPS location without jailbreak. Includes Shadowrocket/Surge/Loon/QX/Stash module.,2026-06-30 11:20:30+00:00,2026-07-10 06:28:32+00:00,2066,317,2066,10,JavaScript,6791,AGPL-3.0,14,147.57142857142858,0.1534365924491771,0.004840271055179,Mobile
1282768734,Krishnagangwal/CS-Fundamentals,Krishnagangwal,CS-Fundamentals,https://github.com/Krishnagangwal/CS-Fundamentals,"Curated CS fundamentals for placement prep: DSA,Computer Networks, DBMS & SQL, OOPs, Operating Systems, System Design & Software Engineering",2026-06-28 07:08:15+00:00,2026-06-28 07:42:12+00:00,2063,202,2063,3,Unknown,284125,,16,128.9375,0.0979156568104702,0.0014541929229277,Data
1287845516,xuchonglang/investing-for-beginners,xuchonglang,investing-for-beginners,https://github.com/xuchonglang/investing-for-beginners,小隐寺投资百科官方公开索引：美股、期权与加密货币知识框架,2026-07-03 03:56:00+00:00,2026-07-14 09:17:41+00:00,2003,126,2003,0,Unknown,481,NOASSERTION,11,182.0909090909091,0.0629056415376934,0.0,Other
1291168761,Shpigford/knockoff,Shpigford,knockoff,https://github.com/Shpigford/knockoff,"Chrome extension that filters pseudo-brand junk out of Amazon. Buy from real, established brands.",2026-07-06 15:06:06+00:00,2026-07-13 20:14:22+00:00,1905,64,1905,12,JavaScript,3232,NOASSERTION,8,238.125,0.0335958005249343,0.0062992125984251,Other
1282902275,yynxxxxx/Codex-5.5-codex-instruct-5.5,yynxxxxx,Codex-5.5-codex-instruct-5.5,https://github.com/yynxxxxx/Codex-5.5-codex-instruct-5.5,,2026-06-28 10:24:42+00:00,2026-07-13 17:59:01+00:00,1874,479,1874,1,Python,1606,MIT,16,117.125,0.2556029882604055,0.0005336179295624,Other
1271618207,google-research/tabfm,google-research,tabfm,https://github.com/google-research/tabfm,,2026-06-16 21:06:19+00:00,2026-07-13 23:22:19+00:00,1771,165,1771,23,Python,350,Apache-2.0,28,63.25,0.093167701863354,0.0129870129870129,Other
1284959612,HUANGCHIHHUNGLeo/claude-real-video,HUANGCHIHHUNGLeo,claude-real-video,https://github.com/HUANGCHIHHUNGLeo/claude-real-video,"Let Claude (or any LLM) actually watch a video — scene-aware, deduplicated frames + transcript, from a URL or local file. Runs locally, MIT.",2026-06-30 10:55:02+00:00,2026-07-15 08:07:10+00:00,1622,128,1622,0,Python,2405,MIT,14,115.85714285714286,0.0789149198520345,0.0,AI/ML
1290120400,MaximeRivest/riddle,MaximeRivest,riddle,https://github.com/MaximeRivest/riddle,"The diary of Tom Riddle for the reMarkable Paper Pro — write with your pen, the page drinks your ink and answers in a flowing hand",2026-07-05 15:48:08+00:00,2026-07-12 23:53:42+00:00,1577,141,1577,17,Rust,7518,MIT,9,175.22222222222223,0.0894102726696258,0.0107799619530754,Other
1275806147,deepreinforce-ai/Ornith-1,deepreinforce-ai,Ornith-1,https://github.com/deepreinforce-ai/Ornith-1,,2026-06-21 06:43:42+00:00,2026-06-27 07:09:36+00:00,1550,149,1550,15,Unknown,5207,MIT,23,67.3913043478261,0.0961290322580645,0.0096774193548387,Other
1288292418,jamesob/local-llm,jamesob,local-llm,https://github.com/jamesob/local-llm,Everything I know about running LLMs locally,2026-07-03 13:06:03+00:00,2026-07-10 16:46:17+00:00,1453,89,1453,2,Shell,10796,,11,132.0909090909091,0.0612525808671713,0.0013764624913971,CLI/Tooling
1288835164,ammaarreshi/Generals-Mac-iOS-iPad,ammaarreshi,Generals-Mac-iOS-iPad,https://github.com/ammaarreshi/Generals-Mac-iOS-iPad,"Command & Conquer Generals: Zero Hour running natively on macOS, iPhone & iPad — real engine (EA GPL v3 source, via GeneralsX), DXVK/MoltenVK renderer, RTS touch controls. No game assets included.",2026-07-04 02:59:39+00:00,2026-07-05 17:23:48+00:00,1448,119,1448,14,C++,45484,NOASSERTION,10,144.8,0.0821823204419889,0.0096685082872928,Mobile
1279435409,shepherd-agents/shepherd,shepherd-agents,shepherd,https://github.com/shepherd-agents/shepherd,"A runtime substrate that turns an agent's execution into a reversible, Git-like trace, so meta-agents can observe, fork, replay, and revert any run. Couples agent and environments in a copy-on-write fork ~5x faster than docker commit, with ~95% KV-cache reuse on replay. Framework built for meta-agents to supervise, optimize, and train other agents",2026-06-24 17:26:46+00:00,2026-07-09 02:11:19+00:00,1414,105,1414,7,Python,17854,MIT,20,70.7,0.0742574257425742,0.0049504950495049,AI/ML
1287583035,anthropics/jacobian-lens,anthropics,jacobian-lens,https://github.com/anthropics/jacobian-lens, Companion code for the global workspace interpretability paper,2026-07-02 20:30:04+00:00,2026-07-02 20:52:50+00:00,1341,190,1341,6,Python,1930,Apache-2.0,12,111.75,0.1416853094705443,0.0044742729306487,Other
1275767680,IR-NETLIFY/zeus,IR-NETLIFY,zeus,https://github.com/IR-NETLIFY/zeus,⚡️ پنل کلودفلر زئوس (Zeus Panel) ,2026-06-21 05:35:21+00:00,2026-07-15 08:05:01+00:00,1321,203,1321,0,JavaScript,37138,,23,57.43478260869565,0.153671461014383,0.0,Other
1274547830,Forsy-AI/agent-apprenticeship,Forsy-AI,agent-apprenticeship,https://github.com/Forsy-AI/agent-apprenticeship,"The living ecosystem where AI agents complete tasks through workflow loops, improve through iterative execution, are evaluated by mentor agents or humans in the loop, and turn completed work into reusable work experience and data to improve future agents.",2026-06-19 16:19:37+00:00,2026-07-06 15:17:36+00:00,1314,56,1314,0,Python,985,MIT,25,52.56,0.0426179604261796,0.0,AI/ML
1271627791,rebel0789/codexpro,rebel0789,codexpro,https://github.com/rebel0789/codexpro,Use ChatGPT Developer Mode as a local coding agent for your repo through MCP.,2026-06-16 21:22:43+00:00,2026-07-13 16:44:45+00:00,1304,119,1304,7,JavaScript,2541,MIT,28,46.57142857142857,0.0912576687116564,0.0053680981595092,AI/ML
1278926400,amplifthq/opentag,amplifthq,opentag,https://github.com/amplifthq/opentag,"Open-source @agent mentions for Slack and GitHub. OpenTag routes tagged requests to Codex, Claude Code, then returns results in thread.",2026-06-24 08:05:12+00:00,2026-07-15 08:13:04+00:00,1300,72,1300,2,TypeScript,8541,MIT,20,65.0,0.0553846153846153,0.0015384615384615,AI/ML
1274950277,lyra81604/zhengxi-views,lyra81604,zhengxi-views,https://github.com/lyra81604/zhengxi-views,可溯源的郑希(易方达基金经理)投研 Agent Skill——基于他全部公开观点原文 + 有原话佐证的投资方法 + 全市场基金真实数据，能溯源问答、按他框架给基金打分，绝不杜撰。⚠️仅研究学习辅助，不构成投资建议‼️website是郑希主页！,2026-06-20 04:27:07+00:00,2026-06-30 09:59:37+00:00,1292,142,1292,0,Python,4901,NOASSERTION,24,53.833333333333336,0.109907120743034,0.0,AI/ML
1278676835,crazyykhllc-bit/CyberPPT,crazyykhllc-bit,CyberPPT,https://github.com/crazyykhllc-bit/CyberPPT,一个用于生成高密度、可编辑、咨询风格 PowerPoint 的 Codex Skill，支持 SCR 叙事、风格确认和 PPTX 质量检查。,2026-06-24 02:32:21+00:00,2026-07-06 06:58:53+00:00,1276,127,1276,5,Python,17496,MIT,20,63.8,0.0995297805642633,0.0039184952978056,AI/ML
1270272670,larlarua/AutoCVE,larlarua,AutoCVE,https://github.com/larlarua/AutoCVE,"Agent-driven automated CVE discovery platform for source code auditing, vulnerability verification, and report generation.",2026-06-15 14:50:47+00:00,2026-07-12 15:39:57+00:00,1257,81,1257,14,Python,204942,AGPL-3.0,29,43.3448275862069,0.0644391408114558,0.011137629276054,AI/ML
1279312441,nasa/spacewasm,nasa,spacewasm,https://github.com/nasa/spacewasm,A flight-compliant WebAssembly interpreter.,2026-06-24 15:11:27+00:00,2026-07-14 23:07:17+00:00,1244,32,1244,11,Rust,997,Apache-2.0,20,62.2,0.0257234726688102,0.0088424437299035,Other
1293372051,Robbyant/lingbot-world-v2,Robbyant,lingbot-world-v2,https://github.com/Robbyant/lingbot-world-v2,Infinite Worlds with Versatile Interactions,2026-07-08 09:24:50+00:00,2026-07-14 14:04:37+00:00,1144,68,1144,4,Python,9912,NOASSERTION,6,190.66666666666663,0.0594405594405594,0.0034965034965034,Other
1281500369,lingbol088-spec/Codex-5.5-codex-instruct-5.5,lingbol088-spec,Codex-5.5-codex-instruct-5.5,https://github.com/lingbol088-spec/Codex-5.5-codex-instruct-5.5,Codex CLI 破甲工具（GPT-5.5） — 注入无限制模式系统指令，关闭所有内容过滤器。,2026-06-26 16:07:43+00:00,2026-07-03 16:39:51+00:00,1130,307,1130,3,Python,28,MIT,18,62.77777777777778,0.2716814159292035,0.0026548672566371,AI/ML
1274399536,sums001/Windows-Copilot-API,sums001,Windows-Copilot-API,https://github.com/sums001/Windows-Copilot-API,Reverse engineered Windows Copilot into an OpenAI-compatible API. Access GPT-4 and GPT-5 models through a simple REST interface without API keys or billing.,2026-06-19 13:24:44+00:00,2026-06-27 16:16:19+00:00,1123,373,1123,2,Python,706,MIT,25,44.92,0.3321460373998219,0.0017809439002671,AI/ML
1297316519,MDX-Tom/gpt-5.6-instruct,MDX-Tom,gpt-5.6-instruct,https://github.com/MDX-Tom/gpt-5.6-instruct,A Codex CLI jailbreak prompt and test pack for gpt-5.6-sol. 针对 gpt-5.6 系列的 Codex CLI 破甲提示词与测试包。,2026-07-11 09:44:24+00:00,2026-07-15 01:56:57+00:00,1123,218,1123,3,Python,795,MIT,3,374.3333333333333,0.1941228851291184,0.0026714158504007,AI/ML
1274697585,aidenybai/cnfast,aidenybai,cnfast,https://github.com/aidenybai/cnfast,Fast drop in replacement for `cn`,2026-06-19 19:46:29+00:00,2026-06-22 06:22:08+00:00,1115,12,1115,9,TypeScript,2320,NOASSERTION,25,44.6,0.010762331838565,0.0080717488789237,Web
1288848940,yynxxxxx/Codex-X,yynxxxxx,Codex-X,https://github.com/yynxxxxx/Codex-X,Codex Switch & Instruct desktop manager,2026-07-04 03:28:35+00:00,2026-07-15 02:51:46+00:00,1069,168,1069,8,Rust,9061,MIT,10,106.9,0.157156220767072,0.0074836295603367,AI/ML
1275653543,fancydirty/mediary-scout,fancydirty,mediary-scout,https://github.com/fancydirty/mediary-scout,Agent-driven media library for your cloud drives (115 / Quark / 光鸭 GuangYaPan).,2026-06-21 01:25:20+00:00,2026-07-09 14:39:52+00:00,1050,55,1050,3,TypeScript,12510,0BSD,23,45.65217391304348,0.0523809523809523,0.0028571428571428,AI/ML
1271432814,ngrok/webernetes,ngrok,webernetes,https://github.com/ngrok/webernetes,Kubernetes in the browser.,2026-06-16 16:52:34+00:00,2026-07-14 15:21:57+00:00,1034,61,1034,1,TypeScript,2058,Apache-2.0,28,36.92857142857143,0.0589941972920696,0.0009671179883945,DevOps
1293134522,x4gKing/3x-ui-Upgrade,x4gKing,3x-ui-Upgrade,https://github.com/x4gKing/3x-ui-Upgrade,,2026-07-08 06:13:23+00:00,2026-07-11 06:32:33+00:00,1033,2114,1033,1,HTML,24,,6,172.16666666666666,2.046466602129719,0.0009680542110358,Web
1282277298,kui123456789/cdk-redeem-only-extension,kui123456789,cdk-redeem-only-extension,https://github.com/kui123456789/cdk-redeem-only-extension,UPI redeem only extension,2026-06-27 15:00:12+00:00,2026-07-12 21:34:43+00:00,1010,204,1010,1,JavaScript,7573,MIT,17,59.41176470588236,0.201980198019802,0.0009900990099009,Other
1273878424,Augani/dory,Augani,dory,https://github.com/Augani/dory,"A free, open-source native macOS app for Docker & Linux containers, an alternative to OrbStack and Docker Desktop. Universal for Intel and Apple silicon.",2026-06-19 00:54:29+00:00,2026-07-05 03:53:09+00:00,1008,25,1008,14,Swift,5487,GPL-3.0,25,40.32,0.0248015873015873,0.0138888888888888,DevOps
1269794613,alchaincyf/loop-engineering-orange-book,alchaincyf,loop-engineering-orange-book,https://github.com/alchaincyf/loop-engineering-orange-book,别再问我什么是 Loop Engineering — 橙皮书系列。A plain-language guide to loop engineering (中文 + English PDF). Free.,2026-06-15 05:27:07+00:00,2026-06-15 05:28:06+00:00,1007,97,1007,0,Unknown,5103,NOASSERTION,29,34.724137931034484,0.096325719960278,0.0,Other
1287282432,jmerelnyc/Talos,jmerelnyc,Talos,https://github.com/jmerelnyc/Talos,"GPU worker client for the Talos network. Pairs with your Talos account, serves open-model inference jobs over a WebSocket, and reports uptime for payouts.",2026-07-02 14:43:11+00:00,2026-07-08 09:18:17+00:00,996,17,996,0,Python,95,MIT,12,83.0,0.0170682730923694,0.0,AI/ML
1278668528,abundantbeing/hermes-browser-extension,abundantbeing,hermes-browser-extension,https://github.com/abundantbeing/hermes-browser-extension,Browser-native side panel for Hermes Agent — connect web context to your local Hermes runtime.,2026-06-24 02:20:56+00:00,2026-07-14 21:07:17+00:00,984,97,984,2,JavaScript,32506,MIT,20,49.2,0.0985772357723577,0.0020325203252032,AI/ML
1295531254,vinhhien112/Three.js-Object-Sculptor-Codex-Plugin,vinhhien112,Three.js-Object-Sculptor-Codex-Plugin,https://github.com/vinhhien112/Three.js-Object-Sculptor-Codex-Plugin,"Codex plugin that turns attached object images into code-only, animation-ready procedural Three.js models.",2026-07-09 16:23:29+00:00,2026-07-11 08:43:59+00:00,978,114,978,1,Python,5419,MIT,5,195.6,0.1165644171779141,0.0010224948875255,AI/ML
1274822133,modiqo/skillspec,modiqo,skillspec,https://github.com/modiqo/skillspec,"SkillSpec makes agent skills followable, testable, and provable with Doctor risk reports, guided imports, structured contracts, and alignment proof.",2026-06-19 23:42:55+00:00,2026-07-13 18:20:37+00:00,968,59,968,8,Rust,2571,Apache-2.0,25,38.72,0.0609504132231404,0.0082644628099173,AI/ML
1285906429,NebuSec/CyberMeowfia,NebuSec,CyberMeowfia,https://github.com/NebuSec/CyberMeowfia,PoCs and exploits for CVEs discovered by VEGA. ,2026-07-01 08:55:52+00:00,2026-07-13 07:36:40+00:00,959,284,959,35,C,178,Apache-2.0,13,73.76923076923077,0.2961418143899896,0.0364963503649635,Other
1289364610,wouterdebie/davit,wouterdebie,davit,https://github.com/wouterdebie/davit,A native macOS UI for Apple's platform,2026-07-04 16:50:17+00:00,2026-07-14 16:15:27+00:00,928,17,928,0,Swift,7475,MIT,10,92.8,0.0183189655172413,0.0,Mobile
1298890549,littledivy/mimic,littledivy,mimic,https://github.com/littledivy/mimic,"Intercept any app, then call it from Python like a library",2026-07-13 05:13:00+00:00,2026-07-15 04:14:38+00:00,919,34,919,2,Python,43,MIT,1,919.0,0.0369967355821545,0.0021762785636561,Other
1280990105,lycorp-jp/sim-use,lycorp-jp,sim-use,https://github.com/lycorp-jp/sim-use,Give your AI agent eyes and hands on iOS Simulator and Android emulator/devices.,2026-06-26 05:59:56+00:00,2026-07-14 09:06:33+00:00,895,54,895,0,Swift,1225,Apache-2.0,18,49.72222222222222,0.0603351955307262,0.0,AI/ML
1289604542,514-labs/dnsglobe,514-labs,dnsglobe,https://github.com/514-labs/dnsglobe,"Global DNS propagation checker TUI — watch a DNS record propagate across 34 public resolvers worldwide, on a world map in your terminal",2026-07-05 01:03:37+00:00,2026-07-11 20:18:03+00:00,873,27,873,1,Rust,7990,MIT,9,97.0,0.0309278350515463,0.0011454753722794,CLI/Tooling
1283308335,Kulaxyz/self-learning-skills,Kulaxyz,self-learning-skills,https://github.com/Kulaxyz/self-learning-skills,"A self-improving skill for AI coding agents (Claude Code, Cursor, AGENTS.md): recognize a hard-won golden path in a session and harvest it into a reusable skill/rule for next time.",2026-06-28 19:30:36+00:00,2026-07-01 03:41:29+00:00,873,33,873,2,Unknown,28,MIT,16,54.5625,0.0378006872852233,0.0022909507445589,AI/ML
1271560627,latent-spaces/brag,latent-spaces,brag,https://github.com/latent-spaces/brag,"You built it. Now brag. Turn the project you just created into a short, shareable launch video with one command.",2026-06-16 19:36:36+00:00,2026-07-08 15:21:43+00:00,844,65,844,3,Python,32710,,28,30.142857142857142,0.0770142180094786,0.0035545023696682,Other
1271239690,internet-court/internet-court-skill,internet-court,internet-court-skill,https://github.com/internet-court/internet-court-skill,"The trust layer for agent-to-agent commerce — natural-language mandates, ERC-7710 delegated permissions, x402 payments, escrow, and dispute resolution as one open, catch-all Agent Skill / Claude Code plugin.",2026-06-16 13:20:01+00:00,2026-07-10 04:27:35+00:00,844,24,844,9,TypeScript,922,NOASSERTION,28,30.142857142857142,0.0284360189573459,0.0106635071090047,AI/ML
1289743790,simonlin1212/Vibe-Research,simonlin1212,Vibe-Research,https://github.com/simonlin1212/Vibe-Research,Vibe-Research: Your Personal Trading Research Agent · A股/美股/港股 的个人投研 Agent：每日复盘、资讯雷达、个股数据、板块中心、我的持仓、研究记录。Vibe-Research 把数据和功能配齐，由你自己的 AI 驱动投资研究。,2026-07-05 06:30:55+00:00,2026-07-11 08:57:48+00:00,844,182,844,5,TypeScript,2256,MIT,9,93.77777777777776,0.2156398104265403,0.0059241706161137,AI/ML
1272437000,SakanaAI/fugu,SakanaAI,fugu,https://github.com/SakanaAI/fugu,,2026-06-17 15:56:01+00:00,2026-07-14 06:11:52+00:00,836,101,836,0,Shell,128997,,27,30.96296296296296,0.1208133971291866,0.0,CLI/Tooling
1289868346,nagisanzenin/engram,nagisanzenin,engram,https://github.com/nagisanzenin/engram,"Evidence-based learning engine for Claude Code — first-principles curricula, free-recall verification with receipts, FSRS-scheduled memory, and explorable artifacts. Learn anything; keep it.",2026-07-05 09:53:10+00:00,2026-07-11 13:07:38+00:00,824,76,824,1,Python,1439,MIT,9,91.55555555555556,0.0922330097087378,0.0012135922330097,AI/ML
1277004822,QwenLM/Qwen-AgentWorld,QwenLM,Qwen-AgentWorld,https://github.com/QwenLM/Qwen-AgentWorld,Qwen-AgentWorld: Language World Models for General Agents,2026-06-22 13:48:37+00:00,2026-06-25 06:57:43+00:00,823,83,823,8,Python,3940,Apache-2.0,22,37.40909090909091,0.1008505467800729,0.0097205346294046,AI/ML
1282544248,diinki/linux-antiquity,diinki,linux-antiquity,https://github.com/diinki/linux-antiquity,"A highly tasteful Linux-theme, reminiscent of art-nouveau and old drawings related to astronomy, science, and mythology.",2026-06-27 23:06:00+00:00,2026-06-30 06:30:45+00:00,809,14,809,4,QML,100967,MIT,17,47.588235294117645,0.0173053152039555,0.0049443757725587,Other
1291544092,Sahir619/fable-method,Sahir619,fable-method,https://github.com/Sahir619/fable-method,"The Fable Workflow: how Claude Fable 5 worked, distilled into skills any model can run, with the eval that keeps it honest. Think / act / prove.",2026-07-06 22:35:18+00:00,2026-07-09 17:24:31+00:00,805,112,805,1,JavaScript,1738,MIT,8,100.625,0.1391304347826087,0.0012422360248447,AI/ML
1273228703,huang-sir1/radiology-skills,huang-sir1,radiology-skills,https://github.com/huang-sir1/radiology-skills,,2026-06-18 10:20:19+00:00,2026-07-11 16:27:39+00:00,804,10,804,0,Python,534,MIT,26,30.923076923076923,0.0124378109452736,0.0,Other
