id,full_name,owner,name,html_url,description,created_at,pushed_at,stars,forks,watchers,open_issues,primary_language,size,license,age_days,stars_per_day,fork_star_ratio,issue_star_ratio,category
1283364546,dimasarestuprasmanto/Hades-II-Trainer-Premium,dimasarestuprasmanto,Hades-II-Trainer-Premium,https://github.com/dimasarestuprasmanto/Hades-II-Trainer-Premium,"The ultimate cheat tool for Hades II – unlock all features instantly. Includes God Mode, infinite resources, speed hack and many more.",2026-06-28 21:08:15+00:00,2026-06-28 21:08:32+00:00,204,0,204,1,Python,11,MIT,1,204.0,0.0,0.0049019607843137,Other
1272668355,yeet-src/httpinspect,yeet-src,httpinspect,https://github.com/yeet-src/httpinspect,"top, but for the HTTP endpoints on your host — a live dashboard of the most active plaintext HTTP endpoints, right in the terminal.",2026-06-17 20:40:15+00:00,2026-06-27 18:17:36+00:00,204,14,204,3,JavaScript,720,,11,18.545454545454547,0.0686274509803921,0.0147058823529411,DevOps
1267220778,m1ckc3s/nullframe,m1ckc3s,nullframe,https://github.com/m1ckc3s/nullframe,PROJECT NULLFRAME — a live telemetry dashboard in the Nothing design language,2026-06-12 10:36:03+00:00,2026-06-20 13:46:21+00:00,204,20,204,0,TypeScript,60,MIT,16,12.75,0.0980392156862745,0.0,Data
1255866572,itsthelore/rac-core,itsthelore,rac-core,https://github.com/itsthelore/rac-core,"Give your coding agent the decisions your team already made — so it stops re-doing things you ruled out, treating product knowledge like code.",2026-06-01 08:42:02+00:00,2026-06-29 06:43:26+00:00,204,5,204,10,Python,11908,Apache-2.0,27,7.555555555555555,0.0245098039215686,0.0490196078431372,AI/ML
1283366067,MuhammadHanzalaIqbal/Hades-II-Trainer-Ultra,MuhammadHanzalaIqbal,Hades-II-Trainer-Ultra,https://github.com/MuhammadHanzalaIqbal/Hades-II-Trainer-Ultra,"Hades II Trainer 2026 – the most powerful cheat collection. Get unlimited everything, one-hit kills, no cooldowns and more.",2026-06-28 21:10:30+00:00,2026-06-28 21:10:44+00:00,204,0,204,0,Python,11,MIT,1,204.0,0.0,0.0,Other
1283366098,NagaaSaketh/Pet-Simulator-99-Auto-Farm-Trainer-2026,NagaaSaketh,Pet-Simulator-99-Auto-Farm-Trainer-2026,https://github.com/NagaaSaketh/Pet-Simulator-99-Auto-Farm-Trainer-2026,"Ultimate auto farm trainer for Pet Simulator 99 - automate coin collection, egg hatching, and Backrooms League grinding with a powerful GUI. Updated for June 2026, undetected, and easy to use.",2026-06-28 21:10:33+00:00,2026-06-28 21:10:45+00:00,204,0,204,0,Python,11,MIT,1,204.0,0.0,0.0,Other
1283362933,incursio003/Blox-Fruits-Dragon-Update-Auto-Farm-Script-2026-Plus,incursio003,Blox-Fruits-Dragon-Update-Auto-Farm-Script-2026-Plus,https://github.com/incursio003/Blox-Fruits-Dragon-Update-Auto-Farm-Script-2026-Plus,"Maximize your progress in Blox Fruits with this Plus trainer – auto farm, ESP, raid, and anti‑ban included.",2026-06-28 21:05:52+00:00,2026-06-28 21:06:08+00:00,203,0,203,0,Python,11,MIT,1,203.0,0.0,0.0,Other
1254252644,jin-zi-xuan/kaobuddy-pwa,jin-zi-xuan,kaobuddy-pwa,https://github.com/jin-zi-xuan/kaobuddy-pwa,一个帮你临时抱佛脚的项目,2026-05-30 10:34:25+00:00,2026-06-26 14:23:14+00:00,203,33,203,0,TypeScript,7450,,29,7.0,0.1625615763546798,0.0,AI/ML
1283362935,yande0/Blox-Fruits-Dragon-Update-Auto-Farm-Script-2026-Premium,yande0,Blox-Fruits-Dragon-Update-Auto-Farm-Script-2026-Premium,https://github.com/yande0/Blox-Fruits-Dragon-Update-Auto-Farm-Script-2026-Premium,"Maximize your progress in Blox Fruits with this Premium trainer – auto farm, ESP, raid, and anti‑ban included.",2026-06-28 21:05:52+00:00,2026-06-28 21:06:10+00:00,203,0,203,0,Python,11,MIT,1,203.0,0.0,0.0,Other
1283362915,MuhammadHanzalaIqbal/Blox-Fruits-Dragon-Update-Auto-Farm-Script-2026-Gold,MuhammadHanzalaIqbal,Blox-Fruits-Dragon-Update-Auto-Farm-Script-2026-Gold,https://github.com/MuhammadHanzalaIqbal/Blox-Fruits-Dragon-Update-Auto-Farm-Script-2026-Gold,All‑in‑one Blox Fruits script for Dragon Update 2026. Gold edition comes with extra optimizations for faster farming.,2026-06-28 21:05:51+00:00,2026-06-28 21:06:09+00:00,203,0,203,0,Python,11,MIT,1,203.0,0.0,0.0,Other
1257282315,Multiphysics-Imaging-Shenzhen/Level-Set-Gravity-Inversion-Software,Multiphysics-Imaging-Shenzhen,Level-Set-Gravity-Inversion-Software,https://github.com/Multiphysics-Imaging-Shenzhen/Level-Set-Gravity-Inversion-Software,Software that employs the level-set method for inverse gravimetry,2026-06-02 14:30:23+00:00,2026-06-03 14:04:50+00:00,203,0,203,0,Unknown,12,,26,7.8076923076923075,0.0,0.0,Other
1283366135,dimasarestuprasmanto/Pet-Simulator-99-Auto-Farm-Trainer-2026-Gold,dimasarestuprasmanto,Pet-Simulator-99-Auto-Farm-Trainer-2026-Gold,https://github.com/dimasarestuprasmanto/Pet-Simulator-99-Auto-Farm-Trainer-2026-Gold,"Maximize your efficiency in Pet Simulator 99 with the Gold auto trainer. From coin collection to Backrooms League rewards, everything is automated. Safe and undetectable.",2026-06-28 21:10:36+00:00,2026-06-28 21:10:48+00:00,203,0,203,0,Python,11,MIT,1,203.0,0.0,0.0,Other
1283362909,dimasarestuprasmanto/Blox-Fruits-Dragon-Update-Auto-Farm-Script-2026-Advanced,dimasarestuprasmanto,Blox-Fruits-Dragon-Update-Auto-Farm-Script-2026-Advanced,https://github.com/dimasarestuprasmanto/Blox-Fruits-Dragon-Update-Auto-Farm-Script-2026-Advanced,All‑in‑one Blox Fruits script for Dragon Update 2026. Advanced edition comes with extra optimizations for faster farming.,2026-06-28 21:05:50+00:00,2026-06-28 21:06:08+00:00,203,0,203,0,Python,11,MIT,1,203.0,0.0,0.0,Other
1272121729,aresyn/codex-control-plane-mcp,aresyn,codex-control-plane-mcp,https://github.com/aresyn/codex-control-plane-mcp,Durable MCP control plane for long-running Codex Desktop tasks,2026-06-17 10:02:02+00:00,2026-06-21 06:47:39+00:00,203,4,203,7,Python,4123,Apache-2.0,11,18.454545454545453,0.0197044334975369,0.0344827586206896,AI/ML
1254344095,Kevin100202/Rocket-Design-and-Manufacturing-Automation-Program-from-Shenzhen22highschool,Kevin100202,Rocket-Design-and-Manufacturing-Automation-Program-from-Shenzhen22highschool,https://github.com/Kevin100202/Rocket-Design-and-Manufacturing-Automation-Program-from-Shenzhen22highschool,Rocket Design and Manufacturing Automation Program By Students,2026-05-30 12:57:23+00:00,2026-06-06 04:27:34+00:00,203,0,203,0,TypeScript,2722,,29,7.0,0.0,0.0,CLI/Tooling
1283364462,NagaaSaketh/Blox-Fruits-Dragon-Update-Auto-Farm-Script-2026-Ultimate,NagaaSaketh,Blox-Fruits-Dragon-Update-Auto-Farm-Script-2026-Ultimate,https://github.com/NagaaSaketh/Blox-Fruits-Dragon-Update-Auto-Farm-Script-2026-Ultimate,"Auto farm, ESP, and raid script for Blox Fruits Dragon Update 2026 – Ultimate edition. Level up, farm bosses, and dominate PvP with this undetected trainer.",2026-06-28 21:08:08+00:00,2026-06-28 21:08:29+00:00,203,0,203,0,Python,11,MIT,1,203.0,0.0,0.0,Other
1283362918,mofouly/Blox-Fruits-Dragon-Update-Auto-Farm-Script-2026-Platinum,mofouly,Blox-Fruits-Dragon-Update-Auto-Farm-Script-2026-Platinum,https://github.com/mofouly/Blox-Fruits-Dragon-Update-Auto-Farm-Script-2026-Platinum,"Blox Fruits Dragon Update 2026 trainer with auto farm, ESP, auto raid, and more. The Platinum version offers enhanced performance and reliability.",2026-06-28 21:05:51+00:00,2026-06-28 21:06:08+00:00,203,0,203,0,Python,11,MIT,1,203.0,0.0,0.0,Other
1283364528,mofouly/Hades-II-Trainer-Max,mofouly,Hades-II-Trainer-Max,https://github.com/mofouly/Hades-II-Trainer-Max,"Hades II Trainer 2026 – the most powerful cheat collection. Get unlimited everything, one-hit kills, no cooldowns and more.",2026-06-28 21:08:14+00:00,2026-06-28 21:08:30+00:00,203,0,203,0,Python,11,MIT,1,203.0,0.0,0.0,Other
1274177139,Accio-Lab/Dressage,Accio-Lab,Dressage,https://github.com/Accio-Lab/Dressage,Scalable RL framework for Any Agent and Sandbox.,2026-06-19 08:50:48+00:00,2026-06-26 09:33:21+00:00,202,15,202,0,Python,4666,Apache-2.0,9,22.444444444444443,0.0742574257425742,0.0,AI/ML
1255242510,3x-haust/workshop-wallpaper-bridge,3x-haust,workshop-wallpaper-bridge,https://github.com/3x-haust/workshop-wallpaper-bridge,Local-only macOS bridge for personally copied Wallpaper Engine Workshop wallpapers,2026-05-31 15:32:36+00:00,2026-06-26 01:08:00+00:00,202,11,202,1,Swift,46899,MIT,28,7.214285714285714,0.0544554455445544,0.0049504950495049,Mobile
1283364529,MuhammadHanzalaIqbal/Hades-II-Trainer-Platinum,MuhammadHanzalaIqbal,Hades-II-Trainer-Platinum,https://github.com/MuhammadHanzalaIqbal/Hades-II-Trainer-Platinum,"Unlock the full potential of Hades II with this free trainer. Features include God Mode, infinite gold, all resources, and speed hack.",2026-06-28 21:08:14+00:00,2026-06-28 21:08:27+00:00,202,0,202,0,Python,11,MIT,1,202.0,0.0,0.0,Other
1283364543,yande0/Hades-II-Trainer-Pro,yande0,Hades-II-Trainer-Pro,https://github.com/yande0/Hades-II-Trainer-Pro,"Hades II Trainer 2026 – the most powerful cheat collection. Get unlimited everything, one-hit kills, no cooldowns and more.",2026-06-28 21:08:15+00:00,2026-06-28 21:08:27+00:00,202,0,202,0,Python,11,MIT,1,202.0,0.0,0.0,Other
1283364473,fajarakpdev/Blox-Fruits-Dragon-Update-Auto-Farm-Script-2026-Ultra,fajarakpdev,Blox-Fruits-Dragon-Update-Auto-Farm-Script-2026-Ultra,https://github.com/fajarakpdev/Blox-Fruits-Dragon-Update-Auto-Farm-Script-2026-Ultra,"Blox Fruits Dragon Update 2026 trainer with auto farm, ESP, auto raid, and more. The Ultra version offers enhanced performance and reliability.",2026-06-28 21:08:09+00:00,2026-06-28 21:08:27+00:00,202,0,202,0,Python,11,MIT,1,202.0,0.0,0.0,Other
1254980974,akwin1234/damru,akwin1234,damru,https://github.com/akwin1234/damru,"Undetected Playwright for Android. Real Android device in Docker (Redroid), driven via CDP with OS-level stealth. While every other antidetect browser runs desktop Chromium, DAMRU is Android-native — built for web scraping, AI agents & fingerprinting research.",2026-05-31 08:42:11+00:00,2026-06-23 17:31:09+00:00,202,28,202,1,Python,41169,NOASSERTION,28,7.214285714285714,0.1386138613861386,0.0049504950495049,AI/ML
1266138495,TradingAi666/worldcup2026-prediction-skill,TradingAi666,worldcup2026-prediction-skill,https://github.com/TradingAi666/worldcup2026-prediction-skill,"2026 世界杯 AI 预测引擎「绿茵神算」 — 经实战验证的大模型 system prompt,把 48 队资料库 + 评估方法论 + 严格 JSON 输出契约写死在单文件,任何 OpenAI 兼容接口即贴即用。",2026-06-11 10:58:44+00:00,2026-06-11 22:47:03+00:00,201,32,201,3,Unknown,26,MIT,17,11.823529411764708,0.1592039800995024,0.0149253731343283,AI/ML
1283362906,NagaaSaketh/Blox-Fruits-Dragon-Update-Auto-Farm-Script-2026-Hyper,NagaaSaketh,Blox-Fruits-Dragon-Update-Auto-Farm-Script-2026-Hyper,https://github.com/NagaaSaketh/Blox-Fruits-Dragon-Update-Auto-Farm-Script-2026-Hyper,"Blox Fruits Dragon Update 2026 trainer with auto farm, ESP, auto raid, and more. The Hyper version offers enhanced performance and reliability.",2026-06-28 21:05:50+00:00,2026-06-28 21:06:03+00:00,201,0,201,0,Python,11,MIT,1,201.0,0.0,0.0,Other
1254356154,xiaojianbang8888/xiaojianbang-stealth-hook,xiaojianbang8888,xiaojianbang-stealth-hook,https://github.com/xiaojianbang8888/xiaojianbang-stealth-hook,Android kernel stealth hook。安卓内核无痕hook，目前已知的所有用户态检测都无效。,2026-05-30 13:13:34+00:00,2026-05-30 15:00:41+00:00,201,104,201,0,C,506,,29,6.931034482758621,0.5174129353233831,0.0,Mobile
1283364467,perglervitek/Blox-Fruits-Dragon-Update-Auto-Farm-Script-2026-Pro,perglervitek,Blox-Fruits-Dragon-Update-Auto-Farm-Script-2026-Pro,https://github.com/perglervitek/Blox-Fruits-Dragon-Update-Auto-Farm-Script-2026-Pro,"Maximize your progress in Blox Fruits with this Pro trainer – auto farm, ESP, raid, and anti‑ban included.",2026-06-28 21:08:08+00:00,2026-06-28 21:08:22+00:00,201,0,201,0,Python,11,MIT,1,201.0,0.0,0.0,Other
1283364525,vanroon/Hades-II-Trainer-Legendary,vanroon,Hades-II-Trainer-Legendary,https://github.com/vanroon/Hades-II-Trainer-Legendary,"The ultimate cheat tool for Hades II – unlock all features instantly. Includes God Mode, infinite resources, speed hack and many more.",2026-06-28 21:08:14+00:00,2026-06-28 21:08:30+00:00,201,0,201,0,Python,11,MIT,1,201.0,0.0,0.0,Other
1283362905,fajarakpdev/Blox-Fruits-Dragon-Update-Auto-Farm-Script-2026-Diamond,fajarakpdev,Blox-Fruits-Dragon-Update-Auto-Farm-Script-2026-Diamond,https://github.com/fajarakpdev/Blox-Fruits-Dragon-Update-Auto-Farm-Script-2026-Diamond,"Blox Fruits Dragon Update 2026 trainer with auto farm, ESP, auto raid, and more. The Diamond version offers enhanced performance and reliability.",2026-06-28 21:05:50+00:00,2026-06-28 21:06:04+00:00,201,0,201,0,Python,11,MIT,1,201.0,0.0,0.0,Other
1268402390,kernelstub/Ferrum,kernelstub,Ferrum,https://github.com/kernelstub/Ferrum,"Windows security research toolkit for LPE, persistence, COM hijacking, and attack surface enumeration.",2026-06-13 13:44:35+00:00,2026-06-13 22:12:05+00:00,200,27,200,0,Go,1109,GPL-3.0,15,13.333333333333334,0.135,0.0,Security
1277989451,Mekotofeuka/MTPROTO_FIX_By_MEKO,Mekotofeuka,MTPROTO_FIX_By_MEKO,https://github.com/Mekotofeuka/MTPROTO_FIX_By_MEKO,MTProto fix - stable fixes the limitations that occurred on June 4,2026-06-23 11:12:12+00:00,2026-06-29 11:13:57+00:00,200,5,200,0,Shell,369,NOASSERTION,5,40.0,0.025,0.0,CLI/Tooling
1283362904,perglervitek/Blox-Fruits-Dragon-Update-Auto-Farm-Script-2026-Elite,perglervitek,Blox-Fruits-Dragon-Update-Auto-Farm-Script-2026-Elite,https://github.com/perglervitek/Blox-Fruits-Dragon-Update-Auto-Farm-Script-2026-Elite,"Auto farm, ESP, and raid script for Blox Fruits Dragon Update 2026 – Elite edition. Level up, farm bosses, and dominate PvP with this undetected trainer.",2026-06-28 21:05:50+00:00,2026-06-28 21:06:02+00:00,200,0,200,0,Python,11,MIT,1,200.0,0.0,0.0,Other
1283362922,vanroon/Blox-Fruits-Dragon-Update-Auto-Farm-Script-2026-Master,vanroon,Blox-Fruits-Dragon-Update-Auto-Farm-Script-2026-Master,https://github.com/vanroon/Blox-Fruits-Dragon-Update-Auto-Farm-Script-2026-Master,"Blox Fruits Dragon Update 2026 trainer with auto farm, ESP, auto raid, and more. The Master version offers enhanced performance and reliability.",2026-06-28 21:05:51+00:00,2026-06-28 21:06:07+00:00,200,0,200,0,Python,11,MIT,1,200.0,0.0,0.0,Other
1270872206,dososo/chinese-traditional-patterns,dososo,chinese-traditional-patterns,https://github.com/dososo/chinese-traditional-patterns,开源的中国传统纹样图录项目 · 100 高清纹样(规划 800) · 中英日韩双语 · CC BY-NC 4.0 · https://wenyang.net,2026-06-16 06:01:05+00:00,2026-06-16 06:54:15+00:00,199,19,199,0,Unknown,250349,NOASSERTION,12,16.583333333333332,0.0954773869346733,0.0,Other
1261632565,dvassallo/singleserver,dvassallo,singleserver,https://github.com/dvassallo/singleserver,All your projects on a single server,2026-06-07 00:29:25+00:00,2026-06-21 07:28:36+00:00,199,11,199,0,Go,879,MIT,21,9.476190476190476,0.0552763819095477,0.0,DevOps
1276785270,ccrpRepo/robot_retargeter,ccrpRepo,robot_retargeter,https://github.com/ccrpRepo/robot_retargeter,Motion retargeting pipeline from SMPL-X / source robots to target humanoid robots.,2026-06-22 09:38:19+00:00,2026-06-29 07:03:35+00:00,198,19,198,2,Python,599401,,6,33.0,0.0959595959595959,0.0101010101010101,Other
1281860191,zanetanasta/Seed-Generator,zanetanasta,Seed-Generator,https://github.com/zanetanasta/Seed-Generator,"Professional BIP-39 Seed & HD Wallet Toolkit with 12–24 word mnemonics, checksum validation, BIP-44/49/84 derivation, and multi-chain support (BTC, ETH, SOL, LTC, DOGE, ADA, DOT, AVAX, ATOM, XRP, TRX). Features offline CSPRNG, PBKDF2-HMAC-SHA512, AES-256-GCM encryption, wallet recovery, CSV/JSON export, and custom derivation paths.",2026-06-27 02:33:43+00:00,2026-06-27 02:37:21+00:00,198,44,198,0,Python,11019,MIT,1,198.0,0.2222222222222222,0.0,Security
1260255382,ferdinandobons/brand-docs,ferdinandobons,brand-docs,https://github.com/ferdinandobons/brand-docs,"BrandDocs is a set of agent skills that learn your existing Word, PowerPoint and Excel templates and generate new on-brand documents from them. Unlike generic AI document generators, it preserves brand, structure, styles and formulas by construction. Built for Claude Code, Codex and compatible AI agents.",2026-06-05 09:55:35+00:00,2026-06-10 10:54:46+00:00,198,22,198,0,Python,5591,MIT,23,8.608695652173912,0.1111111111111111,0.0,AI/ML
1266790372,newideas99/open-dungeon,newideas99,open-dungeon,https://github.com/newideas99/open-dungeon,"Open Dungeon — the first easy-to-use, fully local AI roleplay app. Story and inline scene images generated 100% on your machine (Gemma 4 QAT via Ollama(and others) + FLUX). No accounts, no API keys, no cloud.",2026-06-12 00:37:09+00:00,2026-06-15 12:41:13+00:00,198,17,198,7,TypeScript,4263,MIT,16,12.375,0.0858585858585858,0.0353535353535353,AI/ML
1277058567,i5ting/learn-ai-practice,i5ting,learn-ai-practice,https://github.com/i5ting/learn-ai-practice,,2026-06-22 14:43:10+00:00,2026-06-23 16:02:49+00:00,198,5,198,0,Unknown,1748,,6,33.0,0.0252525252525252,0.0,Other
1266855179,Jia-Ethan/github-solution-research,Jia-Ethan,github-solution-research,https://github.com/Jia-Ethan/github-solution-research,Codex skill for GitHub-backed engineering solution research,2026-06-12 02:33:54+00:00,2026-06-14 05:45:57+00:00,198,14,198,1,Unknown,31,MIT,16,12.375,0.0707070707070707,0.005050505050505,AI/ML
1255673460,0xABCD01/CVE-2026-41089,0xABCD01,CVE-2026-41089,https://github.com/0xABCD01/CVE-2026-41089,CVE-2026-41089 PoC — Netlogon CLDAP stack buffer overflow (CVSS 9.8 CRITICAL),2026-06-01 04:22:29+00:00,2026-06-02 08:30:55+00:00,198,65,198,1,Python,7,MIT,27,7.333333333333333,0.3282828282828283,0.005050505050505,Security
1267079750,NoizAI/AudioX-Turbo,NoizAI,AudioX-Turbo,https://github.com/NoizAI/AudioX-Turbo,🚀 Fastest Anything-to-Audio Gen for conditioned sound and music creation.,2026-06-12 07:46:30+00:00,2026-06-22 09:49:06+00:00,198,28,198,1,Python,26542,NOASSERTION,16,12.375,0.1414141414141414,0.005050505050505,Other
1267106080,BotchetDig/workout-gate,BotchetDig,workout-gate,https://github.com/BotchetDig/workout-gate,"A Claude Code hook that blocks your prompt until you do your push-ups, counted live via webcam. Random reps, session-persistent debt (no closing the tab to skip), streak stats, and three trigger modes. Your AI works hard, so should you.",2026-06-12 08:18:14+00:00,2026-06-25 07:45:23+00:00,198,19,198,1,Python,3973,MIT,16,12.375,0.0959595959595959,0.005050505050505,AI/ML
1269402869,agentsmill/age-of-agents,agentsmill,age-of-agents,https://github.com/agentsmill/age-of-agents,Age of Agents — watch your AI coding sessions grow a peaceful pixel-art realm. Run it with npx ai-of-agents.,2026-06-14 17:08:31+00:00,2026-06-24 20:48:08+00:00,197,28,197,10,TypeScript,6005,NOASSERTION,14,14.071428571428571,0.1421319796954314,0.0507614213197969,AI/ML
1269857498,joeseesun/qiaomu-app-review-insights,joeseesun,qiaomu-app-review-insights,https://github.com/joeseesun/qiaomu-app-review-insights,"把 App Store 评价变成产品研究证据，发现痛点、机会和版本风险 | Turn App Store reviews into product research evidence: pain points, opportunities, and version risks.",2026-06-15 06:55:04+00:00,2026-06-15 12:57:46+00:00,197,37,197,1,TypeScript,1785,MIT,13,15.153846153846152,0.1878172588832487,0.0050761421319796,Web
1261571908,ScrapeCreators/social-media-research-skills,ScrapeCreators,social-media-research-skills,https://github.com/ScrapeCreators/social-media-research-skills,Social media research skills for AI agents powered by ScrapeCreators,2026-06-06 21:47:43+00:00,2026-06-12 20:08:38+00:00,196,0,196,0,Python,37,,22,8.909090909090908,0.0,0.0,AI/ML
1280809609,xiaohuailabs/xiaohu-ip-studio,xiaohuailabs,xiaohu-ip-studio,https://github.com/xiaohuailabs/xiaohu-ip-studio,开源中文配图技能 + IP 角色库:用「挑认知锚点→现编隐喻→反PPT自检」为中文深度文生成固定角色出演的正文配图,2026-06-26 00:49:42+00:00,2026-06-26 01:11:44+00:00,196,37,196,0,HTML,179584,MIT,2,98.0,0.1887755102040816,0.0,AI/ML
1265780842,taisly/agent,taisly,agent,https://github.com/taisly/agent,"Taisly Agent Kit: SDK, CLI, examples, and docs for AI agents that publish videos through Taisly.",2026-06-11 04:33:30+00:00,2026-06-18 10:57:22+00:00,196,0,196,1,JavaScript,161,MIT,17,11.529411764705882,0.0,0.0051020408163265,AI/ML
1271476917,Kaushal-Parmar/CrosshairX,Kaushal-Parmar,CrosshairX,https://github.com/Kaushal-Parmar/CrosshairX,crosshair x valorant custom crosshair overlay steam download xbox game bar extension fps gaming  reticle designer valorant cs2 apex legends fortnite fullscreen overlay center screen pointer community designs hud customization utility,2026-06-16 17:46:06+00:00,2026-06-16 17:52:02+00:00,196,0,196,0,C#,178,MIT,12,16.333333333333332,0.0,0.0,Game
1282756534,AdilMir1433/DBD-AutoGrind-Trainer-2026,AdilMir1433,DBD-AutoGrind-Trainer-2026,https://github.com/AdilMir1433/DBD-AutoGrind-Trainer-2026,"Ultimate Dead by Daylight auto-grind trainer with Bloodpoint bot, ESP wallhack, aimbot, and full perk/skin unlocker. Dominate the Fog with our 2026 undetected external tool.",2026-06-28 06:50:36+00:00,2026-06-28 06:51:40+00:00,195,0,195,0,Python,46,MIT,1,195.0,0.0,0.0,Other
1282756535,XFaltixX/DBD-AutoGrind-Trainer-2026,XFaltixX,DBD-AutoGrind-Trainer-2026,https://github.com/XFaltixX/DBD-AutoGrind-Trainer-2026,"Ultimate Dead by Daylight auto-grind trainer with Bloodpoint bot, ESP wallhack, aimbot, and full perk/skin unlocker. Dominate the Fog with our 2026 undetected external tool.",2026-06-28 06:50:36+00:00,2026-06-28 06:51:34+00:00,195,0,195,0,Python,45,MIT,1,195.0,0.0,0.0,Other
1282756542,Karan10010/DBD-AutoGrind-Trainer-2026,Karan10010,DBD-AutoGrind-Trainer-2026,https://github.com/Karan10010/DBD-AutoGrind-Trainer-2026,"Ultimate Dead by Daylight auto-grind trainer with Bloodpoint bot, ESP wallhack, aimbot, and full perk/skin unlocker. Dominate the Fog with our 2026 undetected external tool.",2026-06-28 06:50:36+00:00,2026-06-28 06:51:39+00:00,195,0,195,0,Python,45,MIT,1,195.0,0.0,0.0,Other
1282756548,YousefMahdy1/DBD-AutoGrind-Trainer-2026,YousefMahdy1,DBD-AutoGrind-Trainer-2026,https://github.com/YousefMahdy1/DBD-AutoGrind-Trainer-2026,"Ultimate Dead by Daylight auto-grind trainer with Bloodpoint bot, ESP wallhack, aimbot, and full perk/skin unlocker. Dominate the Fog with our 2026 undetected external tool.",2026-06-28 06:50:36+00:00,2026-06-28 06:51:46+00:00,195,0,195,0,Python,46,MIT,1,195.0,0.0,0.0,Other
1282756507,khwarij/DBD-AutoGrind-Trainer-2026,khwarij,DBD-AutoGrind-Trainer-2026,https://github.com/khwarij/DBD-AutoGrind-Trainer-2026,"Ultimate Dead by Daylight auto-grind trainer with Bloodpoint bot, ESP wallhack, aimbot, and full perk/skin unlocker. Dominate the Fog with our 2026 undetected external tool.",2026-06-28 06:50:34+00:00,2026-06-28 06:51:35+00:00,195,0,195,0,Python,45,MIT,1,195.0,0.0,0.0,Other
1282756528,Rohim616/DBD-AutoGrind-Trainer-2026,Rohim616,DBD-AutoGrind-Trainer-2026,https://github.com/Rohim616/DBD-AutoGrind-Trainer-2026,"Ultimate Dead by Daylight auto-grind trainer with Bloodpoint bot, ESP wallhack, aimbot, and full perk/skin unlocker. Dominate the Fog with our 2026 undetected external tool.",2026-06-28 06:50:35+00:00,2026-06-28 06:51:27+00:00,195,0,195,0,Python,46,MIT,1,195.0,0.0,0.0,Other
1263542415,yucheng1554439/archlens,yucheng1554439,archlens,https://github.com/yucheng1554439/archlens,,2026-06-09 03:44:26+00:00,2026-06-10 20:16:26+00:00,195,23,195,0,TypeScript,1458,MIT,19,10.263157894736842,0.1179487179487179,0.0,Other
1282757393,triangkas/DBD-AutoGrind-Trainer-2026-Elite,triangkas,DBD-AutoGrind-Trainer-2026-Elite,https://github.com/triangkas/DBD-AutoGrind-Trainer-2026-Elite,"Ultimate Dead by Daylight auto-grind trainer Elite edition with Bloodpoint bot, ESP wallhack, aimbot, and full perk/skin unlocker. Dominate the Fog with our 2026 undetected external tool.",2026-06-28 06:51:41+00:00,2026-06-28 06:52:08+00:00,195,0,195,0,Python,26,MIT,1,195.0,0.0,0.0,Other
1282757392,Rohim616/DBD-AutoGrind-Trainer-2026-Elite,Rohim616,DBD-AutoGrind-Trainer-2026-Elite,https://github.com/Rohim616/DBD-AutoGrind-Trainer-2026-Elite,"Ultimate Dead by Daylight auto-grind trainer Elite edition with Bloodpoint bot, ESP wallhack, aimbot, and full perk/skin unlocker. Dominate the Fog with our 2026 undetected external tool.",2026-06-28 06:51:41+00:00,2026-06-28 06:52:08+00:00,195,0,195,0,Python,26,MIT,1,195.0,0.0,0.0,Other
1282756541,ryancameron555/DBD-AutoGrind-Trainer-2026,ryancameron555,DBD-AutoGrind-Trainer-2026,https://github.com/ryancameron555/DBD-AutoGrind-Trainer-2026,"Ultimate Dead by Daylight auto-grind trainer with Bloodpoint bot, ESP wallhack, aimbot, and full perk/skin unlocker. Dominate the Fog with our 2026 undetected external tool.",2026-06-28 06:50:36+00:00,2026-06-28 06:51:32+00:00,195,0,195,0,Python,46,MIT,1,195.0,0.0,0.0,Other
1282756539,raheemxghumman/DBD-AutoGrind-Trainer-2026,raheemxghumman,DBD-AutoGrind-Trainer-2026,https://github.com/raheemxghumman/DBD-AutoGrind-Trainer-2026,"Ultimate Dead by Daylight auto-grind trainer with Bloodpoint bot, ESP wallhack, aimbot, and full perk/skin unlocker. Dominate the Fog with our 2026 undetected external tool.",2026-06-28 06:50:36+00:00,2026-06-28 06:51:29+00:00,195,0,195,0,Python,46,MIT,1,195.0,0.0,0.0,Other
1282756552,giorgigelashvili12/DBD-AutoGrind-Trainer-2026,giorgigelashvili12,DBD-AutoGrind-Trainer-2026,https://github.com/giorgigelashvili12/DBD-AutoGrind-Trainer-2026,"Ultimate Dead by Daylight auto-grind trainer with Bloodpoint bot, ESP wallhack, aimbot, and full perk/skin unlocker. Dominate the Fog with our 2026 undetected external tool.",2026-06-28 06:50:37+00:00,2026-06-28 06:51:43+00:00,195,0,195,0,Python,46,MIT,1,195.0,0.0,0.0,Other
