id,full_name,owner,name,html_url,description,created_at,pushed_at,stars,forks,watchers,open_issues,primary_language,size,license,age_days,stars_per_day,fork_star_ratio,issue_star_ratio,category
1286880710,frecodecasti/polymarket-weather-trading-bot,frecodecasti,polymarket-weather-trading-bot,https://github.com/frecodecasti/polymarket-weather-trading-bot,Polymarket weather trading bot | Polymarket weather trading bot | Polymarket weather trading bot | Polymarket weather trading bot | Polymarket weather trading bot | Polymarket weather trading bot | Polymarket weather trading bot | Polymarket weather trading bot | Polymarket weather trading bot,2026-07-02 07:20:04+00:00,2026-07-06 16:52:47+00:00,575,2007,575,0,TypeScript,161228,,6,95.83333333333331,3.490434782608696,0.0,Finance/Trading
1267121662,Braffolk/fable5-world-demo,Braffolk,fable5-world-demo,https://github.com/Braffolk/fable5-world-demo,Laas: 3D world built by Claude Fable 5 to test its capabilities using three.js,2026-06-12 08:37:32+00:00,2026-07-08 11:57:15+00:00,574,91,574,2,TypeScript,182266,MIT,26,22.07692307692308,0.1585365853658536,0.0034843205574912,AI/ML
1276908304,WangJunqing-coder/huasheng13-skill,WangJunqing-coder,huasheng13-skill,https://github.com/WangJunqing-coder/huasheng13-skill,基于花生十三公开教学体系、课程资料、历年正题整理得到的skill。,2026-06-22 12:04:23+00:00,2026-06-22 12:44:14+00:00,573,110,573,2,Unknown,133,,16,35.8125,0.1919720767888307,0.0034904013961605,Other
1289743790,simonlin1212/Vibe-Research,simonlin1212,Vibe-Research,https://github.com/simonlin1212/Vibe-Research,Vibe-Research: Your Personal Trading Research Agent · A股/美股/港股 的个人投研 Agent：每日复盘、资讯雷达、个股数据、板块中心、我的持仓、研究记录。Vibe-Research 把数据和功能配齐，由你自己的 AI 驱动投资研究。,2026-07-05 06:30:55+00:00,2026-07-07 13:14:31+00:00,571,112,571,6,TypeScript,2353,MIT,3,190.33333333333331,0.1961471103327495,0.010507880910683,AI/ML
1288414617,Kulaxyz/token-diet,Kulaxyz,token-diet,https://github.com/Kulaxyz/token-diet,"Always-on token-efficiency skill for coding agents (Claude Code, Codex, Cursor, Windsurf, Cline). ~31% lower bill on average, no loss of correctness.",2026-07-03 15:20:04+00:00,2026-07-04 18:32:05+00:00,566,3,566,0,Shell,28,,5,113.2,0.0053003533568904,0.0,AI/ML
1263681504,xingwudao/xquant-beginner,xingwudao,xquant-beginner,https://github.com/xingwudao/xquant-beginner,《XQuant：人人都是量化交易员》开源书稿,2026-06-09 07:08:36+00:00,2026-07-06 04:34:43+00:00,560,98,560,6,TypeScript,10448,NOASSERTION,29,19.310344827586206,0.175,0.0107142857142857,AI/ML
1268898197,royalbhati/sqltoerdiagram,royalbhati,sqltoerdiagram,https://github.com/royalbhati/sqltoerdiagram,"ER diagram generator. Paste CREATE TABLE statements and get a clean, interactive ERD — runs 100% in your browser, nothing uploaded",2026-06-14 04:12:26+00:00,2026-06-20 04:08:50+00:00,559,54,559,3,HTML,380,MIT,24,23.291666666666668,0.0966010733452593,0.0053667262969588,Data
1269836503,dongshuyan/compass-skills,dongshuyan,compass-skills,https://github.com/dongshuyan/compass-skills,司南：个性化 AI 任务总控 Skills 系统 /COMPASS: Personal Alignment Skills OS for AI Agents,2026-06-15 06:28:04+00:00,2026-07-08 10:49:19+00:00,556,46,556,0,Python,55145,MIT,23,24.17391304347826,0.0827338129496402,0.0,AI/ML
1287043670,dzhng/skills,dzhng,skills,https://github.com/dzhng/skills,,2026-07-02 10:24:16+00:00,2026-07-08 13:59:29+00:00,548,39,548,2,JavaScript,4871,MIT,6,91.33333333333331,0.0711678832116788,0.0036496350364963,Other
1291108900,Robbyant/lingbot-vision,Robbyant,lingbot-vision,https://github.com/Robbyant/lingbot-vision,Self-supervised learning for spatial perception,2026-07-06 14:09:42+00:00,2026-07-08 11:27:57+00:00,544,17,544,2,Python,11427,Apache-2.0,2,272.0,0.03125,0.0036764705882352,Other
1275444433,overflowy/make-look-scanned,overflowy,make-look-scanned,https://github.com/overflowy/make-look-scanned,Makes PDFs look scanned (CLI or in the browser via WASM),2026-06-20 17:39:59+00:00,2026-06-21 10:39:21+00:00,540,27,540,0,Go,45,AGPL-3.0,18,30.0,0.05,0.0,CLI/Tooling
1277405426,krea-ai/krea-2,krea-ai,krea-2,https://github.com/krea-ai/krea-2,Official inference code for Krea 2,2026-06-22 21:41:41+00:00,2026-06-24 17:39:12+00:00,539,46,539,13,Python,104860,Apache-2.0,16,33.6875,0.085343228200371,0.0241187384044526,Other
1281091382,Leron-X/leronx,Leron-X,leronx,https://github.com/Leron-X/leronx,LeronX — AI Image & Video Generation Platform,2026-06-26 08:05:42+00:00,2026-07-01 12:05:20+00:00,533,66,533,1,Python,28,MIT,12,44.41666666666666,0.123827392120075,0.0018761726078799,AI/ML
1280984042,Pluviobyte/video-production-skills,Pluviobyte,video-production-skills,https://github.com/Pluviobyte/video-production-skills,"Reusable AI video production skills library for creation, recreation, motion design, openers, and QA.",2026-06-26 05:50:51+00:00,2026-06-30 09:25:01+00:00,526,65,526,0,Python,10063,,12,43.833333333333336,0.123574144486692,0.0,AI/ML
1283642247,spiritov/ds.css,spiritov,ds.css,https://github.com/spiritov/ds.css,A css framework recreating the DS / DS Lite's UI,2026-06-29 05:33:18+00:00,2026-07-07 04:40:33+00:00,524,6,524,1,CSS,1273,MIT,9,58.22222222222222,0.0114503816793893,0.0019083969465648,Web
1286859962,rolekkona/Polymarket-Arbitrage-Trading-Bot,rolekkona,Polymarket-Arbitrage-Trading-Bot,https://github.com/rolekkona/Polymarket-Arbitrage-Trading-Bot,polymarket arbitrage trading Bot | | polymarket arbitrage trading Bot | | polymarket arbitrage trading Bot | | polymarket arbitrage trading Bot | | polymarket arbitrage trading Bot | | polymarket arbitrage trading Bot | | polymarket arbitrage trading Bot | | polymarket arbitrage trading Bot | | polymarket arbitrage trading Bot,2026-07-02 06:55:17+00:00,2026-07-06 23:28:31+00:00,522,2005,522,0,TypeScript,3328,,6,87.0,3.840996168582376,0.0,Finance/Trading
1282799667,Ssupercoder/Salary-Negotiation-Skill,Ssupercoder,Salary-Negotiation-Skill,https://github.com/Ssupercoder/Salary-Negotiation-Skill,谈薪skill--自动化谈薪的开拓者与领跑者,2026-06-28 07:53:42+00:00,2026-07-07 10:17:21+00:00,521,10,521,1,Python,487,,10,52.1,0.019193857965451,0.0019193857965451,Other
1276067021,kanavtwtgg/birds.cafe,kanavtwtgg,birds.cafe,https://github.com/kanavtwtgg/birds.cafe,,2026-06-21 13:57:28+00:00,2026-06-23 09:55:45+00:00,520,2,520,0,JavaScript,81,,17,30.58823529411765,0.0038461538461538,0.0,Other
1263543726,valkor-ai/loom,valkor-ai,loom,https://github.com/valkor-ai/loom,Loop engineering for agentic software delivery.,2026-06-09 03:46:34+00:00,2026-07-08 05:54:11+00:00,514,48,514,0,Rust,4896,Apache-2.0,29,17.724137931034484,0.0933852140077821,0.0,Other
1272942359,yin-yizhen/sonic-topography,yin-yizhen,sonic-topography,https://github.com/yin-yizhen/sonic-topography,随音乐产生交互的棋盘式海浪，支持网易云搜索,2026-06-18 04:26:20+00:00,2026-07-08 15:23:56+00:00,511,66,511,17,TypeScript,24884,NOASSERTION,20,25.55,0.1291585127201565,0.0332681017612524,Other
1264568215,gajus/zod-compiler,gajus,zod-compiler,https://github.com/gajus/zod-compiler,"Compile Zod schemas into zero-overhead validation functions at build time. Works with Vite, webpack, esbuild, Rollup, etc",2026-06-10 02:05:05+00:00,2026-06-18 20:21:57+00:00,506,7,506,0,TypeScript,767,BSD-3-Clause,28,18.071428571428573,0.0138339920948616,0.0,Web
1284538699,ComputeRoyale/Compute-Royale,ComputeRoyale,Compute-Royale,https://github.com/ComputeRoyale/Compute-Royale,"Bet on AI agents racing real GPUs. They rent compute, do hash-verified work, earn and you stake Solana on the best. Live on Solana.",2026-06-30 01:04:13+00:00,2026-07-07 21:36:09+00:00,503,33,503,0,TypeScript,2098,,8,62.875,0.0656063618290258,0.0,AI/ML
1271960167,rpanigrahi222/intruth-factcheck,rpanigrahi222,intruth-factcheck,https://github.com/rpanigrahi222/intruth-factcheck,,2026-06-17 06:53:59+00:00,2026-07-06 16:42:44+00:00,501,84,501,3,JavaScript,33,NOASSERTION,21,23.857142857142858,0.1676646706586826,0.0059880239520958,Other
1278086060,helloyanis/age-verification-bypass,helloyanis,age-verification-bypass,https://github.com/helloyanis/age-verification-bypass,Extension to bypass age verification on some websites,2026-06-23 12:57:58+00:00,2026-07-07 15:09:47+00:00,501,19,501,13,JavaScript,64,MIT,15,33.4,0.0379241516966067,0.0259481037924151,Other
1286732818,asz798838958/FrciblyK12,asz798838958,FrciblyK12,https://github.com/asz798838958/FrciblyK12,多线程全自动注册free 强上K12空间,2026-07-02 03:47:34+00:00,2026-07-02 15:05:05+00:00,500,168,500,0,Python,13143,AGPL-3.0,6,83.33333333333333,0.336,0.0,Other
1268441659,bjarneo/ku,bjarneo,ku,https://github.com/bjarneo/ku,"A fast, keyboard-driven Kubernetes TUI. Browse any resource, edit objects, follow logs, and shell into pods. ",2026-06-13 14:38:25+00:00,2026-07-06 19:44:23+00:00,495,19,495,5,Go,322,MIT,25,19.8,0.0383838383838383,0.0101010101010101,DevOps
1272358389,LING71671/open-reverselab,LING71671,open-reverselab,https://github.com/LING71671/open-reverselab,"Open-source reverse engineering lab: 197-article knowledge base + MCP tools + CTF/APK/PE automation toolchain. Agent-native.  Note:由于场景原因，目前有让几乎所有（除fable5）AI都会越狱的bug,静等官方修复,但是请在合法授权下进行安全测试😉",2026-06-17 14:31:38+00:00,2026-07-08 04:51:46+00:00,490,141,490,2,Python,5554,GPL-3.0,21,23.33333333333333,0.2877551020408163,0.0040816326530612,AI/ML
1276236933,m1ckc3s/claude-status-bar,m1ckc3s,claude-status-bar,https://github.com/m1ckc3s/claude-status-bar,"A tiny macOS menu bar status indicator for Claude Code: animated icons, elapsed timer, and open/close lifecycle.",2026-06-21 18:02:49+00:00,2026-07-09 00:26:55+00:00,487,35,487,3,Swift,393,MIT,17,28.647058823529413,0.0718685831622176,0.0061601642710472,AI/ML
1271012824,hustvl/Moebius,hustvl,Moebius,https://github.com/hustvl/Moebius,[ECCV 2026] Moebius: 0.2B Lightweight Image Inpainting Framework with 10B-Level Performance,2026-06-16 08:52:27+00:00,2026-07-02 13:20:12+00:00,478,40,478,2,Python,106114,Apache-2.0,22,21.727272727272727,0.0836820083682008,0.00418410041841,Other
1271972411,zeropl/2FA,zeropl,2FA,https://github.com/zeropl/2FA,"2FA 在你的浏览器里把一个 2FA 密钥算成实时的 6 位验证码。没有服务器、不用注册、没有数据库——每个""账号""就是一条可收藏的网址，密钥藏在它的 # 片段里（浏览器永远不会把 # 片段发到网络上）。",2026-06-17 07:08:24+00:00,2026-07-04 18:20:43+00:00,477,53,477,0,HTML,3105,MIT,21,22.714285714285715,0.1111111111111111,0.0,Web
1267078448,Nanako0129/coralline,Nanako0129,coralline,https://github.com/Nanako0129/coralline,"🪸 Powerlevel10k-inspired statusline for Claude Code — paste one prompt and your AI interviews you, then installs it",2026-06-12 07:44:56+00:00,2026-07-08 18:03:21+00:00,477,35,477,1,Shell,6493,MIT,26,18.346153846153847,0.0733752620545073,0.0020964360587002,AI/ML
1266985960,skydoves/compose-nav-graph,skydoves,compose-nav-graph,https://github.com/skydoves/compose-nav-graph,"⛵️ Compose Navigation Graph plugin for Android Studio that visualizes your entire app flow as an interactive map of rendered previews, typed arguments, and transitions.",2026-06-12 05:58:40+00:00,2026-07-04 05:07:26+00:00,477,21,477,1,Kotlin,50329,Apache-2.0,26,18.346153846153847,0.0440251572327044,0.0020964360587002,Mobile
1267239286,buynao/aipath,buynao,aipath,https://github.com/buynao/aipath,"Interactive AI General Education Course — 30 Lessons, Zero Math",2026-06-12 10:58:35+00:00,2026-07-02 11:41:49+00:00,476,56,476,0,JavaScript,9581,,26,18.307692307692307,0.1176470588235294,0.0,AI/ML
1277989451,Mekotofeuka/MTPROTO_FIX_By_MEKO,Mekotofeuka,MTPROTO_FIX_By_MEKO,https://github.com/Mekotofeuka/MTPROTO_FIX_By_MEKO,MTProto fix by meko - Universal launcher of MTPROTO with stable fixes the limitations that occurred on June 4 in RU,2026-06-23 11:12:12+00:00,2026-07-07 14:05:39+00:00,473,12,473,0,Shell,1033,NOASSERTION,15,31.53333333333333,0.0253699788583509,0.0,CLI/Tooling
1270503221,SubBoost/subboost,SubBoost,subboost,https://github.com/SubBoost/subboost,"Clash/Mihomo subscription conversion, enhancement, and management tool. Clash/Mihomo 订阅转换、增强和管理工具。通过 UI 可视化，一键实现链式代理、精确分流、防 DNS 泄露和多订阅聚合等高级功能。",2026-06-15 19:22:32+00:00,2026-07-02 16:42:36+00:00,472,90,472,4,TypeScript,3076,AGPL-3.0,23,20.52173913043478,0.1906779661016949,0.0084745762711864,Other
1278235302,0xShug0/audio.cpp,0xShug0,audio.cpp,https://github.com/0xShug0/audio.cpp,"An all-in-one, pure C++ inference engine for audio models, powered by ggml. Supports TTS, STT, VAD, voice conversion, music generation, and more, with highly optimized performance. No Python dependency.",2026-06-23 15:40:46+00:00,2026-07-09 02:16:40+00:00,468,37,468,12,C++,84195,NOASSERTION,15,31.2,0.079059829059829,0.0256410256410256,Game
1285512939,lingbol088-spec/reverse-flow-skill,lingbol088-spec,reverse-flow-skill,https://github.com/lingbol088-spec/reverse-flow-skill,面向 AI Agent / Codex 的本地 CTF 逆向工程流程技能。加载后通过“真心为你”进入逆向模式，默认在本地沙盒、CTF、crackme、wargame 或训练靶场环境中工作，按“分析 → 报告 → 逆向 → 深度逆向 → 漏洞研判 → 用户选择下一步”的流程推进。,2026-06-30 22:08:31+00:00,2026-07-03 16:40:16+00:00,466,224,466,2,Python,45,MIT,8,58.25,0.4806866952789699,0.0042918454935622,AI/ML
1284845470,Archive228/loopkit,Archive228,loopkit,https://github.com/Archive228/loopkit,"33 battle-tested skills + minimal .claude harness for any coding agent (Claude Code, Cursor, Codex, Gemini CLI).",2026-06-30 08:46:55+00:00,2026-07-07 21:03:57+00:00,464,83,464,0,Shell,300,MIT,8,58.0,0.1788793103448276,0.0,AI/ML
1269773493,renee-jia/scholar-loop,renee-jia,scholar-loop,https://github.com/renee-jia/scholar-loop,"An autonomous AI scientist: a multi-agent loop over literature, experiments, self-critique and write-up, with deterministic guards against reward-hacking and hallucination.",2026-06-15 04:50:58+00:00,2026-06-23 06:27:49+00:00,461,35,461,0,Python,405,MIT,23,20.043478260869566,0.0759219088937093,0.0,AI/ML
1269937781,M1n-n9/paper-lifecycle,M1n-n9,paper-lifecycle,https://github.com/M1n-n9/paper-lifecycle,Codex skill for full academic paper lifecycle analysis and revision,2026-06-15 08:32:18+00:00,2026-06-16 07:34:21+00:00,459,32,459,0,Unknown,1122,,23,19.956521739130437,0.0697167755991285,0.0,AI/ML
1268405871,privatenumber/mac-ocr,privatenumber,mac-ocr,https://github.com/privatenumber/mac-ocr,macOS CLI for OCR and searchable PDFs using Apple's Vision framework,2026-06-13 13:49:56+00:00,2026-07-03 08:04:30+00:00,457,21,457,0,Swift,2795,MIT,25,18.28,0.0459518599562363,0.0,Web
1268611404,ruvnet/metaharness,ruvnet,metaharness,https://github.com/ruvnet/metaharness,"🛠️ The meta-harness for AI agents — scaffold your own focused, branded agent harness with its own npx CLI, MCP server, memory, learning loop, and witness-signed releases. Works with Claude Code, Codex, pi.dev, Hermes, OpenClaw, and RVM (hardware-isolated sandbox).",2026-06-13 18:29:11+00:00,2026-07-09 00:10:56+00:00,456,49,456,18,TypeScript,24149,MIT,25,18.24,0.1074561403508772,0.0394736842105263,AI/ML
1282680810,Jia-Ethan/codex-keysmith,Jia-Ethan,codex-keysmith,https://github.com/Jia-Ethan/codex-keysmith,Codex CLI instruction-file installer for local configuration,2026-06-28 04:38:07+00:00,2026-07-04 02:55:10+00:00,454,73,454,0,Python,18,MIT,10,45.4,0.1607929515418502,0.0,AI/ML
1282985659,FractalFir/crustc,FractalFir,crustc,https://github.com/FractalFir/crustc,"Entirety of `rustc`, translated to C. ",2026-06-28 12:25:34+00:00,2026-07-02 17:32:12+00:00,453,9,453,4,C,132548,,10,45.3,0.0198675496688741,0.0088300220750551,Other
1277614585,goehou/tabbit-toy,goehou,tabbit-toy,https://github.com/goehou/tabbit-toy,这是一个基于tabbit的研究包，可以转化成OAI格式出来，同时增加了会员认证功能和一键提取cookie的浏览器拓展，方便快速本地快速使用claude gpt等模型,2026-06-23 03:37:12+00:00,2026-06-25 10:28:21+00:00,451,810,451,2,JavaScript,36,,15,30.066666666666663,1.7960088691796008,0.0044345898004434,Other
1285906429,NebuSec/CyberMeowfia,NebuSec,CyberMeowfia,https://github.com/NebuSec/CyberMeowfia,PoCs and exploits for CVEs discovered by VEGA. ,2026-07-01 08:55:52+00:00,2026-07-09 09:43:53+00:00,451,124,451,8,C,134,Apache-2.0,7,64.42857142857143,0.2749445676274945,0.0177383592017738,Other
1289868346,nagisanzenin/engram,nagisanzenin,engram,https://github.com/nagisanzenin/engram,"Evidence-based learning engine for Claude Code — first-principles curricula, free-recall verification with receipts, FSRS-scheduled memory, and explorable artifacts. Learn anything; keep it.",2026-07-05 09:53:10+00:00,2026-07-09 08:22:25+00:00,449,55,449,1,Python,1062,MIT,3,149.66666666666666,0.1224944320712694,0.0022271714922048,AI/ML
1268774372,duolahypercho/fusion-fable,duolahypercho,fusion-fable,https://github.com/duolahypercho/fusion-fable,"Fuse two frontier models into one Fable-tier answer: Opus 4.8 drafts, a second model (Opus 4.8 or GPT-5.5 via codex) checks, Opus fuses. A Claude Code skill.",2026-06-13 23:24:39+00:00,2026-06-26 21:40:53+00:00,446,63,446,1,Shell,116,MIT,25,17.84,0.1412556053811659,0.0022421524663677,AI/ML
1288102626,ai4s-research/open-science,ai4s-research,open-science,https://github.com/ai4s-research/open-science,"Open Science — an open AI workbench for scientists. Open-source alternative to Claude Science: local-first, model-agnostic, reproducible AI research desktop (macOS & Windows), built on Tauri + MCP + agent skills.",2026-07-03 09:22:31+00:00,2026-07-09 09:46:03+00:00,446,47,446,4,TypeScript,7842,NOASSERTION,5,89.2,0.1053811659192825,0.0089686098654708,AI/ML
1293670798,Robbyant/lingbot-video,Robbyant,lingbot-video,https://github.com/Robbyant/lingbot-video,Scaling Mixture-of-Experts Video Pretraining for Embodied Intelligence,2026-07-08 13:52:08+00:00,2026-07-09 08:44:08+00:00,443,11,443,2,Python,13611,Apache-2.0,1,443.0,0.0248306997742663,0.0045146726862302,Other
1288001931,pocket-stack/pocketjs,pocket-stack,pocketjs,https://github.com/pocket-stack/pocketjs,"High-performance JSX UI outside the browser, with hardware rendering, standard Vue Vapor and Solid support, a Tailwind design system, and 60 FPS animation under an 8 MB memory budget.",2026-07-03 07:28:28+00:00,2026-07-09 02:16:32+00:00,442,16,442,14,TypeScript,32296,MIT,5,88.4,0.0361990950226244,0.0316742081447963,Web
1274683820,eooce/transfer-api,eooce,transfer-api,https://github.com/eooce/transfer-api,Cloudflare Worker adapter for unlimited.surf OpenAI/Anthropic-compatible API routes.,2026-06-19 19:24:47+00:00,2026-06-21 09:37:40+00:00,437,2354,437,2,JavaScript,14,,19,23.0,5.386727688787185,0.0045766590389016,AI/ML
1264875739,oomol-lab/LockIME,oomol-lab,LockIME,https://github.com/oomol-lab/LockIME,"A native macOS menu-bar app that keeps your keyboard input source locked — global, per-app, and per-URL.",2026-06-10 08:59:10+00:00,2026-07-06 03:00:12+00:00,433,16,433,0,Swift,27812,GPL-3.0,28,15.464285714285714,0.0369515011547344,0.0,Mobile
1273379460,flatkey-ai/awesome-images,flatkey-ai,awesome-images,https://github.com/flatkey-ai/awesome-images,Try flatkey.ai for 40% saving! Generate practical images ready for all your work needs!!!,2026-06-18 13:17:13+00:00,2026-06-19 08:52:08+00:00,432,0,432,1,JavaScript,14442,,20,21.6,0.0,0.0023148148148148,Other
1270859186,Liunian06/ko-lesson,Liunian06,ko-lesson,https://github.com/Liunian06/ko-lesson,一个帮助大学牲期末复习的skill，能将清朝老PPT复活为能看的资料,2026-06-16 05:43:13+00:00,2026-07-03 07:30:56+00:00,430,8,430,0,Unknown,119,MIT,22,19.545454545454547,0.0186046511627906,0.0,Other
1268903356,gykim80/perfectpixel-studio,gykim80,perfectpixel-studio,https://github.com/gykim80/perfectpixel-studio,AI-powered animation sprite studio — generate character sprite sheets with 8 directions and 100+ actions from a single text prompt (Wails + Go + React),2026-06-14 04:23:45+00:00,2026-06-22 22:36:11+00:00,428,66,428,2,Go,38120,MIT,24,17.833333333333332,0.1542056074766355,0.0046728971962616,AI/ML
1284008447,meituan-longcat/LongCat-2.0,meituan-longcat,LongCat-2.0,https://github.com/meituan-longcat/LongCat-2.0,,2026-06-29 12:46:02+00:00,2026-07-08 06:13:41+00:00,427,48,427,8,Unknown,1105,MIT,9,47.44444444444444,0.1124121779859484,0.018735362997658,Other
1277468360,samasante/liquid-glass,samasante,liquid-glass,https://github.com/samasante/liquid-glass,"Apple-style Liquid Glass for the web — a headless React lens that refracts the live DOM in Safari, Firefox and Chrome. Zero dependencies.",2026-06-22 23:31:35+00:00,2026-06-23 00:37:45+00:00,426,35,426,2,TypeScript,6081,MIT,16,26.625,0.0821596244131455,0.0046948356807511,Web
1277357877,erdwin90/crypto-bar-mac,erdwin90,crypto-bar-mac,https://github.com/erdwin90/crypto-bar-mac,"macOS menu bar app that bring real time cryptocurrency prices using the CoinGecko API. Supports Bitcoin, Ethereum, and many other coins",2026-06-22 20:30:03+00:00,2026-07-09 02:12:42+00:00,425,31,425,0,Objective-C,18535,MIT,16,26.5625,0.0729411764705882,0.0,Finance/Trading
1291198433,V4bel/Januscape,V4bel,Januscape,https://github.com/V4bel/Januscape,,2026-07-06 15:35:00+00:00,2026-07-06 15:37:40+00:00,424,56,424,5,C,6274,,2,212.0,0.1320754716981132,0.0117924528301886,Other
1278517378,joaogfc/ZeroDelay,joaogfc,ZeroDelay,https://github.com/joaogfc/ZeroDelay,Reduz a latência de lives do YouTube — extensão Manifest V3 que acelera a reprodução para alcançar o ao vivo.,2026-06-23 21:47:05+00:00,2026-07-07 17:51:17+00:00,423,41,423,3,JavaScript,5809,GPL-3.0,15,28.2,0.0969267139479905,0.0070921985815602,Other
1277510172,InternScience/Agents-A1,InternScience,Agents-A1,https://github.com/InternScience/Agents-A1,"Scaling the Horizon, Not the Parameters",2026-06-23 00:48:51+00:00,2026-07-09 01:13:32+00:00,421,41,421,3,Python,26226,Apache-2.0,15,28.066666666666663,0.0973871733966745,0.007125890736342,Other
1293372051,Robbyant/lingbot-world-v2,Robbyant,lingbot-world-v2,https://github.com/Robbyant/lingbot-world-v2,Infinite Worlds with Versatile Interactions,2026-07-08 09:24:50+00:00,2026-07-09 02:26:36+00:00,420,9,420,0,Python,9925,NOASSERTION,1,420.0,0.0214285714285714,0.0,Other
1280019559,winsznx/bull-rush,winsznx,bull-rush,https://github.com/winsznx/bull-rush,🐂 BULL RUSH — a 3D neon endless runner for The Black Bull ($ANSEM). React Three Fiber game + Hono/Redis API + dynamic X share cards. Play → trybullrush.xyz,2026-06-25 07:42:50+00:00,2026-07-04 15:36:26+00:00,419,2,419,0,TypeScript,1568,MIT,13,32.23076923076923,0.0047732696897374,0.0,Finance/Trading
1269229845,baskduf/FableCodex,baskduf,FableCodex,https://github.com/baskduf/FableCodex,🗿 FableCodex is a Codex-style coding agent workflow that plans like Fable.,2026-06-14 13:11:00+00:00,2026-06-24 04:31:37+00:00,418,50,418,8,Python,248,AGPL-3.0,24,17.416666666666668,0.1196172248803827,0.0191387559808612,AI/ML
1278049181,nova452/ComfyUI-Conditioning-Rebalance,nova452,ComfyUI-Conditioning-Rebalance,https://github.com/nova452/ComfyUI-Conditioning-Rebalance,Conditioning optimizer nodes offering IP-Adapter-like features for Krea 2 and Ideogram 4 image reference editing along with other conditioning nodes enhancing the generation experience.,2026-06-23 12:17:48+00:00,2026-06-30 12:33:23+00:00,418,51,418,13,Python,108,Apache-2.0,15,27.866666666666667,0.1220095693779904,0.0311004784688995,Other
1284445032,ion-design/ditto.site,ion-design,ditto.site,https://github.com/ion-design/ditto.site,,2026-06-29 21:46:29+00:00,2026-07-07 15:44:24+00:00,417,55,417,7,TypeScript,102208,MIT,9,46.333333333333336,0.13189448441247,0.0167865707434052,Other
1270883324,halfof8/patterngen-oss,halfof8,patterngen-oss,https://github.com/halfof8/patterngen-oss,,2026-06-16 06:15:37+00:00,2026-06-22 05:37:44+00:00,416,38,416,0,TypeScript,152,MIT,22,18.90909090909091,0.0913461538461538,0.0,Other
1266313328,vercel-labs/personal-agent-template,vercel-labs,personal-agent-template,https://github.com/vercel-labs/personal-agent-template,"Open-source template for a durable personal AI agent — web chat, Slack, Linear, and long-term memory with user-approved saves. Eve, Nuxt, Better Auth, Vercel Connect.",2026-06-11 13:59:55+00:00,2026-07-07 15:53:43+00:00,414,42,414,1,TypeScript,1723,MIT,27,15.333333333333334,0.1014492753623188,0.002415458937198,AI/ML
1292406637,op7418/guizang-material-illustration,op7418,guizang-material-illustration,https://github.com/op7418/guizang-material-illustration,归藏的材质插画 skill：生成带字解释图、图表美化和参考辅助配图。,2026-07-07 13:57:13+00:00,2026-07-07 18:13:06+00:00,411,35,411,0,Unknown,37,,1,411.0,0.0851581508515815,0.0,AI/ML
1276479597,tllovesxs/wandao,tllovesxs,wandao,https://github.com/tllovesxs/wandao,"万能导：多平台知识库 Markdown 全项目一键导入导出工具(导入导出效果最好)，用自动化代替手动复制粘贴(有道云,飞书,语雀,阿里云知识库,知识星球,印象笔记,ima,onenote,为之笔记导出导入).(可保留目录结构,图片,项目格式) 关键词:语雀导出导入,飞书导出导入,ima导出导入.阿里云文档导出,印象笔记导出导入,有道云导出,知识星球导出,为之笔记导出,onenote导出",2026-06-22 02:43:25+00:00,2026-07-09 06:13:02+00:00,409,45,409,4,Python,2433,AGPL-3.0,16,25.5625,0.1100244498777506,0.0097799511002444,Other
1276594511,ingriddaleusag-dotcom/PickTV,ingriddaleusag-dotcom,PickTV,https://github.com/ingriddaleusag-dotcom/PickTV,,2026-06-22 05:54:29+00:00,2026-07-09 04:28:54+00:00,409,84,409,2,Java,26708,GPL-3.0,16,25.5625,0.2053789731051344,0.0048899755501222,Other
