id,full_name,owner,name,html_url,description,created_at,pushed_at,stars,forks,watchers,open_issues,primary_language,size,license,age_days,stars_per_day,fork_star_ratio,issue_star_ratio,category
1259223676,Forlives/21-day-self-interview,Forlives,21-day-self-interview,https://github.com/Forlives/21-day-self-interview,"🪞 An AI existential-psychology counselor asks you 3 meaningful questions every night for 21 days — and remembers, reflecting your own words back to you. Bilingual zh/en. A Hermes Agent skill. 每晚三个问题，一面慢慢显影的镜子。",2026-06-04 09:53:52+00:00,2026-06-08 11:39:03+00:00,153,54,153,2,Python,36,MIT,15,10.2,0.3529411764705882,0.0130718954248366,AI/ML
1254862084,ganbo-gab/open-storyboard-canvas,ganbo-gab,open-storyboard-canvas,https://github.com/ganbo-gab/open-storyboard-canvas,开源的 AI 分镜与导演台画布，支持全景图、摄像机控制、提示词预设和自定义供应商调用。,2026-05-31 04:57:04+00:00,2026-06-20 06:27:55+00:00,153,30,153,1,TypeScript,223314,NOASSERTION,19,8.052631578947368,0.196078431372549,0.0065359477124183,AI/ML
1256997541,impengpong/jitou,impengpong,jitou,https://github.com/impengpong/jitou,即投 · BOSS 直聘 AI 自动投递助手,2026-06-02 09:14:06+00:00,2026-06-18 05:07:32+00:00,153,1,153,5,Unknown,5668,,17,9.0,0.0065359477124183,0.0326797385620915,AI/ML
1255841045,QwenLM/open-computer-use,QwenLM,open-computer-use,https://github.com/QwenLM/open-computer-use,"MCP-based Computer Use service for Qwen Code and any AI agent — controls macOS, Linux, and Windows via accessibility APIs.",2026-06-01 08:10:48+00:00,2026-06-10 16:38:07+00:00,153,28,153,1,Swift,2948,MIT,18,8.5,0.1830065359477124,0.0065359477124183,AI/ML
1261102226,liuliu667/cram-engine,liuliu667,cram-engine,https://github.com/liuliu667/cram-engine,,2026-06-06 08:34:10+00:00,2026-06-17 12:52:04+00:00,152,1,152,1,Unknown,85,MIT,13,11.692307692307692,0.006578947368421,0.006578947368421,Other
1257034082,sautrikroy17/DSA-Interview-Playbook,sautrikroy17,DSA-Interview-Playbook,https://github.com/sautrikroy17/DSA-Interview-Playbook,Crack any interview using this 80/20 DSA playbook,2026-06-02 09:55:34+00:00,2026-06-02 17:06:23+00:00,152,12,152,1,Unknown,2,,17,8.941176470588236,0.0789473684210526,0.006578947368421,Other
1256936189,baidu/nettools,baidu,nettools,https://github.com/baidu/nettools,"A physical network blackbox monitoring toolkit with diagnostic and probing capabilities for link quality, path tracing, packet modification detection, loss localization, and bandwidth measurement, enabling end-to-end reliability in large-scale data centers.",2026-06-02 08:03:10+00:00,2026-06-11 07:10:01+00:00,152,26,152,0,Go,13753,MIT,17,8.941176470588236,0.1710526315789473,0.0,DevOps
1266858242,joeseesun/qiaomu-ai-prd,joeseesun,qiaomu-ai-prd,https://github.com/joeseesun/qiaomu-ai-prd,"Turn one-line product ideas into AI-implementable PRDs with speed-read cards, constraint layers, overdelivery ideas, metrics, and acceptance scripts.",2026-06-12 02:38:55+00:00,2026-06-12 03:20:19+00:00,152,5,152,0,Python,46,MIT,7,21.714285714285715,0.0328947368421052,0.0,AI/ML
1251719304,portingpete/skate3-recomp,portingpete,skate3-recomp,https://github.com/portingpete/skate3-recomp,Skate 3 Recomp: custom ReXGlue build for Skate 3 bring-up: https://github.com/mchughalex/skate3recomp is a more updated project,2026-05-27 21:13:06+00:00,2026-06-11 18:12:16+00:00,152,4,152,2,C,28319,NOASSERTION,23,6.608695652173913,0.0263157894736842,0.0131578947368421,Other
1261114908,chaitin/agent-compose,chaitin,agent-compose,https://github.com/chaitin/agent-compose,,2026-06-06 08:56:11+00:00,2026-06-18 09:44:10+00:00,151,14,151,17,Go,804,AGPL-3.0,13,11.615384615384617,0.0927152317880794,0.1125827814569536,Other
1252906447,xiao-chen-ai/seeking-stars,xiao-chen-ai,seeking-stars,https://github.com/xiao-chen-ai/seeking-stars,觅星小臣 - AI智能求职助手（本地桌面版）,2026-05-29 01:45:52+00:00,2026-06-02 05:50:29+00:00,151,8,151,0,Unknown,23,NOASSERTION,21,7.190476190476191,0.0529801324503311,0.0,Other
1260279644,elder-plinius/ENTHEA,elder-plinius,ENTHEA,https://github.com/elder-plinius/ENTHEA,real-time psychedelic visual synthesizer and pro-grade music visualizer,2026-06-05 10:26:11+00:00,2026-06-05 10:28:52+00:00,151,33,151,1,HTML,117,AGPL-3.0,14,10.785714285714286,0.2185430463576159,0.0066225165562913,Web
1252992358,a6216abcd/Free-Residential-IP-Proxy-Controller,a6216abcd,Free-Residential-IP-Proxy-Controller,https://github.com/a6216abcd/Free-Residential-IP-Proxy-Controller,,2026-05-29 04:09:05+00:00,2026-06-18 05:34:05+00:00,151,192,151,1,JavaScript,141,,21,7.190476190476191,1.271523178807947,0.0066225165562913,Other
1246700632,Saddytech/lockbit-rescue,Saddytech,lockbit-rescue,https://github.com/Saddytech/lockbit-rescue,"A toolkit for recovering files encrypted by LockBit 3.0 (""Black"") ransomware without paying the ransom, by exploiting a known keystream-reuse weakness.",2026-05-22 13:12:17+00:00,2026-05-23 08:46:20+00:00,151,35,151,1,Python,52,MIT,28,5.392857142857143,0.2317880794701986,0.0066225165562913,Other
1255817315,Yacey/agnes-ai-generation-skill,Yacey,agnes-ai-generation-skill,https://github.com/Yacey/agnes-ai-generation-skill,,2026-06-01 07:42:27+00:00,2026-06-01 09:00:53+00:00,151,23,151,3,Python,35,MIT,18,8.38888888888889,0.152317880794702,0.0198675496688741,Other
1252844979,JaceThings/Highlighters,JaceThings,Highlighters,https://github.com/JaceThings/Highlighters,,2026-05-28 23:42:17+00:00,2026-06-12 13:41:17+00:00,151,4,151,0,TypeScript,2277,MIT,22,6.863636363636363,0.0264900662251655,0.0,Other
1248202563,H-ing-1/rCore-OS,H-ing-1,rCore-OS,https://github.com/H-ing-1/rCore-OS,create for rCore-OS,2026-05-24 10:24:29+00:00,2026-05-25 17:09:01+00:00,151,11,151,2,Rust,72,MIT,26,5.807692307692308,0.0728476821192053,0.0132450331125827,Other
1265807829,baibanbao/x-made-easy-skill,baibanbao,x-made-easy-skill,https://github.com/baibanbao/x-made-easy-skill,A Chinese Made Easy writing skill inspired by Calculus Made Easy,2026-06-11 05:12:39+00:00,2026-06-11 05:12:43+00:00,150,16,150,0,Unknown,8,MIT,8,18.75,0.1066666666666666,0.0,Other
1251972814,gy15901580825/Argus,gy15901580825,Argus,https://github.com/gy15901580825/Argus,"Black-box, open-source red-team testing for AI agents. Point Argus at any HTTP, gRPC, or browser-using agent endpoint, run 500+ adversarial probes (OWASP LLM Top 10, MITRE ATLAS, NIST AI RMF, TAP/PAIR/GCG), get LLM-judged findings as SARIF, gate CI via GitHub Code Scanning. Ships with CLI + GH Action.",2026-05-28 04:30:38+00:00,2026-05-28 17:16:30+00:00,150,21,150,0,Python,4047,Apache-2.0,22,6.818181818181818,0.14,0.0,AI/ML
1254334425,Chenruishuo/posterly,Chenruishuo,posterly,https://github.com/Chenruishuo/posterly,"Build academic conference posters as a single HTML/CSS file, rendered to print-ready PDF via headless Chromium. A coding-agent skill.",2026-05-30 12:43:31+00:00,2026-06-19 08:24:13+00:00,150,5,150,0,Python,17488,AGPL-3.0,20,7.5,0.0333333333333333,0.0,AI/ML
1249785700,riyagoelrs/tiktok-scraper,riyagoelrs,tiktok-scraper,https://github.com/riyagoelrs/tiktok-scraper,,2026-05-26 03:17:03+00:00,2026-05-26 03:20:50+00:00,150,15,150,0,Python,3,,24,6.25,0.1,0.0,Other
1250280866,Aimino-Tech/opendocswork-mcp,Aimino-Tech,opendocswork-mcp,https://github.com/Aimino-Tech/opendocswork-mcp,"Rust-native MCP server for Office document processing (Excel, Word, PowerPoint). Sub-millisecond, local-first, open source.",2026-05-26 13:30:19+00:00,2026-06-16 08:49:43+00:00,149,11,149,1,Rust,2997,GPL-3.0,24,6.208333333333333,0.0738255033557047,0.0067114093959731,AI/ML
1251519364,w1163222589-coder/slide-image-to-editable-pptx,w1163222589-coder,slide-image-to-editable-pptx,https://github.com/w1163222589-coder/slide-image-to-editable-pptx,A Codex skill for converting slide screenshots into editable PowerPoint decks.,2026-05-27 16:55:03+00:00,2026-06-17 05:36:34+00:00,148,11,148,1,Unknown,3393,MIT,23,6.434782608695652,0.0743243243243243,0.0067567567567567,AI/ML
1252154132,jerryxugit-2026/Ziyang-Vocab-Master,jerryxugit-2026,Ziyang-Vocab-Master,https://github.com/jerryxugit-2026/Ziyang-Vocab-Master,"An open-source, AI-powered vocabulary study tool designed for students like me.",2026-05-28 08:37:40+00:00,2026-05-28 09:14:13+00:00,148,10,148,0,HTML,35,,22,6.727272727272728,0.0675675675675675,0.0,AI/ML
1256855764,lifuyue/issue-finder,lifuyue,issue-finder,https://github.com/lifuyue/issue-finder,Local-first handoff prep for developers using coding agents.,2026-06-02 06:30:15+00:00,2026-06-19 09:09:46+00:00,148,4,148,1,Rust,942,MIT,17,8.705882352941176,0.027027027027027,0.0067567567567567,AI/ML
1250014189,Setuav/PyThrust,Setuav,PyThrust,https://github.com/Setuav/PyThrust,An Open-Source Framework for Electric Propulsion System Analysis and Optimization in UAV Design,2026-05-26 08:20:07+00:00,2026-06-18 22:13:36+00:00,147,20,147,1,Python,26472,Apache-2.0,24,6.125,0.1360544217687075,0.0068027210884353,Other
1245654240,ku78/tspu-checker,ku78,tspu-checker,https://github.com/ku78/tspu-checker,TSPU Diagnostic Tool — диагностика блокировок и белых списков из командной строки (Bash),2026-05-21 12:30:55+00:00,2026-06-08 15:48:46+00:00,147,7,147,1,Shell,61,MIT,29,5.068965517241379,0.0476190476190476,0.0068027210884353,CLI/Tooling
1246588489,meituan-longcat/WBench,meituan-longcat,WBench,https://github.com/meituan-longcat/WBench,WBench: A Comprehensive Multi-turn Benchmark for Interactive Video World Model Evaluation,2026-05-22 10:46:52+00:00,2026-06-18 06:50:52+00:00,147,6,147,0,Python,51227,MIT,28,5.25,0.0408163265306122,0.0,Other
1249888354,nekocode/filetree-skill,nekocode,filetree-skill,https://github.com/nekocode/filetree-skill,A Claude Code plugin that maintains `FILETREE.md`.,2026-05-26 05:56:39+00:00,2026-06-16 15:37:22+00:00,147,8,147,0,Python,182,,24,6.125,0.0544217687074829,0.0,AI/ML
1262534926,apple/foundation-models-utilities,apple,foundation-models-utilities,https://github.com/apple/foundation-models-utilities,Emerging and experimental patterns for building with the Foundation Models framework,2026-06-08 04:40:53+00:00,2026-06-08 04:50:47+00:00,147,8,147,0,Swift,1996,Apache-2.0,11,13.363636363636363,0.0544217687074829,0.0,Mobile
1248189982,senlindesign/taste-skill,senlindesign,taste-skill,https://github.com/senlindesign/taste-skill,"Claude Code skill — reverse-engineer any website's design taste: concrete tokens + opinionated trade-offs (WHY, not just WHAT)",2026-05-24 10:02:26+00:00,2026-06-08 06:35:09+00:00,147,15,147,2,JavaScript,10104,,26,5.653846153846154,0.1020408163265306,0.0136054421768707,AI/ML
1248659915,maxktz/hitch,maxktz,hitch,https://github.com/maxktz/hitch,"Share your terminal with coding agent in one command. Lightweight shell proxy, written in Rust.",2026-05-24 23:27:54+00:00,2026-06-07 03:08:07+00:00,146,3,146,1,Rust,629,MIT,26,5.615384615384615,0.0205479452054794,0.0068493150684931,AI/ML
1267028123,cha0upup/LeoAI,cha0upup,LeoAI,https://github.com/cha0upup/LeoAI,AI 驱动的后渗透综合管理平台，深度集成 LLM Agent，开箱即用。,2026-06-12 06:48:10+00:00,2026-06-20 09:23:30+00:00,146,17,146,1,Java,10740,GPL-3.0,7,20.857142857142858,0.1164383561643835,0.0068493150684931,AI/ML
1258874888,mizuamedesu/ReportSkills,mizuamedesu,ReportSkills,https://github.com/mizuamedesu/ReportSkills,,2026-06-04 02:11:10+00:00,2026-06-05 10:40:57+00:00,146,3,146,1,Shell,11,MIT,15,9.733333333333333,0.0205479452054794,0.0068493150684931,CLI/Tooling
1260503436,K07VN/capcut-tts-api,K07VN,capcut-tts-api,https://github.com/K07VN/capcut-tts-api,capcut api tts & stt,2026-06-05 15:02:29+00:00,2026-06-10 04:06:28+00:00,146,90,146,4,Python,42,,14,10.428571428571429,0.6164383561643836,0.0273972602739726,Web
1250277749,Chlience/yt-dlp-tauri,Chlience,yt-dlp-tauri,https://github.com/Chlience/yt-dlp-tauri,A minimal Windows desktop downloader powered by yt-dlp and Tauri 2. / 基于 yt-dlp 和 Tauri 2 的轻量 Windows 桌面下载器。,2026-05-26 13:26:58+00:00,2026-05-29 03:20:22+00:00,145,11,145,2,Rust,1720,GPL-3.0,24,6.041666666666667,0.0758620689655172,0.0137931034482758,Other
1269235820,tamnd/ascii-gif,tamnd,ascii-gif,https://github.com/tamnd/ascii-gif,Turn a terminal session into a good-looking animated GIF. A vhs wrapper with an attractive default look.,2026-06-14 13:19:11+00:00,2026-06-14 13:19:20+00:00,145,3,145,0,Go,15,MIT,5,29.0,0.0206896551724137,0.0,CLI/Tooling
1255452572,LiteLLM-Labs/litellm-rust,LiteLLM-Labs,litellm-rust,https://github.com/LiteLLM-Labs/litellm-rust,A minimal Rust gateway built for coding agents (LiteLLM-Compatible),2026-05-31 21:02:49+00:00,2026-06-09 16:41:43+00:00,145,18,145,8,TypeScript,1498,MIT,19,7.631578947368421,0.1241379310344827,0.0551724137931034,AI/ML
1253176096,Wanduforl/MacArkPet,Wanduforl,MacArkPet,https://github.com/Wanduforl/MacArkPet,Unofficial GPL-3.0 native macOS desktop pet app inspired by Ark-Pets.,2026-05-29 08:05:17+00:00,2026-06-12 05:04:20+00:00,144,1,144,0,JavaScript,2215,GPL-3.0,21,6.857142857142857,0.0069444444444444,0.0,Mobile
1248888946,ningsiii/ClickDeck,ningsiii,ClickDeck,https://github.com/ningsiii/ClickDeck,,2026-05-25 06:32:54+00:00,2026-06-13 05:01:16+00:00,144,8,144,2,TypeScript,11770,MIT,25,5.76,0.0555555555555555,0.0138888888888888,Other
1264038598,viitor-ai/viitor-voice-nar,viitor-ai,viitor-voice-nar,https://github.com/viitor-ai/viitor-voice-nar,,2026-06-09 13:56:36+00:00,2026-06-10 12:27:16+00:00,144,30,144,1,Python,2073,,10,14.4,0.2083333333333333,0.0069444444444444,Other
1254876384,Arenbai/SecSkills,Arenbai,SecSkills,https://github.com/Arenbai/SecSkills,面向 Claude Code 的专业渗透测试技能模块。严格遵循 PTES 标准，覆盖信息收集、漏洞利用、后渗透与免杀规避全阶段。不定期更新skill，以达到优化skill。,2026-05-31 05:28:39+00:00,2026-06-05 13:03:59+00:00,144,17,144,0,Unknown,329,MIT,19,7.578947368421052,0.1180555555555555,0.0,AI/ML
1246330857,chefkannofriend-source/mbbb-baker-agent,chefkannofriend-source,mbbb-baker-agent,https://github.com/chefkannofriend-source/mbbb-baker-agent,Claude Code subagent for pastry recipe lookup and Baker's Percentage calculation,2026-05-22 05:07:44+00:00,2026-05-25 13:43:51+00:00,144,39,144,2,Python,29,MIT,28,5.142857142857143,0.2708333333333333,0.0138888888888888,AI/ML
1246428498,qqfly1to19/awesome_proofreading_auto,qqfly1to19,awesome_proofreading_auto,https://github.com/qqfly1to19/awesome_proofreading_auto,,2026-05-22 07:22:52+00:00,2026-05-22 09:34:26+00:00,144,24,144,2,Python,1059,NOASSERTION,28,5.142857142857143,0.1666666666666666,0.0138888888888888,Other
1250780514,dama-cyber/Distilled-Novel-Toolbox,dama-cyber,Distilled-Novel-Toolbox,https://github.com/dama-cyber/Distilled-Novel-Toolbox,??????? - novel writing skills toolbox,2026-05-27 00:53:05+00:00,2026-06-09 03:14:36+00:00,144,38,144,0,Unknown,151,,23,6.260869565217392,0.2638888888888889,0.0,Other
1246522214,rccyx/asryx,rccyx,asryx,https://github.com/rccyx/asryx,"Linux native ASR, done the UNIX way, no dependencies beyond pure C++ and the standard Linux toolchain",2026-05-22 09:20:58+00:00,2026-06-15 11:35:56+00:00,144,9,144,3,C++,18134,Apache-2.0,28,5.142857142857143,0.0625,0.0208333333333333,Other
1264419530,aws-devtools-labs/aws-blocks,aws-devtools-labs,aws-blocks,https://github.com/aws-devtools-labs/aws-blocks,"Composable building blocks for full-stack AWS apps — define infrastructure and runtime code together with end-to-end type safety using TypeScript, local mocking, and native client codegen for Kotlin, Swift, and Dart.",2026-06-09 21:42:12+00:00,2026-06-20 05:34:41+00:00,144,18,144,32,TypeScript,2821,Apache-2.0,10,14.4,0.125,0.2222222222222222,DevOps
1265787517,encrypted-spaces/prototype,encrypted-spaces,prototype,https://github.com/encrypted-spaces/prototype,A cryptographic framework for building collaborative applications over an untrusted server. Research prototype.,2026-06-11 04:43:13+00:00,2026-06-11 12:09:32+00:00,144,8,144,0,Rust,3300,Apache-2.0,8,18.0,0.0555555555555555,0.0,Other
1255391825,ayi-ai/ayi-nonviolent-communication,ayi-ai,ayi-nonviolent-communication,https://github.com/ayi-ai/ayi-nonviolent-communication,马歇尔·卢森堡《非暴力沟通》(NVC) 的可执行 AI Skill：把任何一句话翻译成 观察-感受-需要-请求。Cursor / Claude Code 可直接安装。,2026-05-31 19:16:15+00:00,2026-05-31 19:17:02+00:00,143,25,143,0,Unknown,1715,MIT,19,7.526315789473684,0.1748251748251748,0.0,AI/ML
1246521575,zeke/agents.md,zeke,agents.md,https://github.com/zeke/agents.md,My global instructions for AI agents like OpenCode,2026-05-22 09:20:10+00:00,2026-06-17 02:43:17+00:00,143,7,143,0,Unknown,7,MIT,28,5.107142857142857,0.0489510489510489,0.0,AI/ML
1260212243,nanxiangxi/qssh,nanxiangxi,qssh,https://github.com/nanxiangxi/qssh,一个中文的 SSH 远程连接工具，开源、好看、便携。,2026-06-05 09:02:49+00:00,2026-06-14 11:57:17+00:00,143,12,143,4,Vue,24663,,14,10.214285714285714,0.0839160839160839,0.0279720279720279,Web
1248516993,boheling/deltasci,boheling,deltasci,https://github.com/boheling/deltasci,A verification layer for scientific work,2026-05-24 18:40:11+00:00,2026-05-30 08:20:34+00:00,143,23,143,0,Python,2000,MIT,26,5.5,0.1608391608391608,0.0,Other
1259528788,marcj/papernews,marcj,papernews,https://github.com/marcj/papernews,news and articles nicely rendered as calm pdf for readers,2026-06-04 15:43:49+00:00,2026-06-16 16:54:09+00:00,143,19,143,1,Python,6047,MIT,15,9.533333333333331,0.1328671328671328,0.0069930069930069,Other
1264017362,hvardhan878/ghostwork,hvardhan878,ghostwork,https://github.com/hvardhan878/ghostwork,"Your personal AI worker. Watches your screen, learns your workflows, automates the repetitive parts. Built on Screenpipe. All local, no cloud, no setup. It gets better every day without you doing anything differently.",2026-06-09 13:34:34+00:00,2026-06-13 18:30:33+00:00,143,4,143,12,TypeScript,382,NOASSERTION,10,14.3,0.0279720279720279,0.0839160839160839,AI/ML
1246926223,Priyanshu-1622/skiff,Priyanshu-1622,skiff,https://github.com/Priyanshu-1622/skiff,Self-hosted SSH connection manager. Open-source alternative to Termius.,2026-05-22 17:54:40+00:00,2026-06-11 06:09:31+00:00,143,12,143,0,TypeScript,2075,NOASSERTION,28,5.107142857142857,0.0839160839160839,0.0,Security
1256980488,KyrieCheungYep/ky-design-to-html-skill,KyrieCheungYep,ky-design-to-html-skill,https://github.com/KyrieCheungYep/ky-design-to-html-skill,A Codex / Claude skill for recreating UI screenshots as HTML/CSS.,2026-06-02 08:54:34+00:00,2026-06-02 09:58:03+00:00,142,19,142,0,Python,18,,17,8.352941176470589,0.1338028169014084,0.0,AI/ML
1259483683,britcruise9/GrowBot,britcruise9,GrowBot,https://github.com/britcruise9/GrowBot,What's the simplest possible AI robot that learns everything from scratch?,2026-06-04 14:54:11+00:00,2026-06-05 13:33:32+00:00,142,14,142,1,Python,1841,NOASSERTION,15,9.466666666666669,0.0985915492957746,0.0070422535211267,AI/ML
1253425173,steeliron550-ui/search-bibtex,steeliron550-ui,search-bibtex,https://github.com/steeliron550-ui/search-bibtex,"[PolyCite] 基于多智能体协同、多源汇聚的论文引用元数据检索工具 A command-line tool for quickly scraping BibTeX information from computer science conferences and journals, optimized for LLM Multi-Agents.",2026-05-29 12:56:19+00:00,2026-05-30 08:29:46+00:00,141,4,141,0,TypeScript,3678,MIT,21,6.714285714285714,0.0283687943262411,0.0,AI/ML
1257924723,boona13/glb-shrink,boona13,glb-shrink,https://github.com/boona13/glb-shrink,,2026-06-03 05:55:19+00:00,2026-06-03 06:01:05+00:00,141,20,141,2,TypeScript,498,MIT,16,8.8125,0.1418439716312056,0.0141843971631205,Other
1248468832,AGI-is-going-to-arrive/workflow-cookbook,AGI-is-going-to-arrive,workflow-cookbook,https://github.com/AGI-is-going-to-arrive/workflow-cookbook,"《织经》Loom · Claude Code Dynamic Workflows（CLAUDE_CODE_WORKFLOWS）配方手册：29 章 + 6 附录，每个配方都在本机真跑过、附 Run ID，中英双语。 | Loom · a recipe book for Claude Code's Dynamic Workflows. 29 chapters + 6 appendices, every recipe actually run, with its Run ID.",2026-05-24 17:23:24+00:00,2026-06-02 13:34:14+00:00,141,16,141,0,HTML,5095,MIT,26,5.423076923076923,0.1134751773049645,0.0,AI/ML
1253702844,tommy0103/obelisk,tommy0103,obelisk,https://github.com/tommy0103/obelisk,"Every past session, subagent, and workflow -- queryable by your agent, browsable by you",2026-05-29 18:22:23+00:00,2026-06-17 17:54:20+00:00,141,4,141,0,JavaScript,5971,AGPL-3.0,21,6.714285714285714,0.0283687943262411,0.0,AI/ML
1258433648,toddwyl/hl-quant,toddwyl,hl-quant,https://github.com/toddwyl/hl-quant,heuristic learning quant,2026-06-03 15:17:06+00:00,2026-06-09 02:05:50+00:00,141,10,141,2,Python,10176,MIT,16,8.8125,0.0709219858156028,0.0141843971631205,Finance/Trading
1270108133,Happy-Chen-CH/Educational_RAG_System,Happy-Chen-CH,Educational_RAG_System,https://github.com/Happy-Chen-CH/Educational_RAG_System,面向教育场景的RAG智能问答系统，融合关键词匹配与语义检索双引擎，融合MySQL和RAG技术，先经过MySQL数据库的检索(还融合了Redis辅助储存和搜索)，若无符合条件答案，则进入RAG系统，RAG知识库中的知识储存在Milvus向量数据库中,2026-06-15 11:50:53+00:00,2026-06-15 11:51:02+00:00,140,2,140,0,Python,5629,,4,35.0,0.0142857142857142,0.0,AI/ML
1257647992,gauss314/skills,gauss314,skills,https://github.com/gauss314/skills,Financial market data consumption skills for claude code and AI agents,2026-06-02 22:01:41+00:00,2026-06-14 05:57:25+00:00,140,24,140,0,Python,5974,MIT,17,8.235294117647058,0.1714285714285714,0.0,AI/ML
1246308721,jaehwan02/UltraCat,jaehwan02,UltraCat,https://github.com/jaehwan02/UltraCat,"A macOS menu bar utility for system monitoring, fan control, and sleep management.",2026-05-22 04:25:44+00:00,2026-06-15 01:21:47+00:00,140,4,140,1,Unknown,96,,28,5.0,0.0285714285714285,0.0071428571428571,DevOps
1271452378,Sorathiya123/claude-ai-free-desktop-app,Sorathiya123,claude-ai-free-desktop-app,https://github.com/Sorathiya123/claude-ai-free-desktop-app,free claude code ai github  desktop pc windows linux macOS proxy server anthropic free api local llm router nvidia nim openrouter deepseek ollama lm studio vscode extension jetbrains cli terminal coding assistant,2026-06-16 17:15:06+00:00,2026-06-16 17:26:47+00:00,140,0,140,0,TypeScript,13,MIT,3,46.66666666666666,0.0,0.0,AI/ML
1246367892,nevertoday/xposter,nevertoday,xposter,https://github.com/nevertoday/xposter,Chrome MV3 extension for importing Markdown drafts into X Articles.,2026-05-22 06:08:15+00:00,2026-06-13 00:01:58+00:00,139,31,139,0,JavaScript,2651,MIT,28,4.964285714285714,0.2230215827338129,0.0,Other
1251922807,ATOM00blue/machine-learning-library,ATOM00blue,machine-learning-library,https://github.com/ATOM00blue/machine-learning-library,"A hand-curated, topic-organized library of the best ML education — 923 docs (391 arXiv papers, 474 Stanford/MIT/Karpathy/fast.ai lectures, 58 explainer articles), normalized to Markdown with full provenance. Open it in Obsidian or point your agent at it. A clean ML corpus for learning, RAG & fine-tuning.",2026-05-28 03:03:04+00:00,2026-05-29 16:36:38+00:00,139,14,139,0,Python,17943,NOASSERTION,22,6.318181818181818,0.1007194244604316,0.0,AI/ML
1258127863,axobase001/tomorrowedge,axobase001,tomorrowedge,https://github.com/axobase001/tomorrowedge,Local GUI client for full-access multi-model coding agents,2026-06-03 09:49:11+00:00,2026-06-20 06:19:10+00:00,139,10,139,14,TypeScript,18342,MIT,16,8.6875,0.0719424460431654,0.1007194244604316,AI/ML
1250803751,Makapic/RocoPilot,Makapic,RocoPilot,https://github.com/Makapic/RocoPilot,洛克王国世界自动化助手：基于 Interception 驱动级输入，在内核层面模拟键鼠，游戏反作弊无法检测。  基于 OpenCV 模板匹配 + YOLO 精灵检测的游戏自动化工具，专为《洛克王国：世界》设计。支持自动丢球、精灵定位瞄准、巡航抓宠，以及战斗中的自定义应对策略。,2026-05-27 01:35:21+00:00,2026-05-31 00:55:55+00:00,139,27,139,8,Python,56052,MIT,23,6.043478260869565,0.1942446043165467,0.0575539568345323,Other
1245549227,Sphere-AI-Lab/orbit,Sphere-AI-Lab,orbit,https://github.com/Sphere-AI-Lab/orbit,Stable and Efficient Reinforcement Learning for Trillion-Parameter LLMs,2026-05-21 10:22:48+00:00,2026-05-30 08:02:37+00:00,139,7,139,1,Python,4830,Apache-2.0,29,4.793103448275862,0.0503597122302158,0.0071942446043165,Other
1248378025,ziyuwowo/trust-eval-mm,ziyuwowo,trust-eval-mm,https://github.com/ziyuwowo/trust-eval-mm,Multi-dimensional trustworthiness evaluation for multimodal LLMs,2026-05-24 15:08:30+00:00,2026-05-24 15:08:33+00:00,139,8,139,0,Python,29,NOASSERTION,26,5.346153846153846,0.0575539568345323,0.0,Other
1246925024,3DAgentWorld/HorizonStream,3DAgentWorld,HorizonStream,https://github.com/3DAgentWorld/HorizonStream,HorizonStream Official Implementation,2026-05-22 17:52:56+00:00,2026-06-10 03:00:25+00:00,138,10,138,2,Python,1815,,28,4.928571428571429,0.072463768115942,0.0144927536231884,Other
1252170194,LinYuanovo/HGame-Manager,LinYuanovo,HGame-Manager,https://github.com/LinYuanovo/HGame-Manager,黄油仓库 - 本地HGame管理工具，支持游戏库管理、刮削、标签分类等功能,2026-05-28 08:58:09+00:00,2026-06-20 09:26:25+00:00,138,0,138,1,Dart,29018,,22,6.2727272727272725,0.0,0.0072463768115942,Mobile
1248329138,kouhxp/textsnap,kouhxp,textsnap,https://github.com/kouhxp/textsnap,"Snap any image, screenshot, or webpage into plaintext. No GPU. No cloud. One command.",2026-05-24 13:57:05+00:00,2026-05-27 15:06:15+00:00,138,1,138,0,Python,149,MIT,26,5.307692307692308,0.0072463768115942,0.0,Other
