id,full_name,owner,name,html_url,description,created_at,pushed_at,stars,forks,watchers,open_issues,primary_language,size,license,age_days,stars_per_day,fork_star_ratio,issue_star_ratio,category
1254842258,haskaomni/serenity-skill,haskaomni,serenity-skill,https://github.com/haskaomni/serenity-skill,,2026-05-31 04:13:42+00:00,2026-06-12 04:29:27+00:00,554,85,554,0,Unknown,64,MIT,19,29.157894736842103,0.1534296028880866,0.0,Other
1255237198,chaitanyagiri/munder-difflin,chaitanyagiri,munder-difflin,https://github.com/chaitanyagiri/munder-difflin,local multi-agent harness,2026-05-31 15:25:05+00:00,2026-06-17 23:58:15+00:00,546,57,546,14,TypeScript,25047,NOASSERTION,19,28.73684210526316,0.1043956043956044,0.0256410256410256,AI/ML
1263269573,NuvioMedia/NuvioDesktop,NuvioMedia,NuvioDesktop,https://github.com/NuvioMedia/NuvioDesktop,Official Nuvio Desktop Repository,2026-06-08 19:41:04+00:00,2026-06-19 15:05:09+00:00,545,34,545,35,Kotlin,306663,GPL-3.0,11,49.54545454545455,0.0623853211009174,0.0642201834862385,Mobile
1255103294,pood1e/wa-app,pood1e,wa-app,https://github.com/pood1e/wa-app,,2026-05-31 12:09:33+00:00,2026-06-18 16:45:51+00:00,543,273,543,7,Go,3458,,19,28.57894736842105,0.5027624309392266,0.012891344383057,Other
1262769725,xiaohuailabs/xiaohu-video-translate,xiaohuailabs,xiaohu-video-translate,https://github.com/xiaohuailabs/xiaohu-video-translate,对 AI 说一句话，把外语视频自动配上中文字幕 —— 下载/转写/翻译/润色/烧录一条龙，全程本地，转写零 API 费,2026-06-08 09:55:55+00:00,2026-06-08 10:24:52+00:00,542,85,542,7,Python,357,MIT,11,49.27272727272727,0.1568265682656826,0.0129151291512915,AI/ML
1254749434,Mochocyang/QMAI,Mochocyang,QMAI,https://github.com/Mochocyang/QMAI,青幕AI写作软件，解决长篇小说写作问题，解决小说角色性格不统一，防止人设崩坏。,2026-05-31 00:41:43+00:00,2026-06-20 07:58:08+00:00,538,104,538,8,TypeScript,13263,,19,28.31578947368421,0.1933085501858736,0.0148698884758364,Other
1262689338,kadevin/ilab-gpt-conjure,kadevin,ilab-gpt-conjure,https://github.com/kadevin/ilab-gpt-conjure,"面向 GPT-image-2 的 AI 图片生成 WebUI 工作台，支持 Codex Responses 与 OpenAI 兼容 API 接入，内置公用图库、多类型 Chip 快捷引用、提示词模板、多任务并发和本地队列管理。An AI image generation WebUI workbench for GPT-image-2 with Codex Responses and OpenAI-compatible API support, shared gallery references, multi-type quick chips, prompt templates, concurrent tasks, and local queue management.",2026-06-08 08:20:30+00:00,2026-06-20 00:50:34+00:00,537,74,537,0,Python,17410,AGPL-3.0,11,48.81818181818182,0.1378026070763501,0.0,AI/ML
1248129407,AmmarkoV/SAM3DBody-cpp,AmmarkoV,SAM3DBody-cpp,https://github.com/AmmarkoV/SAM3DBody-cpp,"Real-time 3D full-body reconstruction from a single camera, Multiperson BVH output, Pure C++ runtime, ONNX + ggml, 70-joint skeleton with hands.",2026-05-24 08:12:55+00:00,2026-06-16 17:26:16+00:00,537,73,537,9,C,1799,MIT,26,20.653846153846157,0.1359404096834264,0.0167597765363128,Other
1255291036,RUC-NLPIR/Arbor,RUC-NLPIR,Arbor,https://github.com/RUC-NLPIR/Arbor,"A generalist autonomous research agent — runs experiments, researches, and iteratively optimizes, autonomously.",2026-05-31 16:42:47+00:00,2026-06-19 02:25:52+00:00,534,69,534,0,Python,38302,Apache-2.0,19,28.105263157894736,0.1292134831460674,0.0,AI/ML
1259071744,wy51ai/edulab,wy51ai,edulab,https://github.com/wy51ai/edulab,,2026-06-04 07:02:45+00:00,2026-06-07 11:42:30+00:00,532,103,532,2,HTML,15920,Apache-2.0,15,35.46666666666667,0.1936090225563909,0.0037593984962406,Web
1267455254,fguzman82/gateGPT,fguzman82,gateGPT,https://github.com/fguzman82/gateGPT,"Full Transformer into a custom chip. microGPT in RTL, generating names on a Virtex-5 FPGA at ~56k tokens/second.",2026-06-12 14:55:53+00:00,2026-06-14 03:54:22+00:00,531,88,531,1,Verilog,360,,7,75.85714285714286,0.1657250470809793,0.0018832391713747,AI/ML
1266794943,NO6KIKO/gorest-2d-animation-spritesheet-generator,NO6KIKO,gorest-2d-animation-spritesheet-generator,https://github.com/NO6KIKO/gorest-2d-animation-spritesheet-generator,Codex-assisted local 2D animation spritesheet generator and scene compositing workspace.,2026-06-12 00:46:23+00:00,2026-06-17 18:13:00+00:00,531,69,531,0,TypeScript,109772,MIT,7,75.85714285714286,0.1299435028248587,0.0,AI/ML
1265651119,MSNightmare/GreatXML,MSNightmare,GreatXML,https://github.com/MSNightmare/GreatXML,GreatXML bitlocker bypass vulnerability,2026-06-11 01:03:12+00:00,2026-06-11 01:04:40+00:00,529,222,529,7,Unknown,87,MIT,8,66.125,0.4196597353497164,0.0132325141776937,Security
1250486032,FlashML-org/flashlib,FlashML-org,flashlib,https://github.com/FlashML-org/flashlib,Fast and memory-efficient classical machine learning operators,2026-05-26 17:19:26+00:00,2026-06-20 04:21:27+00:00,527,40,527,1,Python,1214,Apache-2.0,24,21.95833333333333,0.0759013282732447,0.0018975332068311,Other
1258992633,Jane-xiaoer/xiaoer-videolab,Jane-xiaoer,xiaoer-videolab,https://github.com/Jane-xiaoer/xiaoer-videolab,"One click on the toolbar grabs the current page's video into ~/Downloads — local yt-dlp daemon, 1800+ sites. 小耳抓视频：一键把当前页视频抓到本地。",2026-06-04 05:20:47+00:00,2026-06-07 02:10:05+00:00,525,78,525,1,JavaScript,849,MIT,15,35.0,0.1485714285714285,0.0019047619047619,Other
1250235788,kepengxu/PRISM-VL,kepengxu,PRISM-VL,https://github.com/kepengxu/PRISM-VL,"PRISM-VL studies measurement-grounded VLM learning with RAW-derived Meas.-XYZ inputs, camera-conditioned grounding, and exposure-bracketed supervision transfer.",2026-05-26 12:40:07+00:00,2026-05-27 14:27:55+00:00,523,15,523,2,Python,21521,Apache-2.0,24,21.791666666666668,0.02868068833652,0.0038240917782026,Other
1266832037,DanMcInerney/architect-loop,DanMcInerney,architect-loop,https://github.com/DanMcInerney/architect-loop,"Claude Fable 5 as architect, GPT-5.5 Codex as builder, the repo as memory - a research-backed Claude Code skill for the cross-vendor agent loop",2026-06-12 01:54:12+00:00,2026-06-13 01:53:20+00:00,522,47,522,1,HTML,789,MIT,7,74.57142857142857,0.0900383141762452,0.0019157088122605,AI/ML
1268068714,mrtooher/fable-mode,mrtooher,fable-mode,https://github.com/mrtooher/fable-mode,"A Claude skill that activates Fable-style agentic behavior: explicit multi-stage planning, sub-agent delegation, and self-verification.",2026-06-13 05:33:14+00:00,2026-06-19 22:54:05+00:00,520,58,520,0,Unknown,30,,6,86.66666666666667,0.1115384615384615,0.0,AI/ML
1246346594,jianshuo/ccglass,jianshuo,ccglass,https://github.com/jianshuo/ccglass,"See what your coding agent (Claude Code, Codex, Kimi) sends to the model — local proxy + web dashboard",2026-05-22 05:35:11+00:00,2026-06-19 01:04:42+00:00,519,34,519,0,JavaScript,871,MIT,28,18.535714285714285,0.0655105973025048,0.0,AI/ML
1254971431,MatixYo/ESP32-Plane-Radar,MatixYo,ESP32-Plane-Radar,https://github.com/MatixYo/ESP32-Plane-Radar,Open-source ESP32 firmware for a 1.28″ round display that shows live ADS-B aircraft around your location as a sonar-style plane radar.,2026-05-31 08:25:05+00:00,2026-06-09 13:21:07+00:00,518,77,518,26,C++,176,MIT,19,27.26315789473684,0.1486486486486486,0.0501930501930501,Other
1271894214,Plaer1/junction,Plaer1,junction,https://github.com/Plaer1/junction,VS Code chat sidebar for local AI coding agents,2026-06-17 05:27:09+00:00,2026-06-17 16:39:19+00:00,515,7,515,0,TypeScript,2375,MIT,2,257.5,0.0135922330097087,0.0,AI/ML
1252914174,ziguishian/xhs-visual-director-skill,ziguishian,xhs-visual-director-skill,https://github.com/ziguishian/xhs-visual-director-skill,这是一个用于规划小红书图文的 Agent Skill。它不是普通文案助手，而是一个“视觉导演”：先判断内容任务，再选择适合的视觉风格，最后输出完整图文结构、逐页视觉方案、图像生成提示词、发布文案和自检清单。,2026-05-29 02:00:01+00:00,2026-06-16 11:31:40+00:00,514,58,514,0,Unknown,4854,MIT,21,24.476190476190474,0.11284046692607,0.0,AI/ML
1268946118,fivetaku/fablize,fivetaku,fablize,https://github.com/fivetaku/fablize,"A Claude Code plugin that makes Opus behave like Fable — completion, evidence, and verification enforced as procedure. Ships only what a Fable-vs-Opus comparison proved transferable.",2026-06-14 05:49:06+00:00,2026-06-19 09:41:18+00:00,513,75,513,2,Python,59,,5,102.6,0.1461988304093567,0.0038986354775828,AI/ML
1253138201,StarTrail-org/PixelRAG,StarTrail-org,PixelRAG,https://github.com/StarTrail-org/PixelRAG,The end of web parsing. The beginning of scalable pixel-native search.,2026-05-29 07:25:40+00:00,2026-06-19 07:21:19+00:00,511,56,511,5,Python,44736,Apache-2.0,21,24.33333333333333,0.1095890410958904,0.009784735812133,AI/ML
1262119018,jwangkun/claude-for-financial-services-cn,jwangkun,claude-for-financial-services-cn,https://github.com/jwangkun/claude-for-financial-services-cn, 63 个 Claude Skills，为 A 股金融从业者而生  基于 Anthropic 官方 claude-for-financial-services 深度适配国内市场，现已开源。,2026-06-07 15:45:23+00:00,2026-06-09 13:41:28+00:00,510,76,510,2,Python,573,Apache-2.0,12,42.5,0.1490196078431372,0.0039215686274509,AI/ML
1261137494,IvanSobolev/Neo3dEngine,IvanSobolev,Neo3dEngine,https://github.com/IvanSobolev/Neo3dEngine,"A minimalist CPU-based 3D console engine in C# (.NET 8) built from scratch. Features Raycasting/Raytracing, dynamic lighting & shadows, .obj loader, and custom TCP-based multiplayer with real-time chat. No external graphics APIs.",2026-06-06 09:33:31+00:00,2026-06-14 02:26:54+00:00,505,5,505,5,C#,186,GPL-3.0,13,38.84615384615385,0.0099009900990099,0.0099009900990099,Game
1267982346,eli-labz/Third-Eye,eli-labz,Third-Eye,https://github.com/eli-labz/Third-Eye,A production-grade OSINT platform that provides situational awareness across multiple intelligence domains.,2026-06-13 03:15:46+00:00,2026-06-13 06:29:56+00:00,498,6,498,0,TypeScript,2995,MIT,6,83.0,0.0120481927710843,0.0,AI/ML
1255069527,PentesterFlow/agent,PentesterFlow,agent,https://github.com/PentesterFlow/agent,Agentic offensive-security in your terminal,2026-05-31 11:14:35+00:00,2026-06-14 08:51:57+00:00,496,73,496,3,TypeScript,1035,Apache-2.0,19,26.105263157894736,0.1471774193548387,0.0060483870967741,AI/ML
1259875534,visa/visa-vulnerability-agentic-harness,visa,visa-vulnerability-agentic-harness,https://github.com/visa/visa-vulnerability-agentic-harness,Visa Vulnerability Agentic Harness,2026-06-05 00:26:33+00:00,2026-06-14 20:10:24+00:00,489,85,489,0,Python,424,NOASSERTION,14,34.92857142857143,0.1738241308793456,0.0,Security
1268898197,royalbhati/sqltoerdiagram,royalbhati,sqltoerdiagram,https://github.com/royalbhati/sqltoerdiagram,"ER diagram generator. Paste CREATE TABLE statements and get a clean, interactive ERD — runs 100% in your browser, nothing uploaded",2026-06-14 04:12:26+00:00,2026-06-20 04:08:50+00:00,484,40,484,1,HTML,380,MIT,5,96.8,0.0826446280991735,0.0020661157024793,Data
1263268212,secret-tools/secret-tool,secret-tools,secret-tool,https://github.com/secret-tools/secret-tool,Secret-Tools — classified discord utilities. Star the repo.,2026-06-08 19:39:09+00:00,2026-06-08 19:58:27+00:00,484,0,484,1,Unknown,175,,11,44.0,0.0,0.0020661157024793,Other
1260900484,Parcle-AI/parcle-memory,Parcle-AI,parcle-memory,https://github.com/Parcle-AI/parcle-memory,,2026-06-06 02:15:35+00:00,2026-06-20 01:55:23+00:00,482,1,482,1,Python,58,MIT,13,37.07692307692308,0.0020746887966804,0.0020746887966804,Other
1249360152,MoonTechLab/Selene-TV,MoonTechLab,Selene-TV,https://github.com/MoonTechLab/Selene-TV,以 MoonTV v100 版本 / Helios 为后端的 Android TV 客户端，针对遥控器设备优化,2026-05-25 16:06:49+00:00,2026-06-18 14:28:18+00:00,482,58,482,1,Unknown,17181,,25,19.28,0.1203319502074688,0.0020746887966804,Mobile
1254447363,c0deJedi/nbd-vram,c0deJedi,nbd-vram,https://github.com/c0deJedi/nbd-vram,"Use your NVIDIA GPU's VRAM as swap space on Linux. Built for laptops with soldered memory and no upgrade path. If you have an RTX card sitting there with 8GB of VRAM and you're getting swapped to SSD, this puts that VRAM to work",2026-05-30 15:21:16+00:00,2026-06-18 07:17:28+00:00,480,12,480,1,Shell,9315,MIT,20,24.0,0.025,0.0020833333333333,CLI/Tooling
1246721062,VILA-Lab/FigMirror,VILA-Lab,FigMirror,https://github.com/VILA-Lab/FigMirror,An Automated AI Agent Tool for Plotting Your Data in Any Paper's Figure Style.,2026-05-22 13:37:03+00:00,2026-05-25 15:13:25+00:00,476,31,476,2,Python,17722,,28,17.0,0.065126050420168,0.0042016806722689,AI/ML
1255839210,S-Sigdel/vimhjkl,S-Sigdel,vimhjkl,https://github.com/S-Sigdel/vimhjkl,learn vim from your terminal with spaced repetition,2026-06-01 08:08:33+00:00,2026-06-12 06:16:41+00:00,475,9,475,1,Python,743,MIT,18,26.38888888888889,0.0189473684210526,0.0021052631578947,CLI/Tooling
1257953142,tryproduck/produck-skills,tryproduck,produck-skills,https://github.com/tryproduck/produck-skills,Agent skills to help you build products your users love.,2026-06-03 06:34:10+00:00,2026-06-19 07:24:06+00:00,474,3,474,0,Unknown,33,Apache-2.0,16,29.625,0.0063291139240506,0.0,AI/ML
1271627791,rebel0789/codexpro,rebel0789,codexpro,https://github.com/rebel0789/codexpro,Use ChatGPT Developer Mode as a local coding agent for your repo through MCP.,2026-06-16 21:22:43+00:00,2026-06-19 20:04:46+00:00,471,41,471,1,TypeScript,200,MIT,3,157.0,0.0870488322717622,0.0021231422505307,AI/ML
1245256564,Eynzof/Hermes-CN-Desktop,Eynzof,Hermes-CN-Desktop,https://github.com/Eynzof/Hermes-CN-Desktop,"Hermes Agent CN desktop app, Windows-First, built with Tauri, Typescript and Rust. Isolated Hermes Agent core insides. ",2026-05-21 03:58:05+00:00,2026-06-19 11:40:55+00:00,469,28,469,32,TypeScript,16916,NOASSERTION,29,16.17241379310345,0.0597014925373134,0.068230277185501,AI/ML
1247940858,tantara/openbrief,tantara,openbrief,https://github.com/tantara/openbrief,,2026-05-24 01:32:16+00:00,2026-05-30 21:54:06+00:00,469,26,469,3,TypeScript,5762,AGPL-3.0,26,18.03846153846154,0.0554371002132196,0.0063965884861407,Other
1250860168,bioMate-AI/biomate-bioconductor-kb,bioMate-AI,biomate-bioconductor-kb,https://github.com/bioMate-AI/biomate-bioconductor-kb,"BioMate-KB Bioconductor Skills — 200 packages (top 100 by downloads + 100 rising stars) as vignette-grounded Claude/agent skills, with per-package workflow recipes",2026-05-27 03:10:25+00:00,2026-06-17 13:09:38+00:00,466,53,466,0,Python,1224,NOASSERTION,23,20.26086956521739,0.1137339055793991,0.0,AI/ML
1249876603,paraschopra/make-pages-interactive,paraschopra,make-pages-interactive,https://github.com/paraschopra/make-pages-interactive,,2026-05-26 05:39:25+00:00,2026-06-18 07:25:25+00:00,457,50,457,10,JavaScript,51,MIT,24,19.041666666666668,0.1094091903719912,0.0218818380743982,Other
1260625224,FerroxLabs/wayland,FerroxLabs,wayland,https://github.com/FerroxLabs/wayland,Wayland - The AI Agent That Perceives. Reasons. Acts. Evolves.,2026-06-05 17:38:22+00:00,2026-06-19 14:31:25+00:00,454,73,454,37,TypeScript,629224,AGPL-3.0,14,32.42857142857143,0.1607929515418502,0.0814977973568281,AI/ML
1249712804,huilang-me/CF-Server-Monitor,huilang-me,CF-Server-Monitor,https://github.com/huilang-me/CF-Server-Monitor,,2026-05-26 01:21:29+00:00,2026-06-20 07:36:08+00:00,449,309,449,3,JavaScript,1216,,24,18.70833333333333,0.688195991091314,0.0066815144766146,Other
1252434124,mudler/parakeet.cpp,mudler,parakeet.cpp,https://github.com/mudler/parakeet.cpp,Parakeet implementation in C++ with ggml,2026-05-28 14:13:27+00:00,2026-06-19 19:32:09+00:00,448,34,448,2,C++,9694,MIT,22,20.363636363636363,0.0758928571428571,0.0044642857142857,Other
1253525979,DannyMac180/skills,DannyMac180,skills,https://github.com/DannyMac180/skills,AI agent skills created by me: Dan McAteer,2026-05-29 14:54:55+00:00,2026-05-29 15:22:46+00:00,442,35,442,1,Python,11,MIT,21,21.047619047619047,0.0791855203619909,0.002262443438914,AI/ML
1250240320,fancyboi999/ai-engineering-from-scratch-zh,fancyboi999,ai-engineering-from-scratch-zh,https://github.com/fancyboi999/ai-engineering-from-scratch-zh,Agent工程师最全学习路径 · 从零精通 AI 工程 · 20 阶段 503 课 · 中文全量翻译 + 配套站点 + 动画讲解视频 · 如何成为 AI Agent 工程师的修成指南,2026-05-26 12:45:07+00:00,2026-06-19 22:44:06+00:00,441,70,441,1,Python,14894,MIT,24,18.375,0.1587301587301587,0.0022675736961451,AI/ML
1268429667,dzcmemory-web/bazi-ziwei-skill,dzcmemory-web,bazi-ziwei-skill,https://github.com/dzcmemory-web/bazi-ziwei-skill,AI 八字 + 紫微斗数排盘与综合印证 Skill：算法精准排盘（不靠 LLM 猜），三种分析模式，一键生成水墨风 HTML 命盘海报。兼容 Claude / Codex / Cursor / Workbuddy 等 SKILL.md Agent。,2026-06-13 14:22:28+00:00,2026-06-14 03:53:54+00:00,440,55,440,1,TypeScript,1869,MIT,6,73.33333333333333,0.125,0.0022727272727272,AI/ML
1263648864,cobusgreyling/loop-engineering,cobusgreyling,loop-engineering,https://github.com/cobusgreyling/loop-engineering,"Practical patterns, starters & CLI tools for loop engineering with AI coding agents. Design systems that prompt and orchestrate agents (inspired by Addy Osmani and Boris Cherny). Includes loop-audit, loop-init, loop-cost.",2026-06-09 06:28:20+00:00,2026-06-19 11:57:00+00:00,439,63,439,2,JavaScript,1352,MIT,10,43.9,0.143507972665148,0.0045558086560364,AI/ML
1248728151,foru17/make-x-great-again,foru17,make-x-great-again,https://github.com/foru17/make-x-great-again,"Make X Great Again — passive ambient browser extension that makes X usable: spam shield, KOL signal score, profile digest, social graph hints. Public-good, open source.",2026-05-25 01:57:55+00:00,2026-06-20 06:00:40+00:00,436,26,436,11,TypeScript,43947,AGPL-3.0,25,17.44,0.0596330275229357,0.0252293577981651,Other
1249975515,sky22333/skyadb,sky22333,skyadb,https://github.com/sky22333/skyadb,Android 上的 adb 助手，可以很方便的管理安卓手机、平板、电视和盒子。,2026-05-26 07:35:50+00:00,2026-06-08 21:41:43+00:00,433,30,433,6,Kotlin,2401,GPL-3.0,24,18.041666666666668,0.069284064665127,0.0138568129330254,Mobile
1260580223,TexasBedouin/vibe-check,TexasBedouin,vibe-check,https://github.com/TexasBedouin/vibe-check,"By a 12-year product manager who builds 0-to-1: takes a beginner from a vague idea to a buildable plan, then guides the build (GitHub basics, clean-code habits, a verify-and-iterate loop, a checkup for the mess). For Claude Code, Codex, and Antigravity. grill-me is for engineers, vibe-check is for everyone else.",2026-06-05 16:38:57+00:00,2026-06-18 22:29:38+00:00,430,51,430,1,HTML,572,MIT,14,30.714285714285715,0.1186046511627907,0.0023255813953488,AI/ML
1251565665,garnix-io/garnix-ci,garnix-io,garnix-ci,https://github.com/garnix-io/garnix-ci,"CI and hosting for nix-based, flakified github repos",2026-05-27 17:48:52+00:00,2026-06-17 11:11:13+00:00,429,42,429,2,Haskell,1248,BSD-3-Clause,23,18.65217391304348,0.0979020979020979,0.0046620046620046,DevOps
1253887608,argyleink/prop-for-that,argyleink,prop-for-that,https://github.com/argyleink/prop-for-that,"what JS knows, now CSS knows",2026-05-29 23:09:45+00:00,2026-06-15 21:48:15+00:00,427,6,427,0,TypeScript,798,MIT,21,20.33333333333333,0.0140515222482435,0.0,Web
1248486524,xm486/YukiHub,xm486,YukiHub,https://github.com/xm486/YukiHub,YukiHub是一款面向Android平台的Gal游戏管理工具，支持本地游戏、快捷方式、游玩记录同步。项目采用GPL-3.0开源协议。,2026-05-24 17:50:22+00:00,2026-06-20 06:58:13+00:00,426,10,426,1,Java,54255,GPL-3.0,26,16.384615384615383,0.0234741784037558,0.0023474178403755,Other
1245898085,hanyi0000/chatgpt-plus-automation-toolkit,hanyi0000,chatgpt-plus-automation-toolkit,https://github.com/hanyi0000/chatgpt-plus-automation-toolkit,自动化完成 ChatGPT 账号注册、GoPay/PayPal 支付、OAuth 授权与 Session 导出，含 Windows 控制面板,2026-05-21 17:04:35+00:00,2026-06-01 12:49:56+00:00,426,134,426,1,JavaScript,747057,MIT,29,14.689655172413794,0.3145539906103286,0.0023474178403755,Other
1262740944,chubbyguan/chubbyskills,chubbyguan,chubbyskills,https://github.com/chubbyguan/chubbyskills,"把中文全渠道内容（抖音 / B站 / 小红书 / 公众号 / X / 播客）采集进个人知识库的 13 个 AI Skill：图文存图、视频转文字稿、字幕优先免 GPU，附带知识库 MCP server。 ｜ Ingest Chinese content into your personal knowledge base — image/video routing, subtitle-first transcription, and a KB MCP server.",2026-06-08 09:22:13+00:00,2026-06-16 08:05:33+00:00,425,65,425,0,Python,226,MIT,11,38.63636363636363,0.1529411764705882,0.0,AI/ML
1255551884,andrewmccalip/kickbacks.ai,andrewmccalip,kickbacks.ai,https://github.com/andrewmccalip/kickbacks.ai,"Get paid for waiting. The most-watched line on Earth now has a market. Kickbacks turns AI wait states into one sponsored status line, and users get 50% of ad revenue.",2026-06-01 00:40:41+00:00,2026-06-12 19:29:28+00:00,424,79,424,125,TypeScript,698,NOASSERTION,18,23.55555555555556,0.1863207547169811,0.294811320754717,AI/ML
1259058888,mikubaka88/CCFA-Skills,mikubaka88,CCFA-Skills,https://github.com/mikubaka88/CCFA-Skills,A skill family for shaping the research storyline of CCF-A papers.,2026-06-04 06:47:10+00:00,2026-06-09 07:20:03+00:00,423,28,423,0,TeX,272031,MIT,15,28.2,0.0661938534278959,0.0,Other
1254228826,dsta022/lerobot-rgb-rgbd-vla-dataset-toolkit,dsta022,lerobot-rgb-rgbd-vla-dataset-toolkit,https://github.com/dsta022/lerobot-rgb-rgbd-vla-dataset-toolkit,"Toolkit for collecting, merging, auditing, visualizing, and publishing RGB/RGB-D LeRobot VLA datasets.",2026-05-30 09:53:31+00:00,2026-05-31 10:12:55+00:00,423,89,423,0,Python,2521,MIT,20,21.15,0.210401891252955,0.0,Other
1266009367,LearnPrompt/luban-skill,LearnPrompt,luban-skill,https://github.com/LearnPrompt/luban-skill,鲁班 | Luban — 把'能用的Skill'打磨成'能被装、能传播、能验证、能进化'的公共资产。Agent skill-polishing workshop: 验料·访行·过尺·慢刨·回炉,2026-06-11 08:49:42+00:00,2026-06-12 18:49:09+00:00,420,74,420,0,Shell,191,MIT,8,52.5,0.1761904761904762,0.0,CLI/Tooling
1251450386,https-deeplearning-ai/deeplearning-ai,https-deeplearning-ai,deeplearning-ai,https://github.com/https-deeplearning-ai/deeplearning-ai,DeepLearning AI's centralized hub for course materials and resources. ,2026-05-27 15:34:27+00:00,2026-06-12 16:29:53+00:00,416,56,416,2,Python,26054,,23,18.08695652173913,0.1346153846153846,0.0048076923076923,Other
1253187784,huawei-csl/KVarN,huawei-csl,KVarN,https://github.com/huawei-csl/KVarN,"KVarN is a native vLLM KV-cache quantization backend for your agents: 3-5x more context, throughput above FP16, and FP16-level accuracy. Calibration-free, one flag.",2026-05-29 08:19:15+00:00,2026-06-16 08:58:50+00:00,411,26,411,5,Python,43238,Apache-2.0,21,19.571428571428573,0.0632603406326034,0.0121654501216545,AI/ML
1247944288,modaic-ai/gepa-viz,modaic-ai,gepa-viz,https://github.com/modaic-ai/gepa-viz,Interactive live visualizer for gepa runs,2026-05-24 01:41:29+00:00,2026-05-26 02:07:57+00:00,411,30,411,0,TypeScript,58343,MIT,26,15.807692307692308,0.072992700729927,0.0,Other
1254275643,r14dd/patent,r14dd,patent,https://github.com/r14dd/patent,A prior-art search for your code ideas. Stop building what already exists.,2026-05-30 11:12:04+00:00,2026-06-15 13:27:20+00:00,408,14,408,27,Rust,3824,Apache-2.0,20,20.4,0.034313725490196,0.0661764705882353,CLI/Tooling
1258638161,wizenheimer/canary,wizenheimer,canary,https://github.com/wizenheimer/canary,"QA harness built for Claude Code | E2E testing with screen recordings, console logs, network HARs, and Playwright traces",2026-06-03 19:16:55+00:00,2026-06-08 15:19:02+00:00,405,30,405,1,TypeScript,25178,NOASSERTION,16,25.3125,0.074074074074074,0.0024691358024691,AI/ML
1266985960,skydoves/compose-nav-graph,skydoves,compose-nav-graph,https://github.com/skydoves/compose-nav-graph,"⛵️ Compose Navigation Graph plugin for Android Studio that visualizes your entire app flow as an interactive map of rendered previews, typed arguments, and transitions.",2026-06-12 05:58:40+00:00,2026-06-17 09:45:31+00:00,405,16,405,3,Kotlin,50424,Apache-2.0,7,57.85714285714285,0.0395061728395061,0.0074074074074074,Mobile
1247236424,bryanyzhu/agentic-ai-system-course,bryanyzhu,agentic-ai-system-course,https://github.com/bryanyzhu/agentic-ai-system-course,"Use agent to learn agent - A skeleton course on how to design, build, and operate production AI agents ",2026-05-23 03:59:52+00:00,2026-06-03 15:35:15+00:00,403,56,403,2,JavaScript,563,MIT,27,14.925925925925926,0.1389578163771712,0.0049627791563275,AI/ML
1267078448,Nanako0129/coralline,Nanako0129,coralline,https://github.com/Nanako0129/coralline,"🪸 Powerlevel10k-inspired statusline for Claude Code — paste one prompt and your AI interviews you, then installs it",2026-06-12 07:44:56+00:00,2026-06-19 14:38:27+00:00,400,28,400,2,Shell,6132,MIT,7,57.142857142857146,0.07,0.005,AI/ML
1254710588,ProxyShard/ShardBrowser,ProxyShard,ShardBrowser,https://github.com/ProxyShard/ShardBrowser,"Free, open-source anti-detect browser launcher for web scraping and multi-accounting. By the ProxyShard team. Engine-level fingerprint spoofing in Chromium 148 (WebGL / WebGPU / Client Hints / fonts / TLS), 170+ device profiles bundled, stable QUIC + WebRTC over SOCKS5.",2026-05-30 23:05:14+00:00,2026-06-14 00:37:36+00:00,400,62,400,4,Rust,4947,MIT,20,20.0,0.155,0.01,Web
1263886755,jmmy9609-design/gpt-pp,jmmy9609-design,gpt-pp,https://github.com/jmmy9609-design/gpt-pp,,2026-06-09 11:05:36+00:00,2026-06-09 19:06:48+00:00,397,204,397,1,Python,1604,,10,39.7,0.5138539042821159,0.0025188916876574,Other
