id,full_name,owner,name,html_url,description,created_at,pushed_at,stars,forks,watchers,open_issues,primary_language,size,license,age_days,stars_per_day,fork_star_ratio,issue_star_ratio,category
1281611049,philholden/partialupdate,philholden,partialupdate,https://github.com/philholden/partialupdate,"Generative UI in multi user chat. A chat bot that can edit it own HTML, CSS and JS. ",2026-06-26 18:25:38+00:00,2026-06-27 11:53:58+00:00,173,17,173,1,TypeScript,241,MIT,27,6.407407407407407,0.0982658959537572,0.0057803468208092,Web
1289130590,fikstt2/hh-ai-agent,fikstt2,hh-ai-agent,https://github.com/fikstt2/hh-ai-agent,hh.ru аи бот для откликов,2026-07-04 11:20:32+00:00,2026-07-20 09:38:17+00:00,173,29,173,1,Python,38,MIT,19,9.105263157894736,0.1676300578034682,0.0057803468208092,CLI/Tooling
1286279483,Aevella/polaris-local-first,Aevella,polaris-local-first,https://github.com/Aevella/polaris-local-first,"Local-first AI workspace for structured context, collaborators, and portable backups.",2026-07-01 16:05:58+00:00,2026-07-22 15:27:13+00:00,172,70,172,1,TypeScript,8145,AGPL-3.0,22,7.818181818181818,0.4069767441860465,0.005813953488372,AI/ML
1290954656,olemeyer/rocketplaneIO,olemeyer,rocketplaneIO,https://github.com/olemeyer/rocketplaneIO,"Self-hosted AI SRE for Kubernetes — zero-instrumentation eBPF observability plus a copilot that fixes issues through guardrailed, self-verifying actions. BYO-LLM, air-gapped capable.",2026-07-06 11:24:01+00:00,2026-07-20 09:32:27+00:00,172,3,172,0,Go,42555,Apache-2.0,17,10.117647058823527,0.0174418604651162,0.0,AI/ML
1299266129,jinyangwu/SEED,jinyangwu,SEED,https://github.com/jinyangwu/SEED,,2026-07-13 12:26:24+00:00,2026-07-17 05:22:51+00:00,172,6,172,1,Python,29157,MIT,10,17.2,0.0348837209302325,0.005813953488372,Other
1278940275,FrontisAI/Awesome-Self-Improving-Agents,FrontisAI,Awesome-Self-Improving-Agents,https://github.com/FrontisAI/Awesome-Self-Improving-Agents,Awesome list and survey website for agents in the era of experience,2026-06-24 08:21:32+00:00,2026-07-22 06:04:47+00:00,172,6,172,0,Unknown,12494,,29,5.931034482758621,0.0348837209302325,0.0,AI/ML
1280069770,mangiapanejohn-dev/QuotaLens,mangiapanejohn-dev,QuotaLens,https://github.com/mangiapanejohn-dev/QuotaLens,See your AI usage clearly — a macOS menu-bar gauge for Claude & Codex quotas.,2026-06-25 08:39:07+00:00,2026-07-07 10:28:40+00:00,172,2,172,0,Swift,5340,MIT,28,6.142857142857143,0.0116279069767441,0.0,AI/ML
1287395871,Yule-Cai/aaai-review-simulator-prompt,Yule-Cai,aaai-review-simulator-prompt,https://github.com/Yule-Cai/aaai-review-simulator-prompt,"A strict AAAI-style multi-reviewer prompt for simulated paper review, meta-review, and revision planning.",2026-07-02 16:41:08+00:00,2026-07-02 16:50:48+00:00,172,0,172,0,Unknown,58,MIT,21,8.19047619047619,0.0,0.0,Other
1307136587,risa-labs-inc/BossConsole,risa-labs-inc,BossConsole,https://github.com/risa-labs-inc/BossConsole,"Open-source, multi-platform harness for AI agents — a native, multi-threaded operator's console (JVM, not Electron) to run Claude Code, Codex, Gemini or OpenCode with a real browser, terminal, editor, secrets & 100+ MCP tools. Built for enterprises, science & research.",2026-07-21 01:01:05+00:00,2026-07-24 08:13:06+00:00,172,2,172,4,Kotlin,15436,Apache-2.0,2,86.0,0.0116279069767441,0.0232558139534883,AI/ML
1286310347,tirexforyou-sunez/Voicemod-Pro-Activator,tirexforyou-sunez,Voicemod-Pro-Activator,https://github.com/tirexforyou-sunez/Voicemod-Pro-Activator,,2026-07-01 16:40:01+00:00,2026-07-01 16:41:29+00:00,171,1,171,0,Unknown,3,MIT,22,7.772727272727272,0.0058479532163742,0.0,Other
1281054646,orailnoor/private-agent,orailnoor,private-agent,https://github.com/orailnoor/private-agent,PrivateAgent is an open-source Android automation agent built with Flutter. It utilizes the DeepSeek API and native Android Accessibility Services to interpret screen layouts and execute multi-step tasks across any installed application via natural language commands.,2026-06-26 07:25:53+00:00,2026-07-17 03:40:19+00:00,171,73,171,4,Dart,1252,,27,6.333333333333333,0.4269005847953216,0.023391812865497,AI/ML
1287728325,NateBJones-Projects/ringer,NateBJones-Projects,ringer,https://github.com/NateBJones-Projects/ringer,Ringer — parallel AI-agent swarm orchestrator. Ringside — its native mission-control HUD. Fable-quality output without Fable-level burn.,2026-07-03 00:39:20+00:00,2026-07-16 16:28:59+00:00,171,76,171,33,Python,7682,NOASSERTION,20,8.55,0.4444444444444444,0.1929824561403508,AI/ML
1281473904,YuriCrystal/n8n-marketing-flows,YuriCrystal,n8n-marketing-flows,https://github.com/YuriCrystal/n8n-marketing-flows,"開源 n8n 行銷自動化模板庫 — 79 支可一鍵匯入的工作流(社群/輿情/新聞/廣告/SEO),含免費本機 Ollama 版 + 待接 key 架構範本。Free & open-source n8n marketing-automation workflow templates.",2026-06-26 15:35:48+00:00,2026-06-27 16:53:22+00:00,170,49,170,0,Unknown,88,MIT,27,6.296296296296297,0.288235294117647,0.0,CLI/Tooling
1309048757,finna/Finn-loop,finna,Finn-loop,https://github.com/finna/Finn-loop,"The Finn-loop: a 3-skill AI software factory for Claude Code — spec, build, review. Humans merge.",2026-07-22 16:48:50+00:00,2026-07-23 00:54:26+00:00,170,27,170,0,JavaScript,27,MIT,1,170.0,0.1588235294117647,0.0,AI/ML
1285957532,AmbroseX/larksnap,AmbroseX,larksnap,https://github.com/AmbroseX/larksnap,飞书 / Lark 文档导出浏览器扩展（MV3）—— 持登录态直导私有化部署与 「官方导出已关闭」的文档，把 Markdown 写回飞书文档；任意网页转 Markdown、整页截图、 AI 总结、解除复制、下载视频，并可桥接 Claude Code / CLI 落到本地目录,2026-07-01 09:56:12+00:00,2026-07-20 14:03:55+00:00,170,12,170,2,TypeScript,1552,Apache-2.0,22,7.727272727272727,0.0705882352941176,0.0117647058823529,AI/ML
1286305175,ripfineg1337/Soundpad-Activator,ripfineg1337,Soundpad-Activator,https://github.com/ripfineg1337/Soundpad-Activator,,2026-07-01 16:35:07+00:00,2026-07-01 16:36:04+00:00,170,0,170,0,Unknown,3,MIT,22,7.727272727272727,0.0,0.0,Other
1287103512,voevie/SuperScreenControl,voevie,SuperScreenControl,https://github.com/voevie/SuperScreenControl,a cross-platform screen casting & control software supporting group control and automated tasks.,2026-07-02 11:36:30+00:00,2026-07-07 03:19:32+00:00,170,111,170,0,Unknown,26,,21,8.095238095238095,0.6529411764705882,0.0,Other
1285115736,Tasihi89/canvas-hand,Tasihi89,canvas-hand,https://github.com/Tasihi89/canvas-hand,,2026-06-30 13:48:43+00:00,2026-07-01 12:29:01+00:00,169,16,169,0,JavaScript,64,,23,7.3478260869565215,0.0946745562130177,0.0,Other
1285748633,MatthewKuKanich/ChimeraBLE,MatthewKuKanich,ChimeraBLE,https://github.com/MatthewKuKanich/ChimeraBLE,"Advanced BLE security & reverse-engineering tool for ESP32: scan, GATT dump, HID decode, clone/emulate, foxhunt, and MITM - via serial CLI or Cardputer UI.",2026-07-01 05:36:08+00:00,2026-07-07 20:31:21+00:00,169,4,169,1,C++,241,GPL-3.0,22,7.681818181818182,0.0236686390532544,0.0059171597633136,Security
1308175488,0xwilliamortiz/andrej-karpathy-skills,0xwilliamortiz,andrej-karpathy-skills,https://github.com/0xwilliamortiz/andrej-karpathy-skills,"Behavioral guardrails for Claude Code, distilled from Andrej Karpathy's field notes on where LLMs go wrong when they write software.",2026-07-21 22:34:47+00:00,2026-07-21 22:47:20+00:00,169,25,169,0,Unknown,936,MIT,2,84.5,0.1479289940828402,0.0,AI/ML
1298073710,NextWeb4/folder-locker,NextWeb4,folder-locker,https://github.com/NextWeb4/folder-locker,Offline folder locker with AES-256-GCM encrypted containers and optional Windows ACL quick lock,2026-07-12 07:25:24+00:00,2026-07-22 14:14:48+00:00,169,0,169,0,Python,77,MIT,11,15.363636363636363,0.0,0.0,Security
1287604065,lingbol088-spec/ReiPenFlow,lingbol088-spec,ReiPenFlow,https://github.com/lingbol088-spec/ReiPenFlow,"Codex skill for local sandbox, CTF, authorized pentest and reverse-engineering workflows.",2026-07-02 21:00:42+00:00,2026-07-22 19:19:01+00:00,168,56,168,1,Python,55,MIT,21,8.0,0.3333333333333333,0.0059523809523809,AI/ML
1306272949,cactus-compute/cactus-hybrid,cactus-compute,cactus-hybrid,https://github.com/cactus-compute/cactus-hybrid,On-device models that know when they're wrong: every answer carries a confidence score for cloud handoff.,2026-07-20 06:04:59+00:00,2026-07-23 19:48:31+00:00,168,3,168,1,Shell,1413,MIT,3,56.0,0.0178571428571428,0.0059523809523809,CLI/Tooling
1294974964,theteatoast/local-vuln-research-pipeline,theteatoast,local-vuln-research-pipeline,https://github.com/theteatoast/local-vuln-research-pipeline,Fully local vulnerability research pipeline - 14B code-specialized LLM reviews every source file exhaustively.,2026-07-09 09:18:05+00:00,2026-07-11 20:10:59+00:00,167,20,167,0,Python,659,,14,11.928571428571429,0.1197604790419161,0.0,AI/ML
1292265060,NextWeb4/yaml-proxy-editor,NextWeb4,yaml-proxy-editor,https://github.com/NextWeb4/yaml-proxy-editor,"Tauri, React, and TypeScript desktop workbench for local Clash/OpenClash/Mihomo YAML editing, audit, and export.",2026-07-07 11:57:29+00:00,2026-07-22 14:16:31+00:00,167,1,167,0,TypeScript,23143,,16,10.4375,0.0059880239520958,0.0,Web
1289294202,Sylvara-Lin/LianYu-app,Sylvara-Lin,LianYu-app,https://github.com/Sylvara-Lin/LianYu-app,,2026-07-04 15:07:01+00:00,2026-07-04 17:43:17+00:00,167,59,167,2,Kotlin,171551,Apache-2.0,19,8.789473684210526,0.3532934131736527,0.0119760479041916,Mobile
1286118192,HackMan3D/HackMan3D-Orbit-Controller,HackMan3D,HackMan3D-Orbit-Controller,https://github.com/HackMan3D/HackMan3D-Orbit-Controller,"Official repository for the Hackman3D Orbit Controller. This repository contains the complete Bill of Materials (BOM), Arduino firmware, wiring diagrams, board definitions, and setup instructions required to build and configure your own open-source 6-DOF 3D navigation controller.",2026-07-01 13:12:33+00:00,2026-07-17 12:04:41+00:00,167,13,167,5,C++,11566,AGPL-3.0,22,7.590909090909091,0.0778443113772455,0.029940119760479,Other
1281536614,Jeronasand/deepseek-saas-starter-vue,Jeronasand,deepseek-saas-starter-vue,https://github.com/Jeronasand/deepseek-saas-starter-vue,中文 DeepSeek API 变现 Vue SaaS 模板,2026-06-26 16:51:49+00:00,2026-06-26 16:58:19+00:00,167,2,167,0,Vue,39,MIT,27,6.185185185185185,0.0119760479041916,0.0,Web
1281826778,maxprokopp/film-space,maxprokopp,film-space,https://github.com/maxprokopp/film-space,SwiftUI virtual film studio with AR camera and scene recording,2026-06-27 01:14:25+00:00,2026-07-14 12:55:33+00:00,167,22,167,0,Swift,98645,,26,6.423076923076923,0.1317365269461078,0.0,Mobile
1281285550,beany-vu/michi-vz-mono,beany-vu,michi-vz-mono,https://github.com/beany-vu/michi-vz-mono,"D3 charts for React, Angular, Vue, Svelte & Web Components — SVG/Canvas/WebGPU & built-in devtools",2026-06-26 11:59:22+00:00,2026-07-23 13:27:18+00:00,167,0,167,1,TypeScript,8136,MIT,27,6.185185185185185,0.0,0.0059880239520958,AI/ML
1306674258,ni5arga/protestchat,ni5arga,protestchat,https://github.com/ni5arga/protestchat,"Encrypted messaging with no internet, no cell tower, and no server. Phones relay for each other over Bluetooth mesh, so it keeps working during internet shutdowns and inside cellular jammers",2026-07-20 14:07:55+00:00,2026-07-22 12:36:46+00:00,167,24,167,45,TypeScript,3388,MIT,3,55.66666666666666,0.1437125748502994,0.2694610778443114,Other
1281081043,Cuimao777/eterna-image2image-skill,Cuimao777,eterna-image2image-skill,https://github.com/Cuimao777/eterna-image2image-skill,Experimental bilingual Codex skill for ETERNA-inspired image2image cinematic color and composition.,2026-06-26 07:54:27+00:00,2026-06-26 07:55:33+00:00,166,24,166,0,Unknown,15046,MIT,27,6.148148148148148,0.144578313253012,0.0,AI/ML
1305058794,worldwonderer/novel-to-game,worldwonderer,novel-to-game,https://github.com/worldwonderer/novel-to-game,"将任何小说蒸馏为可玩的游戏 · Turn any novel into a playable game — a 7-skill adaptation pipeline for Claude Code, Codex & Kimi Code(k3)",2026-07-18 16:29:56+00:00,2026-07-22 16:57:10+00:00,166,25,166,0,Python,39079,MIT,5,33.2,0.1506024096385542,0.0,AI/ML
1283305589,thenicolas1894/awesome-claude-fable-5-prompt-vault,thenicolas1894,awesome-claude-fable-5-prompt-vault,https://github.com/thenicolas1894/awesome-claude-fable-5-prompt-vault,"Ultimate Claude Fable 5 Guide 2026: Use Cases, Integrations & Benchmarks",2026-06-28 19:26:01+00:00,2026-07-24 07:23:46+00:00,166,2,166,0,HTML,510,,25,6.64,0.0120481927710843,0.0,AI/ML
1280526772,KBRmau/linkedin-profile-optimizer,KBRmau,linkedin-profile-optimizer,https://github.com/KBRmau/linkedin-profile-optimizer,optimize your linkedin,2026-06-25 17:11:53+00:00,2026-06-26 00:34:07+00:00,166,19,166,0,Python,170,,28,5.928571428571429,0.1144578313253012,0.0,Other
1284063381,frankchiu-dev/claude-codex-usage-dashboard,frankchiu-dev,claude-codex-usage-dashboard,https://github.com/frankchiu-dev/claude-codex-usage-dashboard,A local Windows dashboard for Claude Code and Codex usage limits.,2026-06-29 13:43:25+00:00,2026-06-30 10:30:45+00:00,166,32,166,2,JavaScript,31,MIT,24,6.916666666666667,0.1927710843373494,0.0120481927710843,AI/ML
1292302215,NextWeb4/deepseek-translation-studio,NextWeb4,deepseek-translation-studio,https://github.com/NextWeb4/deepseek-translation-studio,"Windows Python/PySide6 translation studio for DeepSeek Web/API workflows, SRT continuation, capture, and packaging.",2026-07-07 12:31:06+00:00,2026-07-22 14:14:37+00:00,166,5,166,0,Python,288,,16,10.375,0.0301204819277108,0.0,Web
1294722834,KORAYTEACHER/fintech-advisor,KORAYTEACHER,fintech-advisor,https://github.com/KORAYTEACHER/fintech-advisor,ai fintech financial advisor for your portfolio,2026-07-09 06:23:12+00:00,2026-07-09 06:37:48+00:00,166,1235,166,1,TypeScript,12365,MIT,14,11.857142857142858,7.439759036144578,0.0060240963855421,AI/ML
1282241227,simonmakzon/GitDeepSearch,simonmakzon,GitDeepSearch,https://github.com/simonmakzon/GitDeepSearch,GitDeepSearch - Deep search repository,2026-06-27 14:07:25+00:00,2026-06-27 14:38:39+00:00,166,7,166,1,JavaScript,36,MIT,26,6.384615384615385,0.0421686746987951,0.0060240963855421,Other
1290150257,generalizingai/OpenStudio,generalizingai,OpenStudio,https://github.com/generalizingai/OpenStudio,"OpenStudio - an open-source AI image, video, cinema, reels and lip sync studio powered by MuAPI",2026-07-05 16:28:44+00:00,2026-07-07 11:50:06+00:00,166,30,166,0,JavaScript,16615,MIT,18,9.22222222222222,0.180722891566265,0.0,AI/ML
1304159264,drumih/turbo-fieldfare,drumih,turbo-fieldfare,https://github.com/drumih/turbo-fieldfare,Gemma 4 26B-A4B inference in ~2 GB of RAM on any M-series MacBook,2026-07-17 15:57:54+00:00,2026-07-22 15:47:50+00:00,165,6,165,4,Swift,2138,Apache-2.0,6,27.5,0.0363636363636363,0.0242424242424242,AI/ML
1283868033,thinkany-ai/termany,thinkany-ai,termany,https://github.com/thinkany-ai/termany,Agent-Native Terminal,2026-06-29 10:04:40+00:00,2026-07-24 05:13:17+00:00,165,12,165,0,TypeScript,9205,NOASSERTION,24,6.875,0.0727272727272727,0.0,AI/ML
1288873753,1370998960-del/https-github.com-Emily2040-seedance-2.0,1370998960-del,https-github.com-Emily2040-seedance-2.0,https://github.com/1370998960-del/https-github.com-Emily2040-seedance-2.0,,2026-07-04 04:20:45+00:00,2026-07-04 04:21:45+00:00,165,36,165,0,Python,23250,MIT,19,8.68421052631579,0.2181818181818181,0.0,Other
1294157055,d-liya/capybara_2d_engine,d-liya,capybara_2d_engine,https://github.com/d-liya/capybara_2d_engine,,2026-07-08 19:58:00+00:00,2026-07-22 20:41:49+00:00,165,27,165,1,TypeScript,580,MIT,15,11.0,0.1636363636363636,0.006060606060606,Other
1283393369,MiaAI-Lab/DeepSeek-v4-Flash-DSpark-2x-DGX-Spark,MiaAI-Lab,DeepSeek-v4-Flash-DSpark-2x-DGX-Spark,https://github.com/MiaAI-Lab/DeepSeek-v4-Flash-DSpark-2x-DGX-Spark,,2026-06-28 22:04:44+00:00,2026-07-23 11:18:36+00:00,165,21,165,0,Python,431,MIT,25,6.6,0.1272727272727272,0.0,Other
1310162837,RongleCat/grok-app,RongleCat,grok-app,https://github.com/RongleCat/grok-app,"Desktop workbench for Grok Build CLI — sessions, projects, media, automations (Tauri 2 · unofficial)",2026-07-23 16:43:40+00:00,2026-07-24 08:28:10+00:00,164,15,164,0,TypeScript,4466,MIT,1,164.0,0.0914634146341463,0.0,CLI/Tooling
1297189467,NextWeb4/phone-record-manager,NextWeb4,phone-record-manager,https://github.com/NextWeb4/phone-record-manager,"Local Windows phone-number binding record manager built with Python, PySide6, SQLite, backups, and release packaging.",2026-07-11 06:27:56+00:00,2026-07-22 14:15:31+00:00,164,1,164,0,Python,316,MIT,12,13.666666666666666,0.0060975609756097,0.0,Other
1294821660,SilentFleetKK/ai-market-pulse,SilentFleetKK,ai-market-pulse,https://github.com/SilentFleetKK/ai-market-pulse,Turn any watchlist into a daily AI market research report — a quant research cockpit or a zero-code daily report tool.,2026-07-09 07:34:37+00:00,2026-07-11 00:47:58+00:00,163,33,163,0,Python,693,MIT,14,11.642857142857142,0.2024539877300613,0.0,AI/ML
1281412970,goobolabs/git-github-bootcamp,goobolabs,git-github-bootcamp,https://github.com/goobolabs/git-github-bootcamp,Git & GitHub Bootcamp. (Jul - 2026),2026-06-26 14:29:40+00:00,2026-07-24 06:57:19+00:00,162,55,162,4,Unknown,94,NOASSERTION,27,6.0,0.3395061728395062,0.0246913580246913,Other
1291795193,NextWeb4/alias-cockpit,NextWeb4,alias-cockpit,https://github.com/NextWeb4/alias-cockpit,"Windows local email-alias cockpit built with .NET and WinUI for alias generation, markers, local storage, and release packaging.",2026-07-07 05:18:59+00:00,2026-07-22 14:14:15+00:00,162,3,162,0,C#,413,,16,10.125,0.0185185185185185,0.0,Other
1300123581,HSJ-BanFan/grok-register-web,HSJ-BanFan,grok-register-web,https://github.com/HSJ-BanFan/grok-register-web,Grok 自动注册 Web 平台：Outlook 别名批量注册、SSO 采集，注册成功后自动导入 grok2api（Web / Build）,2026-07-14 06:53:54+00:00,2026-07-23 23:56:42+00:00,162,45,162,0,Python,946,MIT,9,18.0,0.2777777777777778,0.0,Web
1278823120,HKUST-C4G/DomainShuttle,HKUST-C4G,DomainShuttle,https://github.com/HKUST-C4G/DomainShuttle,DomainShuttle: Freeform Open Domain Subject-driven Text-to-video Generation,2026-06-24 06:06:08+00:00,2026-06-26 04:59:57+00:00,162,16,162,1,Python,47450,Apache-2.0,29,5.586206896551724,0.0987654320987654,0.0061728395061728,Other
1287752664,7-e1even/learn-agent,7-e1even,learn-agent,https://github.com/7-e1even/learn-agent,学习Agent开发的笔记，尝试让Agent从可用到可靠,2026-07-03 01:24:04+00:00,2026-07-17 15:44:07+00:00,162,10,162,0,JavaScript,426,MIT,20,8.1,0.0617283950617283,0.0,AI/ML
1299823731,ShouqiaoW/erdos,ShouqiaoW,erdos,https://github.com/ShouqiaoW/erdos,,2026-07-13 23:38:09+00:00,2026-07-24 07:43:06+00:00,162,18,162,4,Lean,7418,,10,16.2,0.1111111111111111,0.0246913580246913,Other
1307252454,hahhforest/pi-textbook,hahhforest,pi-textbook,https://github.com/hahhforest/pi-textbook,《动手学 Pi》：沿 15 个真实 checkpoint 从零构建 Pi-style Agent,2026-07-21 04:17:35+00:00,2026-07-23 03:35:41+00:00,162,11,162,0,TypeScript,5661,MIT,2,81.0,0.0679012345679012,0.0,AI/ML
1306432703,Brandon030722/ark-ui-skill,Brandon030722,ark-ui-skill,https://github.com/Brandon030722/ark-ui-skill,Evidence-based Codex skill for five Ark-adjacent UI families and four application depths,2026-07-20 09:21:07+00:00,2026-07-20 11:23:39+00:00,162,6,162,0,CSS,4052,,3,54.0,0.037037037037037,0.0,AI/ML
1298028535,NextWeb4/photo-metadata-editor,NextWeb4,photo-metadata-editor,https://github.com/NextWeb4/photo-metadata-editor,Windows desktop EXIF/XMP/IPTC photo metadata editor powered by ExifTool.,2026-07-12 06:07:24+00:00,2026-07-22 14:15:38+00:00,162,0,162,0,Python,10712,MIT,11,14.727272727272728,0.0,0.0,Other
1284040136,Sophomoresty/gemini-search-mcp,Sophomoresty,gemini-search-mcp,https://github.com/Sophomoresty/gemini-search-mcp,"Free MCP server for web search powered by Google AI Mode (Gemini). Unlimited, no API key.",2026-06-29 13:17:52+00:00,2026-06-30 08:59:54+00:00,161,26,161,0,Python,3742,,24,6.708333333333333,0.1614906832298136,0.0,AI/ML
1288436208,xsser/codex-jailbreak-guide,xsser,codex-jailbreak-guide,https://github.com/xsser/codex-jailbreak-guide,Codex CLI jailbreak guide — customizing system prompt via model_instructions_file config,2026-07-03 15:45:09+00:00,2026-07-03 23:52:44+00:00,161,28,161,0,Python,12,,20,8.05,0.1739130434782608,0.0,AI/ML
1295768859,adamholter/hive-mind-landing-page,adamholter,hive-mind-landing-page,https://github.com/adamholter/hive-mind-landing-page,"CHORUS Hive Mind landing page — source, prompts, frontend skills, generated design reference, and sanitized Codex build trace",2026-07-09 20:51:58+00:00,2026-07-09 20:52:07+00:00,161,2,161,0,CSS,7689,MIT,14,11.5,0.0124223602484472,0.0,AI/ML
1293608593,BitMiracle-AI/Dormice,BitMiracle-AI,Dormice,https://github.com/BitMiracle-AI/Dormice,"The SQLite of agent sandboxes — self-hosted, E2B-compatible. One machine, sandboxes that live forever, idle costs nothing.",2026-07-08 13:02:44+00:00,2026-07-23 02:35:31+00:00,161,19,161,0,TypeScript,1834,Apache-2.0,15,10.733333333333333,0.1180124223602484,0.0,AI/ML
1289038438,iAm-182/bluk-cf,iAm-182,bluk-cf,https://github.com/iAm-182/bluk-cf,Cloudflare Workers AI Account ID & Token Auto-Grabber — automated signup with Turnstile bypass,2026-07-04 09:07:38+00:00,2026-07-06 11:06:49+00:00,161,33,161,1,Python,66,NOASSERTION,19,8.473684210526315,0.2049689440993788,0.0062111801242236,AI/ML
1298760593,Chaelsoo/Zetsu,Chaelsoo,Zetsu,https://github.com/Chaelsoo/Zetsu,A personal RAG system for offensive security knowledge,2026-07-13 01:44:01+00:00,2026-07-13 19:55:20+00:00,160,8,160,0,Python,627,,10,16.0,0.05,0.0,AI/ML
1298007247,NextWeb4/offline-utility-suite,NextWeb4,offline-utility-suite,https://github.com/NextWeb4/offline-utility-suite,Offline folder protection and SRT subtitle utilities,2026-07-12 05:28:41+00:00,2026-07-22 14:15:25+00:00,160,2,160,0,Python,119,MIT,11,14.545454545454543,0.0125,0.0,Security
1296913096,xai-org/grok-build-plugin-cc,xai-org,grok-build-plugin-cc,https://github.com/xai-org/grok-build-plugin-cc,"Claude Code plugin that delegates reviews, rescue tasks, and session transfer to the Grok Build CLI",2026-07-10 21:24:10+00:00,2026-07-10 21:24:51+00:00,160,30,160,6,JavaScript,68,Apache-2.0,13,12.307692307692308,0.1875,0.0375,AI/ML
1297100852,lilxyzw/NonToon,lilxyzw,NonToon,https://github.com/lilxyzw/NonToon,A shader combining PBR and NPR,2026-07-11 03:46:27+00:00,2026-07-14 05:59:03+00:00,160,2,160,3,HLSL,102,Zlib,12,13.333333333333334,0.0125,0.01875,Game
1290976115,Foxemsx/riptide,Foxemsx,riptide,https://github.com/Foxemsx/riptide,"A polished terminal internet speed test and realtime bandwidth monitor written in Go. Riptide measures download, upload, and latency in a centered card UI with live progress, compact sparklines, smooth animation, and clean cross-platform output for Linux and Windows terminals.",2026-07-06 11:47:48+00:00,2026-07-13 13:09:20+00:00,160,6,160,1,Go,20596,MIT,17,9.411764705882351,0.0375,0.00625,CLI/Tooling
1306830776,dinosn/fastjson-jsontype-rce-lab,dinosn,fastjson-jsontype-rce-lab,https://github.com/dinosn/fastjson-jsontype-rce-lab,Docker lab + one-payload exploit + defensive scanner for the fastjson 1.2.66-1.2.83 @JSONType remote-class-load RCE (SSRF->defineClass under Spring Boot LaunchedURLClassLoader; autoType OFF; parseObject binding is not a mitigation),2026-07-20 17:00:03+00:00,2026-07-22 06:22:03+00:00,160,81,160,0,Python,139,MIT,3,53.333333333333336,0.50625,0.0,Security
1309088889,NextWeb4/official-document-ai-assistant,NextWeb4,official-document-ai-assistant,https://github.com/NextWeb4/official-document-ai-assistant,"Local official-document review, formatting repair, and compliant export desktop assistant.",2026-07-22 17:34:09+00:00,2026-07-24 06:30:24+00:00,159,0,159,0,Python,819,NOASSERTION,1,159.0,0.0,0.0,Other
1298031533,NextWeb4/tips-prompt-manager,NextWeb4,tips-prompt-manager,https://github.com/NextWeb4/tips-prompt-manager,Offline prompt engineering manager for Windows,2026-07-12 06:13:12+00:00,2026-07-22 14:15:55+00:00,159,1,159,0,Python,77,MIT,11,14.454545454545457,0.0062893081761006,0.0,Other
1283323401,nefijpalide-droid/Forex-Alpha-Scalper-MT5-MT4,nefijpalide-droid,Forex-Alpha-Scalper-MT5-MT4,https://github.com/nefijpalide-droid/Forex-Alpha-Scalper-MT5-MT4,Forex Scalping EA 2026: High-Frequency M1-M5 Signal Trading for MT5 & MT4,2026-06-28 19:54:00+00:00,2026-07-24 06:29:44+00:00,159,4,159,2,HTML,495,,25,6.36,0.0251572327044025,0.0125786163522012,Finance/Trading
1293329788,amitshekhariitbhu/transformers-explained,amitshekhariitbhu,transformers-explained,https://github.com/amitshekhariitbhu/transformers-explained,"Transformer architecture explained step by step - the full architecture, every attention variant, positional embeddings, and every layer inside a Transformer.",2026-07-08 08:48:47+00:00,2026-07-08 08:52:47+00:00,159,11,159,0,Unknown,86,Apache-2.0,15,10.6,0.0691823899371069,0.0,AI/ML
1279525967,benlamiro/ShipGenAI,benlamiro,ShipGenAI,https://github.com/benlamiro/ShipGenAI,"🚀 50 production-ready Generative AI SaaS apps — brand them, ship them, keep 100% of the revenue. Stripe billing · Google OAuth · Vercel deploy · MIT licensed",2026-06-24 19:15:25+00:00,2026-06-24 19:33:10+00:00,158,7,158,0,JavaScript,11837,MIT,29,5.448275862068965,0.0443037974683544,0.0,AI/ML
1292260588,CSCB/vibe-mouse,CSCB,vibe-mouse,https://github.com/CSCB/vibe-mouse,"Core open-source Vibecoding interactive mouse project, belonging to a self-developed open-source system including the nation's first open-source robot actuator and stepless mobile intelligent monitoring solution.",2026-07-07 11:53:39+00:00,2026-07-24 03:22:47+00:00,158,0,158,0,Python,245,AGPL-3.0,16,9.875,0.0,0.0,DevOps
