id,full_name,owner,name,html_url,description,created_at,pushed_at,stars,forks,watchers,open_issues,primary_language,size,license,age_days,stars_per_day,fork_star_ratio,issue_star_ratio,category
1282265183,larashero3-dotcom/writing-dna-skill,larashero3-dotcom,writing-dna-skill,https://github.com/larashero3-dotcom/writing-dna-skill,写作蒸馏器.skill｜蒸馏复刻任意写作风格的 agent skill,2026-06-27 14:43:12+00:00,2026-06-29 10:56:33+00:00,260,34,260,1,Unknown,32,MIT,26,10.0,0.1307692307692307,0.0038461538461538,AI/ML
1279325204,ZeKaiNie/universal-examprep-skill,ZeKaiNie,universal-examprep-skill,https://github.com/ZeKaiNie/universal-examprep-skill,"Last-night exam-cram coach as a Claude Agent Skill: turns your slides, notes and past papers into a chaptered knowledge base + quiz bank, teaches only what's in your materials, and never fabricates (measured 100% out-of-scope abstention). Bilingual EN/中文 — the 期末极速备考 skill.",2026-06-24 15:25:04+00:00,2026-07-19 03:50:41+00:00,258,14,258,0,Python,7869,MIT,29,8.89655172413793,0.0542635658914728,0.0,AI/ML
1281620190,husklet/husklet,husklet,husklet,https://github.com/husklet/husklet,,2026-06-26 18:37:27+00:00,2026-07-08 14:28:28+00:00,257,5,257,0,C,12211,MIT,27,9.51851851851852,0.0194552529182879,0.0,Other
1285987351,Moh4696/freecut,Moh4696,freecut,https://github.com/Moh4696/freecut,"Fork of browser-use/video-use with the paid ElevenLabs dependency replaced by free, pluggable transcription (local Whisper by default; VibeVoice-ASR for diarization).",2026-07-01 10:33:36+00:00,2026-07-01 10:34:34+00:00,257,49,257,0,Python,569,MIT,22,11.681818181818182,0.1906614785992217,0.0,Other
1302709153,PromptPartner/agentsmith,PromptPartner,agentsmith,https://github.com/PromptPartner/agentsmith,"Universal, model-agnostic operating harness for AI agents (Claude, Codex, Gemini, …) — a lean core + work-type profiles assembled by one setup script.",2026-07-16 11:37:15+00:00,2026-07-23 15:03:23+00:00,255,11,255,0,Shell,1254,MIT,7,36.42857142857143,0.0431372549019607,0.0,AI/ML
1301213233,LanceZPF/awesome-papers-awesome,LanceZPF,awesome-papers-awesome,https://github.com/LanceZPF/awesome-papers-awesome,The unified gateway to high-quality Awesome XXX Paper repositories.,2026-07-15 04:56:42+00:00,2026-07-16 16:10:16+00:00,254,1,254,0,Python,145,,8,31.75,0.0039370078740157,0.0,Other
1302365520,robinhood-ape/robinhood-sniper-bot,robinhood-ape,robinhood-sniper-bot,https://github.com/robinhood-ape/robinhood-sniper-bot,"NOXA Fun token sniper on Robinhood Chain - watches TokenLaunched, buys via Uniswap V3 SwapRouter02, auto-sells on take-profit / stop-loss",2026-07-16 05:41:44+00:00,2026-07-21 16:54:36+00:00,253,258,253,0,TypeScript,64,,7,36.142857142857146,1.0197628458498025,0.0,Finance/Trading
1289887145,lucid-softworks/lumen,lucid-softworks,lumen,https://github.com/lucid-softworks/lumen,"A from-scratch JavaScript engine in Rust — std only, zero deps, three tiers incl. an ARM64 JIT, 100% test262 (53,400/53,400)",2026-07-05 10:24:00+00:00,2026-07-14 14:23:21+00:00,253,4,253,3,Rust,9250,MIT,18,14.055555555555555,0.0158102766798418,0.0118577075098814,Game
1281002336,Vanszs/qwencloud-generator,Vanszs,qwencloud-generator,https://github.com/Vanszs/qwencloud-generator," Automated QwenCloud account registration & API key harvester with multi-threading, TUI dashboard, proxy rotation, and Gmail OAuth",2026-06-26 06:17:28+00:00,2026-06-27 13:18:41+00:00,252,74,252,0,Python,513,,27,9.333333333333334,0.2936507936507936,0.0,Security
1279062216,ckissi/kinetics,ckissi,kinetics,https://github.com/ckissi/kinetics,A library of interface animations built on spring physics instead of fixed-duration easing.,2026-06-24 10:37:25+00:00,2026-07-14 13:26:24+00:00,252,26,252,1,HTML,294,,29,8.689655172413794,0.1031746031746031,0.0039682539682539,Web
1301715242,XiaomiRobotics/Xiaomi-Robotics-1,XiaomiRobotics,Xiaomi-Robotics-1,https://github.com/XiaomiRobotics/Xiaomi-Robotics-1,Code for Xiaomi-Robotics-1,2026-07-15 14:37:37+00:00,2026-07-16 05:32:46+00:00,251,3,251,3,Unknown,16084,,8,31.375,0.0119521912350597,0.0119521912350597,Other
1291490166,OmarH-creator/Autonomous-Forge,OmarH-creator,Autonomous-Forge,https://github.com/OmarH-creator/Autonomous-Forge,"This repo is automated and is fully AI-built and AI-maintained project that continuously plans, codes, tests, and improves itself.",2026-07-06 21:12:03+00:00,2026-07-12 18:31:45+00:00,251,10,251,4,Python,1641,Apache-2.0,17,14.764705882352942,0.0398406374501992,0.0159362549800796,AI/ML
1281368037,zhaozhaozhiyi/XIAOCHUANGx,zhaozhaozhiyi,XIAOCHUANGx,https://github.com/zhaozhaozhiyi/XIAOCHUANGx,链接一切智能体的工作台,2026-06-26 13:39:28+00:00,2026-07-22 17:05:55+00:00,251,11,251,2,TypeScript,36954,MIT,27,9.296296296296296,0.0438247011952191,0.0079681274900398,Other
1302365391,robinhood-ape/robinhood-noxa-bundler,robinhood-ape,robinhood-noxa-bundler,https://github.com/robinhood-ape/robinhood-noxa-bundler,NOXA Fun multi-wallet launch bundler for Robinhood Chain - launch via NOXA factory then buy from many wallets on Uniswap V3 before public snipers,2026-07-16 05:41:33+00:00,2026-07-21 16:54:49+00:00,250,185,250,0,TypeScript,58,,7,35.714285714285715,0.74,0.0,Finance/Trading
1280809609,xiaohuailabs/xiaohu-ip-studio,xiaohuailabs,xiaohu-ip-studio,https://github.com/xiaohuailabs/xiaohu-ip-studio,开源中文配图技能 + IP 角色库:用「挑认知锚点→现编隐喻→反PPT自检」为中文深度文生成固定角色出演的正文配图,2026-06-26 00:49:42+00:00,2026-06-26 01:11:44+00:00,250,46,250,1,HTML,179584,MIT,27,9.25925925925926,0.184,0.004,AI/ML
1300819170,perplexityai/wandr,perplexityai,wandr,https://github.com/perplexityai/wandr,,2026-07-14 18:15:38+00:00,2026-07-16 20:33:24+00:00,249,30,249,0,Python,10570,Apache-2.0,9,27.666666666666668,0.1204819277108433,0.0,Other
1283937710,kocasariumut/FaceAnything,kocasariumut,FaceAnything,https://github.com/kocasariumut/FaceAnything,,2026-06-29 11:24:35+00:00,2026-06-29 11:42:41+00:00,248,30,248,2,Python,56231,NOASSERTION,24,10.333333333333334,0.1209677419354838,0.0080645161290322,Other
1292813857,sunflower-of-parchman/codex-hygiene,sunflower-of-parchman,codex-hygiene,https://github.com/sunflower-of-parchman/codex-hygiene,Codex skill for auditing and tuning Codex Desktop context/tool surfaces,2026-07-07 21:51:14+00:00,2026-07-19 20:04:35+00:00,247,7,247,0,Python,305,MIT,16,15.4375,0.0283400809716599,0.0,AI/ML
1304957651,RinDig/icm-architect,RinDig,icm-architect,https://github.com/RinDig/icm-architect,"Claude skill: design any process, idea, or problem into an ICM workspace (folder structure as agent architecture), or restructure an existing folder into one",2026-07-18 14:11:04+00:00,2026-07-19 20:07:23+00:00,247,50,247,3,Unknown,30,MIT,5,49.4,0.2024291497975708,0.0121457489878542,AI/ML
1291947423,adriflex/autoremesher-blender-bridge,adriflex,autoremesher-blender-bridge,https://github.com/adriflex/autoremesher-blender-bridge,Blender bridge for AutoRemesher,2026-07-07 07:36:26+00:00,2026-07-10 09:57:23+00:00,247,20,247,1,Python,98,NOASSERTION,16,15.4375,0.0809716599190283,0.0040485829959514,Other
1280439591,kentjuno/ainovel-cli,kentjuno,ainovel-cli,https://github.com/kentjuno/ainovel-cli,CLI sáng tác tiểu thuyết AI đa agent — Bản tiếng Việt của voocel/ainovel-cli,2026-06-25 15:28:12+00:00,2026-06-25 15:28:26+00:00,246,127,246,2,Go,6751,Apache-2.0,28,8.785714285714286,0.516260162601626,0.008130081300813,AI/ML
1301372808,CyberSunil/LLMVault,CyberSunil,LLMVault,https://github.com/CyberSunil/LLMVault,"An intentionally vulnerable OWASP LLM Top 10 training platform for AI Security, Prompt Injection, RAG Security, Agent Security, and GenAI penetration testing.",2026-07-15 08:18:22+00:00,2026-07-18 18:23:05+00:00,245,58,245,2,Python,20182,MIT,8,30.625,0.236734693877551,0.0081632653061224,AI/ML
1285859071,leon7482/chatgpt-plus-codex,leon7482,chatgpt-plus-codex,https://github.com/leon7482/chatgpt-plus-codex,2026最新ChatGPT Plus/Pro 代充教程：如何充值 ChatGPT Plus 会员？怎样购买 ChatGPT Plus 成品账号？如何充值 Codex 会员？（附国内使用ChatGPT Codex指南）,2026-07-01 07:58:59+00:00,2026-07-17 08:13:39+00:00,244,14,244,0,Unknown,79,MIT,22,11.090909090909092,0.0573770491803278,0.0,AI/ML
1289726309,TheColliny/FableClaudeMDForOpus,TheColliny,FableClaudeMDForOpus,https://github.com/TheColliny/FableClaudeMDForOpus,A Fable written Claude MD for Opus/Sonnet to give it some of the quality methodology that Fable uses,2026-07-05 05:55:58+00:00,2026-07-05 05:57:34+00:00,244,44,244,0,Unknown,207,,18,13.555555555555555,0.180327868852459,0.0,AI/ML
1297656513,BryanLunduke/LCOS,BryanLunduke,LCOS,https://github.com/BryanLunduke/LCOS,The Lunduke Computer Operating System,2026-07-11 17:39:07+00:00,2026-07-14 18:34:29+00:00,243,17,243,33,Unknown,2213,GPL-3.0,12,20.25,0.0699588477366255,0.1358024691358024,Other
1279426975,kansoku-trade/kansoku,kansoku-trade,kansoku,https://github.com/kansoku-trade/kansoku,"AI Stock Partner on Your Mac – Local Market Information, Multi-timeframe K-line, AI Intraday Comments and Follow-up Analysis",2026-06-24 17:17:30+00:00,2026-07-24 07:13:49+00:00,243,23,243,5,TypeScript,13378,NOASSERTION,29,8.379310344827585,0.0946502057613168,0.0205761316872428,AI/ML
1289724268,Neeeophytee/finding-unknowns-skills,Neeeophytee,finding-unknowns-skills,https://github.com/Neeeophytee/finding-unknowns-skills,"8 installable skills for Claude Code and OpenAI Codex, for finding your unknowns before they get expensive: blindspot pass, brainstorms, interviews, references, plans, notes, pitches, and a merge quiz. Community distillation, not official Anthropic.",2026-07-05 05:51:40+00:00,2026-07-19 14:52:59+00:00,242,19,242,0,Unknown,65,NOASSERTION,18,13.444444444444445,0.0785123966942148,0.0,AI/ML
1285612276,ArmyPhoenixLog/claude-fable-5-claude-opus-4-8,ArmyPhoenixLog,claude-fable-5-claude-opus-4-8,https://github.com/ArmyPhoenixLog/claude-fable-5-claude-opus-4-8,"A polished AI writing workflow landing repository for long-form fiction planning, chapter structure, and prompt organization. Domain: https://claude.mirrorify.fun/",2026-07-01 01:36:00+00:00,2026-07-13 17:13:45+00:00,242,0,242,0,HTML,3,MIT,22,11.0,0.0,0.0,AI/ML
1293290940,s0ld13rr/pentestcode,s0ld13rr,pentestcode,https://github.com/s0ld13rr/pentestcode,"PentestCode - Multi-agent AI penetration testing system with persistent engagement state, strategic coordination, and parallel autonomous operations.",2026-07-08 08:22:01+00:00,2026-07-24 06:54:10+00:00,242,49,242,1,TypeScript,11593,MIT,15,16.133333333333333,0.2024793388429752,0.0041322314049586,AI/ML
1279760665,suboss87/FDEOps,suboss87,FDEOps,https://github.com/suboss87/FDEOps,"Second brain for Forward Deployed Engineers. Engagement memory + 35 skills across 6 domains, all behind one @fde... Works with any AI coding agent.",2026-06-25 01:54:13+00:00,2026-07-23 05:38:08+00:00,241,27,241,3,JavaScript,1985,MIT,28,8.607142857142858,0.1120331950207468,0.0124481327800829,AI/ML
1281819568,eli-labz/Godcoder,eli-labz,Godcoder,https://github.com/eli-labz/Godcoder,"A local-first, open-source coding agent for your desktop. Bring your own LLM key; your code stays on your machine and only ever leaves to the model provider. The AI Agent builds its own Harnes.",2026-06-27 00:56:36+00:00,2026-07-04 20:02:41+00:00,239,8,239,0,Rust,16097,NOASSERTION,26,9.192307692307692,0.0334728033472803,0.0,AI/ML
1305178119,OpenBMB/MiniCPM-Robot,OpenBMB,MiniCPM-Robot,https://github.com/OpenBMB/MiniCPM-Robot,A Smarter and Faster On-Device AI Brain for Robots,2026-07-18 19:35:23+00:00,2026-07-20 07:39:32+00:00,238,15,238,3,Python,157627,Apache-2.0,5,47.6,0.0630252100840336,0.0126050420168067,AI/ML
1290565606,inclusionAI/Avernet,inclusionAI,Avernet,https://github.com/inclusionAI/Avernet,"Distributed agent coordination platform where agents live, connect, coordinate, execute, and evolve together.",2026-07-06 03:52:54+00:00,2026-07-24 08:34:06+00:00,238,16,238,37,Python,44720,Apache-2.0,17,14.0,0.0672268907563025,0.1554621848739495,AI/ML
1285614028,weldstewardhub/Meccha-Enhancer-Pro,weldstewardhub,Meccha-Enhancer-Pro,https://github.com/weldstewardhub/Meccha-Enhancer-Pro,Meccha-Enhancer-Pro,2026-07-01 01:39:15+00:00,2026-07-10 12:11:13+00:00,237,0,237,1,Unknown,4,,22,10.772727272727272,0.0,0.0042194092827004,Other
1302093382,gakonst/nanocodex,gakonst,nanocodex,https://github.com/gakonst/nanocodex,"Blazing-fast, minimal, library-first reimplementation of Codex",2026-07-15 22:46:14+00:00,2026-07-24 07:48:01+00:00,237,17,237,0,Rust,31934,Apache-2.0,8,29.625,0.0717299578059071,0.0,AI/ML
1288067014,3441293738/creatorhub,3441293738,creatorhub,https://github.com/3441293738/creatorhub,"多平台内容监控·采集·搬运 —— 纯 Python(FastAPI + Playwright),一个 Web 面板管起抖音 / 小红书 / 快手",2026-07-03 08:43:10+00:00,2026-07-21 06:40:47+00:00,237,54,237,5,Python,1752,,20,11.85,0.2278481012658227,0.0210970464135021,Web
1301827233,ZethRise/Aethery,ZethRise,Aethery,https://github.com/ZethRise/Aethery,One-click mobile GUI for the Aether censorship-circumvention tunnel — Kotlin & Rust,2026-07-15 16:30:13+00:00,2026-07-24 03:56:07+00:00,236,10,236,3,Kotlin,2954,AGPL-3.0,8,29.5,0.0423728813559322,0.0127118644067796,Mobile
1303020015,h9-tec/Awesome_ai_learning,h9-tec,Awesome_ai_learning,https://github.com/h9-tec/Awesome_ai_learning,,2026-07-16 16:43:25+00:00,2026-07-16 16:47:08+00:00,236,33,236,1,Unknown,8,,7,33.714285714285715,0.1398305084745762,0.0042372881355932,Other
1287442244,Oft3r/agentic-trading-desk,Oft3r,agentic-trading-desk,https://github.com/Oft3r/agentic-trading-desk,"AI-assisted trading desk for short-term technical analysis on stocks & ETFs via Robinhood MCP. Deterministic Python engines score each asset on a three-pillar framework (Trend · Momentum · Macro-Sentiment) using EMA, RSI, MACD, TRIX & Bollinger Bands. The AI fetches data; the scripts compute; the human approves every order.",2026-07-02 17:33:30+00:00,2026-07-02 18:03:28+00:00,234,56,234,0,Python,27,MIT,21,11.142857142857142,0.2393162393162393,0.0,AI/ML
1289612923,SirAllap/agentglass,SirAllap,agentglass,https://github.com/SirAllap/agentglass,"🛰 A loupe for your agents — a real-time Mission-Control dashboard and workspace for AI coding agents, across every provider and every project on your machine",2026-07-05 01:26:40+00:00,2026-07-23 23:08:20+00:00,234,26,234,45,TypeScript,26254,MIT,18,13.0,0.1111111111111111,0.1923076923076923,AI/ML
1280847472,MLNLP-World/Paper-Rebuttal-Tips,MLNLP-World,Paper-Rebuttal-Tips,https://github.com/MLNLP-World/Paper-Rebuttal-Tips,MLNLP社区用来帮助大家论文Rebuttal的整理仓库。,2026-06-26 01:59:35+00:00,2026-07-15 11:54:45+00:00,234,23,234,1,Unknown,5717,,27,8.666666666666666,0.0982905982905982,0.0042735042735042,Other
1288338937,loyal-studio/Honami-Animation-System,loyal-studio,Honami-Animation-System,https://github.com/loyal-studio/Honami-Animation-System,"Honami Animation System is a complete, from-scratch alternative to Unity's built-in Animator. Designed for Unity 6, it gives you a powerful node-graph editor, built-in procedural rigging and seamless Timeline integration - all at zero runtime allocation cost.",2026-07-03 13:59:17+00:00,2026-07-23 22:36:45+00:00,233,15,233,0,C#,2297,MIT,20,11.65,0.0643776824034334,0.0,Web
1300153697,Encod3d-Sec/ClaudeBrain,Encod3d-Sec,ClaudeBrain,https://github.com/Encod3d-Sec/ClaudeBrain,Karpathy LLM based claude harness for PenetrationTesting / Bugbounty using obsidian,2026-07-14 07:25:10+00:00,2026-07-24 05:02:48+00:00,232,36,232,0,Python,3407,MIT,9,25.77777777777778,0.1551724137931034,0.0,AI/ML
1280979277,Pengbinghui/pipeline-math,Pengbinghui,pipeline-math,https://github.com/Pengbinghui/pipeline-math,,2026-06-26 05:44:35+00:00,2026-07-20 21:20:30+00:00,230,16,230,3,Lean,7518,,27,8.518518518518519,0.0695652173913043,0.0130434782608695,Other
1302019080,CodeDrobe/skills,CodeDrobe,skills,https://github.com/CodeDrobe/skills,"Agent Skills for theming AI desktop apps: reference image → reversible Codex/WorkBuddy skin → verify, repair, publish. | 给 AI 桌面应用换肤的 Agent Skills：参考图 → 可逆皮肤 → 验证、修复、发布。",2026-07-15 20:36:32+00:00,2026-07-19 08:02:12+00:00,230,18,230,1,CSS,16518,Apache-2.0,8,28.75,0.0782608695652174,0.0043478260869565,AI/ML
1295688807,dboudreau00/Xault-Wallet,dboudreau00,Xault-Wallet,https://github.com/dboudreau00/Xault-Wallet,XMR Desktop Wallet built for Duress and privacy-first usage.,2026-07-09 19:08:29+00:00,2026-07-24 02:36:48+00:00,230,11,230,0,C#,447,MIT,14,16.428571428571427,0.0478260869565217,0.0,Finance/Trading
1284645462,ww085213/Mineradio-LX-Music,ww085213,Mineradio-LX-Music,https://github.com/ww085213/Mineradio-LX-Music,MR：可独立运行的本地音乐播放器与音乐可视化工具，支持本地音乐、歌词舞台、桌面歌词和 3D 可视化；LX Music 歌单导入与本机联动为可选扩展。,2026-06-30 04:19:48+00:00,2026-07-22 17:00:16+00:00,228,16,228,10,HTML,43540,GPL-3.0,23,9.91304347826087,0.0701754385964912,0.043859649122807,Web
1290410846,oxbshw/watch-skill,oxbshw,watch-skill,https://github.com/oxbshw/watch-skill,"Video understanding and self-verification for AI agents. Turn videos, streams, and agent screen recordings into searchable, timestamped evidence—then use THE LOOP to inspect, fix, and verify the work. MCP, CLI, REST, local-first.",2026-07-05 23:25:30+00:00,2026-07-12 16:32:04+00:00,228,35,228,0,Python,4700,MIT,18,12.666666666666666,0.1535087719298245,0.0,AI/ML
1280559914,MihaiCiprianChezan/Agentic-First-Enterprises,MihaiCiprianChezan,Agentic-First-Enterprises,https://github.com/MihaiCiprianChezan/Agentic-First-Enterprises,"A reference operating model for organizations where any role can be filled by a human or an agent, every process is built for agents first, and every flow can be paused, adjusted by a human, and resumed.",2026-06-25 17:53:37+00:00,2026-07-07 18:35:26+00:00,227,0,227,0,Unknown,160,CC-BY-4.0,28,8.107142857142858,0.0,0.0,AI/ML
1292208306,EXXETA/exxperts,EXXETA,exxperts,https://github.com/EXXETA/exxperts,"Persistent AI rooms with governed, approval-gated memory: local-first, on your machine.",2026-07-07 11:10:01+00:00,2026-07-24 02:31:12+00:00,227,21,227,2,TypeScript,12534,NOASSERTION,16,14.1875,0.092511013215859,0.0088105726872246,AI/ML
1300418295,shibco/ableton-linux,shibco,ableton-linux,https://github.com/shibco/ableton-linux,Run Ableton 12 and Push on Linux,2026-07-14 11:40:27+00:00,2026-07-23 12:37:06+00:00,227,12,227,18,C,101138,LGPL-2.1,9,25.22222222222222,0.052863436123348,0.079295154185022,Other
1288777900,lynote-ai/humanize-text-skill,lynote-ai,humanize-text-skill,https://github.com/lynote-ai/humanize-text-skill,Free AI Humanizer: Humanize AI Text Online,2026-07-04 00:48:19+00:00,2026-07-07 13:31:42+00:00,226,4,226,0,JavaScript,209,MIT,19,11.894736842105264,0.0176991150442477,0.0,AI/ML
1281328046,persiyanov/herdr-reviewr,persiyanov,herdr-reviewr,https://github.com/persiyanov/herdr-reviewr,"A code-review + file-viewer sidebar for herdr — comment on an agent's diff, send it back. Plus a read-only view of the PR, its checks, and comments.",2026-06-26 12:50:56+00:00,2026-07-23 18:38:50+00:00,226,21,226,9,Rust,2309,MIT,27,8.37037037037037,0.0929203539823008,0.0398230088495575,CLI/Tooling
1289958986,Kuddev/nebula,Kuddev,nebula,https://github.com/Kuddev/nebula,,2026-07-05 12:17:36+00:00,2026-07-24 02:47:54+00:00,225,13,225,4,Rust,13682,GPL-3.0,18,12.5,0.0577777777777777,0.0177777777777777,Other
1285692037,yanliudesign/offer-toolkit-skill,yanliudesign,offer-toolkit-skill,https://github.com/yanliudesign/offer-toolkit-skill,Full job-hunt Claude skill bundle — Job Description decoder + Resume builder (11 templates) + Behavioral Interview / story bank. Three self-contained sub-skills with a top-level router.,2026-07-01 04:03:37+00:00,2026-07-24 02:23:38+00:00,225,23,225,1,HTML,66780,MIT,22,10.227272727272728,0.1022222222222222,0.0044444444444444,AI/ML
1290023012,ZimengXiong/tinyTouch,ZimengXiong,tinyTouch,https://github.com/ZimengXiong/tinyTouch,"authenticate, sudo, login with your fingerprint wire(less)ly without having to spend $149 at the cost of some security",2026-07-05 13:43:52+00:00,2026-07-11 14:26:53+00:00,224,3,224,0,C,308,MIT,18,12.444444444444445,0.0133928571428571,0.0,Security
1294637523,MartinDelophy/ai-video-editor,MartinDelophy,ai-video-editor,https://github.com/MartinDelophy/ai-video-editor,"Local-first browser AI video editor with ONNX voiceovers, Whisper captions, talking avatars, and multi-track MP4/WebM export.",2026-07-09 04:43:11+00:00,2026-07-24 08:34:38+00:00,223,17,223,4,JavaScript,13509,MIT,14,15.928571428571429,0.0762331838565022,0.0179372197309417,AI/ML
1296649839,chordswallowthrust/undress-design,chordswallowthrust,undress-design,https://github.com/chordswallowthrust/undress-design,"AI-powered fashion visualization and virtual try-on toolkit for consent-based garment editing, outfit prototyping, and creative design workflows. https://undress.design/edit?utm_source=gist.github.com/chordswallowthrust/undress-design",2026-07-10 15:34:39+00:00,2026-07-12 12:05:14+00:00,223,0,223,0,Unknown,19,MIT,13,17.153846153846153,0.0,0.0,AI/ML
1286889837,nutllwhy/hyperframes-motion-library,nutllwhy,hyperframes-motion-library,https://github.com/nutllwhy/hyperframes-motion-library,,2026-07-02 07:30:18+00:00,2026-07-11 09:09:18+00:00,223,24,223,1,HTML,8851,,21,10.61904761904762,0.1076233183856502,0.0044843049327354,Web
1297518906,barretlee/agent-pulse,barretlee,agent-pulse,https://github.com/barretlee/agent-pulse,"Evidence-backed AI industry intelligence — trends, source updates, daily data refreshes, and weekly decision briefs.",2026-07-11 14:38:25+00:00,2026-07-23 12:56:14+00:00,222,25,222,3,TypeScript,22291,MIT,12,18.5,0.1126126126126126,0.0135135135135135,AI/ML
1282636938,huytranvan2010/AI-auto-generate-video,huytranvan2010,AI-auto-generate-video,https://github.com/huytranvan2010/AI-auto-generate-video,Auto generate AI video with hyperframes,2026-06-28 03:06:58+00:00,2026-06-29 00:10:49+00:00,222,111,222,1,HTML,7554,MIT,25,8.88,0.5,0.0045045045045045,AI/ML
1295784978,vybenetwork/solana-defi-positions-api,vybenetwork,solana-defi-positions-api,https://github.com/vybenetwork/solana-defi-positions-api,Solana DeFi Positions API,2026-07-09 21:17:40+00:00,2026-07-21 06:03:36+00:00,222,84,222,0,JavaScript,1940,,14,15.857142857142858,0.3783783783783784,0.0,Finance/Trading
1305421235,chenjin-cmd/xhs-virtual-product,chenjin-cmd,xhs-virtual-product,https://github.com/chenjin-cmd/xhs-virtual-product,xhs-virtual-product,2026-07-19 04:37:53+00:00,2026-07-19 23:55:59+00:00,222,28,222,0,Unknown,27,MIT,4,55.5,0.1261261261261261,0.0,Other
1299738062,vybenetwork/solana-pyth-api,vybenetwork,solana-pyth-api,https://github.com/vybenetwork/solana-pyth-api,Solana Pyth API,2026-07-13 21:10:36+00:00,2026-07-15 21:50:23+00:00,222,85,222,0,CSS,391,,10,22.2,0.3828828828828828,0.0,Finance/Trading
1287846492,xiaol/wkvm,xiaol,wkvm,https://github.com/xiaol/wkvm,"Inference for hybrid LLMs: Gemma, RWKV, and all kinds of hybrids.",2026-07-03 03:57:22+00:00,2026-07-23 00:23:12+00:00,222,12,222,0,Python,25128,,20,11.1,0.054054054054054,0.0,Other
1289951235,kunchenguid/dotfiles,kunchenguid,dotfiles,https://github.com/kunchenguid/dotfiles,Kun's dotfiles for agentic engineering,2026-07-05 12:05:39+00:00,2026-07-24 01:03:29+00:00,221,113,221,4,Nix,47,MIT-0,18,12.27777777777778,0.5113122171945701,0.0180995475113122,Other
1298946124,iptvorganization/TV-AutoBuild,iptvorganization,TV-AutoBuild,https://github.com/iptvorganization/TV-AutoBuild,Monitored public GitHub Actions builds for iptvorganization TV Mobile and Leanback APKs,2026-07-13 06:30:09+00:00,2026-07-23 04:14:55+00:00,221,133,221,0,Shell,29,MIT,10,22.1,0.6018099547511312,0.0,Mobile
1285227084,0xAntoniPL/hitman-bot,0xAntoniPL,hitman-bot,https://github.com/0xAntoniPL/hitman-bot,Hitman Bot — Robinhood Chain DeFi CLI,2026-06-30 15:44:20+00:00,2026-07-15 17:41:38+00:00,221,0,221,27,TypeScript,72527,NOASSERTION,23,9.608695652173912,0.0,0.1221719457013574,Finance/Trading
1296462200,liangdabiao/liurun-bookwriter-skills,liangdabiao,liurun-bookwriter-skills,https://github.com/liangdabiao/liurun-bookwriter-skills,蒸馏skill : 基于刘润28 年商业写作经验的完整复刻。基于其《我这28年的写作心法》提炼的 8 大心法、3 种结构、SCQA 逻辑势能、5商派 SCA++ 模板、7 种 callout，专为商业长文创作设计。你让它随便写任何 东西的 商业评论，都没有问题，都有意思，有洞见。,2026-07-10 12:10:08+00:00,2026-07-11 01:05:32+00:00,221,31,221,0,Python,268,,13,17.0,0.1402714932126696,0.0,Other
1297753223,GameDevGrzesiek/GameFunds,GameDevGrzesiek,GameFunds,https://github.com/GameDevGrzesiek/GameFunds,"A catalogue of publishers, investors, VCs and other grants to fund your game!",2026-07-11 20:11:17+00:00,2026-07-14 16:39:55+00:00,221,24,221,1,Unknown,195,MIT,12,18.416666666666668,0.1085972850678733,0.004524886877828,Game
1290513696,MCG-NJU/VideoChat3,MCG-NJU,VideoChat3,https://github.com/MCG-NJU/VideoChat3,"A generalist video MLLM built for fine-grained motion, long-form reasoning, temporal grounding, and live streaming.",2026-07-06 02:31:19+00:00,2026-07-17 12:54:29+00:00,220,4,220,2,Unknown,6857,,17,12.941176470588236,0.0181818181818181,0.009090909090909,Other
1283091989,pwilkin/trellis.cpp,pwilkin,trellis.cpp,https://github.com/pwilkin/trellis.cpp,"TRELLIS.2 image-to-3D in C++/GGML (CUDA + Vulkan), with a resident HTTP server",2026-06-28 14:37:43+00:00,2026-07-22 12:21:32+00:00,220,14,220,11,C++,89092,,25,8.8,0.0636363636363636,0.05,Other
