id,full_name,owner,name,html_url,description,created_at,pushed_at,stars,forks,watchers,open_issues,primary_language,size,license,age_days,stars_per_day,fork_star_ratio,issue_star_ratio,category
1235175101,JUk1-GH/gpt-promo-scanner,JUk1-GH,gpt-promo-scanner,https://github.com/JUk1-GH/gpt-promo-scanner,"ChatGPT Team(Business) 促销码自动扫描工具 — 批量发现/验证/价格收集，支持 17 国 34 个码，最高折扣 71% | ChatGPT Business promo code scanner — batch discovery, validation, price collection, 34 codes across 17 countries, up to 71% off",2026-05-11 04:42:18+00:00,2026-05-15 08:41:27+00:00,613,122,613,6,Python,211,MIT,29,21.13793103448276,0.199021207177814,0.0097879282218597,AI/ML
1253236308,jdevalk/specification.website,jdevalk,specification.website,https://github.com/jdevalk/specification.website,"Website specification — HTML, accessibility, security, SEO, agent-readiness. Platform-agnostic, sourced, MIT.",2026-05-29 09:13:26+00:00,2026-06-10 10:10:21+00:00,612,41,612,1,TypeScript,10685,NOASSERTION,11,55.63636363636363,0.0669934640522875,0.0016339869281045,AI/ML
1256080504,VAST-AI-Research/TripoSplat,VAST-AI-Research,TripoSplat,https://github.com/VAST-AI-Research/TripoSplat,"TripoSplat converts a single 2D image into high-quality and variable number of 3D Gaussians, developed by TripoAI.",2026-06-01 12:50:21+00:00,2026-06-02 08:47:41+00:00,608,57,608,2,Python,4749,MIT,8,76.0,0.09375,0.0032894736842105,Other
1254102663,liyue-aigc/female-portrait-director,liyue-aigc,female-portrait-director,https://github.com/liyue-aigc/female-portrait-director,A modular Codex Skill for directing and expanding detailed AI female portrait prompts.,2026-05-30 06:32:54+00:00,2026-06-01 07:54:46+00:00,608,83,608,0,Unknown,1765,MIT,10,60.8,0.1365131578947368,0.0,AI/ML
1242867671,evilsocket/audit,evilsocket,audit,https://github.com/evilsocket/audit,An 8-stage vulnerability-discovery agent.,2026-05-18 20:42:44+00:00,2026-05-29 14:16:51+00:00,604,89,604,3,Python,218,MIT,22,27.454545454545453,0.1473509933774834,0.0049668874172185,AI/ML
1248747220,nv-tlabs/Gamma-World,nv-tlabs,Gamma-World,https://github.com/nv-tlabs/Gamma-World,Implementation of Gamma-World: Generative Multi-Agent World Modeling Beyond Two Players,2026-05-25 02:35:01+00:00,2026-05-28 01:59:36+00:00,601,7,601,1,Unknown,25285,,15,40.06666666666667,0.0116472545757071,0.0016638935108153,AI/ML
1250579716,vedika-io/xalen-ephemeris,vedika-io,xalen-ephemeris,https://github.com/vedika-io/xalen-ephemeris,"Pure-Rust astronomical ephemeris for astrology — Vedic, Western, Chinese, and 9 world traditions",2026-05-26 19:16:49+00:00,2026-06-02 15:48:14+00:00,601,61,601,0,Rust,796,Apache-2.0,14,42.92857142857143,0.1014975041597337,0.0,Other
1245733063,mims-harvard/AutoScientists,mims-harvard,AutoScientists,https://github.com/mims-harvard/AutoScientists,AutoScientists: Self-Organizing Agent Teams for Long-Running Scientific Experimentation,2026-05-21 13:58:17+00:00,2026-05-28 05:00:19+00:00,598,96,598,2,Python,11509,,19,31.473684210526315,0.1605351170568562,0.0033444816053511,AI/ML
1248026928,msitarzewski/brew-browser,msitarzewski,brew-browser,https://github.com/msitarzewski/brew-browser,Homebrew is the standard package manager on macOS. brew-browser gives it a real native GUI.,2026-05-24 04:58:59+00:00,2026-06-07 06:15:00+00:00,592,18,592,36,Rust,23992,MIT,16,37.0,0.0304054054054054,0.0608108108108108,Other
1235536039,yliust/Tactile,yliust,Tactile,https://github.com/yliust/Tactile,Tactile: an accessibility-first operating layer for agents.,2026-05-11 12:21:23+00:00,2026-05-29 04:53:15+00:00,592,12,592,0,Python,17725,NOASSERTION,29,20.41379310344828,0.0202702702702702,0.0,AI/ML
1250818845,JuneYaooo/nihaisha-nishi-tcm,JuneYaooo,nihaisha-nishi-tcm,https://github.com/JuneYaooo/nihaisha-nishi-tcm,"倪海厦中医课程资料的 Agent Skill：支持课程检索、方证穴位辨析、学习笔记整理与板书截图证据索引。 |  An Agent Skill for Ni Haisha TCM course study, formula-pattern lookup, acupoint reference, and screenshot evidence indexing.",2026-05-27 02:01:16+00:00,2026-06-05 09:23:18+00:00,590,127,590,2,Python,74863,,13,45.38461538461539,0.2152542372881355,0.0033898305084745,AI/ML
1255939927,Fullive-AI/Anima,Fullive-AI,Anima,https://github.com/Fullive-AI/Anima,Make Every Hardware Intelligent — an open-source Agent OS for hardware intelligence,2026-06-01 10:06:21+00:00,2026-06-03 16:00:26+00:00,590,14,590,6,Python,6775,Apache-2.0,8,73.75,0.023728813559322,0.0101694915254237,AI/ML
1238694393,Purewhiter/mobilegym,Purewhiter,mobilegym,https://github.com/Purewhiter/mobilegym,MobileGym: A Verifiable and Highly Parallel Simulation Platform for Mobile GUI Agent Research · 浏览器里运行的安卓模拟器 · Browser-hosted Android Simulator · Verifiable Evaluation · Scalable Online RL Training,2026-05-14 11:09:52+00:00,2026-06-08 08:29:26+00:00,586,91,586,5,TypeScript,210528,Apache-2.0,26,22.53846153846154,0.1552901023890785,0.0085324232081911,AI/ML
1239434866,intellicia-public/parastore,intellicia-public,parastore,https://github.com/intellicia-public/parastore,"Draw a store, generate LLM personas, and watch them shop — an isometric 3D sandbox for synthetic-consumer experiments.",2026-05-15 05:00:31+00:00,2026-05-21 09:48:23+00:00,583,13,583,0,TypeScript,6289,MIT,25,23.32,0.0222984562607204,0.0,AI/ML
1245319446,sandiiarov/skill-creator,sandiiarov,skill-creator,https://github.com/sandiiarov/skill-creator,"Turn any MCP server, OpenAPI spec, or GraphQL endpoint into a CLI at runtime.",2026-05-21 05:45:40+00:00,2026-06-03 00:23:19+00:00,578,71,578,0,TypeScript,578,MIT,19,30.42105263157895,0.1228373702422145,0.0,AI/ML
1246600517,open-gsd/gsd-pi,open-gsd,gsd-pi,https://github.com/open-gsd/gsd-pi,"A powerful meta-prompting, context engineering and spec-driven development system that enables agents to work for long periods of time autonomously without losing track of the big picture",2026-05-22 11:03:33+00:00,2026-06-10 05:26:57+00:00,572,55,572,48,TypeScript,73511,MIT,18,31.77777777777778,0.0961538461538461,0.0839160839160839,AI/ML
1239522492,agentic-in/elephant-agent,agentic-in,elephant-agent,https://github.com/agentic-in/elephant-agent,Personal-Model First Self Evolving AI Agent 🐘,2026-05-15 07:08:17+00:00,2026-06-01 02:33:06+00:00,565,59,565,19,Python,199394,,25,22.6,0.1044247787610619,0.0336283185840707,AI/ML
1255349541,anomalyco/rift,anomalyco,rift,https://github.com/anomalyco/rift,,2026-05-31 18:09:30+00:00,2026-06-03 17:08:28+00:00,562,10,562,0,Rust,234,,9,62.44444444444444,0.0177935943060498,0.0,Other
1246148135,akitaonrails/ai-memory,akitaonrails,ai-memory,https://github.com/akitaonrails/ai-memory,Solution for long term memory for agent coding CLIs and to facilitate handoff between different agent vendors,2026-05-21 23:23:51+00:00,2026-06-08 22:51:23+00:00,559,59,559,0,Rust,7064,MIT,19,29.42105263157895,0.1055456171735241,0.0,AI/ML
1251086916,yb2460/harness-anything,yb2460,harness-anything,https://github.com/yb2460/harness-anything,"Harness Anything - AI agent control hub: WPS, MS Office, Zotero, Photoshop, 47 CLI commands, 27 academic skills, SVG-to-PPTX",2026-05-27 08:25:28+00:00,2026-05-31 06:41:10+00:00,555,27,555,3,Python,732,MIT,13,42.69230769230769,0.0486486486486486,0.0054054054054054,AI/ML
1238374602,zLanqing/codex-claude-academic-skills,zLanqing,codex-claude-academic-skills,https://github.com/zLanqing/codex-claude-academic-skills,本仓库包含三个面向学术科研人员的Skills，覆盖从文献阅读、论文写作到科学计算的完整研究工作流。office-academic-skill 负责论文阅读报告与学术 PPT/Word 文档生成；research-writing-skill 提供论文写作、润色与审稿回复辅助；scientific-toolkit-skill 整合 MATLAB/Python 科学计算与期刊级图表生成。三个 Skill 专为中文科研用户设计，可在 Claude Code 和 codex 中一键调用。,2026-05-14 04:13:15+00:00,2026-05-14 09:08:48+00:00,552,49,552,0,Python,2674,MIT,26,21.23076923076923,0.0887681159420289,0.0,AI/ML
1258621567,tastyeffectco/sandboxd,tastyeffectco,sandboxd,https://github.com/tastyeffectco/sandboxd,"Self-hosted dev sandboxes with preview URLs. One command. No Kubernetes, perfect for coding agents and Saas factories",2026-06-03 18:55:02+00:00,2026-06-09 21:07:37+00:00,550,18,550,7,Go,301,MIT,6,91.66666666666669,0.0327272727272727,0.0127272727272727,AI/ML
1238377818,B3hnamR/PsiphonOverMITM,B3hnamR,PsiphonOverMITM,https://github.com/B3hnamR/PsiphonOverMITM,,2026-05-14 04:19:09+00:00,2026-05-14 10:31:14+00:00,548,83,548,16,PowerShell,30350,,26,21.07692307692308,0.1514598540145985,0.0291970802919708,Other
1244665294,Unclecheng-li/poc-lab,Unclecheng-li,poc-lab,https://github.com/Unclecheng-li/poc-lab,"Recent CVE PoC & reproduction scripts. Focused on high-severity vulnerabilities across Linux kernel, Windows, macOS and more.",2026-05-20 13:31:52+00:00,2026-06-07 05:15:19+00:00,547,90,547,0,C,1184,MIT,20,27.35,0.1645338208409506,0.0,Security
1251948393,QwenLM/Qwen-VLA,QwenLM,Qwen-VLA,https://github.com/QwenLM/Qwen-VLA,The official repository of Qwen-VLA,2026-05-28 03:46:53+00:00,2026-05-29 13:49:38+00:00,544,20,544,9,Unknown,112426,,12,45.333333333333336,0.0367647058823529,0.0165441176470588,Other
1236249097,mit-han-lab/kernel-design-agents,mit-han-lab,kernel-design-agents,https://github.com/mit-han-lab/kernel-design-agents,,2026-05-12 04:42:45+00:00,2026-06-02 05:28:39+00:00,544,45,544,2,Unknown,20,,28,19.428571428571427,0.0827205882352941,0.0036764705882352,Other
1264312494,MSNightmare/RoguePlanet,MSNightmare,RoguePlanet,https://github.com/MSNightmare/RoguePlanet,RoguePlanet Windows Defender Vulnerability,2026-06-09 19:10:18+00:00,2026-06-09 19:58:22+00:00,543,212,543,1,C++,303,MIT,1,543.0,0.3904235727440147,0.001841620626151,Security
1262119305,vorpus/performativeUI,vorpus,performativeUI,https://github.com/vorpus/performativeUI,,2026-06-07 15:45:48+00:00,2026-06-09 14:57:05+00:00,542,14,542,3,TypeScript,570,,2,271.0,0.025830258302583,0.0055350553505535,Other
1239864142,shannhk/hermes-agent-control-room,shannhk,hermes-agent-control-room,https://github.com/shannhk/hermes-agent-control-room,Control Room-first template for managing Hermes agents from one VPS agent to specialist teams and orchestrated workflows,2026-05-15 14:18:45+00:00,2026-05-16 19:30:12+00:00,532,89,532,0,Shell,1781,MIT,25,21.28,0.1672932330827067,0.0,AI/ML
1261422007,amElnagdy/guard-skills,amElnagdy,guard-skills,https://github.com/amElnagdy/guard-skills,"Guard skills for coding agents, quality gates that catch AI-generated failure modes in code, tests, and docs",2026-06-06 16:59:27+00:00,2026-06-07 11:46:54+00:00,530,59,530,0,Unknown,77,MIT,3,176.66666666666666,0.1113207547169811,0.0,AI/ML
1235232619,pydantic/httpx2,pydantic,httpx2,https://github.com/pydantic/httpx2,A next generation HTTP client for Python. 🦋,2026-05-11 06:15:04+00:00,2026-06-08 17:49:10+00:00,512,27,512,105,Python,10058,BSD-3-Clause,29,17.655172413793103,0.052734375,0.205078125,Other
1251604333,fayazara/macos-app-skills,fayazara,macos-app-skills,https://github.com/fayazara/macos-app-skills,"AI coding agent skills for building, shipping, and maintaining native macOS apps",2026-05-27 18:36:27+00:00,2026-05-27 19:10:57+00:00,509,12,509,0,Swift,44,,13,39.15384615384615,0.0235756385068762,0.0,AI/ML
1238047523,agent-substrate/substrate,agent-substrate,substrate,https://github.com/agent-substrate/substrate,Agent Substrate: the core system,2026-05-13 19:02:38+00:00,2026-06-10 01:25:44+00:00,507,92,507,84,Go,41945,Apache-2.0,27,18.77777777777778,0.1814595660749507,0.165680473372781,AI/ML
1250486032,FlashML-org/flashlib,FlashML-org,flashlib,https://github.com/FlashML-org/flashlib,Fast and memory-efficient classical machine learning operators,2026-05-26 17:19:26+00:00,2026-06-02 20:44:29+00:00,504,36,504,0,Python,883,Apache-2.0,14,36.0,0.0714285714285714,0.0,Other
1248129407,AmmarkoV/SAM3DBody-cpp,AmmarkoV,SAM3DBody-cpp,https://github.com/AmmarkoV/SAM3DBody-cpp,"Real-time 3D full-body reconstruction from a single camera, Multiperson BVH output, Pure C++ runtime, ONNX + ggml, 70-joint skeleton with hands.",2026-05-24 08:12:55+00:00,2026-06-10 06:46:36+00:00,501,67,501,6,C,1674,MIT,16,31.3125,0.1337325349301397,0.0119760479041916,Other
1259081986,jeff141/meatshell,jeff141,meatshell,https://github.com/jeff141/meatshell,"一个轻量级、低内存占用的 SSH / 终端客户端（A lightweight, low-memory SSH / terminal client）",2026-06-04 07:13:39+00:00,2026-06-10 08:31:24+00:00,500,55,500,17,Rust,1187,,5,100.0,0.11,0.034,CLI/Tooling
1258992633,Jane-xiaoer/xiaoer-videolab,Jane-xiaoer,xiaoer-videolab,https://github.com/Jane-xiaoer/xiaoer-videolab,"One click on the toolbar grabs the current page's video into ~/Downloads — local yt-dlp daemon, 1800+ sites. 小耳抓视频：一键把当前页视频抓到本地。",2026-06-04 05:20:47+00:00,2026-06-07 02:10:05+00:00,499,76,499,1,JavaScript,849,MIT,5,99.8,0.1523046092184369,0.002004008016032,Other
1243089932,next-1688/1688-common-html-report-generator,next-1688,1688-common-html-report-generator,https://github.com/next-1688/1688-common-html-report-generator,将文本数据报告快速转换为交互式可视化HTML网页。使用 Python 代码驱动预置模板，只需编写数据配置即可自动生成专业数据看板。适用于市场分析报告、运营数据复盘、行业调研报告、销售数据汇总等场景。触发词：生成HTML报告、生成网页报告、转成可视化网页、做成数据看板、数据可视化、生成HTML看板。,2026-05-19 03:24:02+00:00,2026-05-19 03:24:11+00:00,498,18,498,0,Python,18,,21,23.714285714285715,0.036144578313253,0.0,Other
1238525750,PandoraReads/apex-dashboard,PandoraReads,apex-dashboard,https://github.com/PandoraReads/apex-dashboard,"Stop switching between Obsidian notes. One page. Everything you need. Memo your thoughts, crush your todos, track your projects — and make it look incredible doing it.",2026-05-14 07:42:42+00:00,2026-06-03 19:05:55+00:00,497,25,497,8,TypeScript,12820,MIT,26,19.115384615384617,0.0503018108651911,0.0160965794768611,Data
1255237198,chaitanyagiri/munder-difflin,chaitanyagiri,munder-difflin,https://github.com/chaitanyagiri/munder-difflin,local multi-agent harness,2026-05-31 15:25:05+00:00,2026-06-10 06:27:51+00:00,491,55,491,15,TypeScript,24271,NOASSERTION,9,54.55555555555556,0.1120162932790224,0.0305498981670061,AI/ML
1243062666,Open-X-Humanoid/HEX,Open-X-Humanoid,HEX,https://github.com/Open-X-Humanoid/HEX,HEX is a whole-body vision-language-action framework for full-sized humanoid robots. ,2026-05-19 02:39:19+00:00,2026-05-26 04:10:01+00:00,489,18,489,0,Jupyter Notebook,8514,,21,23.285714285714285,0.0368098159509202,0.0,Other
1246418196,fish2018/webhtv,fish2018,webhtv,https://github.com/fish2018/webhtv,WebHomeTV 基于FongMi二次开发，增强了 WebHome 自定义首页、App Native SDK、网盘链接检测 和 Nostr推荐首页。  这个项目的核心目标是让 CSP 站点首页可以变成一个真正可开发的网页应用：开发者可以用 HTML/CSS/JavaScript 定制首页，再通过 App 暴露的 Native 能力完成搜索、播放、跨域请求、资源代理、最近观看、网盘检测和状态同步。,2026-05-22 07:10:04+00:00,2026-06-10 03:55:31+00:00,486,139,486,13,Java,32092,GPL-3.0,18,27.0,0.2860082304526748,0.0267489711934156,Web
1255852666,agent0ai/dox,agent0ai,dox,https://github.com/agent0ai/dox,Self-documenting AGENTS.md,2026-06-01 08:25:21+00:00,2026-06-02 06:48:12+00:00,485,66,485,1,Unknown,74,MIT,8,60.625,0.1360824742268041,0.002061855670103,AI/ML
1259194283,zenhosta/9drive,zenhosta,9drive,https://github.com/zenhosta/9drive,"9Drive is a storage gateway web app for connecting multiple Google Drive accounts into one virtual storage dashboard. Users can connect Google Drive accounts, track quota, upload files, organize files with virtual folders, preview files, and let the backend route uploads to the Drive account with enough free space.",2026-06-04 09:22:03+00:00,2026-06-05 16:39:38+00:00,481,164,481,1,TypeScript,297,,5,96.2,0.340956340956341,0.002079002079002,Data
1262530182,apple/coreai-models,apple,coreai-models,https://github.com/apple/coreai-models,"Model export recipes, Python primitives, and Swift runtime utilities for on-device AI",2026-06-08 04:32:27+00:00,2026-06-09 21:30:15+00:00,480,17,480,6,Python,6256,BSD-3-Clause,1,480.0,0.0354166666666666,0.0125,AI/ML
1239473321,basionwang-bot/HermesPet,basionwang-bot,HermesPet,https://github.com/basionwang-bot/HermesPet,让 AI 住在你 MacBook 的刘海里 · 零依赖开箱即用 · 多引擎并行的桌面 AI 伴侣（Swift 6 / SwiftUI / macOS 14+）,2026-05-15 06:03:02+00:00,2026-06-10 10:14:38+00:00,477,52,477,111,Swift,7212,Apache-2.0,25,19.08,0.1090146750524109,0.2327044025157232,AI/ML
1243403407,FutureMLS-Lab/OSCAR,FutureMLS-Lab,OSCAR,https://github.com/FutureMLS-Lab/OSCAR,OSCAR: Offline Spectral Covariance-Aware Rotation for 2-bit KV Cache Quantization,2026-05-19 10:02:36+00:00,2026-06-08 07:53:09+00:00,475,71,475,3,Python,396304,,21,22.61904761904762,0.1494736842105263,0.0063157894736842,Other
1242312297,paywallpro/paywall-gallery,paywallpro,paywall-gallery,https://github.com/paywallpro/paywall-gallery,"Top iOS app subscription paywall and onboarding gallery with screenshots, videos, pricing models, patterns, and monetization signals.",2026-05-18 10:07:09+00:00,2026-06-05 02:35:48+00:00,474,96,474,2,Unknown,77219,NOASSERTION,22,21.545454545454547,0.2025316455696202,0.0042194092827004,Mobile
1254749434,Mochocyang/QMAI,Mochocyang,QMAI,https://github.com/Mochocyang/QMAI,青幕AI写作软件，解决长篇小说写作问题，解决小说角色性格不统一，防止人设崩坏。,2026-05-31 00:41:43+00:00,2026-06-10 00:44:14+00:00,473,92,473,1,TypeScript,12724,,9,52.55555555555556,0.1945031712473573,0.0021141649048625,Other
1239210415,trong776/Roblox-Hub-2026,trong776,Roblox-Hub-2026,https://github.com/trong776/Roblox-Hub-2026,Developer utilities for Roblox game testing — Lua tools for exploring game mechanics and performance. MIT License.,2026-05-14 21:47:53+00:00,2026-05-14 21:49:37+00:00,471,46,471,1,Unknown,3,MIT,26,18.115384615384617,0.0976645435244161,0.0021231422505307,Game
1254416912,WUBING2023/ExamPass-Assistant,WUBING2023,ExamPass-Assistant,https://github.com/WUBING2023/ExamPass-Assistant,把课堂讲义变成考试利器 一键将 PPT、Word、PDF 课件转化为结构清晰的知识清单和交互式测试题，让复习事半功倍。 适用人群：大学生、各个阶段老师、其他需要对付短期考试的朋友,2026-05-30 14:38:13+00:00,2026-06-08 09:31:50+00:00,470,32,470,0,Python,183,NOASSERTION,10,47.0,0.0680851063829787,0.0,Other
1259071744,wy51ai/edulab,wy51ai,edulab,https://github.com/wy51ai/edulab,,2026-06-04 07:02:45+00:00,2026-06-07 11:42:30+00:00,469,86,469,2,HTML,15920,Apache-2.0,5,93.8,0.1833688699360341,0.0042643923240938,Web
1241152875,pat-jj/harness-1,pat-jj,harness-1,https://github.com/pat-jj/harness-1,🚀 Ultra Recipe for Training Long-Horizon Search Agents - matching frontier AI's search capability with a 20B model,2026-05-17 02:51:19+00:00,2026-06-09 20:39:12+00:00,468,57,468,0,Python,1454,Apache-2.0,23,20.347826086956523,0.1217948717948717,0.0,AI/ML
1254447363,c0deJedi/nbd-vram,c0deJedi,nbd-vram,https://github.com/c0deJedi/nbd-vram,"Use your NVIDIA GPU's VRAM as swap space on Linux. Built for laptops with soldered memory and no upgrade path. If you have an RTX card sitting there with 8GB of VRAM and you're getting swapped to SSD, this puts that VRAM to work",2026-05-30 15:21:16+00:00,2026-06-09 21:58:07+00:00,465,12,465,0,Shell,9301,MIT,10,46.5,0.0258064516129032,0.0,CLI/Tooling
1238829177,S4rdenz/gta-5-mod-menu,S4rdenz,gta-5-mod-menu,https://github.com/S4rdenz/gta-5-mod-menu,"🚀 Dominate GTA V servers with this free, reliable FiveM mod menu featuring ESP, aimbot, and more, designed for Steam and Epic Games versions.",2026-05-14 13:48:33+00:00,2026-05-14 13:57:17+00:00,465,108,465,1,Unknown,7,MIT,26,17.884615384615383,0.232258064516129,0.0021505376344086,Other
1245086469,KNG7-P/Se7en-Pro,KNG7-P,Se7en-Pro,https://github.com/KNG7-P/Se7en-Pro,,2026-05-20 22:36:24+00:00,2026-05-25 17:12:57+00:00,464,35,464,9,C#,47078,MIT,20,23.2,0.0754310344827586,0.0193965517241379,Other
1250283885,Yeachan-Heo/gajae-code,Yeachan-Heo,gajae-code,https://github.com/Yeachan-Heo/gajae-code,Gajae Code MVP,2026-05-26 13:33:33+00:00,2026-06-10 09:05:12+00:00,463,53,463,2,TypeScript,46004,MIT,14,33.07142857142857,0.1144708423326133,0.0043196544276457,Other
1246346594,jianshuo/ccglass,jianshuo,ccglass,https://github.com/jianshuo/ccglass,"See what your coding agent (Claude Code, Codex, Kimi) sends to the model — local proxy + web dashboard",2026-05-22 05:35:11+00:00,2026-06-10 06:43:18+00:00,462,26,462,3,JavaScript,772,MIT,18,25.666666666666668,0.0562770562770562,0.0064935064935064,AI/ML
1241158851,Nieobie/Game-Icon-Pack,Nieobie,Game-Icon-Pack,https://github.com/Nieobie/Game-Icon-Pack,570+ rounded style icons,2026-05-17 03:05:14+00:00,2026-05-21 05:52:21+00:00,461,27,461,2,Unknown,2995,NOASSERTION,23,20.043478260869566,0.0585683297180043,0.0043383947939262,Other
1245476031,DEEIX-AI/DEEIX-Chat,DEEIX-AI,DEEIX-Chat,https://github.com/DEEIX-AI/DEEIX-Chat,"An enterprise AI workspace for model routing, multimodal chat, files, tools, billing, identity, and operations.",2026-05-21 08:57:01+00:00,2026-06-10 09:23:07+00:00,461,54,461,4,Go,17350,Apache-2.0,19,24.26315789473684,0.1171366594360086,0.0086767895878524,AI/ML
1237927619,microsoft/rayfin,microsoft,rayfin,https://github.com/microsoft/rayfin,"Backend-as-a-Service with built-in auth, data, and more",2026-05-13 16:36:21+00:00,2026-06-09 17:43:28+00:00,458,38,458,16,Unknown,2205,MIT,27,16.962962962962962,0.0829694323144104,0.0349344978165938,Data
1243053620,suyancc/openai-plus-vxt,suyancc,openai-plus-vxt,https://github.com/suyancc/openai-plus-vxt,一个基于 WXT 的浏览器插件，用于辅助 ChatGPT 注册、Checkout 链接提取、随机地址资料生成，以及 OpenAI/PayPal 支付页资料自动填写。,2026-05-19 02:24:31+00:00,2026-06-05 11:21:38+00:00,454,130,454,4,TypeScript,2085,,21,21.61904761904762,0.2863436123348017,0.0088105726872246,AI/ML
1246721062,VILA-Lab/FigMirror,VILA-Lab,FigMirror,https://github.com/VILA-Lab/FigMirror,An Automated AI Agent Tool for Plotting Your Data in Any Paper's Figure Style.,2026-05-22 13:37:03+00:00,2026-05-25 15:13:25+00:00,454,28,454,2,Python,17722,,18,25.22222222222222,0.0616740088105726,0.0044052863436123,AI/ML
1244162403,chen0416ccc-cpu/codex-windows-fast-patch-skill,chen0416ccc-cpu,codex-windows-fast-patch-skill,https://github.com/chen0416ccc-cpu/codex-windows-fast-patch-skill,此skills用于指导智能体在 Windows 上恢复 Codex Desktop 升级后失效的本地补丁和能力开关。（Computer Use，插件，fast mode等问题）支持每次使用前自动将skills更新到最新版。/These skills are designed to guide the agent in restoring local patches and feature toggles that have been disabled or invalidated following a Codex Desktop upgrade on Windows. Supports auto-updating translations.,2026-05-20 02:45:32+00:00,2026-06-09 08:37:11+00:00,451,47,451,0,PowerShell,392,,20,22.55,0.1042128603104212,0.0,AI/ML
1239965927,trong776/gta-5-mod-menu,trong776,gta-5-mod-menu,https://github.com/trong776/gta-5-mod-menu,"External game enhancement for GTA V single-player. ImGui overlay, no injection, minimal FPS impact. Windows x64, C++17.",2026-05-15 16:18:35+00:00,2026-05-15 16:26:26+00:00,450,154,450,0,Unknown,180,MIT,25,18.0,0.3422222222222222,0.0,Game
1254971431,MatixYo/ESP32-Plane-Radar,MatixYo,ESP32-Plane-Radar,https://github.com/MatixYo/ESP32-Plane-Radar,Open-source ESP32 firmware for a 1.28″ round display that shows live ADS-B aircraft around your location as a sonar-style plane radar.,2026-05-31 08:25:05+00:00,2026-06-09 13:21:07+00:00,442,51,442,13,C++,176,MIT,9,49.11111111111112,0.1153846153846153,0.0294117647058823,Other
1240535795,SubamanojJ-2004/gta-5-mod-menu,SubamanojJ-2004,gta-5-mod-menu,https://github.com/SubamanojJ-2004/gta-5-mod-menu,"Ultimate Enhancement Toolkit for GTA V — powerful mod menu with ESP, vehicle spawner, recovery features, and clean UI",2026-05-16 08:50:42+00:00,2026-05-16 10:48:23+00:00,436,60,436,0,Unknown,19,MIT,24,18.166666666666668,0.1376146788990825,0.0,Other
1255839210,S-Sigdel/vimhjkl,S-Sigdel,vimhjkl,https://github.com/S-Sigdel/vimhjkl,learn vim from your terminal with spaced repetition,2026-06-01 08:08:33+00:00,2026-06-07 03:04:59+00:00,436,8,436,4,Python,673,MIT,8,54.5,0.018348623853211,0.0091743119266055,CLI/Tooling
1254810449,zzzhhh1/free-nodes,zzzhhh1,free-nodes,https://github.com/zzzhhh1/free-nodes,,2026-05-31 03:06:09+00:00,2026-06-06 03:21:57+00:00,434,654,434,0,Python,452,,9,48.22222222222222,1.5069124423963134,0.0,Other
1253525979,DannyMac180/skills,DannyMac180,skills,https://github.com/DannyMac180/skills,AI agent skills created by me: Dan McAteer,2026-05-29 14:54:55+00:00,2026-05-29 15:22:46+00:00,434,34,434,1,Python,11,MIT,11,39.45454545454545,0.0783410138248847,0.0023041474654377,AI/ML
1255069527,PentesterFlow/agent,PentesterFlow,agent,https://github.com/PentesterFlow/agent,Agentic offensive-security in your terminal,2026-05-31 11:14:35+00:00,2026-06-06 14:58:07+00:00,429,55,429,3,TypeScript,619,Apache-2.0,9,47.66666666666666,0.1282051282051282,0.0069930069930069,AI/ML
1258828721,mysk-research/loupe,mysk-research,loupe,https://github.com/mysk-research/loupe,A privacy-focused iOS app that raises awareness about what native apps can see,2026-06-04 00:45:57+00:00,2026-06-10 06:29:50+00:00,429,22,429,2,Unknown,6773,NOASSERTION,5,85.8,0.0512820512820512,0.0046620046620046,Mobile
