id,full_name,owner,name,html_url,description,created_at,pushed_at,stars,forks,watchers,open_issues,primary_language,size,license,age_days,stars_per_day,fork_star_ratio,issue_star_ratio,category
1248761307,1ove9/antenna-forge,1ove9,antenna-forge,https://github.com/1ove9/antenna-forge,AI-driven inverse antenna design with real NEC2 + openEMS in the loop. Try the live in-browser playground.,2026-05-25 03:00:24+00:00,2026-06-01 09:11:25+00:00,262,42,262,0,Python,2753,MIT,25,10.48,0.1603053435114503,0.0,AI/ML
1252174335,Health-Yang/MineEcho,Health-Yang,MineEcho,https://github.com/Health-Yang/MineEcho,"Local-first Memory OS for personal AI assistants with L0-L3 memory, Wiki++ knowledge, skill routing, and TokenLess context compression.",2026-05-28 09:03:15+00:00,2026-06-05 14:18:13+00:00,261,26,261,0,TypeScript,20939,NOASSERTION,22,11.863636363636363,0.0996168582375478,0.0,AI/ML
1260198724,CWS6206/ai-coding-starter-kit,CWS6206,ai-coding-starter-kit,https://github.com/CWS6206/ai-coding-starter-kit,"Kuratierte Agent Skills, Checklisten, Templates und Leitfäden für Schweizer Entwicklungsteams – direkt aus meinen Blog-Artikeln destilliert.",2026-06-05 08:46:35+00:00,2026-06-05 08:56:11+00:00,261,22,261,2,Unknown,23,GPL-3.0,14,18.642857142857142,0.0842911877394636,0.0076628352490421,AI/ML
1247336503,aref-vc/tufte-claude-skill,aref-vc,tufte-claude-skill,https://github.com/aref-vc/tufte-claude-skill,Claude Code skill that turns 'make me a chart' into a Tufte-compliant chart. Distilled from Edward Tufte's three foundational books.,2026-05-23 07:18:34+00:00,2026-06-15 05:40:13+00:00,261,25,261,1,HTML,1632,MIT,27,9.666666666666666,0.0957854406130268,0.003831417624521,AI/ML
1250296864,chaos-xxl/zelda-hyrule-ui,chaos-xxl,zelda-hyrule-ui,https://github.com/chaos-xxl/zelda-hyrule-ui,"🗡️ Zelda BOTW style React UI component library — 84 components with Sheikah glow effects, dark theme, and AI-consumable design specs (Cursor/v0 ready)",2026-05-26 13:47:23+00:00,2026-06-18 10:09:19+00:00,260,32,260,2,HTML,33088,NOASSERTION,24,10.833333333333334,0.123076923076923,0.0076923076923076,AI/ML
1256738405,Totoro-jam/battle-tested-patterns,Totoro-jam,battle-tested-patterns,https://github.com/Totoro-jam/battle-tested-patterns,"Battle-tested programming patterns from production codebases — React, Linux, Go, Chromium, and more. Precise source links, multi-language examples, runnable exercises.",2026-06-02 03:41:37+00:00,2026-06-20 07:12:22+00:00,260,31,260,7,TypeScript,10069,MIT,17,15.294117647058824,0.1192307692307692,0.0269230769230769,Web
1248414534,jake-stewart/tuie,jake-stewart,tuie,https://github.com/jake-stewart/tuie,"A rich, performant TUI library for Rust.",2026-05-24 16:00:45+00:00,2026-06-17 13:56:41+00:00,259,15,259,0,Rust,671,MIT,26,9.961538461538462,0.0579150579150579,0.0,CLI/Tooling
1270244429,fendouai/best-humanizer-handbook,fendouai,best-humanizer-handbook,https://github.com/fendouai/best-humanizer-handbook,"Best AI Humanizer Handbook A practical guide to making AI-assisted writing clearer, more credible, and more human",2026-06-15 14:21:44+00:00,2026-06-16 13:27:57+00:00,259,3,259,0,Unknown,13589,MIT,4,64.75,0.0115830115830115,0.0,AI/ML
1259676981,PlummersSoftwareLLC/TinyRetroPad,PlummersSoftwareLLC,TinyRetroPad,https://github.com/PlummersSoftwareLLC/TinyRetroPad,,2026-06-04 18:43:16+00:00,2026-06-06 18:18:04+00:00,259,18,259,9,Assembly,116,Apache-2.0,15,17.266666666666666,0.0694980694980695,0.0347490347490347,Other
1248482197,quarqlabs/argus,quarqlabs,argus,https://github.com/quarqlabs/argus,"A recursive evidence-gated cognitive runtime for memory-native AI agents, combining hybrid retrieval, temporal reasoning, async learning, and plug-and-play tools.",2026-05-24 17:43:24+00:00,2026-06-09 15:10:04+00:00,258,26,258,0,Python,1582,Apache-2.0,26,9.923076923076923,0.1007751937984496,0.0,AI/ML
1258221473,AI272/speaker,AI272,speaker,https://github.com/AI272/speaker,"Speaker is a Codex skill project for academic presentations: read real.pptx, combine text extraction, PPTX structure parsing, page-by-page rendering, OCR, and visual review to generate page-by-page speaker notes, and write a clean version of the lecture into the PowerPoint comment area.",2026-06-03 11:33:33+00:00,2026-06-08 17:49:42+00:00,258,9,258,0,Python,5468,,16,16.125,0.0348837209302325,0.0,AI/ML
1260137777,iampedii/WhiteDNS-Wizard,iampedii,WhiteDNS-Wizard,https://github.com/iampedii/WhiteDNS-Wizard,"Cloudflare-first WhiteDNS CLI/TUI for provisioning a managed 3x-ui/Xray VPN stack over SSH, with DNS, certificates, client import links, Tor-routed profiles, diagnostics, backups, and repair/reset flows.",2026-06-05 07:34:28+00:00,2026-06-16 06:18:12+00:00,258,22,258,18,Go,1035,,14,18.428571428571427,0.0852713178294573,0.0697674418604651,CLI/Tooling
1256791924,Soul-AILab/SoulX-Transcriber,Soul-AILab,SoulX-Transcriber,https://github.com/Soul-AILab/SoulX-Transcriber,"An end-to-end framework for multi-speaker transcription that jointly models who spoke, when, and what.",2026-06-02 05:08:08+00:00,2026-06-04 08:04:43+00:00,257,12,257,6,Python,28842,Apache-2.0,17,15.117647058823527,0.046692607003891,0.0233463035019455,AI/ML
1258240608,Insta360-Research-Team/UniSHARP,Insta360-Research-Team,UniSHARP,https://github.com/Insta360-Research-Team/UniSHARP,Official implementation of UniSHARP: Universal Sharp Monocular View Synthesis,2026-06-03 11:55:26+00:00,2026-06-11 14:08:26+00:00,256,18,256,0,Python,34724,NOASSERTION,16,16.0,0.0703125,0.0,Other
1253654878,zhnt/loushang,zhnt,loushang,https://github.com/zhnt/loushang,"AI-native agent harness for coding workflows by python: multi-model LLM orchestration, stateful sessions, tool governance,   traceable delivery, and provider routing for GPT, Claude, DeepSeek, Qwen, Kimi, GLM, and MiniMax.",2026-05-29 17:25:11+00:00,2026-06-18 13:14:45+00:00,256,58,256,22,Python,4287,Apache-2.0,21,12.19047619047619,0.2265625,0.0859375,AI/ML
1262918341,Liuchun-oss/codelf-agent,Liuchun-oss,codelf-agent,https://github.com/Liuchun-oss/codelf-agent,轻量级 Agent 助手工具,2026-06-08 12:53:48+00:00,2026-06-17 12:25:30+00:00,255,7,255,2,TypeScript,20377,MIT,11,23.181818181818183,0.0274509803921568,0.0078431372549019,AI/ML
1251216667,digitalinnovationone/dio-agent,digitalinnovationone,dio-agent,https://github.com/digitalinnovationone/dio-agent,Agente de IA criado pela DIO para apoiar seus estudos.,2026-05-27 11:04:32+00:00,2026-05-28 17:30:46+00:00,255,46,255,1,Unknown,59,,23,11.08695652173913,0.1803921568627451,0.0039215686274509,Other
1257269578,portbuster1337/ArachneC2,portbuster1337,ArachneC2,https://github.com/portbuster1337/ArachneC2,Decentralized C2 framework built on libp2p,2026-06-02 14:18:03+00:00,2026-06-16 14:02:26+00:00,255,41,255,1,Go,3739,,17,15.0,0.1607843137254902,0.0039215686274509,Other
1251356527,FoundZiGu/SMSBazaar,FoundZiGu,SMSBazaar,https://github.com/FoundZiGu/SMSBazaar,OPENAI(ChatGPT) 短信接码价格和库存对比看板,2026-05-27 13:52:59+00:00,2026-06-02 23:21:48+00:00,254,36,254,2,JavaScript,129,MIT,23,11.043478260869565,0.1417322834645669,0.0078740157480314,Other
1263039651,Anttwo/Surflo,Anttwo,Surflo,https://github.com/Anttwo/Surflo,Official implementation of Surflo: Consistent 3D Surface Flow Model with Global State.,2026-06-08 15:04:09+00:00,2026-06-12 01:45:33+00:00,254,7,254,2,Unknown,2,,11,23.09090909090909,0.0275590551181102,0.0078740157480314,Other
1256946355,2417467487-hub/WorldCupROI,2417467487-hub,WorldCupROI,https://github.com/2417467487-hub/WorldCupROI,"Sports sponsorship intelligence platform for World Cup match data, real-source text signals, ROI prediction, uncertainty analysis, and scenario recommendations.",2026-06-02 08:15:02+00:00,2026-06-16 11:01:54+00:00,254,20,254,4,Python,154932,,17,14.941176470588236,0.0787401574803149,0.0157480314960629,AI/ML
1246714376,wuwukaka/ComfyUI-WanAnimatePlus,wuwukaka,ComfyUI-WanAnimatePlus,https://github.com/wuwukaka/ComfyUI-WanAnimatePlus,Seamless video connection and multi-reference image support for Wan Animate.,2026-05-22 13:29:05+00:00,2026-06-18 14:45:16+00:00,254,7,254,1,Python,37594,Apache-2.0,28,9.071428571428571,0.0275590551181102,0.0039370078740157,Other
1250258692,a2328275243/mempalace-evolve,a2328275243,mempalace-evolve,https://github.com/a2328275243/mempalace-evolve,"Self-evolving memory palace for AI agents — persistent memory with automatic learning, knowledge graph, and multi-agent support",2026-05-26 13:05:47+00:00,2026-06-19 17:24:14+00:00,253,9,253,0,Python,107821,MIT,24,10.541666666666666,0.0355731225296442,0.0,AI/ML
1256706847,zonghaoyuan/infiplot,zonghaoyuan,infiplot,https://github.com/zonghaoyuan/infiplot,InfiPlot is the world's first interactive plot game that AI generates all text and images in real-time. InfiPlot是全球首个由 AI 实时生成全部图文内容的交互式剧情游戏,2026-06-02 02:49:30+00:00,2026-06-19 01:39:24+00:00,253,38,253,0,TypeScript,100816,AGPL-3.0,17,14.882352941176473,0.150197628458498,0.0,AI/ML
1247906833,haoz19/world-tracing,haoz19,world-tracing,https://github.com/haoz19/world-tracing,Office inference code for World Tracing (object/scene/dynamic). Live demos: https://haoz19.github.io/world-tracing-page/,2026-05-24 00:02:22+00:00,2026-06-17 06:24:42+00:00,252,21,252,0,Python,421393,NOASSERTION,26,9.692307692307692,0.0833333333333333,0.0,Other
1261861097,TwoSevenOneT/EDRChoker,TwoSevenOneT,EDRChoker,https://github.com/TwoSevenOneT/EDRChoker,A tool uses the QoS Policy (Pacer.sys) to throttle Endpoint Detection and Response (EDR) agents from connecting to the server.,2026-06-07 08:48:55+00:00,2026-06-13 02:55:46+00:00,252,44,252,0,C#,15,,12,21.0,0.1746031746031746,0.0,AI/ML
1251578195,ShiroEirin/comfyui-good-anima,ShiroEirin,comfyui-good-anima,https://github.com/ShiroEirin/comfyui-good-anima,,2026-05-27 18:03:57+00:00,2026-06-15 09:58:01+00:00,251,23,251,6,Rust,53654,GPL-3.0,23,10.91304347826087,0.0916334661354581,0.0239043824701195,Other
1250390120,GoDiao/dreamcoder,GoDiao,dreamcoder,https://github.com/GoDiao/dreamcoder,完全开源claude desktop的桌面编程工作台| https://godiao.github.io/dreamcoder/,2026-05-26 15:26:35+00:00,2026-06-15 08:24:26+00:00,250,16,250,17,TypeScript,41877,MIT,24,10.416666666666666,0.064,0.068,Other
1261555327,adamallcock/codex-chatgpt-control,adamallcock,codex-chatgpt-control,https://github.com/adamallcock/codex-chatgpt-control,Unofficial SDK for Codex agents controlling visible ChatGPT web sessions,2026-06-06 21:09:56+00:00,2026-06-14 18:45:01+00:00,249,18,249,0,JavaScript,3063,MIT,13,19.153846153846157,0.072289156626506,0.0,AI/ML
1261080024,abhinand5/pi-setup,abhinand5,pi-setup,https://github.com/abhinand5/pi-setup,Personal Pi coding agent setup,2026-06-06 07:56:45+00:00,2026-06-15 18:23:19+00:00,249,30,249,0,TypeScript,2447,,13,19.153846153846157,0.1204819277108433,0.0,AI/ML
1259888079,chaseai-yt/grill-me-codex,chaseai-yt,grill-me-codex,https://github.com/chaseai-yt/grill-me-codex,,2026-06-05 00:51:06+00:00,2026-06-05 01:57:50+00:00,248,32,248,2,Unknown,18,NOASSERTION,14,17.714285714285715,0.1290322580645161,0.0080645161290322,Other
1250707188,facebookresearch/atlas-lean,facebookresearch,atlas-lean,https://github.com/facebookresearch/atlas-lean,ATLAS Autoformalized Textbook Library At Scale,2026-05-26 22:31:48+00:00,2026-06-02 17:28:59+00:00,247,28,247,3,Lean,12847,NOASSERTION,24,10.291666666666666,0.1133603238866396,0.0121457489878542,Other
1252849584,Rvosy/Sakura,Rvosy,Sakura,https://github.com/Rvosy/Sakura,一个通用桌宠 Agent 框架，能导入自定义角色包，并让角色感知屏幕内容与系统事件，根据用户当前场景主动做出自然反应。,2026-05-28 23:52:47+00:00,2026-06-20 02:04:33+00:00,246,13,246,3,Python,53000,MIT,22,11.181818181818182,0.0528455284552845,0.0121951219512195,AI/ML
1251122133,stepfun-ai/Step-3.7-Flash,stepfun-ai,Step-3.7-Flash,https://github.com/stepfun-ai/Step-3.7-Flash,,2026-05-27 09:06:25+00:00,2026-06-01 06:58:45+00:00,246,21,246,2,Unknown,992,Apache-2.0,23,10.695652173913045,0.0853658536585365,0.008130081300813,Other
1245926260,jaytel0/taste,jaytel0,taste,https://github.com/jaytel0/taste,Taste skill creation pipeline,2026-05-21 17:40:22+00:00,2026-05-25 00:50:30+00:00,246,21,246,1,TypeScript,3947,,29,8.482758620689655,0.0853658536585365,0.0040650406504065,Other
1255014875,ntd4996/agentpet,ntd4996,agentpet,https://github.com/ntd4996/agentpet,"A desktop pet for macOS & Windows that monitors your AI coding agents (Claude Code, Codex, Cursor, Gemini...) in real time, and grows as you code, feed it tokens, level it up, climb the leaderboard.",2026-05-31 09:40:06+00:00,2026-06-17 06:30:24+00:00,246,45,246,4,Swift,53258,MIT,19,12.947368421052632,0.1829268292682926,0.016260162601626,AI/ML
1249258514,huaiyuechusan/YanAI,huaiyuechusan,YanAI,https://github.com/huaiyuechusan/YanAI,颜AI：基于gpt-image-2的美颜美图网站,2026-05-25 14:10:02+00:00,2026-06-19 15:36:27+00:00,245,67,245,0,Python,204992,MIT,25,9.8,0.273469387755102,0.0,Other
1256658764,anthonycaccese/240-MP,anthonycaccese,240-MP,https://github.com/anthonycaccese/240-MP,240-MP is a retro VCR style frontend to playback local media or content from a plex library via a Raspberry Pi on CRT,2026-06-02 01:30:35+00:00,2026-06-20 04:13:05+00:00,244,18,244,5,QML,725,GPL-3.0,17,14.352941176470589,0.0737704918032786,0.0204918032786885,Web
1251875798,modelstudioai/cli,modelstudioai,cli,https://github.com/modelstudioai/cli,"Official Model Studio CLI（阿里云百炼 CLI）built for AI Agent frameworks, exposing models, search, multimodal, and workflow capabilities as structured tool calls.",2026-05-28 01:46:10+00:00,2026-06-19 15:25:22+00:00,243,14,243,2,TypeScript,817,Apache-2.0,22,11.045454545454543,0.0576131687242798,0.0082304526748971,AI/ML
1268794733,Jeidoban/Ironsmith,Jeidoban,Ironsmith,https://github.com/Jeidoban/Ironsmith,Create personal Mac apps instantly with a prompt. Supports on-device and cloud LLMs,2026-06-14 00:11:35+00:00,2026-06-18 19:34:24+00:00,242,17,242,2,Swift,8948,GPL-3.0,5,48.4,0.0702479338842975,0.0082644628099173,Mobile
1253048130,packyme/privacy-filter,packyme,privacy-filter,https://github.com/packyme/privacy-filter,LLM privacy gateway in Go — millisecond-latency PII and secret redaction. Used in production by PackyCode.,2026-05-29 05:34:55+00:00,2026-06-09 06:06:51+00:00,240,29,240,1,Go,76,MIT,21,11.428571428571429,0.1208333333333333,0.0041666666666666,AI/ML
1248432232,jephersonRD/JiruHub,jephersonRD,JiruHub,https://github.com/jephersonRD/JiruHub,"JiruHub — Modern Open Source Desktop App for Watching Anime, Reading Manga & Comics, Streaming Movies and Entertainment Content for Free on Windows and Linux",2026-05-24 16:27:03+00:00,2026-06-13 16:06:58+00:00,240,10,240,11,JavaScript,50060,AGPL-3.0,26,9.23076923076923,0.0416666666666666,0.0458333333333333,Web
1254944331,liconstudio/ComfyUI-Licon-MSR,liconstudio,ComfyUI-Licon-MSR,https://github.com/liconstudio/ComfyUI-Licon-MSR,  A ComfyUI custom node designed for LTX 2.3 MSR (Multiple-Subject-Reference) LoRA workflows.,2026-05-31 07:36:33+00:00,2026-06-12 04:43:29+00:00,239,13,239,1,Python,20,MIT,19,12.578947368421051,0.0543933054393305,0.00418410041841,Web
1263158313,kennss/SiliconScope,kennss,SiliconScope,https://github.com/kennss/SiliconScope,Sudoless Apple Silicon system monitor (native SwiftUI GUI) with ANE / Media Engine / memory-bandwidth tracking,2026-06-08 17:19:50+00:00,2026-06-20 09:19:17+00:00,238,11,238,0,Swift,8807,MIT,11,21.63636363636364,0.0462184873949579,0.0,AI/ML
1253974459,bernardohcrocha/persistia-for-claude-code,bernardohcrocha,persistia-for-claude-code,https://github.com/bernardohcrocha/persistia-for-claude-code,Give Claude Code the persistent memory it was missing and turn it into your operational co-pilot.,2026-05-30 02:09:45+00:00,2026-06-13 14:47:35+00:00,238,0,238,0,HTML,358,MIT,20,11.9,0.0,0.0,AI/ML
1249132710,nevertoday/100-layout-compositions,nevertoday,100-layout-compositions,https://github.com/nevertoday/100-layout-compositions,100 layout composition images for design and typography reference,2026-05-25 11:37:45+00:00,2026-05-28 23:45:11+00:00,237,35,237,0,Unknown,135096,NOASSERTION,25,9.48,0.1476793248945147,0.0,Other
1262034051,ApodexAI/AgentHarness,ApodexAI,AgentHarness,https://github.com/ApodexAI/AgentHarness,Evaluation harness for Apodex-1.0 on public deep-research benchmarks.,2026-06-07 13:39:42+00:00,2026-06-08 15:56:45+00:00,236,24,236,0,Python,920,Apache-2.0,12,19.666666666666668,0.1016949152542373,0.0,Other
1247187253,kppox/polymarket-copy-bot,kppox,polymarket-copy-bot,https://github.com/kppox/polymarket-copy-bot,polymarket copy polymarket copy polymarket copy polymarket copy polymarket copy polymarket copy polymarket copy polymarket copy polymarket copy polymarket copy polymarket copy polymarket copy polymarket copy polymarket copy polymarket copy polymarket copy polymarket copy polymarket copy,2026-05-23 02:11:44+00:00,2026-06-18 12:53:02+00:00,236,4966,236,0,TypeScript,518,,27,8.74074074074074,21.04237288135593,0.0,Finance/Trading
1248372602,ziyuwowo/mllm-jailbreak-bench,ziyuwowo,mllm-jailbreak-bench,https://github.com/ziyuwowo/mllm-jailbreak-bench,Reproducible benchmark for adversarial attacks on multimodal large language models,2026-05-24 15:00:25+00:00,2026-05-24 15:00:28+00:00,236,49,236,0,Python,40,NOASSERTION,26,9.076923076923077,0.2076271186440678,0.0,Other
1248877453,Shawn-CodeDev/Awesome-Consistency-Diffusion-Visual-Generation,Shawn-CodeDev,Awesome-Consistency-Diffusion-Visual-Generation,https://github.com/Shawn-CodeDev/Awesome-Consistency-Diffusion-Visual-Generation,Consistency in Diffusion-Based Visual Generation: A Survey,2026-05-25 06:17:16+00:00,2026-06-16 11:37:58+00:00,235,4,235,0,TeX,16925,MIT,25,9.4,0.0170212765957446,0.0,AI/ML
1257914186,CodeBendKit/codeseek,CodeBendKit,codeseek,https://github.com/CodeBendKit/codeseek,Rust-powered code intelligence CLI for AI coding agents. Builds call graphs and hybrid semantic search indexes (Dense + Sparse + RRF + Reranker) across 7 languages. Ships as native MCP tools for Claude Code and Codex CLI.,2026-06-03 05:41:22+00:00,2026-06-10 04:07:18+00:00,235,19,235,0,Rust,1308,MIT,16,14.6875,0.0808510638297872,0.0,AI/ML
1260920967,yuzhworkhard-wq/image-to-code,yuzhworkhard-wq,image-to-code,https://github.com/yuzhworkhard-wq/image-to-code,Codex skill for 750px image-to-code reconstruction and transparent PNG slicing,2026-06-06 03:01:49+00:00,2026-06-10 10:38:11+00:00,235,31,235,0,Python,46,MIT,13,18.07692307692308,0.1319148936170212,0.0,AI/ML
1251009711,Mrjie7205/serenity-bottleneck-hunter,Mrjie7205,serenity-bottleneck-hunter,https://github.com/Mrjie7205/serenity-bottleneck-hunter,A Claude skill: reverse-map a supply chain to find overlooked upstream bottleneck stocks. Distilled from trader Serenity (@aleabitoreddit)'s public methodology. Not financial advice.,2026-05-27 06:53:49+00:00,2026-06-18 10:23:24+00:00,234,34,234,1,Python,1095,MIT,23,10.173913043478262,0.1452991452991453,0.0042735042735042,AI/ML
1255326646,haaarshsingh/loomix,haaarshsingh,loomix,https://github.com/haaarshsingh/loomix,Drop-in video player component,2026-05-31 17:35:07+00:00,2026-06-11 10:26:47+00:00,234,19,234,0,TypeScript,10625,Apache-2.0,19,12.31578947368421,0.0811965811965812,0.0,Web
1248789121,JasonLam08/cursor_agent_status_light,JasonLam08,cursor_agent_status_light,https://github.com/JasonLam08/cursor_agent_status_light,"A BLE-powered status light for Cursor Agent, using ESP32-C3 to visualize AI coding states such as thinking, busy,  success, error, and waiting for user action. 基于 ESP32-C3 的 Cursor Agent BLE 状态灯，用红绿灯直观显示 AI 编程过程中的思考、忙碌、成功、错误以及等待用户操作 等状态。",2026-05-25 03:50:14+00:00,2026-05-26 03:32:34+00:00,234,33,234,3,C++,709,,25,9.36,0.141025641025641,0.0128205128205128,AI/ML
1257154160,weicj/vLLM-2080Ti-Definitive,weicj,vLLM-2080Ti-Definitive,https://github.com/weicj/vLLM-2080Ti-Definitive,"The definitive vLLM runtime for dual RTX 2080 Ti 22GB + NVLink, delivering Qwen 27B local inference with 100+ tok/s single-request decode with support of FP8 weight ",2026-06-02 12:15:32+00:00,2026-06-17 07:40:15+00:00,233,33,233,22,Python,41152,Apache-2.0,17,13.705882352941176,0.1416309012875536,0.0944206008583691,Other
1246873510,cortsdine/solana-trading-bot-v3,cortsdine,solana-trading-bot-v3,https://github.com/cortsdine/solana-trading-bot-v3,solana trading bot solana trading bot solana trading bot solana trading bot solana trading bot solana trading bot solana trading bot solana trading bot solana trading bot solana trading bot solana trading bot solana trading bot solana trading bot solana trading bot solana trading bot solana trading bot solana trading bot solana trading bot ,2026-05-22 16:44:59+00:00,2026-06-03 08:57:18+00:00,233,6469,233,0,TypeScript,228,MS-PL,28,8.321428571428571,27.76394849785408,0.0,Finance/Trading
1245697002,matem6/P2JB-Y2JB-Porting,matem6,P2JB-Y2JB-Porting,https://github.com/matem6/P2JB-Y2JB-Porting,PS5 jailbreak via the Y2JB. Ports Gezine's p2jb kqueueex cr_ref overflow,2026-05-21 13:19:07+00:00,2026-05-28 07:47:11+00:00,232,28,232,15,JavaScript,45,MIT,29,8.0,0.1206896551724138,0.0646551724137931,Other
1253359600,Moh4696/websites-100-audit,Moh4696,websites-100-audit,https://github.com/Moh4696/websites-100-audit,,2026-05-29 11:35:54+00:00,2026-05-29 11:52:17+00:00,232,48,232,0,Shell,15,,21,11.047619047619047,0.2068965517241379,0.0,CLI/Tooling
1252996606,xiongqi123123/awesome-rebuttal,xiongqi123123,awesome-rebuttal,https://github.com/xiongqi123123/awesome-rebuttal,a skill for rebuttal,2026-05-29 04:16:16+00:00,2026-06-13 12:16:03+00:00,231,7,231,0,TeX,1377,MIT,21,11.0,0.0303030303030303,0.0,Other
1266521249,ale2348/trading-bot,ale2348,trading-bot,https://github.com/ale2348/trading-bot,Polymarket Arbitrage Bot || Polymarket Trading Bot || Polymarket Arbitrage Bot || Polymarket Trading Bot || Polymarket Arbitrage Bot || Polymarket Trading Bot || Polymarket Arbitrage Bot || Polymarket Trading Bot || Polymarket Arbitrage Bot || Polymarket Trading Bot || Polymarket Arbitrage Bot || Polymarket Trading Bot || Polymarket Arbitrage Bot,2026-06-11 17:39:39+00:00,2026-06-19 06:01:36+00:00,231,209,231,0,TypeScript,1868,,8,28.875,0.9047619047619048,0.0,Finance/Trading
1260467366,wechat-miniprogram/ai-mode-demo,wechat-miniprogram,ai-mode-demo,https://github.com/wechat-miniprogram/ai-mode-demo,,2026-06-05 14:22:25+00:00,2026-06-09 11:44:13+00:00,230,35,230,44,JavaScript,55,MIT,14,16.428571428571427,0.1521739130434782,0.1913043478260869,Other
1258994637,helloianneo/ian-xiaohei-scenes,helloianneo,ian-xiaohei-scenes,https://github.com/helloianneo/ian-xiaohei-scenes,Xiaohei 2.0 Codex Skill for Chinese real-object article illustrations and long-scroll story images,2026-06-04 05:23:49+00:00,2026-06-04 05:49:37+00:00,230,19,230,1,Unknown,8635,MIT,15,15.333333333333334,0.0826086956521739,0.0043478260869565,AI/ML
1256690992,zhishile/codex-auth-helper,zhishile,codex-auth-helper,https://github.com/zhishile/codex-auth-helper,Codex登陆助手：安全地在本地导出您的已登录 ChatGPT 会话配置，生成符合 Codex 规范的 auth.json 本地备份文件。,2026-06-02 02:23:56+00:00,2026-06-07 07:58:54+00:00,230,42,230,7,CSS,67,,17,13.529411764705882,0.1826086956521739,0.0304347826086956,AI/ML
1266852273,chen2he/orange-cloud,chen2he,orange-cloud,https://github.com/chen2he/orange-cloud,"Open-source native Cloudflare client for iPhone, iPad & Apple Watch — sign in with OAuth, no API tokens to paste. Native Android app (Kotlin/Compose) in development.",2026-06-12 02:29:10+00:00,2026-06-19 21:40:11+00:00,230,26,230,4,Swift,9676,NOASSERTION,7,32.857142857142854,0.1130434782608695,0.017391304347826,Security
1251546438,safeboundai/vibe-scanner,safeboundai,vibe-scanner,https://github.com/safeboundai/vibe-scanner,,2026-05-27 17:26:13+00:00,2026-05-27 20:07:56+00:00,230,61,230,2,HTML,72,Apache-2.0,23,10.0,0.2652173913043478,0.008695652173913,Web
1245871732,T8mars/T8-penguin-canvas,T8mars,T8-penguin-canvas,https://github.com/T8mars/T8-penguin-canvas,,2026-05-21 16:33:25+00:00,2026-06-17 08:48:32+00:00,229,59,229,4,TypeScript,266558,MIT,29,7.896551724137931,0.2576419213973799,0.0174672489082969,Other
1249218782,BJTUpupil/AscendFHE,BJTUpupil,AscendFHE,https://github.com/BJTUpupil/AscendFHE,,2026-05-25 13:24:04+00:00,2026-05-28 03:36:45+00:00,229,10,229,4,C++,110,GPL-2.0,25,9.16,0.0436681222707423,0.0174672489082969,Other
1255174587,rstagit/rstaspoof,rstagit,rstaspoof,https://github.com/rstagit/rstaspoof,ابزار دور زدن DPI با جعل SNI — پشتیبانی از Termux/Android/Linux,2026-05-31 13:56:58+00:00,2026-06-11 20:34:43+00:00,228,32,228,3,Go,16453,,19,12.0,0.1403508771929824,0.0131578947368421,Mobile
1252440913,bozhouDev/14days-build-claude-code-cli,bozhouDev,14days-build-claude-code-cli,https://github.com/bozhouDev/14days-build-claude-code-cli,网页版教程，看起来会舒服一点,2026-05-28 14:20:47+00:00,2026-06-02 02:45:40+00:00,228,21,228,2,Python,685,MIT,22,10.363636363636363,0.0921052631578947,0.0087719298245614,Other
1249245754,lynote-ai/ai-detector-skill,lynote-ai,ai-detector-skill,https://github.com/lynote-ai/ai-detector-skill, A free detector capable of identifying content generated by all advanced AI models.,2026-05-25 13:55:03+00:00,2026-05-27 06:42:59+00:00,227,6,227,3,Python,47,MIT,25,9.08,0.026431718061674,0.013215859030837,AI/ML
1254959609,datawhalechina/quant-for-beginners,datawhalechina,quant-for-beginners,https://github.com/datawhalechina/quant-for-beginners,,2026-05-31 08:03:36+00:00,2026-06-09 08:33:19+00:00,227,27,227,1,Jupyter Notebook,17205,MIT,19,11.947368421052632,0.118942731277533,0.0044052863436123,Other
1255689883,saksham2001/PulseLoopIOS,saksham2001,PulseLoopIOS,https://github.com/saksham2001/PulseLoopIOS,,2026-06-01 04:50:40+00:00,2026-06-20 02:12:08+00:00,227,29,227,6,Swift,12042,CC-BY-4.0,18,12.61111111111111,0.1277533039647577,0.026431718061674,Mobile
