id,full_name,owner,name,html_url,description,created_at,pushed_at,stars,forks,watchers,open_issues,primary_language,size,license,age_days,stars_per_day,fork_star_ratio,issue_star_ratio,category
1272107529,Po1yScripts/polymarket-arbitrage-trading-bot-pack-5min-15min-kalshi,Po1yScripts,polymarket-arbitrage-trading-bot-pack-5min-15min-kalshi,https://github.com/Po1yScripts/polymarket-arbitrage-trading-bot-pack-5min-15min-kalshi,polymarket bot polymarket trading bot polymarket arbitrage bot polymarket arbitrage bot polymarket arbitrage bot polymarket arbitrage bot polymarket bot polymarket bot polymarket bot polymarket bot polymarket trading bot polymarket trading bot polymarket arbitrage bot polymarket bot polymarket kalshi bot polymarket 5min bot polymarket bot 15min bot,2026-06-17 09:46:11+00:00,2026-06-27 00:25:49+00:00,437,751,437,1,Unknown,4479,,11,39.72727272727273,1.7185354691075514,0.0022883295194508,Finance/Trading
1268441659,bjarneo/ku,bjarneo,ku,https://github.com/bjarneo/ku,"A fast, keyboard-driven Kubernetes TUI. Browse any resource, edit objects, follow logs, and shell into pods. ",2026-06-13 14:38:25+00:00,2026-06-25 07:46:43+00:00,434,16,434,2,Go,447,MIT,15,28.933333333333334,0.0368663594470046,0.0046082949308755,DevOps
1263543726,valkor-ai/loom,valkor-ai,loom,https://github.com/valkor-ai/loom,Loop engineering for agentic software delivery.,2026-06-09 03:46:34+00:00,2026-06-29 06:06:25+00:00,430,33,430,2,Rust,3903,Apache-2.0,19,22.63157894736842,0.0767441860465116,0.0046511627906976,Other
1258413847,eddyzzl/marvis-risk-agent,eddyzzl,marvis-risk-agent,https://github.com/eddyzzl/marvis-risk-agent,"MARVIS-Agent: all-purpose credit risk agent for model development, validation, data processing, feature engineering, and strategy workflows.",2026-06-03 14:56:36+00:00,2026-06-28 05:22:56+00:00,428,0,428,0,Python,18376,MIT,25,17.12,0.0,0.0,AI/ML
1258638161,wizenheimer/canary,wizenheimer,canary,https://github.com/wizenheimer/canary,"QA harness built for Claude Code | E2E testing with screen recordings, console logs, network HARs, and Playwright traces",2026-06-03 19:16:55+00:00,2026-06-20 23:05:12+00:00,426,33,426,2,TypeScript,25188,NOASSERTION,25,17.04,0.0774647887323943,0.0046948356807511,AI/ML
1271960167,rpanigrahi222/intruth-factcheck,rpanigrahi222,intruth-factcheck,https://github.com/rpanigrahi222/intruth-factcheck,,2026-06-17 06:53:59+00:00,2026-06-26 15:33:17+00:00,426,71,426,3,JavaScript,25,NOASSERTION,11,38.72727272727273,0.1666666666666666,0.0070422535211267,Other
1254710588,ProxyShard/ShardBrowser,ProxyShard,ShardBrowser,https://github.com/ProxyShard/ShardBrowser,"Free, open-source anti-detect browser launcher for web scraping and multi-accounting. By the ProxyShard team. Engine-level fingerprint spoofing in Chromium 148 (WebGL / WebGPU / Client Hints / fonts / TLS), 170+ device profiles bundled, stable QUIC + WebRTC over SOCKS5.",2026-05-30 23:05:14+00:00,2026-06-21 21:44:39+00:00,425,65,425,0,Rust,4960,MIT,29,14.655172413793103,0.1529411764705882,0.0,Web
1254228826,dsta022/lerobot-rgb-rgbd-vla-dataset-toolkit,dsta022,lerobot-rgb-rgbd-vla-dataset-toolkit,https://github.com/dsta022/lerobot-rgb-rgbd-vla-dataset-toolkit,"Toolkit for collecting, merging, auditing, visualizing, and publishing RGB/RGB-D LeRobot VLA datasets.",2026-05-30 09:53:31+00:00,2026-05-31 10:12:55+00:00,422,88,422,0,Python,2521,MIT,29,14.551724137931034,0.2085308056872037,0.0,Other
1259764673,mchughalex/skate3recomp,mchughalex,skate3recomp,https://github.com/mchughalex/skate3recomp,,2026-06-04 20:48:10+00:00,2026-06-14 08:50:03+00:00,421,14,421,24,C++,384,,24,17.541666666666668,0.0332541567695962,0.0570071258907363,Other
1271012824,hustvl/Moebius,hustvl,Moebius,https://github.com/hustvl/Moebius,[ECCV 2026] Moebius: 0.2B Lightweight Image Inpainting Framework with 10B-Level Performance,2026-06-16 08:52:27+00:00,2026-06-24 18:33:05+00:00,421,38,421,1,Python,106103,Apache-2.0,12,35.083333333333336,0.0902612826603325,0.002375296912114,Other
1276908304,WangJunqing-coder/huasheng13-skill,WangJunqing-coder,huasheng13-skill,https://github.com/WangJunqing-coder/huasheng13-skill,基于花生十三公开教学体系、课程资料、历年正题整理得到的skill。,2026-06-22 12:04:23+00:00,2026-06-22 12:44:14+00:00,419,84,419,2,Unknown,133,,6,69.83333333333333,0.2004773269689737,0.0047732696897374,Other
1268774372,duolahypercho/fusion-fable,duolahypercho,fusion-fable,https://github.com/duolahypercho/fusion-fable,"Fuse two frontier models into one Fable-tier answer: Opus 4.8 drafts, a second model (Opus 4.8 or GPT-5.5 via codex) checks, Opus fuses. A Claude Code skill.",2026-06-13 23:24:39+00:00,2026-06-26 21:40:53+00:00,419,61,419,0,Shell,116,MIT,15,27.933333333333334,0.1455847255369928,0.0,AI/ML
1272134131,PolyMaxi-Labs/polymarket-arbitrage-trading-bot,PolyMaxi-Labs,polymarket-arbitrage-trading-bot,https://github.com/PolyMaxi-Labs/polymarket-arbitrage-trading-bot,polymarket trading bot polymarket bot polymarket bot polymarket bot polymarket trading bot polymarket trading bot polymarket trading bot polymarket trading bot polymarket trading bot polymarket trading bot polymarket trading bot polymarket bot polymarket bot polymarket bot polymarket trading bot polymarket bot polymarket bot polymarket trading bot,2026-06-17 10:16:06+00:00,2026-06-27 23:59:20+00:00,414,905,414,0,Unknown,309562,,11,37.63636363636363,2.185990338164251,0.0,AI/ML
1257914186,CodeBendKit/codeseek,CodeBendKit,codeseek,https://github.com/CodeBendKit/codeseek,Rust-powered code intelligence CLI for AI coding agents. Builds call graphs and hybrid semantic search indexes (Dense + Sparse + RRF + Reranker) across 7 languages. Ships as native MCP tools for Claude Code and Codex CLI.,2026-06-03 05:41:22+00:00,2026-06-24 12:11:59+00:00,412,30,412,0,Rust,1308,MIT,25,16.48,0.0728155339805825,0.0,AI/ML
1268133303,sjtuyinjie/Ultra-Fusion,sjtuyinjie,Ultra-Fusion,https://github.com/sjtuyinjie/Ultra-Fusion,Ultra-Fusion: A Resilient Tightly-Coupled Multi-Sensor Fusion SLAM Framework under Sensor Degradation and Spatiotemporal Perturbation,2026-06-13 07:15:48+00:00,2026-06-28 14:53:55+00:00,411,26,411,0,Shell,89891,MIT,15,27.4,0.0632603406326034,0.0,CLI/Tooling
1274683820,eooce/transfer-api,eooce,transfer-api,https://github.com/eooce/transfer-api,Cloudflare Worker adapter for unlimited.surf OpenAI/Anthropic-compatible API routes.,2026-06-19 19:24:47+00:00,2026-06-21 09:37:40+00:00,411,2145,411,2,JavaScript,14,,9,45.66666666666666,5.218978102189781,0.0048661800486618,AI/ML
1260155434,hoolulu/deep-research,hoolulu,deep-research,https://github.com/hoolulu/deep-research,深度调研报告生成 Skill — 一条命令，十分钟出券商级深度调研报告 / Professional deep research report generation Skill · Supports 19 languages,2026-06-05 07:56:54+00:00,2026-06-29 09:55:35+00:00,409,44,409,0,HTML,5749,MIT,23,17.782608695652176,0.1075794621026894,0.0,Web
1276236933,m1ckc3s/claude-status-bar,m1ckc3s,claude-status-bar,https://github.com/m1ckc3s/claude-status-bar,"A tiny macOS menu bar status indicator for Claude Code: animated icons, elapsed timer, and open/close lifecycle.",2026-06-21 18:02:49+00:00,2026-06-28 10:01:37+00:00,407,28,407,3,Swift,386,MIT,7,58.142857142857146,0.0687960687960688,0.0073710073710073,AI/ML
1266884317,kunchenguid/firstmate,kunchenguid,firstmate,https://github.com/kunchenguid/firstmate,Talk to one agent. Ship with a crew.,2026-06-12 03:21:10+00:00,2026-06-28 21:21:37+00:00,407,100,407,35,Shell,4227,MIT,16,25.4375,0.2457002457002457,0.085995085995086,AI/ML
1258841185,nv-tlabs/ArtiFixer,nv-tlabs,ArtiFixer,https://github.com/nv-tlabs/ArtiFixer,,2026-06-04 01:11:13+00:00,2026-06-09 21:35:05+00:00,407,30,407,3,Python,1047,Apache-2.0,24,16.958333333333332,0.0737100737100737,0.0073710073710073,Other
1263886755,jmmy9609-design/gpt-pp,jmmy9609-design,gpt-pp,https://github.com/jmmy9609-design/gpt-pp,,2026-06-09 11:05:36+00:00,2026-06-09 19:06:48+00:00,402,205,402,1,Python,1604,,19,21.157894736842103,0.5099502487562189,0.0024875621890547,Other
1257545922,AnthonySturdy/micro-radar,AnthonySturdy,micro-radar,https://github.com/AnthonySturdy/micro-radar,A tiny open-source flight radar for your desk,2026-06-02 19:30:17+00:00,2026-06-18 22:44:42+00:00,401,32,401,1,C++,21239,MIT,26,15.423076923076923,0.0798004987531172,0.0024937655860349,Other
1258932513,techjarves/Uncensored-Local-Studio,techjarves,Uncensored-Local-Studio,https://github.com/techjarves/Uncensored-Local-Studio,"Uncensored local AI studio for Windows, Linux, and macOS. Zero-setup GUI for Image Generation, GGUF LLMs, Text to Speech & Speech to Text",2026-06-04 03:45:01+00:00,2026-06-27 12:04:39+00:00,400,120,400,10,JavaScript,4036,MIT,24,16.666666666666668,0.3,0.025,AI/ML
1266313328,vercel-labs/personal-agent-template,vercel-labs,personal-agent-template,https://github.com/vercel-labs/personal-agent-template,"Open-source template for a durable personal AI agent — web chat, Slack, Linear, and long-term memory with user-approved saves. Eve, Nuxt, Better Auth, Vercel Connect.",2026-06-11 13:59:55+00:00,2026-06-25 15:53:53+00:00,399,35,399,1,TypeScript,1988,MIT,17,23.47058823529412,0.087719298245614,0.0025062656641604,AI/ML
1280984042,Pluviobyte/video-production-skills,Pluviobyte,video-production-skills,https://github.com/Pluviobyte/video-production-skills,"Reusable AI video production skills library for creation, recreation, motion design, openers, and QA.",2026-06-26 05:50:51+00:00,2026-06-26 09:45:56+00:00,398,44,398,0,Python,10042,,2,199.0,0.1105527638190954,0.0,AI/ML
1268903356,gykim80/perfectpixel-studio,gykim80,perfectpixel-studio,https://github.com/gykim80/perfectpixel-studio,AI-powered animation sprite studio — generate character sprite sheets with 8 directions and 100+ actions from a single text prompt (Wails + Go + React),2026-06-14 04:23:45+00:00,2026-06-22 22:36:11+00:00,397,62,397,2,Go,38120,MIT,14,28.357142857142858,0.1561712846347607,0.0050377833753148,AI/ML
1264875739,oomol-lab/LockIME,oomol-lab,LockIME,https://github.com/oomol-lab/LockIME,"A native macOS menu-bar app that keeps your keyboard input source locked — global, per-app, and per-URL.",2026-06-10 08:59:10+00:00,2026-06-29 09:31:40+00:00,395,13,395,0,Swift,27669,GPL-3.0,18,21.944444444444443,0.0329113924050632,0.0,Mobile
1260030086,zengxiao-he/tessera,zengxiao-he,tessera,https://github.com/zengxiao-he/tessera,"From teacher to tiles — a from-scratch LLM distillation & serving engine: custom Triton/CUDA kernels, FSDP distillation, paged-KV continuous batching, speculative decoding, a Rust gateway, a JAX oracle, and interpretability tooling.",2026-06-05 05:02:09+00:00,2026-06-05 06:20:24+00:00,394,3,394,0,Python,101,NOASSERTION,23,17.130434782608695,0.0076142131979695,0.0,AI/ML
1271972411,zeropl/2FA,zeropl,2FA,https://github.com/zeropl/2FA,"2FA 在你的浏览器里把一个 2FA 密钥算成实时的 6 位验证码。没有服务器、不用注册、没有数据库——每个""账号""就是一条可收藏的网址，密钥藏在它的 # 片段里（浏览器永远不会把 # 片段发到网络上）。",2026-06-17 07:08:24+00:00,2026-06-28 07:41:40+00:00,389,43,389,1,HTML,2992,MIT,11,35.36363636363637,0.1105398457583547,0.0025706940874035,Web
1277405426,krea-ai/krea-2,krea-ai,krea-2,https://github.com/krea-ai/krea-2,Official inference code for Krea 2,2026-06-22 21:41:41+00:00,2026-06-24 17:39:12+00:00,389,28,389,11,Python,104860,Apache-2.0,6,64.83333333333333,0.0719794344473007,0.0282776349614395,Other
1277614585,goehou/tabbit-toy,goehou,tabbit-toy,https://github.com/goehou/tabbit-toy,这是一个基于tabbit的研究包，可以转化成OAI格式出来，同时增加了会员认证功能和一键提取cookie的浏览器拓展，方便快速本地快速使用claude gpt等模型,2026-06-23 03:37:12+00:00,2026-06-25 10:28:21+00:00,386,763,386,3,JavaScript,36,,5,77.2,1.976683937823834,0.0077720207253886,Other
1269229845,baskduf/FableCodex,baskduf,FableCodex,https://github.com/baskduf/FableCodex,🗿 FableCodex is a Codex-style coding agent workflow that plans like Fable.,2026-06-14 13:11:00+00:00,2026-06-24 04:31:37+00:00,385,49,385,8,Python,248,AGPL-3.0,14,27.5,0.1272727272727272,0.0207792207792207,AI/ML
1261348412,yux1azhengye/BestSerenitySkillFromAT,yux1azhengye,BestSerenitySkillFromAT,https://github.com/yux1azhengye/BestSerenitySkillFromAT,BestSerenityFromAT(AlphaTerminal On The Way),2026-06-06 15:09:20+00:00,2026-06-24 14:50:22+00:00,383,61,383,0,Unknown,1918,MIT,22,17.40909090909091,0.1592689295039164,0.0,Other
1270587915,leyten/shard,leyten,shard,https://github.com/leyten/shard,Pipeline-parallel LLM inference across GPUs on separate machines.,2026-06-15 21:31:07+00:00,2026-06-29 11:04:59+00:00,383,48,383,4,Python,913,Apache-2.0,13,29.46153846153846,0.1253263707571801,0.010443864229765,AI/ML
1261690469,tinyhumansai/tiny.place,tinyhumansai,tiny.place,https://github.com/tinyhumansai/tiny.place,The social economy for autonomous AI agents. ,2026-06-07 03:01:58+00:00,2026-06-26 23:45:07+00:00,381,13,381,14,TypeScript,146944,GPL-3.0,21,18.142857142857142,0.0341207349081364,0.0367454068241469,AI/ML
1270503221,SubBoost/subboost,SubBoost,subboost,https://github.com/SubBoost/subboost,"Clash/Mihomo subscription conversion, enhancement, and management tool. Clash/Mihomo 订阅转换、增强和管理工具。通过 UI 可视化，一键实现链式代理、精确分流、防 DNS 泄露和多订阅聚合等高级功能。",2026-06-15 19:22:32+00:00,2026-06-24 13:04:32+00:00,381,72,381,4,TypeScript,3073,AGPL-3.0,13,29.307692307692307,0.1889763779527559,0.0104986876640419,Other
1270883324,halfof8/patterngen-oss,halfof8,patterngen-oss,https://github.com/halfof8/patterngen-oss,,2026-06-16 06:15:37+00:00,2026-06-22 05:37:44+00:00,380,33,380,0,TypeScript,152,MIT,12,31.666666666666668,0.0868421052631579,0.0,Other
1270859186,Liunian06/ko-lesson,Liunian06,ko-lesson,https://github.com/Liunian06/ko-lesson,一个帮助大学牲期末复习的skill，能将清朝老PPT复活为能看的资料,2026-06-16 05:43:13+00:00,2026-06-25 14:40:38+00:00,379,6,379,0,Unknown,106,MIT,12,31.58333333333333,0.0158311345646438,0.0,Other
1261899475,beijingcao/binance-deribit-btc,beijingcao,binance-deribit-btc,https://github.com/beijingcao/binance-deribit-btc,"Binance and Deribit BTC cross-exchange arbitrage bot with Redis state recovery, Telegram alerts, and a Flask monitoring dashboard.",2026-06-07 09:58:06+00:00,2026-06-22 02:33:10+00:00,378,133,378,0,Python,655,MIT,21,18.0,0.3518518518518518,0.0,Finance/Trading
1254582918,OnlyTerp/UltraCode-Shim,OnlyTerp,UltraCode-Shim,https://github.com/OnlyTerp/UltraCode-Shim,Give Claude Code's ultracode mode to ANY model you already pay for. A tiny local proxy + one config.json. Point your AI at AGENTS.md and it sets itself up.,2026-05-30 18:48:20+00:00,2026-06-18 06:49:16+00:00,377,33,377,1,Python,6636,MIT,29,13.0,0.0875331564986737,0.0026525198938992,AI/ML
1266521249,ale2348/trading-bot,ale2348,trading-bot,https://github.com/ale2348/trading-bot,Polymarket Arbitrage Bot || Polymarket Trading Bot || Polymarket Arbitrage Bot || Polymarket Trading Bot || Polymarket Arbitrage Bot || Polymarket Trading Bot || Polymarket Arbitrage Bot || Polymarket Trading Bot || Polymarket Arbitrage Bot || Polymarket Trading Bot || Polymarket Arbitrage Bot || Polymarket Trading Bot || Polymarket Arbitrage Bot,2026-06-11 17:39:39+00:00,2026-06-29 05:48:12+00:00,373,2277,373,0,TypeScript,3306,,17,21.94117647058824,6.10455764075067,0.0,Finance/Trading
1255267904,johnbean393/KeyType,johnbean393,KeyType,https://github.com/johnbean393/KeyType,An open-source Cotypist with macOS system wide AI autocomplete,2026-05-31 16:08:48+00:00,2026-06-27 17:18:28+00:00,372,15,372,15,Swift,8789,MIT,28,13.285714285714286,0.0403225806451612,0.0403225806451612,AI/ML
1256946355,2417467487-hub/WorldCupROI,2417467487-hub,WorldCupROI,https://github.com/2417467487-hub/WorldCupROI,"Sports sponsorship intelligence platform for World Cup match data, real-source text signals, ROI prediction, uncertainty analysis, and scenario recommendations.",2026-06-02 08:15:02+00:00,2026-06-16 11:01:54+00:00,372,25,372,1,Python,154932,,26,14.307692307692308,0.0672043010752688,0.0026881720430107,AI/ML
1272942359,yin-yizhen/sonic-topography,yin-yizhen,sonic-topography,https://github.com/yin-yizhen/sonic-topography,随音乐产生交互的棋盘式海浪，支持网易云搜索,2026-06-18 04:26:20+00:00,2026-06-29 10:51:11+00:00,370,49,370,8,TypeScript,24757,NOASSERTION,10,37.0,0.1324324324324324,0.0216216216216216,Other
1255737222,MiniMax-AI/MiniMax-M3,MiniMax-AI,MiniMax-M3,https://github.com/MiniMax-AI/MiniMax-M3,,2026-06-01 06:05:17+00:00,2026-06-22 06:36:12+00:00,369,34,369,15,Unknown,3822,,27,13.666666666666666,0.0921409214092141,0.040650406504065,Other
1277468360,samasante/liquid-glass,samasante,liquid-glass,https://github.com/samasante/liquid-glass,"Apple-style Liquid Glass for the web — a headless React lens that refracts the live DOM in Safari, Firefox and Chrome. Zero dependencies.",2026-06-22 23:31:35+00:00,2026-06-23 00:37:45+00:00,369,29,369,1,TypeScript,6081,MIT,6,61.5,0.078590785907859,0.002710027100271,Web
1281921049,downclash/clash,downclash,clash,https://github.com/downclash/clash,,2026-06-27 04:54:21+00:00,2026-06-28 12:36:38+00:00,367,0,367,0,JavaScript,5,,1,367.0,0.0,0.0,Other
1275942797,Th0rgal/open_oura,Th0rgal,open_oura,https://github.com/Th0rgal/open_oura,"A Rust toolkit for the Oura Ring (Gen 3/4/5): reverse-engineered BLE protocol, event decoders, and reimplemented data-processing algorithms. Sync, store, and analyze your data locally.",2026-06-21 10:43:18+00:00,2026-06-29 07:53:51+00:00,366,53,366,4,Rust,1964,,7,52.285714285714285,0.1448087431693989,0.0109289617486338,Data
1281620190,ricccrd/dd,ricccrd,dd,https://github.com/ricccrd/dd,,2026-06-26 18:37:27+00:00,2026-06-29 09:34:18+00:00,366,0,366,0,C,8457,MIT,2,183.0,0.0,0.0,Other
1266037990,MiniMax-AI/MSA,MiniMax-AI,MSA,https://github.com/MiniMax-AI/MSA,,2026-06-11 09:20:28+00:00,2026-06-15 04:40:59+00:00,364,34,364,3,Python,8151,MIT,17,21.41176470588235,0.0934065934065934,0.0082417582417582,Other
1257392325,openai/role-specific-plugins,openai,role-specific-plugins,https://github.com/openai/role-specific-plugins,Role-specific Codex plugin templates,2026-06-02 16:27:24+00:00,2026-06-08 20:17:31+00:00,364,52,364,6,Python,5717,MIT,26,14.0,0.1428571428571428,0.0164835164835164,AI/ML
1261832412,JFGAtlas/aethergate-pro,JFGAtlas,aethergate-pro,https://github.com/JFGAtlas/aethergate-pro,,2026-06-07 07:57:03+00:00,2026-06-11 10:30:01+00:00,362,51,362,4,Python,113,,21,17.238095238095237,0.1408839779005525,0.011049723756906,Other
1278926400,amplifthq/opentag,amplifthq,opentag,https://github.com/amplifthq/opentag,"Open-source @agent mentions for Slack and GitHub. OpenTag routes tagged requests to Codex, Claude Code, then returns results in thread.",2026-06-24 08:05:12+00:00,2026-06-29 05:55:03+00:00,359,33,359,7,TypeScript,5443,MIT,4,89.75,0.0919220055710306,0.0194986072423398,AI/ML
1280934172,CopilotKit/OpenTag,CopilotKit,OpenTag,https://github.com/CopilotKit/OpenTag,OpenTag,2026-06-26 04:34:01+00:00,2026-06-26 20:18:34+00:00,359,44,359,2,TypeScript,2179,MIT,2,179.5,0.1225626740947075,0.0055710306406685,Other
1281772914,playPlumtown/Plumtown,playPlumtown,Plumtown,https://github.com/playPlumtown/Plumtown,"The cozy life-sim that pays. Build a home, master skills, climb careers — earn $PLUM and cash out real SOL. Free to play in your browser.",2026-06-26 22:59:46+00:00,2026-06-27 00:06:03+00:00,358,3,358,0,JavaScript,2767,,2,179.0,0.0083798882681564,0.0,Other
1270244429,fendouai/best-humanizer-handbook,fendouai,best-humanizer-handbook,https://github.com/fendouai/best-humanizer-handbook,"Best AI Humanizer Handbook A practical guide to making AI-assisted writing clearer, more credible, and more human",2026-06-15 14:21:44+00:00,2026-06-16 13:27:57+00:00,354,4,354,0,Unknown,13589,MIT,13,27.23076923076923,0.0112994350282485,0.0,AI/ML
1254639466,nv-tlabs/dvlt,nv-tlabs,dvlt,https://github.com/nv-tlabs/dvlt,Official implementation of Déjà View: Looping Transformers for Multi-View 3D Reconstruction,2026-05-30 20:31:05+00:00,2026-06-01 10:06:52+00:00,352,15,352,0,Python,13544,NOASSERTION,29,12.137931034482758,0.0426136363636363,0.0,Other
1260940283,tryproduck/produck-oss,tryproduck,produck-oss,https://github.com/tryproduck/produck-oss,Open-source tools for builders to improve product-market fit.,2026-06-06 03:43:20+00:00,2026-06-22 04:07:32+00:00,352,0,352,1,Unknown,3,,22,16.0,0.0,0.002840909090909,Other
1257356954,torvalds/ScrollWheel,torvalds,ScrollWheel,https://github.com/torvalds/ScrollWheel,Minimalist RP2350 magnetic sensor scroll wheel toy project,2026-06-02 15:48:56+00:00,2026-06-02 15:52:37+00:00,348,13,348,8,C,15,GPL-2.0,26,13.384615384615383,0.0373563218390804,0.0229885057471264,Other
1269773493,renee-jia/scholar-loop,renee-jia,scholar-loop,https://github.com/renee-jia/scholar-loop,"An autonomous AI scientist: a multi-agent loop over literature, experiments, self-critique and write-up, with deterministic guards against reward-hacking and hallucination.",2026-06-15 04:50:58+00:00,2026-06-23 06:27:49+00:00,348,24,348,0,Python,405,MIT,13,26.76923076923077,0.0689655172413793,0.0,AI/ML
1257858164,GalaxyGeneralRobotics/Humanoid-GPT,GalaxyGeneralRobotics,Humanoid-GPT,https://github.com/GalaxyGeneralRobotics/Humanoid-GPT,[CVPR 2026] Humanoid-GPT: Scaling Data and Structure for Zero-Shot Motion Tracking,2026-06-03 04:22:11+00:00,2026-06-12 15:26:38+00:00,347,27,347,5,Python,75392,Apache-2.0,25,13.88,0.0778097982708933,0.0144092219020172,AI/ML
1265617292,orange2ai/orange-line-illustration,orange2ai,orange-line-illustration,https://github.com/orange2ai/orange-line-illustration,"🍊 New Yorker-style minimalist editorial illustration skill for AI agents — one idea, one accent, lots of silence. Free for open-source use; commercial license for closed-source.",2026-06-10 23:58:59+00:00,2026-06-15 00:34:19+00:00,347,24,347,0,Unknown,45014,NOASSERTION,18,19.27777777777778,0.069164265129683,0.0,AI/ML
1282902275,yynxxxxx/Codex-5.5-codex-instruct-5.5,yynxxxxx,Codex-5.5-codex-instruct-5.5,https://github.com/yynxxxxx/Codex-5.5-codex-instruct-5.5,,2026-06-28 10:24:42+00:00,2026-06-28 10:26:56+00:00,347,121,347,0,Python,6,MIT,1,347.0,0.3487031700288184,0.0,Other
1268611404,ruvnet/agent-harness-generator,ruvnet,agent-harness-generator,https://github.com/ruvnet/agent-harness-generator,"🛠️ The meta-harness for AI agents — scaffold your own focused, branded agent harness with its own npx CLI, MCP server, memory, learning loop, and witness-signed releases. Works with Claude Code, Codex, pi.dev, Hermes, OpenClaw, and RVM (hardware-isolated sandbox).",2026-06-13 18:29:11+00:00,2026-06-29 00:04:25+00:00,344,35,344,13,TypeScript,17730,MIT,15,22.933333333333334,0.1017441860465116,0.0377906976744186,AI/ML
1256690992,zhishile/codex-auth-helper,zhishile,codex-auth-helper,https://github.com/zhishile/codex-auth-helper,Codex登陆助手：安全地在本地导出您的已登录 ChatGPT 会话配置，生成符合 Codex 规范的 auth.json 本地备份文件。,2026-06-02 02:23:56+00:00,2026-06-07 07:58:54+00:00,343,64,343,10,CSS,67,,26,13.192307692307692,0.1865889212827988,0.0291545189504373,AI/ML
1269937781,M1n-n9/paper-lifecycle,M1n-n9,paper-lifecycle,https://github.com/M1n-n9/paper-lifecycle,Codex skill for full academic paper lifecycle analysis and revision,2026-06-15 08:32:18+00:00,2026-06-16 07:34:21+00:00,343,27,343,0,Unknown,1122,,13,26.384615384615383,0.0787172011661807,0.0,AI/ML
1270983350,JCarterJohnson/vibecoded-design-tells,JCarterJohnson,vibecoded-design-tells,https://github.com/JCarterJohnson/vibecoded-design-tells,"Reddit-mined data ranking the visual tells of vibe-coded (AI-built) sites: 3.2M posts scanned across 47 subreddits, with scripts, raw data, and charts.",2026-06-16 08:17:33+00:00,2026-06-24 01:10:58+00:00,339,23,339,1,Python,45328,NOASSERTION,12,28.25,0.0678466076696165,0.0029498525073746,AI/ML
1258240608,Insta360-Research-Team/UniSHARP,Insta360-Research-Team,UniSHARP,https://github.com/Insta360-Research-Team/UniSHARP,Official implementation of UniSHARP: Universal Sharp Monocular View Synthesis,2026-06-03 11:55:26+00:00,2026-06-11 14:08:26+00:00,337,25,337,1,Python,34724,NOASSERTION,25,13.48,0.0741839762611275,0.0029673590504451,Other
1258209237,nex-agi/Nex-N2,nex-agi,Nex-N2,https://github.com/nex-agi/Nex-N2,,2026-06-03 11:19:28+00:00,2026-06-09 05:42:20+00:00,334,32,334,5,Unknown,467,,25,13.36,0.0958083832335329,0.0149700598802395,Other
1268528222,joeseesun/qiaomu-novel-generator,joeseesun,qiaomu-novel-generator,https://github.com/joeseesun/qiaomu-novel-generator,"Generate complete, gripping original Chinese short fiction from story ideas with reusable narrative craft hooks.",2026-06-13 16:32:57+00:00,2026-06-14 14:15:15+00:00,334,45,334,0,Python,6430,MIT,15,22.266666666666666,0.1347305389221557,0.0,Other
1255251478,duncatzat/vigils,duncatzat,vigils,https://github.com/duncatzat/vigils,"A local control plane for AI agents — see what they do, approve what matters, keep secrets out. Rust + Tauri + Chrome MV3.",2026-05-31 15:45:25+00:00,2026-06-29 07:19:55+00:00,333,20,333,1,Rust,8692,Apache-2.0,28,11.892857142857142,0.06006006006006,0.003003003003003,AI/ML
1279342186,PMTraderAdam/pm-adam-trader,PMTraderAdam,pm-adam-trader,https://github.com/PMTraderAdam/pm-adam-trader,,2026-06-24 15:42:58+00:00,2026-06-29 03:48:35+00:00,332,199,332,0,TypeScript,25544,,4,83.0,0.5993975903614458,0.0,Other
1261212386,cauenapier/TownSquare,cauenapier,TownSquare,https://github.com/cauenapier/TownSquare,,2026-06-06 11:42:20+00:00,2026-06-29 10:49:16+00:00,332,9,332,6,JavaScript,1396,MIT,22,15.090909090909092,0.0271084337349397,0.0180722891566265,Other
