id,full_name,owner,name,html_url,description,created_at,pushed_at,stars,forks,watchers,open_issues,primary_language,size,license,age_days,stars_per_day,fork_star_ratio,issue_star_ratio,category
1260198724,CWS6206/ai-coding-starter-kit,CWS6206,ai-coding-starter-kit,https://github.com/CWS6206/ai-coding-starter-kit,"Kuratierte Agent Skills, Checklisten, Templates und Leitfäden für Schweizer Entwicklungsteams – direkt aus meinen Blog-Artikeln destilliert.",2026-06-05 08:46:35+00:00,2026-06-05 08:56:11+00:00,260,22,260,2,Unknown,23,GPL-3.0,4,65.0,0.0846153846153846,0.0076923076923076,AI/ML
1260155434,hoolulu/deep-research,hoolulu,deep-research,https://github.com/hoolulu/deep-research,深度调研报告生成 Skill — 一个命令，十分钟，多语言，一份深度专业的调研报告 / Professional deep research report generation Skill · Supports 19 languages,2026-06-05 07:56:54+00:00,2026-06-10 09:13:22+00:00,260,23,260,0,Python,1546,,4,65.0,0.0884615384615384,0.0,Other
1245711411,learningCatHD/telos-sdk,learningCatHD,telos-sdk,https://github.com/learningCatHD/telos-sdk,TELOS SDK: a cache-aware prompt protocol and gateway for portable agent context.,2026-05-21 13:35:08+00:00,2026-06-06 09:17:28+00:00,259,21,259,1,Python,3958,Apache-2.0,19,13.63157894736842,0.081081081081081,0.0038610038610038,AI/ML
1245333424,IvanWng97/pixtuoid,IvanWng97,pixtuoid,https://github.com/IvanWng97/pixtuoid,Terminal pixel-art office for AI coding agents,2026-05-21 06:05:19+00:00,2026-06-10 08:09:46+00:00,258,13,258,12,Rust,61503,MIT,19,13.578947368421051,0.0503875968992248,0.0465116279069767,AI/ML
1244468619,scheidydude/codeindex,scheidydude,codeindex,https://github.com/scheidydude/codeindex,Repo dependency analyzer with **blast-radius impact scoring** for AI-assisted development.,2026-05-20 09:42:57+00:00,2026-06-08 06:17:35+00:00,257,35,257,3,Python,341,NOASSERTION,20,12.85,0.1361867704280155,0.0116731517509727,AI/ML
1238775512,alchaincyf/codex-orange-book,alchaincyf,codex-orange-book,https://github.com/alchaincyf/codex-orange-book,OpenAI Codex: The Complete Guide · 橙皮书系列 · GPT-5.5 时代的 AI 编程实战手册,2026-05-14 12:49:01+00:00,2026-05-15 16:07:49+00:00,257,20,257,0,HTML,43831,,26,9.884615384615383,0.0778210116731517,0.0,AI/ML
1253818087,tonbistudio/hermes-multi-agent-workflow,tonbistudio,hermes-multi-agent-workflow,https://github.com/tonbistudio/hermes-multi-agent-workflow,,2026-05-29 21:03:29+00:00,2026-06-01 16:07:40+00:00,257,55,257,0,Python,67,MIT,11,23.363636363636363,0.2140077821011673,0.0,Other
1247923238,SMCGames/Paper-Mario-ReCut,SMCGames,Paper-Mario-ReCut,https://github.com/SMCGames/Paper-Mario-ReCut,A PC Port of Paper Mario for N64,2026-05-24 00:47:21+00:00,2026-06-01 20:31:42+00:00,257,7,257,0,C++,89589,MIT,16,16.0625,0.0272373540856031,0.0,Other
1243151221,RoseKhlifa/Image-Studio,RoseKhlifa,Image-Studio,https://github.com/RoseKhlifa/Image-Studio,"开源image2调用图像生成/编辑桌面客户端 · SSE 流式保活,兼容 Cloudflare 524/504 超时截断 · Wails (Go + React/TS) ·   数据 100% 本地",2026-05-19 05:06:52+00:00,2026-06-10 07:22:07+00:00,257,26,257,4,Go,901033,AGPL-3.0,21,12.238095238095235,0.1011673151750972,0.0155642023346303,Web
1248510915,bautistaaa/dotfiles,bautistaaa,dotfiles,https://github.com/bautistaaa/dotfiles,,2026-05-24 18:29:57+00:00,2026-06-07 16:48:14+00:00,256,7,256,0,Shell,15338,,16,16.0,0.02734375,0.0,CLI/Tooling
1255045044,gerardapennant96075336582/CapC-Pro-2,gerardapennant96075336582,CapC-Pro-2,https://github.com/gerardapennant96075336582/CapC-Pro-2,"CapCut Pro Studio (2026) — The ultimate high-performance video editing suite with all premium features unlocked. Experience 4K HDR exporting, AI-powered transitions, and a full professional asset library without limitations.",2026-05-31 10:32:10+00:00,2026-05-31 10:33:50+00:00,256,0,256,1,C++,9,Apache-2.0,9,28.444444444444443,0.0,0.00390625,AI/ML
1252801819,trynullsec/nullsec-s1,trynullsec,nullsec-s1,https://github.com/trynullsec/nullsec-s1,Security-native LLM system for AI-generated application security.,2026-05-28 22:13:50+00:00,2026-06-04 13:12:43+00:00,256,71,256,0,Python,1101,,12,21.33333333333333,0.27734375,0.0,AI/ML
1252174335,Health-Yang/MineEcho,Health-Yang,MineEcho,https://github.com/Health-Yang/MineEcho,"Local-first Memory OS for personal AI assistants with L0-L3 memory, Wiki++ knowledge, skill routing, and TokenLess context compression.",2026-05-28 09:03:15+00:00,2026-06-05 14:18:13+00:00,255,26,255,0,TypeScript,20939,NOASSERTION,12,21.25,0.1019607843137254,0.0,AI/ML
1239695193,nanovisionx/RAEv2,nanovisionx,RAEv2,https://github.com/nanovisionx/RAEv2,Official Implemenation for RAEv2: Improved Baselines with Representation Autoencoders,2026-05-15 10:50:17+00:00,2026-05-21 21:24:06+00:00,255,9,255,3,Python,6761,NOASSERTION,25,10.2,0.0352941176470588,0.0117647058823529,Other
1244493472,simonlin1212/global-stock-data,simonlin1212,global-stock-data,https://github.com/simonlin1212/global-stock-data,美股港股全栈数据工具包 (AI Skill) — 7层架构 · 17端点 · 5数据源 · 零鉴权 | US & HK Stock Full-Stack Data Toolkit for AI Coding Assistants,2026-05-20 10:12:30+00:00,2026-05-20 12:52:40+00:00,255,55,255,1,Unknown,161,Apache-2.0,20,12.75,0.2156862745098039,0.0039215686274509,AI/ML
1239928176,RyensX/OpenCodex,RyensX,OpenCodex,https://github.com/RyensX/OpenCodex,"OpenCodex is a middleware layer for Codex Desktop. It lets you use a phone, tablet, or another computer to access and operate Codex on a target machine through a browser, making it suitable for continuous AI Coding in LAN or remote LAN environments.",2026-05-15 15:33:26+00:00,2026-06-08 13:26:28+00:00,255,26,255,1,JavaScript,1353,AGPL-3.0,25,10.2,0.1019607843137254,0.0039215686274509,AI/ML
1252834518,madhvantyagi/SOUL.md,madhvantyagi,SOUL.md,https://github.com/madhvantyagi/SOUL.md,This repo contains different Soul.md files each file is different and allow your agents to behave in unique interesting personality. ,2026-05-28 23:19:14+00:00,2026-06-08 06:36:05+00:00,255,18,255,0,Python,26927,,12,21.25,0.0705882352941176,0.0,AI/ML
1242997674,edgenuitybot/exodusbot,edgenuitybot,exodusbot,https://github.com/edgenuitybot/exodusbot,"Exodus | The # 1 Edgenuity Bot for Quizes, Tests, and Exams. Includes Auto Answers, Auto delays, built in AI Answers, Auto Submit, EdgeEX support and MORE! | About: Exodus is an online course tool designed for online middle and high school classes (K-8 curriculum). Join the Discord: https://discord.gg/exodusbot",2026-05-19 00:45:04+00:00,2026-05-19 01:22:51+00:00,253,0,253,0,JavaScript,125,NOASSERTION,21,12.047619047619047,0.0,0.0,AI/ML
1235928536,zapier/gtm-cheat-codes,zapier,gtm-cheat-codes,https://github.com/zapier/gtm-cheat-codes,This repo is a field guide and installable library for GTM teams using coding agents.,2026-05-11 19:42:04+00:00,2026-06-04 21:15:17+00:00,252,8,252,0,Unknown,146,MIT,29,8.689655172413794,0.0317460317460317,0.0,AI/ML
1257392325,openai/role-specific-plugins,openai,role-specific-plugins,https://github.com/openai/role-specific-plugins,Role-specific Codex plugin templates,2026-06-02 16:27:24+00:00,2026-06-08 20:17:31+00:00,252,33,252,5,Python,5717,MIT,7,36.0,0.1309523809523809,0.0198412698412698,AI/ML
1242306767,leiting-eric/DailyBrief,leiting-eric,DailyBrief,https://github.com/leiting-eric/DailyBrief,AI 每日新闻简报 · GitHub 热门 + X 热门文章 + 行情技术分析 · 23 个数据源聚合 + LLM 中文摘要 · 本地或 GitHub Actions 部署,2026-05-18 10:00:52+00:00,2026-06-09 23:41:41+00:00,252,113,252,1,TypeScript,3663,MIT,22,11.454545454545457,0.4484126984126984,0.0039682539682539,AI/ML
1258389924,Albert-Weasker/niubi_guard,Albert-Weasker,niubi_guard,https://github.com/Albert-Weasker/niubi_guard,Open-source GitHub repository abuse detection and response system.,2026-06-03 14:32:02+00:00,2026-06-09 06:46:00+00:00,251,113,251,1,TypeScript,2321,NOASSERTION,6,41.833333333333336,0.450199203187251,0.0039840637450199,Security
1249990320,yuanzhongqiao/ai-interview-platform,yuanzhongqiao,ai-interview-platform,https://github.com/yuanzhongqiao/ai-interview-platform,ai-interview-platform ,2026-05-26 07:52:43+00:00,2026-06-05 04:04:02+00:00,251,111,251,0,TypeScript,11266,MIT,14,17.928571428571427,0.4422310756972111,0.0,AI/ML
1248482197,quarqlabs/argus,quarqlabs,argus,https://github.com/quarqlabs/argus,"A recursive evidence-gated cognitive runtime for memory-native AI agents, combining hybrid retrieval, temporal reasoning, async learning, and plug-and-play tools.",2026-05-24 17:43:24+00:00,2026-06-09 15:10:04+00:00,250,25,250,0,Python,1582,Apache-2.0,16,15.625,0.1,0.0,AI/ML
1247336503,aref-vc/tufte-claude-skill,aref-vc,tufte-claude-skill,https://github.com/aref-vc/tufte-claude-skill,Claude Code skill that turns 'make me a chart' into a Tufte-compliant chart. Distilled from Edward Tufte's three foundational books.,2026-05-23 07:18:34+00:00,2026-05-23 07:18:37+00:00,250,25,250,1,HTML,1625,MIT,17,14.705882352941176,0.1,0.004,AI/ML
1235254657,VigoZhao/AI-Visual-Prompt-Cookbook,VigoZhao,AI-Visual-Prompt-Cookbook,https://github.com/VigoZhao/AI-Visual-Prompt-Cookbook,Curated collection of reusable JSON prompt templates & style references for AI image generation. Updated daily.,2026-05-11 06:39:51+00:00,2026-06-09 08:39:56+00:00,249,27,249,0,Python,76034,MIT,29,8.586206896551724,0.108433734939759,0.0,AI/ML
1239226792,rockorager/comview,rockorager,comview,https://github.com/rockorager/comview,the best diff viewer ever made,2026-05-14 22:17:40+00:00,2026-06-02 14:01:40+00:00,249,17,249,2,Go,1969,MIT,26,9.576923076923077,0.0682730923694779,0.0080321285140562,Other
1237739069,gonemedia/aipointer,gonemedia,aipointer,https://github.com/gonemedia/aipointer,"AI cursor assistant for macOS, Windows, Linux. Hold a hotkey, ask a question about what's on your screen, get an instant answer. Vision-capable AI overlay with OpenRouter, Anthropic, OpenAI, Gemini. Local-first, BYO key, no telemetry.",2026-05-13 13:13:57+00:00,2026-05-31 19:52:38+00:00,249,27,249,1,TypeScript,1472,NOASSERTION,27,9.22222222222222,0.108433734939759,0.0040160642570281,AI/ML
1255469819,eversinc33/MogVMP,eversinc33,MogVMP,https://github.com/eversinc33/MogVMP,Static devirtualizer for VMProtect 3.0-3.5. Lifts virtualized code to LLVM using Remill and strips the VM layer through optimization.,2026-05-31 21:36:37+00:00,2026-06-02 11:34:13+00:00,248,18,248,4,C++,32681,,9,27.55555555555556,0.0725806451612903,0.0161290322580645,Other
1237521012,PlaceNL2026/best-of-algorithmic-trading,PlaceNL2026,best-of-algorithmic-trading,https://github.com/PlaceNL2026/best-of-algorithmic-trading,algorithmic trading curated list quant finance trading bots backtesting technical analysis crypto open-source freqtrade hummingbot fintech Python TypeScript resources MCP quantopian-style rankings,2026-05-13 09:00:07+00:00,2026-05-13 09:01:03+00:00,248,2059,248,1,TypeScript,2888,CC-BY-SA-4.0,27,9.185185185185183,8.30241935483871,0.0040322580645161,AI/ML
1235812056,ahalpha/Snowbreak-AnitAmend,ahalpha,Snowbreak-AnitAmend,https://github.com/ahalpha/Snowbreak-AnitAmend,尘白禁区反和谐模组 Snowbreak: Containment Zone Anti Amend / Censorship Mod,2026-05-11 17:19:17+00:00,2026-05-16 16:21:38+00:00,245,14,245,5,Lua,492468,,29,8.448275862068966,0.0571428571428571,0.0204081632653061,Other
1257638955,SenhorH/tab-labeler,SenhorH,tab-labeler,https://github.com/SenhorH/tab-labeler,Rename browser tabs locally and bring order to chaotic sessions.,2026-06-02 21:45:25+00:00,2026-06-02 21:46:47+00:00,244,14,244,3,TypeScript,48,MIT,7,34.857142857142854,0.0573770491803278,0.0122950819672131,Other
1254765696,vannyben7/course-learning-workspace,vannyben7,course-learning-workspace,https://github.com/vannyben7/course-learning-workspace,,2026-05-31 01:23:16+00:00,2026-05-31 01:36:13+00:00,244,3,244,0,Python,133,MIT,9,27.11111111111111,0.0122950819672131,0.0,Other
1247294654,Liset999/ZenDesktop,Liset999,ZenDesktop,https://github.com/Liset999/ZenDesktop,"A ultra-lightweight, high-performance Windows desktop and taskbar enhancement utility with a native C++ Windhawk mod and a standalone tray daemon.",2026-05-23 06:02:24+00:00,2026-06-06 18:33:46+00:00,244,7,244,1,C++,1910,,17,14.352941176470589,0.0286885245901639,0.0040983606557377,Other
1235452828,QuanjianSong/FashionChameleon,QuanjianSong,FashionChameleon,https://github.com/QuanjianSong/FashionChameleon,"Official Pytorch Code of the Paper ""FashionChameleon: Towards Real-Time and Interactive Human-Garment Video Customization""",2026-05-11 10:41:01+00:00,2026-05-31 09:17:10+00:00,243,12,243,2,Python,22579,Apache-2.0,29,8.379310344827585,0.0493827160493827,0.0082304526748971,AI/ML
1237841602,justxor/MachineLearningRoadmap,justxor,MachineLearningRoadmap,https://github.com/justxor/MachineLearningRoadmap,Полный Roadmap по машинному обучению 2026 ,2026-05-13 15:00:31+00:00,2026-06-03 10:52:26+00:00,242,48,242,0,Unknown,1522,,27,8.962962962962964,0.1983471074380165,0.0,Other
1239423873,tszdanger/RealMythos,tszdanger,RealMythos,https://github.com/tszdanger/RealMythos,"Public reconstruction of Claude Mythos as an open cybersecurity reasoning stack: datasets, models, reproducible environments, and trace infrastructure.",2026-05-15 04:40:16+00:00,2026-06-08 04:32:57+00:00,242,29,242,0,Python,275,,25,9.68,0.1198347107438016,0.0,AI/ML
1236147743,entropyvortex/meta-llm-charter,entropyvortex,meta-llm-charter,https://github.com/entropyvortex/meta-llm-charter,Compact operational charter that turns LLM coding agents into disciplined principal engineers. Eleven rules + one meta-rule.,2026-05-12 01:51:04+00:00,2026-05-31 22:00:23+00:00,241,19,241,0,TypeScript,69,MIT,28,8.607142857142858,0.0788381742738589,0.0,AI/ML
1256706847,zonghaoyuan/infiplot,zonghaoyuan,infiplot,https://github.com/zonghaoyuan/infiplot,InfiPlot is the world's first interactive plot game that AI generates all text and images in real-time. InfiPlot是全球首个由 AI 实时生成全部图文内容的交互式剧情游戏,2026-06-02 02:49:30+00:00,2026-06-09 16:24:28+00:00,241,36,241,0,TypeScript,92648,AGPL-3.0,7,34.42857142857143,0.1493775933609958,0.0,AI/ML
1248414534,jake-stewart/tuie,jake-stewart,tuie,https://github.com/jake-stewart/tuie,"A rich, performant TUI library for Rust.",2026-05-24 16:00:45+00:00,2026-06-09 14:22:51+00:00,240,13,240,0,Rust,609,MIT,16,15.0,0.0541666666666666,0.0,CLI/Tooling
1239140279,exploitbench/exploitbench,exploitbench,exploitbench,https://github.com/exploitbench/exploitbench,"ExploitBench measures how far AI agents climb, from reaching vulnerable code, to triggering the bug, to building exploit primitives, to arbitrary code execution.",2026-05-14 19:57:32+00:00,2026-05-16 00:15:09+00:00,240,16,240,3,Python,655,MIT,26,9.23076923076923,0.0666666666666666,0.0125,AI/ML
1237465820,AnttiHero/lavern,AnttiHero,lavern,https://github.com/AnttiHero/lavern,"An agentic law firm. Yours. 67 specialist AI agents that review documents through evidence-backed debate, with mandatory human gates and a 10-pass verification loop. Apache 2.0.",2026-05-13 07:56:41+00:00,2026-05-29 08:31:01+00:00,239,76,239,4,TypeScript,332689,Apache-2.0,27,8.851851851851851,0.3179916317991632,0.0167364016736401,AI/ML
1236024834,minghe36/haoone-app,minghe36,haoone-app,https://github.com/minghe36/haoone-app,新一代 AI 专业字幕软件，支持 mac 与 Windows。中英转录识别准确率超过 96%，词语音频对齐率 98%，基于 Qwen3-ASR 。带有专业字幕编辑器、命令行工具、Skill，达芬奇字幕插件，PR 字幕插件，本地转录、远程转录、文稿匹配、智能拆行、AI校正、AI 智能热词、翻译、双语字幕、专业字幕编辑器、字幕合成、自定义大模型 API...,2026-05-11 22:04:28+00:00,2026-06-08 01:58:58+00:00,239,0,239,1,MDX,7560,,29,8.241379310344827,0.0,0.00418410041841,AI/ML
1251356527,FoundZiGu/SMSBazaar,FoundZiGu,SMSBazaar,https://github.com/FoundZiGu/SMSBazaar,OPENAI(ChatGPT) 短信接码价格和库存对比看板,2026-05-27 13:52:59+00:00,2026-06-02 23:21:48+00:00,238,36,238,2,JavaScript,129,MIT,13,18.307692307692307,0.1512605042016806,0.0084033613445378,Other
1248216427,uu201/character-arc,uu201,character-arc,https://github.com/uu201/character-arc,弧光 · AI 小说创作桌面应用，集项目设定、角色关系、剧情大纲、章节写作与多模型 AI 协作于一体,2026-05-24 10:49:16+00:00,2026-06-10 08:40:33+00:00,238,33,238,10,TypeScript,7590,MIT,16,14.875,0.1386554621848739,0.042016806722689,AI/ML
1248372602,ziyuwowo/mllm-jailbreak-bench,ziyuwowo,mllm-jailbreak-bench,https://github.com/ziyuwowo/mllm-jailbreak-bench,Reproducible benchmark for adversarial attacks on multimodal large language models,2026-05-24 15:00:25+00:00,2026-05-24 15:00:28+00:00,237,50,237,0,Python,40,NOASSERTION,16,14.8125,0.2109704641350211,0.0,Other
1238121308,dexhorthy/shannon,dexhorthy,shannon,https://github.com/dexhorthy/shannon,alternative to claude -p that lifecycles interactive sessions in tmux,2026-05-13 20:43:49+00:00,2026-05-13 22:26:43+00:00,236,17,236,3,TypeScript,390,MIT,27,8.74074074074074,0.0720338983050847,0.0127118644067796,AI/ML
1252117557,imcuttle/flipbook-app,imcuttle,flipbook-app,https://github.com/imcuttle/flipbook-app,🎨 点击式探索的知识画册，长按图片生成带标注子图 | Flipbook Canvas — click-to-explore knowledge picture-book. Long-press any image to spawn an annotated child diagram via a pluggable multimodal pipeline (LLM + image gen + web search + OCR). ,2026-05-28 07:52:00+00:00,2026-06-05 09:16:49+00:00,236,11,236,0,JavaScript,825606,,12,19.666666666666668,0.0466101694915254,0.0,AI/ML
1246595519,YOUSTHEONE/FH6Auto,YOUSTHEONE,FH6Auto,https://github.com/YOUSTHEONE/FH6Auto,Forza Horizon 6 Automation Tool / Super Wheelspin,2026-05-22 10:56:39+00:00,2026-06-05 04:00:11+00:00,236,38,236,55,Python,111199,,18,13.11111111111111,0.1610169491525423,0.2330508474576271,CLI/Tooling
1235852606,extend-hq/ui,extend-hq,ui,https://github.com/extend-hq/ui,,2026-05-11 18:06:09+00:00,2026-06-10 01:07:58+00:00,236,16,236,1,TypeScript,10458,NOASSERTION,29,8.137931034482758,0.0677966101694915,0.0042372881355932,Other
1236315300,VirtualLUOUCAS/Chronicles-OCR,VirtualLUOUCAS,Chronicles-OCR,https://github.com/VirtualLUOUCAS/Chronicles-OCR,"Chronicles-OCR: A Cross-Temporal Perception Benchmark for the Evolutionary Trajectory of Chinese Characters (Seven Chinese Scripts, 2800 images)",2026-05-12 06:22:17+00:00,2026-06-02 03:51:24+00:00,236,12,236,0,Python,2743,,28,8.428571428571429,0.0508474576271186,0.0,Other
1244090374,THUYRan/Legal-Skills-Chinese,THUYRan,Legal-Skills-Chinese,https://github.com/THUYRan/Legal-Skills-Chinese,,2026-05-20 00:41:03+00:00,2026-06-07 06:43:27+00:00,235,33,235,2,Unknown,1205,,20,11.75,0.1404255319148936,0.0085106382978723,Other
1262110699,ziqihe10-droid/xuefeng-agent,ziqihe10-droid,xuefeng-agent,https://github.com/ziqihe10-droid/xuefeng-agent,AI 高考志愿顾问 — 会追问、会分析、敢说真话,2026-06-07 15:33:07+00:00,2026-06-10 07:25:35+00:00,235,29,235,5,Python,17524,MIT,2,117.5,0.1234042553191489,0.0212765957446808,AI/ML
1236390840,open-energy-transition/grid2poster,open-energy-transition,grid2poster,https://github.com/open-energy-transition/grid2poster,Design posters showcasing your country's electrical grid,2026-05-12 07:50:34+00:00,2026-06-09 06:58:07+00:00,235,18,235,1,Python,502370,MIT,28,8.392857142857142,0.076595744680851,0.0042553191489361,Other
1253974459,bernardohcrocha/persistia-for-claude-code,bernardohcrocha,persistia-for-claude-code,https://github.com/bernardohcrocha/persistia-for-claude-code,Give Claude Code the persistent memory it was missing and turn it into your operational co-pilot.,2026-05-30 02:09:45+00:00,2026-06-10 03:01:50+00:00,235,0,235,1,HTML,356,MIT,10,23.5,0.0,0.0042553191489361,AI/ML
1248795924,GU-Cryptography/anykb,GU-Cryptography,anykb,https://github.com/GU-Cryptography/anykb,AnyKB — 私有 RAG 知识库 + 透明 Agent,2026-05-25 04:02:27+00:00,2026-06-03 00:55:15+00:00,234,7,234,0,Python,575,,15,15.6,0.0299145299145299,0.0,AI/ML
1237573710,google-deepmind/alphaproof-nexus-results,google-deepmind,alphaproof-nexus-results,https://github.com/google-deepmind/alphaproof-nexus-results,Lean math proofs generated by AlphaProof Nexus and accompanying natural language prose proofs.,2026-05-13 09:59:21+00:00,2026-06-05 14:10:22+00:00,233,18,233,1,Lean,1923,Apache-2.0,27,8.62962962962963,0.0772532188841201,0.0042918454935622,Other
1241515224,PEPETII/danmuai,PEPETII,danmuai,https://github.com/PEPETII/danmuai,"Windows AI danmaku assistant. Web console (FastAPI + pywebview), OBS live overlay (SSE), multi-provider (Doubao, DashScope, MiMo).",2026-05-17 13:41:39+00:00,2026-06-09 15:00:44+00:00,232,11,232,2,Python,81565,NOASSERTION,23,10.08695652173913,0.0474137931034482,0.0086206896551724,AI/ML
1241263123,NTU-AI4X/ConceptSeg-R1,NTU-AI4X,ConceptSeg-R1,https://github.com/NTU-AI4X/ConceptSeg-R1,Segment Any Concept via Meta-Reinforcement Learning,2026-05-17 06:50:55+00:00,2026-06-03 09:27:19+00:00,232,19,232,0,Python,33580,,23,10.08695652173913,0.0818965517241379,0.0,Other
1259676981,PlummersSoftwareLLC/TinyRetroPad,PlummersSoftwareLLC,TinyRetroPad,https://github.com/PlummersSoftwareLLC/TinyRetroPad,,2026-06-04 18:43:16+00:00,2026-06-06 18:18:04+00:00,231,13,231,4,Assembly,116,Apache-2.0,5,46.2,0.0562770562770562,0.0173160173160173,Other
1249218782,BJTUpupil/AscendFHE,BJTUpupil,AscendFHE,https://github.com/BJTUpupil/AscendFHE,,2026-05-25 13:24:04+00:00,2026-05-28 03:36:45+00:00,231,10,231,0,C++,110,GPL-2.0,15,15.4,0.0432900432900432,0.0,Other
1237537915,mattenarle10/markamd,mattenarle10,markamd,https://github.com/mattenarle10/markamd,"🐙 local markdown, live markdown editor + live preview built with tauri + react.",2026-05-13 09:19:55+00:00,2026-06-10 07:29:18+00:00,231,13,231,2,TypeScript,7539,MIT,27,8.555555555555555,0.0562770562770562,0.0086580086580086,Web
1244270669,physx-omni/PhysX-Omni,physx-omni,PhysX-Omni,https://github.com/physx-omni/PhysX-Omni,"PhysX-Omni: Unified Simulation-Ready Physical 3D Generation for Rigid, Deformable, and Articulated Objects",2026-05-20 05:45:58+00:00,2026-05-21 07:01:06+00:00,231,10,231,1,Jupyter Notebook,31329,NOASSERTION,20,11.55,0.0432900432900432,0.0043290043290043,Other
1260940283,tryproduck/produck-oss,tryproduck,produck-oss,https://github.com/tryproduck/produck-oss,Helping startups accelerate PMF,2026-06-06 03:43:20+00:00,2026-06-06 04:06:47+00:00,229,0,229,0,Unknown,1,,3,76.33333333333333,0.0,0.0,Other
1247187253,kppox/polymarket-copy-bot,kppox,polymarket-copy-bot,https://github.com/kppox/polymarket-copy-bot,polymarket copy polymarket copy polymarket copy polymarket copy polymarket copy polymarket copy polymarket copy polymarket copy polymarket copy polymarket copy polymarket copy polymarket copy polymarket copy polymarket copy polymarket copy polymarket copy polymarket copy polymarket copy,2026-05-23 02:11:44+00:00,2026-06-10 05:53:07+00:00,228,4966,228,0,TypeScript,511,,17,13.411764705882351,21.78070175438597,0.0,Finance/Trading
1251122133,stepfun-ai/Step-3.7-Flash,stepfun-ai,Step-3.7-Flash,https://github.com/stepfun-ai/Step-3.7-Flash,,2026-05-27 09:06:25+00:00,2026-06-01 06:58:45+00:00,228,19,228,3,Unknown,992,Apache-2.0,13,17.53846153846154,0.0833333333333333,0.0131578947368421,Other
1255326646,haaarshsingh/halftone-dots,haaarshsingh,halftone-dots,https://github.com/haaarshsingh/halftone-dots,,2026-05-31 17:35:07+00:00,2026-05-31 19:33:56+00:00,228,18,228,0,TypeScript,9024,MIT,9,25.33333333333333,0.0789473684210526,0.0,Other
1241163667,lwwywang/AW4SR-academic-website-4-senior-researcher,lwwywang,AW4SR-academic-website-4-senior-researcher,https://github.com/lwwywang/AW4SR-academic-website-4-senior-researcher,"Conventional academic websites work well for basic information, but lack a structured way for senior researchers to present their work. **AW4SR** fills that gap.",2026-05-17 03:15:51+00:00,2026-05-21 16:16:44+00:00,228,22,228,2,TypeScript,1562,,23,9.91304347826087,0.0964912280701754,0.0087719298245614,Other
1238129424,orinimron123/CVE-2026-40369-EXPLOIT,orinimron123,CVE-2026-40369-EXPLOIT,https://github.com/orinimron123/CVE-2026-40369-EXPLOIT,Full exploit code for CVE-2026-40369 - A Windows kernel arbitrary write vulnerability that allows browser sandbox escape from all browsers render process sandbox,2026-05-13 20:56:15+00:00,2026-05-18 21:29:59+00:00,228,51,228,0,C++,126,,27,8.444444444444445,0.2236842105263158,0.0,Security
1238996909,ZJU-REAL/SDAR,ZJU-REAL,SDAR,https://github.com/ZJU-REAL/SDAR,"Official code for ""Self-Distilled Agentic Reinforcement Learning""",2026-05-14 16:54:03+00:00,2026-05-27 04:27:16+00:00,227,15,227,4,Python,39242,Apache-2.0,26,8.73076923076923,0.066079295154185,0.0176211453744493,Other
1250707188,facebookresearch/atlas-lean,facebookresearch,atlas-lean,https://github.com/facebookresearch/atlas-lean,ATLAS Autoformalized Textbook Library At Scale,2026-05-26 22:31:48+00:00,2026-06-02 17:28:59+00:00,227,23,227,2,Lean,12847,NOASSERTION,14,16.214285714285715,0.1013215859030837,0.0088105726872246,Other
1247193229,sitodowubb/polymarket-arbitrage-bot,sitodowubb,polymarket-arbitrage-bot,https://github.com/sitodowubb/polymarket-arbitrage-bot,polymarket arbitrage polymarket arbitrage polymarket arbitrage polymarket arbitrage polymarket arbitrage polymarket arbitrage polymarket arbitrage polymarket arbitrage polymarket arbitrage polymarket arbitrage polymarket arbitrage polymarket arbitrage polymarket arbitrage polymarket arbitrage polymarket arbitrage polymarket arbitrage,2026-05-23 02:25:12+00:00,2026-06-10 01:59:20+00:00,226,7444,226,0,TypeScript,2630,,17,13.294117647058824,32.93805309734513,0.0,Finance/Trading
