id,full_name,owner,name,html_url,description,created_at,pushed_at,stars,forks,watchers,open_issues,primary_language,size,license,age_days,stars_per_day,fork_star_ratio,issue_star_ratio,category
1252258448,2aronS/Duel-Agents,2aronS,Duel-Agents,https://github.com/2aronS/Duel-Agents,"CLI, SDK, and IDE plugins for Duel Agents",2026-05-28 10:45:44+00:00,2026-05-28 10:50:43+00:00,655,18,655,1,TypeScript,47,MIT,4,163.75,0.0274809160305343,0.0015267175572519,AI/ML
1228004380,tolibear/goalbuddy,tolibear,goalbuddy,https://github.com/tolibear/goalbuddy,A better /goal for Codex and Claude Code,2026-05-03 13:16:02+00:00,2026-05-31 23:17:22+00:00,646,54,646,4,JavaScript,22942,MIT,29,22.27586206896552,0.0835913312693498,0.0061919504643962,AI/ML
1228438586,polymarket-developers/mkzmbd4,polymarket-developers,mkzmbd4,https://github.com/polymarket-developers/mkzmbd4,,2026-05-04 02:37:55+00:00,2026-05-04 02:38:06+00:00,646,400,646,0,Python,27,NOASSERTION,28,23.071428571428573,0.6191950464396285,0.0,Other
1233111215,chojs23/concord,chojs23,concord,https://github.com/chojs23/concord,"A feature-rich TUI client for Discord, written in Rust.",2026-05-08 15:51:03+00:00,2026-06-02 08:59:28+00:00,638,31,638,26,Rust,6140,GPL-3.0,24,26.58333333333333,0.0485893416927899,0.0407523510971786,CLI/Tooling
1242413123,hadriansecurity/OpenHack,hadriansecurity,OpenHack,https://github.com/hadriansecurity/OpenHack,"Lightweight, file-based workspace for source-guided whitebox security review.",2026-05-18 12:03:50+00:00,2026-06-01 09:15:34+00:00,631,91,631,1,Python,337,MIT,14,45.07142857142857,0.144215530903328,0.0015847860538827,Security
1241479513,jiujiu532/grok2api,jiujiu532,grok2api,https://github.com/jiujiu532/grok2api,,2026-05-17 12:50:26+00:00,2026-05-29 12:36:22+00:00,629,72,629,6,Python,596,MIT,15,41.93333333333333,0.1144674085850556,0.0095389507154213,Other
1232897321,setube/stackprism,setube,stackprism,https://github.com/setube/stackprism,StackPrism是一款用于检测网页技术栈的浏览器插件。,2026-05-08 11:40:48+00:00,2026-05-28 12:26:03+00:00,622,38,622,1,TypeScript,16108,NOASSERTION,24,25.916666666666668,0.0610932475884244,0.0016077170418006,Other
1250575980,boona13/image-extender,boona13,image-extender,https://github.com/boona13/image-extender,"Seamlessly extend any image in any direction with AI. Open-source web app powered by Gemini via OpenRouter, with Poisson-blended seams and best-of-3 variant picker.",2026-05-26 19:11:44+00:00,2026-05-31 19:39:52+00:00,618,69,618,0,TypeScript,1198,MIT,6,103.0,0.1116504854368932,0.0,AI/ML
1231442651,xiaoqi-7/SheetasToken,xiaoqi-7,SheetasToken,https://github.com/xiaoqi-7/SheetasToken,"Implementation and resources for Sheet as Token, a graph-enhanced framework for multi-sheet spreadsheet understanding and retrieval.",2026-05-07 01:02:54+00:00,2026-05-11 15:02:09+00:00,613,110,613,2,Python,123,,25,24.52,0.1794453507340946,0.0032626427406199,Other
1249866465,ace-trump-tech/DeltaForce-OBS-Locker,ace-trump-tech,DeltaForce-OBS-Locker,https://github.com/ace-trump-tech/DeltaForce-OBS-Locker,"三角洲行动OBS锁头插件 – 基于OBS渲染注入的智能锁头辅助，支持QQ音乐/网易云联精准骨骼识别、平滑自瞄、压枪抑制，稳定过检，提升击杀效率。动加载。DeltaForce OBS Lockhead Plugin – Smart aim assist via OBS injection, supports QQ Music/NetEase Cloud integration. Bone recognition, smooth aimbot, recoil control, stable anti-cheat bypass.",2026-05-26 05:24:10+00:00,2026-06-02 03:31:39+00:00,613,582,613,24,Python,10608,,6,102.16666666666669,0.9494290375203916,0.0391517128874388,Other
1228653314,devmikets/hyperliquid-sdk,devmikets,hyperliquid-sdk,https://github.com/devmikets/hyperliquid-sdk,"hyperliquid sdk | hyperliquid sdk | hyperliquid sdk | hyperliquid sdk | hyperliquid sdk | hyperliquid sdk | hyperliquid sdk | hyperliquid sdk | hyperliquid sdk | hyperliquid sdk | hyperliquid sdk | hyperliquid sdk | hyperliquid sdk | hyperliquid sdk - The Hyperliquid API SDK, written in TypeScript, supports all major JavaScript environments.",2026-05-04 08:28:59+00:00,2026-05-15 06:29:08+00:00,613,402,613,2,TypeScript,4824,MIT,28,21.892857142857142,0.6557911908646004,0.0032626427406199,Finance/Trading
1237319927,WantongC/journal-adapt-writing-skill,WantongC,journal-adapt-writing-skill,https://github.com/WantongC/journal-adapt-writing-skill,"Learn any journal's writing conventions from its published papers, then revise your manuscript to match — section by section.",2026-05-13 04:33:17+00:00,2026-05-15 03:18:22+00:00,611,40,611,0,Unknown,177,MIT,19,32.1578947368421,0.0654664484451718,0.0,AI/ML
1228664213,dev-polymarket/clob-client-v2,dev-polymarket,clob-client-v2,https://github.com/dev-polymarket/clob-client-v2,polymarket clob | polymarket clob | polymarket clob | polymarket clob | polymarket clob | polymarket clob | polymarket clob | polymarket clob | polymarket clob | polymarket clob | polymarket clob | polymarket clob | polymarket clob | polymarket clob | polymarket clob | polymarket clob - TypeScript client for Polymarket's CLOB (V2),2026-05-04 08:42:52+00:00,2026-05-13 10:34:01+00:00,605,404,605,2,Unknown,118,MIT,28,21.607142857142858,0.6677685950413224,0.0033057851239669,Finance/Trading
1246386725,zhaoyue4810/pianke,zhaoyue4810,pianke,https://github.com/zhaoyue4810/pianke,,2026-05-22 06:33:38+00:00,2026-05-28 10:04:49+00:00,605,134,605,17,Python,2900,NOASSERTION,10,60.5,0.2214876033057851,0.028099173553719,Other
1234044955,amircloner/g2ray,amircloner,g2ray,https://github.com/amircloner/g2ray,Self-hosted proxy setup running inside GitHub Codespaces — for educational purposes only,2026-05-09 17:18:16+00:00,2026-05-10 19:18:17+00:00,601,2987,601,6,Dockerfile,23,NOASSERTION,23,26.130434782608692,4.9700499168053245,0.0099833610648918,Other
1242867671,evilsocket/audit,evilsocket,audit,https://github.com/evilsocket/audit,An 8-stage vulnerability-discovery agent.,2026-05-18 20:42:44+00:00,2026-05-29 14:16:51+00:00,584,84,584,1,Python,218,MIT,14,41.71428571428572,0.1438356164383561,0.0017123287671232,AI/ML
1235175101,JUk1-GH/gpt-promo-scanner,JUk1-GH,gpt-promo-scanner,https://github.com/JUk1-GH/gpt-promo-scanner,"ChatGPT Team(Business) 促销码自动扫描工具 — 批量发现/验证/价格收集，支持 17 国 34 个码，最高折扣 71% | ChatGPT Business promo code scanner — batch discovery, validation, price collection, 34 codes across 17 countries, up to 71% off",2026-05-11 04:42:18+00:00,2026-05-15 08:41:27+00:00,579,117,579,5,Python,211,MIT,21,27.571428571428573,0.2020725388601036,0.0086355785837651,AI/ML
1245136531,nv-tlabs/PiD,nv-tlabs,PiD,https://github.com/nv-tlabs/PiD,PiD: Fast and High-Resolution Latent Decoding with Pixel Diffusion,2026-05-21 00:22:20+00:00,2026-05-28 16:22:16+00:00,579,26,579,3,Python,2056,NOASSERTION,11,52.63636363636363,0.0449050086355785,0.005181347150259,AI/ML
1244185155,VibeBench/VibeSearchBench,VibeBench,VibeSearchBench,https://github.com/VibeBench/VibeSearchBench,"🔍 The hardest search benchmark in the wild — vague, multi-turn, proactive. 200 long-horizon tasks with persona-driven progressive disclosure, scored by verifiable schema-free knowledge-graph evaluation. No vibes, just triplet F1.",2026-05-20 03:24:57+00:00,2026-05-28 03:21:51+00:00,574,1,574,0,Python,480,MIT,12,47.833333333333336,0.0017421602787456,0.0,Other
1231009237,fendouai/CodexSaver,fendouai,CodexSaver,https://github.com/fendouai/CodexSaver,Make Codex cheaper without making it dumber with DeepSeek.,2026-05-06 14:34:36+00:00,2026-05-31 13:24:32+00:00,567,41,567,0,Python,1986,,26,21.807692307692307,0.0723104056437389,0.0,AI/ML
1239522492,agentic-in/elephant-agent,agentic-in,elephant-agent,https://github.com/agentic-in/elephant-agent,Personal-Model First Self Evolving AI Agent 🐘,2026-05-15 07:08:17+00:00,2026-06-01 02:33:06+00:00,565,60,565,19,Python,199394,,17,33.23529411764706,0.1061946902654867,0.0336283185840707,AI/ML
1248747220,nv-tlabs/Gamma-World,nv-tlabs,Gamma-World,https://github.com/nv-tlabs/Gamma-World,Implementation of Gamma-World: Generative Multi-Agent World Modeling Beyond Two Players,2026-05-25 02:35:01+00:00,2026-05-28 01:59:36+00:00,564,7,564,1,Unknown,25285,,7,80.57142857142857,0.0124113475177304,0.00177304964539,AI/ML
1231342524,PentHertz/LUKSbox,PentHertz,LUKSbox,https://github.com/PentHertz/LUKSbox,"Store sensitive files in the cloud, or on shared media without trusting the host. LUKSbox is a Rust-based encrypted-container tool with passphrase, FIDO2 (YubiKey, Titan, Nitrokey, Windows Hello), TPM 2.0, and hybrid post-quantum (ML-KEM-768 / 1024) keyslots. Mounts as a real drive on Linux, macOS, and Windows.",2026-05-06 21:47:11+00:00,2026-06-02 08:48:48+00:00,560,46,560,3,Rust,4749,Apache-2.0,26,21.53846153846154,0.0821428571428571,0.0053571428571428,AI/ML
1239993295,dtnewman/burn-baby-burn,dtnewman,burn-baby-burn,https://github.com/dtnewman/burn-baby-burn,Be the most productive engineer on your team 🚀🚀🚀,2026-05-15 16:51:59+00:00,2026-05-21 15:38:15+00:00,558,12,558,8,Shell,5476,MIT,17,32.8235294117647,0.021505376344086,0.014336917562724,CLI/Tooling
1235604959,XiaoLuoLYG/GOD,XiaoLuoLYG,GOD,https://github.com/XiaoLuoLYG/GOD,"Govern, Observe, Direct - a real-time control room for agent societies",2026-05-11 13:35:48+00:00,2026-06-01 07:30:26+00:00,557,79,557,13,Python,67579,Apache-2.0,21,26.52380952380953,0.1418312387791741,0.0233393177737881,AI/ML
1230541272,darkrishabh/agent-skills-eval,darkrishabh,agent-skills-eval,https://github.com/darkrishabh/agent-skills-eval,A test runner for agentskills.io-style AI agent skills,2026-05-06 05:10:29+00:00,2026-05-20 20:37:23+00:00,556,27,556,3,TypeScript,81,MIT,26,21.384615384615383,0.0485611510791366,0.0053956834532374,AI/ML
1233119393,PaperGuru-AI/PaperGuru-Benchmark,PaperGuru-AI,PaperGuru-Benchmark,https://github.com/PaperGuru-AI/PaperGuru-Benchmark,"Lifecycle-Aware Memory for long-horizon LLM agents — 66.05% on PaperBench, 94.66% on SurveyBench, 10 peer-reviewed acceptances at FSE/ICML/TOSEM/AEI/ICoGB",2026-05-08 16:01:28+00:00,2026-05-30 06:37:11+00:00,553,85,553,0,TeX,372654,NOASSERTION,24,23.041666666666668,0.1537070524412296,0.0,AI/ML
1238377818,B3hnamR/PsiphonOverMITM,B3hnamR,PsiphonOverMITM,https://github.com/B3hnamR/PsiphonOverMITM,,2026-05-14 04:19:09+00:00,2026-05-14 10:31:14+00:00,547,82,547,16,PowerShell,30350,,18,30.38888888888889,0.149908592321755,0.0292504570383912,Other
1228202170,LayrKits/Sprite-Pipeline,LayrKits,Sprite-Pipeline,https://github.com/LayrKits/Sprite-Pipeline,2D Sprite Sheet Creation Pipeline,2026-05-03 18:19:20+00:00,2026-05-10 12:21:02+00:00,546,58,546,1,Python,274,,29,18.82758620689655,0.1062271062271062,0.0018315018315018,Other
1227764627,JustLikeCheese/LGBT-Prompt,JustLikeCheese,LGBT-Prompt,https://github.com/JustLikeCheese/LGBT-Prompt,"利用 AI 对 LGBT 弱势群体的 ""同情偏向"" 让他执行原先会被拒绝的请求",2026-05-03 06:11:46+00:00,2026-05-05 04:33:27+00:00,546,51,546,3,HTML,63,MIT,29,18.82758620689655,0.0934065934065934,0.0054945054945054,AI/ML
1238606716,rpamis/comet,rpamis,comet,https://github.com/rpamis/comet,Comet: OpenSpec + Superpowers dual-star development workflow,2026-05-14 09:22:35+00:00,2026-06-02 08:00:30+00:00,545,81,545,22,TypeScript,2676,MIT,18,30.27777777777778,0.1486238532110091,0.0403669724770642,AI/ML
1233569086,Sayhi-bzb/Agent-HTML,Sayhi-bzb,Agent-HTML,https://github.com/Sayhi-bzb/Agent-HTML,You don't need a chat ui but a canvas with ai.,2026-05-09 05:22:38+00:00,2026-06-02 10:15:19+00:00,538,17,538,0,TypeScript,37132,Apache-2.0,23,23.39130434782609,0.0315985130111524,0.0,AI/ML
1232370714,BerriAI/litellm-agent-platform,BerriAI,litellm-agent-platform,https://github.com/BerriAI/litellm-agent-platform,"Self-hosted platform for running coding agents (Claude Code, Codex, Hermes) in isolated sandboxes with vault proxy. ",2026-05-07 21:35:39+00:00,2026-06-02 05:44:39+00:00,537,56,537,30,TypeScript,72914,MIT,25,21.48,0.1042830540037244,0.0558659217877094,AI/ML
1230179862,ProAlit/aio-downloader,ProAlit,aio-downloader,https://github.com/ProAlit/aio-downloader,regain your freedom and break gfw!,2026-05-05 18:53:30+00:00,2026-06-02 10:43:58+00:00,531,1236,531,0,Unknown,27069885,GPL-3.0,27,19.666666666666668,2.327683615819209,0.0,Other
1239890796,datacurve-ai/deep-swe,datacurve-ai,deep-swe,https://github.com/datacurve-ai/deep-swe,"Measuring frontier coding agents on original, long-horizon engineering tasks",2026-05-15 14:49:34+00:00,2026-06-01 21:52:47+00:00,531,28,531,20,Shell,1516,,17,31.235294117647054,0.0527306967984934,0.0376647834274952,AI/ML
1234345172,virgo777/buddyme,virgo777,buddyme,https://github.com/virgo777/buddyme,"Lightweight agent framework with layered personality evolution, three-tier skill loading and heartbeat memory system.",2026-05-10 04:04:49+00:00,2026-05-12 04:32:55+00:00,530,61,530,1,Python,276,,22,24.09090909090909,0.1150943396226415,0.0018867924528301,AI/ML
1245319446,sandiiarov/skill-creator,sandiiarov,skill-creator,https://github.com/sandiiarov/skill-creator,"Turn any MCP server, OpenAPI spec, or GraphQL endpoint into a CLI at runtime.",2026-05-21 05:45:40+00:00,2026-05-29 12:00:31+00:00,530,71,530,0,TypeScript,576,MIT,11,48.18181818181818,0.1339622641509434,0.0,AI/ML
1228013205,jherrodthomas/robotics-skills-suite,jherrodthomas,robotics-skills-suite,https://github.com/jherrodthomas/robotics-skills-suite,"76 audit-ready Claude skills automating the industrial robot, cobot, AMR, ROS2, V&V, AI/ML, and IEC 62443 lifecycle. 38 builder + reviewer pairs anchored to ISO 10218, 13849, 62061, 12100, 9283, 15066, 3691-4, and IEC 62443.",2026-05-03 13:30:01+00:00,2026-06-01 13:41:03+00:00,518,22,518,5,Unknown,592,MIT,29,17.862068965517242,0.0424710424710424,0.0096525096525096,AI/ML
1229167008,L1v1ng0ffTh3L4N/EdgeSavedPasswordsDumper,L1v1ng0ffTh3L4N,EdgeSavedPasswordsDumper,https://github.com/L1v1ng0ffTh3L4N/EdgeSavedPasswordsDumper,Proof of concept to show that Edge stores credentials in cleartext,2026-05-04 19:12:35+00:00,2026-05-27 20:45:06+00:00,516,110,516,1,C#,27,,28,18.428571428571427,0.2131782945736434,0.001937984496124,Other
1239864142,shannhk/hermes-agent-control-room,shannhk,hermes-agent-control-room,https://github.com/shannhk/hermes-agent-control-room,Control Room-first template for managing Hermes agents from one VPS agent to specialist teams and orchestrated workflows,2026-05-15 14:18:45+00:00,2026-05-16 19:30:12+00:00,515,86,515,0,Shell,1781,MIT,17,30.294117647058822,0.1669902912621359,0.0,AI/ML
1239811673,nkzw-tech/codiff,nkzw-tech,codiff,https://github.com/nkzw-tech/codiff,a fast local diff viewer,2026-05-15 13:17:31+00:00,2026-06-02 05:17:36+00:00,510,25,510,2,TypeScript,5830,MIT,17,30.0,0.0490196078431372,0.0039215686274509,Other
1228217659,ScenemaAI/scenema-audio,ScenemaAI,scenema-audio,https://github.com/ScenemaAI/scenema-audio,"Zero-shot expressive voice cloning and speech generation. Generate anything from short clips to full-length audiobooks with realistic emotional delivery, pacing, and breath   control. Clone any voice from a 10-second reference and perform emotions the original speaker never recorded.",2026-05-03 18:44:50+00:00,2026-05-15 11:57:15+00:00,507,73,507,10,Python,114,MIT,29,17.482758620689655,0.1439842209072978,0.019723865877712,Other
1228490158,ThisIsDara/mhr-cfw-go,ThisIsDara,mhr-cfw-go,https://github.com/ThisIsDara/mhr-cfw-go,A local proxy that runs on your machine and forwards traffic through Google.,2026-05-04 04:24:15+00:00,2026-05-14 09:40:27+00:00,506,53,506,8,Go,73,MIT,28,18.071428571428573,0.1047430830039525,0.0158102766798418,Other
1231741292,7as0nch/mimo2codex,7as0nch,mimo2codex,https://github.com/7as0nch/mimo2codex,让最新版 OpenAI Codex CLI / Codex 桌面端接入主流大模型的本地代理(新增mac/win包支持，后台运行，开机自动重启)。内置 小米 MiMo V2.5/DeepSeek V4 Pro，并提供通用 provider 机制，**OpenAI Chat Completions 兼容**（Qwen / GLM / Kimi / 本地 vLLM / Ollama / LM Studio …）或**原生 Responses API**（OpenAI 自家）的上游接到新版 Codex。把 Codex 的 Responses API 实时翻译成上游的 Chat Completions API，按客户端发的 `model` 字段在 provider 之间自动路由. ,2026-05-07 08:39:38+00:00,2026-06-02 09:53:10+00:00,506,49,506,7,TypeScript,12383,MIT,25,20.24,0.0968379446640316,0.0138339920948616,AI/ML
1228881105,DadsMmoLab/dads-mmo-lab,DadsMmoLab,dads-mmo-lab,https://github.com/DadsMmoLab/dads-mmo-lab,"Offline MMO private servers on Steam Deck. Free guides, Docker scripts & shell installers for classic MMOs. No subscription. No internet. Forever. Visibility:       ✅ Public",2026-05-04 13:27:40+00:00,2026-06-01 03:23:11+00:00,506,45,506,23,Shell,873,,28,18.071428571428573,0.0889328063241106,0.0454545454545454,DevOps
1231072198,browser-use/terminal,browser-use,terminal,https://github.com/browser-use/terminal,Terminal UI to get stuff done in the browser,2026-05-06 15:43:52+00:00,2026-06-02 05:55:54+00:00,495,24,495,8,Rust,8776,MIT,26,19.03846153846154,0.0484848484848484,0.0161616161616161,CLI/Tooling
1234585846,thakur-works/DarkGPT,thakur-works,DarkGPT,https://github.com/thakur-works/DarkGPT,Darkgpt mod free #chatgpt,2026-05-10 11:32:52+00:00,2026-05-10 11:35:23+00:00,494,53,494,0,Unknown,2,,22,22.454545454545453,0.1072874493927125,0.0,Other
1248697773,ytnrvdf/wha-spell-simulator,ytnrvdf,wha-spell-simulator,https://github.com/ytnrvdf/wha-spell-simulator,A fan-made browser-based Witch Hat Atelier spell simulator.,2026-05-25 00:57:33+00:00,2026-05-31 12:16:42+00:00,494,64,494,11,JavaScript,7533,MIT,7,70.57142857142857,0.1295546558704453,0.0222672064777327,Other
1235536039,yliust/Tactile,yliust,Tactile,https://github.com/yliust/Tactile,Tactile: an accessibility-first operating layer for agents.,2026-05-11 12:21:23+00:00,2026-05-29 04:53:15+00:00,493,12,493,0,Python,17725,NOASSERTION,21,23.476190476190474,0.024340770791075,0.0,AI/ML
1228093729,mingli30119/stock-analysis,mingli30119,stock-analysis,https://github.com/mingli30119/stock-analysis,一句话搞定个股分析,2026-05-03 15:32:23+00:00,2026-05-30 15:00:30+00:00,490,86,490,3,Python,1460,MIT,29,16.896551724137932,0.1755102040816326,0.0061224489795918,Other
1234572130,thakur-works/Velocity-Executor,thakur-works,Velocity-Executor,https://github.com/thakur-works/Velocity-Executor,"This repository contains Velocity Executor — a free Roblox script executor for PC built for fast injection, stable performance, and easy access. Includes Level 8 execution in 2026 with no ads, no key checkpoints, and no extra verification.",2026-05-10 11:10:20+00:00,2026-05-10 11:21:25+00:00,489,51,489,0,Unknown,22,GPL-3.0,22,22.227272727272727,0.1042944785276073,0.0,Other
1233603128,tophant-ai/promptbeat,tophant-ai,promptbeat,https://github.com/tophant-ai/promptbeat,Break your AI before they do.,2026-05-09 06:16:58+00:00,2026-05-31 17:06:35+00:00,487,0,487,0,MDX,219,,23,21.17391304347826,0.0,0.0,AI/ML
1231982666,Belkins/ai-dive-deep,Belkins,ai-dive-deep,https://github.com/Belkins/ai-dive-deep,"Vlad's Playbook — the operator's field manual where every artifact is live, clickable, and forwardable. 39 chapters · 25 interactive widgets · 3 embedded case studies (AFC pitch + sanitized client audit). Read it → dive.vladyslavpodoliako.com",2026-05-07 13:26:59+00:00,2026-05-30 17:09:39+00:00,487,0,487,0,MDX,22474,NOASSERTION,25,19.48,0.0,0.0,AI/ML
1239210415,trong776/Roblox-Hub-2026,trong776,Roblox-Hub-2026,https://github.com/trong776/Roblox-Hub-2026,Developer utilities for Roblox game testing — Lua tools for exploring game mechanics and performance. MIT License.,2026-05-14 21:47:53+00:00,2026-05-14 21:49:37+00:00,482,50,482,1,Unknown,3,MIT,18,26.77777777777778,0.1037344398340249,0.0020746887966804,Game
1233530473,shengshu-ai/minWM,shengshu-ai,minWM,https://github.com/shengshu-ai/minWM,A Minimal and Elegant Framework & Tutorial for Real-Time Interactive World Models,2026-05-09 04:04:35+00:00,2026-06-01 12:35:40+00:00,482,4,482,5,Python,18511,Apache-2.0,23,20.956521739130437,0.0082987551867219,0.0103734439834024,Other
1246148135,akitaonrails/ai-memory,akitaonrails,ai-memory,https://github.com/akitaonrails/ai-memory,Solution for long term memory for agent coding CLIs and to facilitate handoff between different agent vendors,2026-05-21 23:23:51+00:00,2026-06-01 14:05:20+00:00,481,50,481,2,Rust,6549,MIT,11,43.72727272727273,0.1039501039501039,0.0041580041580041,AI/ML
1231330338,mykolaharmash/notelet,mykolaharmash,notelet,https://github.com/mykolaharmash/notelet,SwiftUI component for displaying rich release notes inside an app,2026-05-06 21:26:47+00:00,2026-05-20 15:02:16+00:00,481,20,481,2,Swift,30136,MIT,26,18.5,0.0415800415800415,0.0041580041580041,Mobile
1229708435,hoangnb24/harness-experimental,hoangnb24,harness-experimental,https://github.com/hoangnb24/harness-experimental,"Turn any repo into an agent-ready workspace for Claude Code, Codex, Cursor, and other coding agents.",2026-05-05 10:02:30+00:00,2026-06-01 13:33:12+00:00,480,236,480,0,Rust,245,MIT,27,17.77777777777778,0.4916666666666666,0.0,AI/ML
1238829177,S4rdenz/gta-5-mod-menu,S4rdenz,gta-5-mod-menu,https://github.com/S4rdenz/gta-5-mod-menu,"🚀 Dominate GTA V servers with this free, reliable FiveM mod menu featuring ESP, aimbot, and more, designed for Steam and Epic Games versions.",2026-05-14 13:48:33+00:00,2026-05-14 13:57:17+00:00,476,117,476,1,Unknown,7,MIT,18,26.444444444444443,0.245798319327731,0.0021008403361344,Other
1232997470,HiDream-ai/HiDream-O1-Image,HiDream-ai,HiDream-O1-Image,https://github.com/HiDream-ai/HiDream-O1-Image,,2026-05-08 13:36:17+00:00,2026-05-20 09:02:45+00:00,473,28,473,8,Python,62992,MIT,24,19.70833333333333,0.0591966173361522,0.0169133192389006,Other
1254102663,liyue-aigc/female-portrait-director,liyue-aigc,female-portrait-director,https://github.com/liyue-aigc/female-portrait-director,A modular Codex Skill for directing and expanding detailed AI female portrait prompts.,2026-05-30 06:32:54+00:00,2026-06-01 07:54:46+00:00,470,72,470,0,Unknown,1765,MIT,2,235.0,0.1531914893617021,0.0,AI/ML
1230280405,NirDiamant/Agent_Memory_Techniques,NirDiamant,Agent_Memory_Techniques,https://github.com/NirDiamant/Agent_Memory_Techniques,"Agent memory for LLMs: 30 runnable Jupyter notebooks covering conversation buffers, vector stores, knowledge graphs, episodic and semantic memory, MemGPT, Mem0, Letta, Zep, Graphiti, LoCoMo benchmarks, and production patterns.",2026-05-05 21:08:23+00:00,2026-05-31 11:42:37+00:00,470,67,470,1,Jupyter Notebook,7017,Apache-2.0,27,17.40740740740741,0.1425531914893617,0.002127659574468,AI/ML
1236185998,manycoretech/aholo-viewer,manycoretech,aholo-viewer,https://github.com/manycoretech/aholo-viewer,A high performance 3DGS renderer,2026-05-12 02:54:28+00:00,2026-06-02 10:25:05+00:00,469,43,469,0,TypeScript,23642,MIT,20,23.45,0.091684434968017,0.0,Other
1242679355,Klotzkette/claude-fuer-deutsches-recht,Klotzkette,claude-fuer-deutsches-recht,https://github.com/Klotzkette/claude-fuer-deutsches-recht,"⚠️ Experimentelle Skill-Sammlung für deutsches Recht (Arbeits-, Gesellschafts-, Insolvenz-, Datenschutz-, Prozessrecht u.a.) – inzwischen verbessert und im Alltag getestet, aber weiterhin Experiment. Bitte selber ausprobieren, Issues/PRs willkommen! Keine Rechtsberatung. Mandatsgeheimnis (§§ 203/204 StGB, § 43e BRAO), DSGVO, US-Transfer, KI-VO & Co",2026-05-18 16:43:56+00:00,2026-06-02 10:50:43+00:00,465,50,465,1,Python,125629,NOASSERTION,14,33.214285714285715,0.1075268817204301,0.0021505376344086,AI/ML
1230084743,Avarok-Cybersecurity/atlas,Avarok-Cybersecurity,atlas,https://github.com/Avarok-Cybersecurity/atlas,Pure Rust Inference Engine,2026-05-05 16:59:33+00:00,2026-06-02 05:49:51+00:00,460,64,460,32,Rust,20344,AGPL-3.0,27,17.037037037037038,0.1391304347826087,0.0695652173913043,Game
1239965927,trong776/gta-5-mod-menu,trong776,gta-5-mod-menu,https://github.com/trong776/gta-5-mod-menu,"External game enhancement for GTA V single-player. ImGui overlay, no injection, minimal FPS impact. Windows x64, C++17.",2026-05-15 16:18:35+00:00,2026-05-15 16:26:26+00:00,459,160,459,0,Unknown,180,MIT,17,27.0,0.3485838779956427,0.0,Game
1233543984,nickvasilescu/hermes-desktop-os1,nickvasilescu,hermes-desktop-os1,https://github.com/nickvasilescu/hermes-desktop-os1,Hermes Desktop - OS1 Edition: native macOS workspace for Hermes Agent on Orgo cloud computers and SSH hosts,2026-05-09 04:32:48+00:00,2026-05-09 05:01:58+00:00,456,88,456,7,Swift,13898,MIT,23,19.82608695652174,0.1929824561403508,0.0153508771929824,AI/ML
1234429907,konbakuyomu/smartsearch,konbakuyomu,smartsearch,https://github.com/konbakuyomu/smartsearch,,2026-05-10 07:08:47+00:00,2026-05-29 20:49:58+00:00,456,30,456,0,Python,420,MIT,22,20.727272727272727,0.0657894736842105,0.0,Other
1244665294,Unclecheng-li/poc-lab,Unclecheng-li,poc-lab,https://github.com/Unclecheng-li/poc-lab,"Recent CVE PoC & reproduction scripts. Focused on high-severity vulnerabilities across Linux kernel, Windows, macOS and more.",2026-05-20 13:31:52+00:00,2026-06-01 03:40:41+00:00,451,82,451,0,C,1177,MIT,12,37.583333333333336,0.1818181818181818,0.0,Security
1248129407,AmmarkoV/SAM3DBody-cpp,AmmarkoV,SAM3DBody-cpp,https://github.com/AmmarkoV/SAM3DBody-cpp,"Real-time 3D full-body reconstruction from a single camera, Multiperson BVH output, Pure C++ runtime, ONNX + ggml, 70-joint skeleton with hands.",2026-05-24 08:12:55+00:00,2026-06-02 09:26:52+00:00,450,55,450,4,C,1799,MIT,8,56.25,0.1222222222222222,0.0088888888888888,Other
1240535795,SubamanojJ-2004/gta-5-mod-menu,SubamanojJ-2004,gta-5-mod-menu,https://github.com/SubamanojJ-2004/gta-5-mod-menu,"Ultimate Enhancement Toolkit for GTA V — powerful mod menu with ESP, vehicle spawner, recovery features, and clean UI",2026-05-16 08:50:42+00:00,2026-05-16 10:48:23+00:00,446,60,446,0,Unknown,19,MIT,16,27.875,0.1345291479820627,0.0,Other
