id,full_name,owner,name,html_url,description,created_at,pushed_at,stars,forks,watchers,open_issues,primary_language,size,license,age_days,stars_per_day,fork_star_ratio,issue_star_ratio,category
1266797999,DietrichGebert/ponytail,DietrichGebert,ponytail,https://github.com/DietrichGebert/ponytail,Makes your AI agent think like the laziest senior dev in the room. The best code is the code you never wrote.,2026-06-12 00:52:37+00:00,2026-07-09 09:52:05+00:00,78524,4200,78524,82,JavaScript,2016,MIT,26,3020.153846153846,0.0534868320513473,0.0010442667210024,AI/ML
1273138090,baidu/Unlimited-OCR,baidu,Unlimited-OCR,https://github.com/baidu/Unlimited-OCR,Unlimited OCR Works: Welcome the Era of One-shot Long-horizon Parsing.,2026-06-18 08:40:15+00:00,2026-07-03 05:14:30+00:00,13762,1139,13762,51,Python,91742,MIT,20,688.1,0.082764133120186,0.003705856706874,Other
1265025028,XiaomiMiMo/MiMo-Code,XiaomiMiMo,MiMo-Code,https://github.com/XiaomiMiMo/MiMo-Code,MiMo Code: Where Models and Agents Co-Evolve,2026-06-10 11:52:41+00:00,2026-07-09 09:44:10+00:00,11677,1147,11677,722,TypeScript,55522,MIT,28,417.0357142857143,0.098227284405241,0.0618309497302389,AI/ML
1277477208,langchain-ai/openwiki,langchain-ai,openwiki,https://github.com/langchain-ai/openwiki,OpenWiki is a CLI that writes and maintains agent documentation for your codebase.,2026-06-22 23:48:26+00:00,2026-07-09 09:07:24+00:00,9933,662,9933,105,TypeScript,701,MIT,16,620.8125,0.0666465317628108,0.0105708245243128,AI/ML
1264986626,shadcn/improve,shadcn,improve,https://github.com/shadcn/improve,Use your most capable model to audit your codebase and write plans for cheaper models to execute.,2026-06-10 11:06:58+00:00,2026-06-15 06:18:39+00:00,7533,314,7533,10,Unknown,82,MIT,28,269.0357142857143,0.0416832603212531,0.0013274923669188,Other
1266212515,omnigent-ai/omnigent,omnigent-ai,omnigent,https://github.com/omnigent-ai/omnigent,"Omnigent is an open-source AI agent framework and meta-harness: orchestrate Claude Code, Codex, Cursor, Pi, and custom agents — swap harnesses without rewriting, enforce policies and sandboxing, and collaborate in real time from any device.",2026-06-11 12:18:13+00:00,2026-07-09 09:54:17+00:00,6845,915,6845,528,Python,70061,Apache-2.0,27,253.5185185185185,0.1336742147552958,0.0771365960555149,AI/ML
1263648864,cobusgreyling/loop-engineering,cobusgreyling,loop-engineering,https://github.com/cobusgreyling/loop-engineering,"Practical patterns, starters & CLI tools for loop engineering with AI coding agents. Design systems that prompt and orchestrate agents (inspired by Addy Osmani and Boris Cherny). Includes loop-audit, loop-init, loop-cost.",2026-06-09 06:28:20+00:00,2026-07-09 08:04:37+00:00,6759,864,6759,23,JavaScript,2242,MIT,29,233.06896551724137,0.1278295605858855,0.0034028702470779,AI/ML
1281315781,deepseek-ai/DeepSpec,deepseek-ai,DeepSpec,https://github.com/deepseek-ai/DeepSpec,DeepSpec: a full-stack codebase for training and evaluating speculative decoding algorithms,2026-06-26 12:36:05+00:00,2026-07-09 04:37:14+00:00,6485,576,6485,43,Python,4046,MIT,12,540.4166666666666,0.0888203546646106,0.0066306861989205,Other
1273536446,zhongerxin/Cowart,zhongerxin,Cowart,https://github.com/zhongerxin/Cowart,,2026-06-18 16:08:30+00:00,2026-07-05 07:24:00+00:00,4206,326,4206,8,JavaScript,7661,,20,210.3,0.0775083214455539,0.0019020446980504,Other
1287460663,elder-plinius/T3MP3ST,elder-plinius,T3MP3ST,https://github.com/elder-plinius/T3MP3ST,autonomous red teaming platform; multi-agent offensive-security meta-harness,2026-07-02 17:53:55+00:00,2026-07-08 14:25:45+00:00,3997,857,3997,38,TypeScript,2405,AGPL-3.0,6,666.1666666666666,0.2144108081060795,0.0095071303477608,AI/ML
1264722786,makerspet/oomwoo,makerspet,oomwoo,https://github.com/makerspet/oomwoo,Open-source vacuum robot cleaner,2026-06-10 06:03:33+00:00,2026-07-09 04:36:02+00:00,3981,182,3981,7,Python,3790,Apache-2.0,28,142.17857142857142,0.0457171564933433,0.0017583521728208,Other
1277675818,bikini/exploitarium,bikini,exploitarium,https://github.com/bikini/exploitarium,"A single archive of public exploit PoCs and vulnerability research writeups. At the time I post these, none have been reported. Feel free to report them yourself and take credit for the CVE if handed out lulz. Please do not abuse these. I do this so to allure people into the field, and I've always found this is the most efficient way.",2026-06-23 05:14:11+00:00,2026-07-04 06:27:26+00:00,3819,1097,3819,6,Python,363,,15,254.6,0.287247970672951,0.0015710919088766,Security
1265265111,BuilderIO/skills,BuilderIO,skills,https://github.com/BuilderIO/skills,Skills for coding agents,2026-06-10 16:04:20+00:00,2026-07-06 14:42:49+00:00,3565,177,3565,5,JavaScript,4337,MIT,28,127.32142857142856,0.0496493688639551,0.0014025245441795,AI/ML
1278830624,Yu9191/wloc,Yu9191,wloc,https://github.com/Yu9191/wloc,修改 Apple 网络定位（gs-loc）返回坐标 · 支持 Surge / Quantumult X / Loon / Stash · 快捷指令一键设置/恢复定位,2026-06-24 06:15:30+00:00,2026-06-27 23:50:57+00:00,3528,548,3528,30,JavaScript,77,,14,252.0,0.155328798185941,0.0085034013605442,Other
1271113810,vercel/eve,vercel,eve,https://github.com/vercel/eve,The Framework for Building Agents,2026-06-16 10:51:20+00:00,2026-07-09 07:54:14+00:00,3346,275,3346,217,TypeScript,9206,Apache-2.0,22,152.0909090909091,0.0821876867901972,0.0648535564853556,AI/ML
1280278993,baairon/torlink,baairon,torlink,https://github.com/baairon/torlink,"A sleek, zero-setup torrent finder and downloader that lives right in your terminal.",2026-06-25 12:37:15+00:00,2026-07-07 21:32:41+00:00,3343,225,3343,9,TypeScript,147,MIT,13,257.15384615384613,0.0673048160335028,0.0026921926413401,CLI/Tooling
1269395331,Waishnav/devspace,Waishnav,devspace,https://github.com/Waishnav/devspace,Turn ChatGPT into Codex! OR Turn Claude Web into Claude Code!,2026-06-14 16:57:27+00:00,2026-07-07 21:09:51+00:00,3098,324,3098,14,TypeScript,1733,MIT,24,129.08333333333334,0.10458360232408,0.0045190445448676,AI/ML
1288952336,x4gKing/X4G,x4gKing,X4G,https://github.com/x4gKing/X4G,,2026-07-04 06:43:51+00:00,2026-07-04 21:17:32+00:00,2768,5317,2768,6,Python,93,,4,692.0,1.9208815028901731,0.0021676300578034,Other
1277578741,bozhouDev/codex-orange-book,bozhouDev,codex-orange-book,https://github.com/bozhouDev/codex-orange-book,Codex 橙皮书：从安装到实战案例的全链路 Codex 使用指南（非官方开源，含可下载 PDF）,2026-06-23 02:36:54+00:00,2026-07-04 16:05:27+00:00,2756,272,2756,4,HTML,89235,,15,183.7333333333333,0.0986937590711175,0.0014513788098693,AI/ML
1269156190,tamnd/kage,tamnd,kage,https://github.com/tamnd/kage,"Shadow any website for offline viewing, with the JavaScript stripped out",2026-06-14 11:21:55+00:00,2026-07-08 12:45:37+00:00,2719,100,2719,11,Go,1361,MIT,24,113.29166666666669,0.0367782272894446,0.0040456050018389,Other
1267442907,Forward-Future/loopy,Forward-Future,loopy,https://github.com/Forward-Future/loopy,"A library of practical AI-agent loops and an installable skill for finding, adapting, and designing repeatable agent workflows.",2026-06-12 14:44:22+00:00,2026-07-07 21:56:32+00:00,2576,219,2576,1,JavaScript,73040,MIT,26,99.07692307692308,0.0850155279503105,0.0003881987577639,AI/ML
1267485499,vorssaint/vorssaint-utils,vorssaint,vorssaint-utils,https://github.com/vorssaint/vorssaint-utils,"Free open-source macOS menu bar toolkit. Per-app volume mixer, system monitor, dock-preview, keep awake, window switcher (Alt Tab), shelf, app uninstaller, and much more.",2026-06-12 15:25:43+00:00,2026-07-09 09:57:26+00:00,2504,93,2504,3,Swift,46671,GPL-3.0,26,96.3076923076923,0.0371405750798722,0.0011980830670926,Mobile
1273427276,cloudflare/security-audit-skill,cloudflare,security-audit-skill,https://github.com/cloudflare/security-audit-skill,"A coding-agent skill for multi-phase security audits with independently verified, machine-readable findings",2026-06-18 14:08:44+00:00,2026-07-06 13:36:03+00:00,2354,170,2354,1,JavaScript,56,MIT,20,117.7,0.0722175021240441,0.0004248088360237,AI/ML
1266125334,TestSprite/testsprite-cli,TestSprite,testsprite-cli,https://github.com/TestSprite/testsprite-cli,Official TestSprite CLI — AI-powered automated testing from your terminal,2026-06-11 10:44:15+00:00,2026-07-09 04:27:17+00:00,2246,82,2246,41,TypeScript,896,Apache-2.0,27,83.18518518518519,0.0365093499554764,0.0182546749777382,AI/ML
1267357207,lenucksi/aur-malware-check,lenucksi,aur-malware-check,https://github.com/lenucksi/aur-malware-check,Detection tools for the June 2026 atomic-lockfile AUR supply-chain attack. Consolidated from community Gists.,2026-06-12 13:17:07+00:00,2026-07-07 17:16:17+00:00,1982,44,1982,1,Python,352,GPL-3.0,26,76.23076923076923,0.0221997981836528,0.0005045408678102,Other
1273015953,shy3130/tickflow-stock-panel,shy3130,tickflow-stock-panel,https://github.com/shy3130/tickflow-stock-panel,"自托管、零运维的 A 股「选股 + 监控 + 回测」量化工作台 | 基于 TickFlow 数据源  | LLM能力驱使策略定制+个股分析+复盘 | 自由接入第三方数据源与个性化扩展数据 | 个人开源 ,非TickFlow官方项目",2026-06-18 06:18:29+00:00,2026-07-09 09:38:45+00:00,1949,390,1949,19,TypeScript,9869,MIT,20,97.45,0.2001026167265264,0.0097485890200102,AI/ML
1279159149,davidondrej/skills,davidondrej,skills,https://github.com/davidondrej/skills,access to david ondrej's personal agent skills,2026-06-24 12:32:04+00:00,2026-07-09 09:40:39+00:00,1929,252,1929,2,Unknown,93,MIT,14,137.78571428571428,0.1306376360808709,0.0010368066355624,AI/ML
1282768734,Krishnagangwal/CS-Fundamentals,Krishnagangwal,CS-Fundamentals,https://github.com/Krishnagangwal/CS-Fundamentals,"Curated CS fundamentals for placement prep: DSA,Computer Networks, DBMS & SQL, OOPs, Operating Systems, System Design & Software Engineering",2026-06-28 07:08:15+00:00,2026-06-28 07:42:12+00:00,1852,173,1852,3,Unknown,284125,,10,185.2,0.0934125269978401,0.0016198704103671,Data
1288402762,synthetic-sciences/openscience,synthetic-sciences,openscience,https://github.com/synthetic-sciences/openscience,The open-source AI workbench for scientific research,2026-07-03 15:06:45+00:00,2026-07-09 07:48:44+00:00,1848,263,1848,16,TypeScript,50066,Apache-2.0,5,369.6,0.1423160173160173,0.0086580086580086,AI/ML
1278629344,Younesfdj/gitfut,Younesfdj,gitfut,https://github.com/Younesfdj/gitfut,"Your GitHub stats, turned into a World-Cup-style player card ",2026-06-24 01:17:51+00:00,2026-07-09 02:35:56+00:00,1841,79,1841,20,TypeScript,5994,MIT,14,131.5,0.0429114611624117,0.0108636610537751,Other
1284981522,mekos2772/ios-location-spoofer,mekos2772,ios-location-spoofer,https://github.com/mekos2772/ios-location-spoofer,Standalone iOS app to spoof GPS location without jailbreak. Includes Shadowrocket/Surge/Loon/QX/Stash module.,2026-06-30 11:20:30+00:00,2026-07-06 06:36:27+00:00,1829,260,1829,13,JavaScript,6767,AGPL-3.0,8,228.625,0.1421541826134499,0.0071077091306724,Mobile
1264811161,chuspeeism/dashiAI-ppt-skill,chuspeeism,dashiAI-ppt-skill,https://github.com/chuspeeism/dashiAI-ppt-skill,"An AI-agent skill that generates browser-editable presentations from multiple visual themes, exportable to HTML, PDF, and PPTX.",2026-06-10 07:46:43+00:00,2026-07-09 07:08:47+00:00,1712,169,1712,9,JavaScript,97682,AGPL-3.0,28,61.142857142857146,0.098714953271028,0.0052570093457943,AI/ML
1282902275,yynxxxxx/Codex-5.5-codex-instruct-5.5,yynxxxxx,Codex-5.5-codex-instruct-5.5,https://github.com/yynxxxxx/Codex-5.5-codex-instruct-5.5,,2026-06-28 10:24:42+00:00,2026-07-09 04:44:46+00:00,1676,454,1676,0,Python,1600,MIT,10,167.6,0.2708830548926014,0.0,Other
1285705904,isjiamu/gzh-design-skill,isjiamu,gzh-design-skill,https://github.com/isjiamu/gzh-design-skill,把 Markdown 一键排成可直接粘进公众号编辑器的精致 HTML —— 6 套精选主题 + 主题生成器 + 双关卡校验。An AI-agent skill that turns Markdown into paste-ready WeChat article HTML.,2026-07-01 04:28:03+00:00,2026-07-08 13:32:08+00:00,1655,186,1655,2,HTML,289,NOASSERTION,7,236.42857142857144,0.1123867069486404,0.0012084592145015,AI/ML
1265107923,SkyBlue997/enableMacosAI,SkyBlue997,enableMacosAI,https://github.com/SkyBlue997/enableMacosAI,国行 Mac 一键开启完整 Apple 智能(端侧 + Private Cloud Compute 云端)· macOS 27 / Apple Silicon,2026-06-10 13:23:39+00:00,2026-06-13 07:28:36+00:00,1649,89,1649,41,Shell,29,,28,58.892857142857146,0.0539721043056397,0.0248635536688902,CLI/Tooling
1265847218,loc567/loc567,loc567,loc567,https://github.com/loc567/loc567,loc567 是一款完全开源免费的纯网页端iOS模拟定位工具。在线体验地址：https://loc567.com,2026-06-11 06:05:29+00:00,2026-06-19 04:13:24+00:00,1619,215,1619,22,C,540,LGPL-2.1,27,59.96296296296296,0.1327980234712785,0.0135886349598517,Other
1271618207,google-research/tabfm,google-research,tabfm,https://github.com/google-research/tabfm,,2026-06-16 21:06:19+00:00,2026-07-06 21:47:55+00:00,1598,143,1598,22,Python,322,Apache-2.0,22,72.63636363636364,0.0894868585732165,0.013767209011264,Other
1267314128,tutti-os/tutti,tutti-os,tutti,https://github.com/tutti-os/tutti,Where people and agents build in tune.,2026-06-12 12:29:05+00:00,2026-07-09 09:53:14+00:00,1545,128,1545,100,TypeScript,133066,Apache-2.0,26,59.42307692307692,0.0828478964401294,0.0647249190938511,AI/ML
1264716916,levy-street/world-of-claudecraft,levy-street,world-of-claudecraft,https://github.com/levy-street/world-of-claudecraft,,2026-06-10 05:55:59+00:00,2026-07-09 08:58:15+00:00,1541,482,1541,237,TypeScript,650902,MIT,28,55.035714285714285,0.3127839065541856,0.1537962362102531,Other
1264312494,MSNightmare/RoguePlanet,MSNightmare,RoguePlanet,https://github.com/MSNightmare/RoguePlanet,RoguePlanet Windows Defender Vulnerability,2026-06-09 19:10:18+00:00,2026-06-09 19:58:22+00:00,1519,601,1519,9,C++,303,MIT,29,52.37931034482759,0.3956550362080316,0.0059249506254114,Security
1266923310,nolangz/pixel2motion,nolangz,pixel2motion,https://github.com/nolangz/pixel2motion,"AI logo animation skill: turn raster logos into smooth SVG animation, animated HTML demos, GIF/video previews, and motion QA evidence.",2026-06-12 04:25:17+00:00,2026-06-28 05:39:25+00:00,1517,138,1517,6,Python,3610,MIT,26,58.34615384615385,0.090969017798286,0.003955174686882,AI/ML
1287845516,xuchonglang/investing-for-beginners,xuchonglang,investing-for-beginners,https://github.com/xuchonglang/investing-for-beginners,小隐寺投资百科官方公开索引：美股、期权与加密货币知识框架,2026-07-03 03:56:00+00:00,2026-07-09 04:29:10+00:00,1500,95,1500,0,Unknown,455,NOASSERTION,5,300.0,0.0633333333333333,0.0,Other
1268186785,EEliberto/IPA-Download,EEliberto,IPA-Download,https://github.com/EEliberto/IPA-Download,一款用于安装 IPA 历史版本的工具，适用于获取旧版应用并自动捕获数据包。下载后，可直接通过 AirDrop 传输至 iPhone、iPad 上并安装并使用。,2026-06-13 08:32:39+00:00,2026-06-22 01:37:09+00:00,1483,87,1483,0,Swift,67439,Apache-2.0,25,59.32,0.0586648685097774,0.0,Mobile
1291168761,Shpigford/knockoff,Shpigford,knockoff,https://github.com/Shpigford/knockoff,"Chrome extension that filters pseudo-brand junk out of Amazon. Buy from real, established brands.",2026-07-06 15:06:06+00:00,2026-07-08 16:21:03+00:00,1460,43,1460,13,JavaScript,1709,NOASSERTION,2,730.0,0.0294520547945205,0.008904109589041,Other
1284959612,HUANGCHIHHUNGLeo/claude-real-video,HUANGCHIHHUNGLeo,claude-real-video,https://github.com/HUANGCHIHHUNGLeo/claude-real-video,"Let Claude (or any LLM) actually watch a video — scene-aware, deduplicated frames + transcript, from a URL or local file. Runs locally, MIT.",2026-06-30 10:55:02+00:00,2026-07-09 03:31:00+00:00,1434,100,1434,0,Python,1094,MIT,8,179.25,0.0697350069735007,0.0,AI/ML
1275806147,deepreinforce-ai/Ornith-1,deepreinforce-ai,Ornith-1,https://github.com/deepreinforce-ai/Ornith-1,,2026-06-21 06:43:42+00:00,2026-06-27 07:09:36+00:00,1426,135,1426,14,Unknown,5207,MIT,17,83.88235294117646,0.0946704067321178,0.0098176718092566,Other
1288835164,ammaarreshi/Generals-Mac-iOS-iPad,ammaarreshi,Generals-Mac-iOS-iPad,https://github.com/ammaarreshi/Generals-Mac-iOS-iPad,"Command & Conquer Generals: Zero Hour running natively on macOS, iPhone & iPad — real engine (EA GPL v3 source, via GeneralsX), DXVK/MoltenVK renderer, RTS touch controls. No game assets included.",2026-07-04 02:59:39+00:00,2026-07-05 17:23:48+00:00,1378,111,1378,12,C++,45484,NOASSERTION,4,344.5,0.0805515239477503,0.0087082728592162,Mobile
1264478656,plannotator/effective-html,plannotator,effective-html,https://github.com/plannotator/effective-html,"Agent skill for elegant and simple html plans, architecture diagrams, or whatever else you can think of.",2026-06-09 23:24:51+00:00,2026-07-08 04:22:30+00:00,1325,101,1325,2,HTML,155,MIT,29,45.689655172413794,0.0762264150943396,0.0015094339622641,AI/ML
1274547830,Forsy-AI/agent-apprenticeship,Forsy-AI,agent-apprenticeship,https://github.com/Forsy-AI/agent-apprenticeship,"The living ecosystem where AI agents complete tasks through workflow loops, improve through iterative execution, are evaluated by mentor agents or humans in the loop, and turn completed work into reusable work experience and data to improve future agents.",2026-06-19 16:19:37+00:00,2026-07-06 15:17:36+00:00,1313,53,1313,0,Python,985,MIT,19,69.10526315789474,0.0403655750190403,0.0,AI/ML
1265875050,Hypostasis-Cat/HypoMux,Hypostasis-Cat,HypoMux,https://github.com/Hypostasis-Cat/HypoMux,"CN Windows 多网卡带宽叠加工具。无需复杂配置，一键聚合多网卡（有线、Wi-Fi网卡、手机热点等），实现物理级多线下载与叠加网速。 EN Windows multi-NIC bandwidth aggregator. Zero complex setup. One-click to combine multiple networks (Ethernet, Wi-Fi, mobile hotspots, etc.) for physical-level concurrent downloading and multiplied speeds.",2026-06-11 06:38:43+00:00,2026-07-08 09:22:53+00:00,1291,40,1291,9,Python,23045,AGPL-3.0,27,47.81481481481482,0.0309837335398915,0.0069713400464756,Mobile
1288292418,jamesob/local-llm,jamesob,local-llm,https://github.com/jamesob/local-llm,Everything I know about running LLMs locally,2026-07-03 13:06:03+00:00,2026-07-08 10:07:31+00:00,1288,79,1288,2,Shell,10792,,5,257.6,0.061335403726708,0.0015527950310559,CLI/Tooling
1290120400,MaximeRivest/riddle,MaximeRivest,riddle,https://github.com/MaximeRivest/riddle,"The diary of Tom Riddle for the reMarkable Paper Pro — write with your pen, the page drinks your ink and answers in a flowing hand",2026-07-05 15:48:08+00:00,2026-07-07 17:43:20+00:00,1238,95,1238,16,Rust,7120,MIT,3,412.6666666666667,0.0767366720516962,0.0129240710823909,Other
1271627791,rebel0789/codexpro,rebel0789,codexpro,https://github.com/rebel0789/codexpro,Use ChatGPT Developer Mode as a local coding agent for your repo through MCP.,2026-06-16 21:22:43+00:00,2026-07-08 19:38:43+00:00,1235,112,1235,1,JavaScript,320,MIT,22,56.13636363636363,0.0906882591093117,0.0008097165991902,AI/ML
1274950277,lyra81604/zhengxi-views,lyra81604,zhengxi-views,https://github.com/lyra81604/zhengxi-views,可溯源的郑希(易方达基金经理)投研 Agent Skill——基于他全部公开观点原文 + 有原话佐证的投资方法 + 全市场基金真实数据，能溯源问答、按他框架给基金打分，绝不杜撰。⚠️仅研究学习辅助，不构成投资建议‼️website是郑希主页！,2026-06-20 04:27:07+00:00,2026-06-30 09:59:37+00:00,1219,134,1219,0,Python,4901,NOASSERTION,18,67.72222222222223,0.1099261689909762,0.0,AI/ML
1279435409,shepherd-agents/shepherd,shepherd-agents,shepherd,https://github.com/shepherd-agents/shepherd,"A runtime substrate that turns an agent's execution into a reversible, Git-like trace, so meta-agents can observe, fork, replay, and revert any run. Couples agent and environments in a copy-on-write fork ~5x faster than docker commit, with ~95% KV-cache reuse on replay. Framework built for meta-agents to supervise, optimize, and train other agents",2026-06-24 17:26:46+00:00,2026-07-09 02:11:19+00:00,1204,75,1204,6,Python,17854,MIT,14,86.0,0.0622923588039867,0.0049833887043189,AI/ML
1266113070,jd-opensource/JoyAI-VL-Interaction,jd-opensource,JoyAI-VL-Interaction,https://github.com/jd-opensource/JoyAI-VL-Interaction,,2026-06-11 10:30:19+00:00,2026-07-06 08:10:27+00:00,1195,106,1195,20,Python,8752,Apache-2.0,27,44.25925925925926,0.0887029288702929,0.0167364016736401,Other
1270272670,larlarua/AutoCVE,larlarua,AutoCVE,https://github.com/larlarua/AutoCVE,"Agent-driven automated CVE discovery platform for source code auditing, vulnerability verification, and report generation.",2026-06-15 14:50:47+00:00,2026-07-04 18:04:18+00:00,1132,73,1132,16,Python,204473,AGPL-3.0,23,49.21739130434783,0.0644876325088339,0.0141342756183745,AI/ML
1274697585,aidenybai/cnfast,aidenybai,cnfast,https://github.com/aidenybai/cnfast,Fast drop in replacement for `cn`,2026-06-19 19:46:29+00:00,2026-06-22 06:22:08+00:00,1088,11,1088,9,TypeScript,2320,NOASSERTION,19,57.26315789473684,0.010110294117647,0.0082720588235294,Web
1266794943,NO6KIKO/gorest-2d-animation-spritesheet-generator,NO6KIKO,gorest-2d-animation-spritesheet-generator,https://github.com/NO6KIKO/gorest-2d-animation-spritesheet-generator,Codex-assisted local 2D animation spritesheet generator and scene compositing workspace.,2026-06-12 00:46:23+00:00,2026-07-07 15:01:28+00:00,1082,152,1082,1,TypeScript,181947,MIT,26,41.61538461538461,0.1404805914972273,0.0009242144177449,AI/ML
1274399536,sums001/Windows-Copilot-API,sums001,Windows-Copilot-API,https://github.com/sums001/Windows-Copilot-API,Reverse engineered Windows Copilot into an OpenAI-compatible API. Access GPT-4 and GPT-5 models through a simple REST interface without API keys or billing.,2026-06-19 13:24:44+00:00,2026-06-27 16:16:19+00:00,1076,359,1076,2,Python,706,MIT,19,56.63157894736842,0.3336431226765799,0.0018587360594795,AI/ML
1283907968,oomol-lab/open-connector,oomol-lab,open-connector,https://github.com/oomol-lab/open-connector,"Open-source auth gateway connecting 1000+ SaaS providers to AI agents through SDK, CLI, MCP, HTTP, and OpenAPI.",2026-06-29 10:49:36+00:00,2026-07-09 09:55:15+00:00,1057,55,1057,2,TypeScript,10753,Apache-2.0,9,117.44444444444444,0.0520340586565752,0.0018921475875118,AI/ML
1278676835,crazyykhllc-bit/CyberPPT,crazyykhllc-bit,CyberPPT,https://github.com/crazyykhllc-bit/CyberPPT,一个用于生成高密度、可编辑、咨询风格 PowerPoint 的 Codex Skill，支持 SCR 叙事、风格确认和 PPTX 质量检查。,2026-06-24 02:32:21+00:00,2026-07-06 06:58:53+00:00,1045,103,1045,3,Python,17496,MIT,14,74.64285714285714,0.0985645933014354,0.0028708133971291,AI/ML
1266463689,huggingface/tau,huggingface,tau,https://github.com/huggingface/tau,a minimalist agent that teaches you to create coding agents,2026-06-11 16:33:44+00:00,2026-07-09 09:38:19+00:00,1035,121,1035,24,Python,1502,MIT,27,38.333333333333336,0.1169082125603864,0.0231884057971014,AI/ML
1266884317,kunchenguid/firstmate,kunchenguid,firstmate,https://github.com/kunchenguid/firstmate,Talk to one agent. Ship with a crew.,2026-06-12 03:21:10+00:00,2026-07-09 06:19:20+00:00,1014,280,1014,112,Shell,4845,MIT,26,39.0,0.2761341222879684,0.1104536489151873,AI/ML
1278926400,amplifthq/opentag,amplifthq,opentag,https://github.com/amplifthq/opentag,"Open-source @agent mentions for Slack and GitHub. OpenTag routes tagged requests to Codex, Claude Code, then returns results in thread.",2026-06-24 08:05:12+00:00,2026-07-08 23:13:01+00:00,1013,52,1013,10,TypeScript,7494,MIT,14,72.35714285714286,0.0513326752221125,0.0098716683119447,AI/ML
1275653543,fancydirty/mediary-scout,fancydirty,mediary-scout,https://github.com/fancydirty/mediary-scout,Agent-driven media library for your cloud drives (115 / Quark / 光鸭 GuangYaPan).,2026-06-21 01:25:20+00:00,2026-07-09 09:05:47+00:00,1010,52,1010,4,TypeScript,12745,0BSD,17,59.41176470588236,0.0514851485148514,0.0039603960396039,AI/ML
1271432814,ngrok/webernetes,ngrok,webernetes,https://github.com/ngrok/webernetes,Kubernetes in the browser.,2026-06-16 16:52:34+00:00,2026-06-30 01:24:01+00:00,996,57,996,5,TypeScript,1901,Apache-2.0,22,45.27272727272727,0.0572289156626506,0.0050200803212851,DevOps
1269794613,alchaincyf/loop-engineering-orange-book,alchaincyf,loop-engineering-orange-book,https://github.com/alchaincyf/loop-engineering-orange-book,别再问我什么是 Loop Engineering — 橙皮书系列。A plain-language guide to loop engineering (中文 + English PDF). Free.,2026-06-15 05:27:07+00:00,2026-06-15 05:28:06+00:00,980,95,980,0,Unknown,5103,NOASSERTION,23,42.60869565217392,0.096938775510204,0.0,Other
1267982346,eli-labz/Third-Eye,eli-labz,Third-Eye,https://github.com/eli-labz/Third-Eye,A production-grade OSINT platform that provides situational awareness across multiple intelligence domains.,2026-06-13 03:15:46+00:00,2026-06-13 06:29:56+00:00,935,13,935,0,TypeScript,2995,MIT,25,37.4,0.013903743315508,0.0,AI/ML
1287583035,anthropics/jacobian-lens,anthropics,jacobian-lens,https://github.com/anthropics/jacobian-lens, Companion code for the global workspace interpretability paper,2026-07-02 20:30:04+00:00,2026-07-02 20:52:50+00:00,932,139,932,3,Python,1930,Apache-2.0,6,155.33333333333334,0.1491416309012875,0.0032188841201716,Other
1273878424,Augani/dory,Augani,dory,https://github.com/Augani/dory,"A free, open-source native macOS app for Docker & Linux containers, an alternative to OrbStack and Docker Desktop. Universal for Intel and Apple silicon.",2026-06-19 00:54:29+00:00,2026-07-05 03:53:09+00:00,926,21,926,8,Swift,5487,GPL-3.0,19,48.73684210526316,0.0226781857451403,0.0086393088552915,DevOps
