id,full_name,owner,name,html_url,description,created_at,pushed_at,stars,forks,watchers,open_issues,primary_language,size,license,age_days,stars_per_day,fork_star_ratio,issue_star_ratio,category
1278082914,FlavioAdamo/openfit,FlavioAdamo,openfit,https://github.com/FlavioAdamo/openfit,Desktop dashboard and Codex-powered assistant for Fitbit data,2026-06-23 12:54:29+00:00,2026-06-26 17:29:06+00:00,251,31,251,6,TypeScript,1801,,21,11.952380952380953,0.1235059760956175,0.0239043824701195,AI/ML
1270661532,shreyashankar/plain-writing-skill,shreyashankar,plain-writing-skill,https://github.com/shreyashankar/plain-writing-skill,"A plain-language writing skill for AI agents, with a revision view that shows what changed.",2026-06-15 23:49:32+00:00,2026-07-12 04:19:19+00:00,251,10,251,3,HTML,229,,29,8.655172413793103,0.0398406374501992,0.0119521912350597,AI/ML
1272830676,jaredrhod/ai-memory-vault,jaredrhod,ai-memory-vault,https://github.com/jaredrhod/ai-memory-vault,"Give your AI a real, persistent memory. The open-source system plus templates that turn an Obsidian vault into your AI's working memory. No vector database, just markdown.",2026-06-18 01:17:27+00:00,2026-07-14 21:59:10+00:00,249,44,249,0,Unknown,157,NOASSERTION,26,9.576923076923077,0.1767068273092369,0.0,AI/ML
1277561099,Yuuhann1999/codex-storyboard,Yuuhann1999,codex-storyboard,https://github.com/Yuuhann1999/codex-storyboard,本地多项目 Codex 视频分镜工作台，支持图片/视频生成任务、HyperFrames 与 Remotion 自动回填。Local multi-project storyboard workspace for Codex.,2026-06-23 02:09:36+00:00,2026-07-07 15:40:30+00:00,248,37,248,1,JavaScript,28430,MIT,21,11.80952380952381,0.1491935483870967,0.0040322580645161,AI/ML
1281368037,zhaozhaozhiyi/XIAOCHUANGx,zhaozhaozhiyi,XIAOCHUANGx,https://github.com/zhaozhaozhiyi/XIAOCHUANGx,链接一切智能体的工作台,2026-06-26 13:39:28+00:00,2026-07-15 06:52:06+00:00,247,10,247,2,TypeScript,36570,MIT,18,13.72222222222222,0.0404858299595141,0.0080971659919028,Other
1269930651,QuZhan51496/paper2anything,QuZhan51496,paper2anything,https://github.com/QuZhan51496/paper2anything,"An agent skills pack that turns an academic paper PDF into slides, a poster, a webpage, a Xiaohongshu post, or a WeChat article (paper2slides/poster/html/xhs/wechat)",2026-06-15 08:24:23+00:00,2026-07-05 06:45:23+00:00,246,9,246,1,Python,66134,Apache-2.0,29,8.482758620689655,0.0365853658536585,0.0040650406504065,AI/ML
1276785270,ccrpRepo/robot_retargeter,ccrpRepo,robot_retargeter,https://github.com/ccrpRepo/robot_retargeter,Motion retargeting pipeline from SMPL-X / source robots to target humanoid robots.,2026-06-22 09:38:19+00:00,2026-06-29 07:03:35+00:00,245,25,245,2,Python,599401,,22,11.136363636363637,0.1020408163265306,0.0081632653061224,Other
1292080064,zerosupercycIe/risk-free-sniper,zerosupercycIe,risk-free-sniper,https://github.com/zerosupercycIe/risk-free-sniper,,2026-07-07 09:28:50+00:00,2026-07-07 09:37:08+00:00,245,1269,245,0,Python,6218,,7,35.0,5.179591836734694,0.0,Other
1270567918,google/mantis,google,mantis,https://github.com/google/mantis,"A modular, stack-agnostic toolkit of security review skills for AI coding agents to autonomously find, reproduce, and patch vulnerabilities.",2026-06-15 20:58:00+00:00,2026-07-15 00:24:41+00:00,245,29,245,1,Unknown,217,Apache-2.0,29,8.448275862068966,0.1183673469387755,0.0040816326530612,AI/ML
1285612276,ArmyPhoenixLog/claude-fable-5-claude-opus-4-8,ArmyPhoenixLog,claude-fable-5-claude-opus-4-8,https://github.com/ArmyPhoenixLog/claude-fable-5-claude-opus-4-8,"A polished AI writing workflow landing repository for long-form fiction planning, chapter structure, and prompt organization. Domain: https://claude.mirrorify.fun/",2026-07-01 01:36:00+00:00,2026-07-13 17:13:45+00:00,243,0,243,0,HTML,3,MIT,13,18.692307692307693,0.0,0.0,AI/ML
1294906179,change-42-yhmm/quota-float,change-42-yhmm,quota-float,https://github.com/change-42-yhmm/quota-float,A plug-in for easy viewing of credit limits,2026-07-09 08:33:45+00:00,2026-07-13 07:51:39+00:00,242,14,242,7,TypeScript,1326,MIT,5,48.4,0.0578512396694214,0.0289256198347107,AI/ML
1280809609,xiaohuailabs/xiaohu-ip-studio,xiaohuailabs,xiaohu-ip-studio,https://github.com/xiaohuailabs/xiaohu-ip-studio,开源中文配图技能 + IP 角色库:用「挑认知锚点→现编隐喻→反PPT自检」为中文深度文生成固定角色出演的正文配图,2026-06-26 00:49:42+00:00,2026-06-26 01:11:44+00:00,242,46,242,1,HTML,179584,MIT,18,13.444444444444445,0.1900826446280991,0.0041322314049586,AI/ML
1280439591,kentjuno/ainovel-cli,kentjuno,ainovel-cli,https://github.com/kentjuno/ainovel-cli,CLI sáng tác tiểu thuyết AI đa agent — Bản tiếng Việt của voocel/ainovel-cli,2026-06-25 15:28:12+00:00,2026-06-25 15:28:26+00:00,242,124,242,2,Go,6751,Apache-2.0,19,12.736842105263158,0.512396694214876,0.0082644628099173,AI/ML
1284736292,Chozzc/Lujie-Careerkit,Chozzc,Lujie-Careerkit,https://github.com/Chozzc/Lujie-Careerkit,"An AI-powered career workspace from resume editing to offer acceptance, covering resume editing, JD matching, application tracking, mock interviews, and interview review.",2026-06-30 06:37:23+00:00,2026-07-15 06:24:41+00:00,241,15,241,1,TypeScript,7369,Apache-2.0,14,17.214285714285715,0.0622406639004149,0.0041493775933609,AI/ML
1272228069,Tyxy-R/codex-referral-risk-research,Tyxy-R,codex-referral-risk-research,https://github.com/Tyxy-R/codex-referral-risk-research,,2026-06-17 12:08:33+00:00,2026-06-18 05:56:46+00:00,241,132,241,2,Python,64,MIT,27,8.925925925925926,0.5477178423236515,0.0082987551867219,Other
1290069682,tinbase/tinbase,tinbase,tinbase,https://github.com/tinbase/tinbase,"Supabase-compatible backend in a single binary — real Postgres with RLS, no Docker. Works with supabase-js unchanged.",2026-07-05 14:46:18+00:00,2026-07-15 06:16:09+00:00,240,18,240,1,TypeScript,3714,MIT,9,26.666666666666668,0.075,0.0041666666666666,DevOps
1292813857,sunflower-of-parchman/codex-hygiene,sunflower-of-parchman,codex-hygiene,https://github.com/sunflower-of-parchman/codex-hygiene,Codex skill for auditing and tuning Codex Desktop context/tool surfaces,2026-07-07 21:51:14+00:00,2026-07-08 05:24:58+00:00,240,7,240,0,Shell,23,MIT,7,34.285714285714285,0.0291666666666666,0.0,AI/ML
1274566706,umacloud/umadev,umacloud,umadev,https://github.com/umacloud/umadev,"UmaDev: A coding agent that works like a real dev team, commanding the Claude Code / Codex / OpenCode you already use.",2026-06-19 16:43:11+00:00,2026-07-15 04:13:47+00:00,240,60,240,4,Rust,129074,MIT,25,9.6,0.25,0.0166666666666666,AI/ML
1289077633,programmersd21/flow,programmersd21,flow,https://github.com/programmersd21/flow,🌊 see your network breathe,2026-07-04 10:09:41+00:00,2026-07-10 17:13:02+00:00,239,7,239,0,Go,37567,MIT,10,23.9,0.0292887029288702,0.0,DevOps
1285614028,weldstewardhub/Meccha-Enhancer-Pro,weldstewardhub,Meccha-Enhancer-Pro,https://github.com/weldstewardhub/Meccha-Enhancer-Pro,Meccha-Enhancer-Pro,2026-07-01 01:39:15+00:00,2026-07-10 12:11:13+00:00,238,0,238,0,Unknown,4,,13,18.307692307692307,0.0,0.0,Other
1293496062,CWS6206/EasyLastSkill,CWS6206,EasyLastSkill,https://github.com/CWS6206/EasyLastSkill,"EasyLastSkill ist eine deutschsprachige Codex-/Agent-Skill fuer schnelle Recherchen zu den letzten Tagen eines Themas. Standardmaessig betrachtet sie die letzten 30 Tage und erstellt einen kompakten Bericht mit Quellen, Relevanzscore und Unsicherheiten.",2026-07-08 11:15:29+00:00,2026-07-08 11:35:51+00:00,238,32,238,0,Python,35,GPL-3.0,6,39.66666666666666,0.134453781512605,0.0,AI/ML
1289858698,RennAkira/spicy-monopoly,RennAkira,spicy-monopoly,https://github.com/RennAkira/spicy-monopoly,"和你的 AI 一起玩的双人棋盘小游戏 · 18+ （A two-player board game you play with your AI — dice, tiles, spicy tasks, all run by code (18+））",2026-07-05 09:37:43+00:00,2026-07-14 12:30:37+00:00,237,32,237,1,Python,1002,NOASSERTION,9,26.33333333333333,0.1350210970464135,0.0042194092827004,AI/ML
1287346748,Danilaa1/cuelume,Danilaa1,cuelume,https://github.com/Danilaa1/cuelume,"Cuelume is a curated sound palette, not an audio engine. It gives buttons, links, toggles, and completed actions clear feedback without asking developers to design sounds themselves. Add an attribute, call bind(), done.",2026-07-02 15:49:05+00:00,2026-07-14 20:35:38+00:00,236,9,236,0,TypeScript,29,MIT,12,19.666666666666668,0.0381355932203389,0.0,Game
1293806470,nv-tlabs/ardy,nv-tlabs,ardy,https://github.com/nv-tlabs/ardy,Official implementation of ARDY: Autoregressive Diffusion with Hybrid Representation for Interactive Human Motion Generation (SIGGRAPH 2026).,2026-07-08 15:40:28+00:00,2026-07-10 14:13:31+00:00,235,31,235,3,Python,22531,Apache-2.0,6,39.16666666666666,0.1319148936170212,0.0127659574468085,AI/ML
1279637192,martinkoutecky/tine,martinkoutecky,tine,https://github.com/martinkoutecky/tine,,2026-06-24 21:59:31+00:00,2026-07-15 08:15:23+00:00,235,17,235,45,TypeScript,27608,AGPL-3.0,20,11.75,0.0723404255319148,0.1914893617021276,Other
1273073712,Albus-White/spark-to-paper-skills,Albus-White,spark-to-paper-skills,https://github.com/Albus-White/spark-to-paper-skills,"One sentence in, one draft paper out: spark-to-paper-skills automatically reviews papers, plans and runs experiments, and writes a research draft—typically using about $10 in API costs per paper.",2026-06-18 07:26:19+00:00,2026-07-14 10:43:44+00:00,235,2,235,0,Python,43589,MIT,26,9.038461538461538,0.0085106382978723,0.0,Data
1292782830,RoboDojo-Benchmark/RoboDojo,RoboDojo-Benchmark,RoboDojo,https://github.com/RoboDojo-Benchmark/RoboDojo,RoboDojo Official Repo,2026-07-07 21:02:32+00:00,2026-07-14 17:35:33+00:00,233,16,233,5,Python,247,MIT,7,33.285714285714285,0.0686695278969957,0.0214592274678111,Other
1289726309,TheColliny/FableClaudeMDForOpus,TheColliny,FableClaudeMDForOpus,https://github.com/TheColliny/FableClaudeMDForOpus,A Fable written Claude MD for Opus/Sonnet to give it some of the quality methodology that Fable uses,2026-07-05 05:55:58+00:00,2026-07-05 05:57:34+00:00,232,43,232,0,Unknown,207,,9,25.77777777777778,0.1853448275862069,0.0,AI/ML
1289887145,lucid-softworks/lumen,lucid-softworks,lumen,https://github.com/lucid-softworks/lumen,"A from-scratch JavaScript engine in Rust — std only, zero deps, three tiers incl. an ARM64 JIT, 100% test262 (53,400/53,400)",2026-07-05 10:24:00+00:00,2026-07-14 14:23:21+00:00,231,4,231,3,Rust,9250,MIT,9,25.666666666666668,0.0173160173160173,0.0129870129870129,Game
1284261425,openng-org/optimus-ui,openng-org,optimus-ui,https://github.com/openng-org/optimus-ui,,2026-06-29 17:24:18+00:00,2026-07-15 06:30:26+00:00,231,28,231,1200,TypeScript,332959,NOASSERTION,15,15.4,0.1212121212121212,5.194805194805195,Other
1279206627,FlareStarter/flarestarter,FlareStarter,flarestarter,https://github.com/FlareStarter/flarestarter,"A full-stack, edge-native SaaS starter built with TanStack Start + Cloudflare Workers  | 基于 TanStack Start + Cloudflare Workers 构建的全栈、边缘原生 SaaS 起步模板 ",2026-06-24 13:24:15+00:00,2026-07-09 18:10:13+00:00,230,30,230,0,TypeScript,1466,Apache-2.0,20,11.5,0.1304347826086956,0.0,Web
1270706314,alexchan197611/ai_media_assistant,alexchan197611,ai_media_assistant,https://github.com/alexchan197611/ai_media_assistant,AI-Powered Automate Self-Media Video Generation Tools‌,2026-06-16 01:20:58+00:00,2026-06-30 00:26:08+00:00,229,29,229,2,Python,34363,MIT,28,8.178571428571429,0.1266375545851528,0.0087336244541484,AI/ML
1279749812,Dicklesworthstone/franken_ocr,Dicklesworthstone,franken_ocr,https://github.com/Dicklesworthstone/franken_ocr,"Pure-Rust, CPU-only OCR engine for Baidu Unlimited-OCR (a DeepSeek-OCR-derived 3B MoE VLM). Five-model zoo, custom int8 kernels, no ML framework, no Python, no GPU.",2026-06-25 01:38:58+00:00,2026-07-13 20:40:49+00:00,229,20,229,0,Rust,35548,NOASSERTION,19,12.052631578947368,0.0873362445414847,0.0,AI/ML
1270787191,twhsi/skills,twhsi,skills,https://github.com/twhsi/skills,"AI Agent Skills for Chinese Knowledge Workers: iMandalArt, FIRE, planning, and publishing workflows for Claude Code, Codex, and LLM agents.",2026-06-16 03:46:53+00:00,2026-07-12 15:34:03+00:00,229,32,229,2,Python,5596,,28,8.178571428571429,0.1397379912663755,0.0087336244541484,AI/ML
1285161033,Orkas-AI/Orkas-VideoStudio,Orkas-AI,Orkas-VideoStudio,https://github.com/Orkas-AI/Orkas-VideoStudio,"Turn your coding agent into a video studio: describe a video in plain language, and your agent writes the timeline and produces the file.",2026-06-30 14:34:58+00:00,2026-07-09 12:26:58+00:00,227,20,227,0,TypeScript,281,MIT,14,16.214285714285715,0.0881057268722467,0.0,AI/ML
1288777900,lynote-ai/humanize-text-skill,lynote-ai,humanize-text-skill,https://github.com/lynote-ai/humanize-text-skill,Free AI Humanizer: Humanize AI Text Online,2026-07-04 00:48:19+00:00,2026-07-07 13:31:42+00:00,226,3,226,0,JavaScript,209,MIT,10,22.6,0.0132743362831858,0.0,AI/ML
1296385256,dongguatanglinux/grok-build-auth,dongguatanglinux,grok-build-auth,https://github.com/dongguatanglinux/grok-build-auth,Protocol research client: x.ai signup → SSO → Grok Build OAuth → CLIProxyAPI auth export (authorized use only),2026-07-10 10:36:31+00:00,2026-07-10 11:03:54+00:00,226,101,226,0,Python,85,MIT,4,56.5,0.4469026548672566,0.0,Security
1280979277,Pengbinghui/pipeline-math,Pengbinghui,pipeline-math,https://github.com/Pengbinghui/pipeline-math,,2026-06-26 05:44:35+00:00,2026-07-10 15:41:35+00:00,225,17,225,3,Lean,2837,,18,12.5,0.0755555555555555,0.0133333333333333,Other
1270936576,yehonathanlitman/Lift4D,yehonathanlitman,Lift4D,https://github.com/yehonathanlitman/Lift4D,Lift4D: Harmonizing Single-View 3D Estimation for 4D Reconstruction In-the-Wild,2026-06-16 07:21:42+00:00,2026-06-23 18:02:05+00:00,224,6,224,1,Unknown,4,,28,8.0,0.0267857142857142,0.0044642857142857,Other
1279788844,LYiHub/labs-ArchiveAssistant,LYiHub,labs-ArchiveAssistant,https://github.com/LYiHub/labs-ArchiveAssistant,,2026-06-25 02:40:57+00:00,2026-07-09 02:16:31+00:00,224,45,224,1,Kotlin,100587,GPL-3.0,19,11.789473684210526,0.2008928571428571,0.0044642857142857,Mobile
1270872206,dososo/chinese-traditional-patterns,dososo,chinese-traditional-patterns,https://github.com/dososo/chinese-traditional-patterns,开源的中国传统纹样图录项目 · 100 高清纹样(规划 800) · 中英日韩双语 · CC BY-NC 4.0 · https://wenyang.net,2026-06-16 06:01:05+00:00,2026-06-16 06:54:15+00:00,222,23,222,0,Unknown,250349,NOASSERTION,28,7.928571428571429,0.1036036036036036,0.0,Other
1285987351,Moh4696/freecut,Moh4696,freecut,https://github.com/Moh4696/freecut,"Fork of browser-use/video-use with the paid ElevenLabs dependency replaced by free, pluggable transcription (local Whisper by default; VibeVoice-ASR for diarization).",2026-07-01 10:33:36+00:00,2026-07-01 10:34:34+00:00,221,43,221,0,Python,569,MIT,13,17.0,0.1945701357466063,0.0,Other
1287442244,Oft3r/agentic-trading-desk,Oft3r,agentic-trading-desk,https://github.com/Oft3r/agentic-trading-desk,"AI-assisted trading desk for short-term technical analysis on stocks & ETFs via Robinhood MCP. Deterministic Python engines score each asset on a three-pillar framework (Trend · Momentum · Macro-Sentiment) using EMA, RSI, MACD, TRIX & Bollinger Bands. The AI fetches data; the scripts compute; the human approves every order.",2026-07-02 17:33:30+00:00,2026-07-02 18:03:28+00:00,221,54,221,0,Python,27,MIT,12,18.416666666666668,0.2443438914027149,0.0,AI/ML
1298268497,BloxHubSSS/Game-Copier,BloxHubSSS,Game-Copier,https://github.com/BloxHubSSS/Game-Copier,,2026-07-12 12:36:58+00:00,2026-07-13 11:24:22+00:00,220,7,220,0,Unknown,24,,2,110.0,0.0318181818181818,0.0,Game
1285613791,conecocoongrasp/spotx,conecocoongrasp,spotx,https://github.com/conecocoongrasp/spotx,,2026-07-01 01:38:50+00:00,2026-07-09 19:42:32+00:00,219,0,219,0,Unknown,2,MIT,13,16.846153846153847,0.0,0.0,Other
1277058567,i5ting/learn-ai-practice,i5ting,learn-ai-practice,https://github.com/i5ting/learn-ai-practice,狼叔的ai自留地，2026上半年总结,2026-06-22 14:43:10+00:00,2026-07-14 03:12:35+00:00,219,6,219,0,Unknown,1753,,22,9.954545454545457,0.0273972602739726,0.0,Other
1272668355,yeet-src/httpinspect,yeet-src,httpinspect,https://github.com/yeet-src/httpinspect,"top, but for the HTTP endpoints on your host — a live dashboard of the most active plaintext HTTP endpoints, right in the terminal.",2026-06-17 20:40:15+00:00,2026-07-10 13:26:45+00:00,219,14,219,2,JavaScript,722,,27,8.11111111111111,0.0639269406392694,0.0091324200913242,DevOps
1273054934,datagallery-lab/datafoundry,datagallery-lab,datafoundry,https://github.com/datagallery-lab/datafoundry,"DataFoundry is an open-source AI workbench for data analysis, unifying data sources, knowledge, tools, and agent runtime into a governed workspace for interactive analytics.",2026-06-18 07:03:43+00:00,2026-07-15 07:57:25+00:00,219,29,219,5,TypeScript,20438,Apache-2.0,26,8.423076923076923,0.1324200913242009,0.0228310502283105,AI/ML
1291947423,adriflex/autoremesher-blender-bridge,adriflex,autoremesher-blender-bridge,https://github.com/adriflex/autoremesher-blender-bridge,Blender bridge for AutoRemesher,2026-07-07 07:36:26+00:00,2026-07-10 09:57:23+00:00,219,21,219,1,Python,98,NOASSERTION,7,31.285714285714285,0.0958904109589041,0.0045662100456621,Other
1282265183,larashero3-dotcom/writing-dna-skill,larashero3-dotcom,writing-dna-skill,https://github.com/larashero3-dotcom/writing-dna-skill,写作蒸馏器.skill｜蒸馏复刻任意写作风格的 agent skill,2026-06-27 14:43:12+00:00,2026-06-29 10:56:33+00:00,218,31,218,0,Unknown,32,MIT,17,12.823529411764708,0.1422018348623853,0.0,AI/ML
1272162595,VisionForge-OU/foreman,VisionForge-OU,foreman,https://github.com/VisionForge-OU/foreman,A Boris-style agentic orchestrator TUI that supervises headless Claude Code agents through a gated software-delivery pipeline — pointed at any repository.,2026-06-17 10:49:49+00:00,2026-06-29 00:12:23+00:00,218,46,218,12,Python,560,NOASSERTION,27,8.074074074074074,0.2110091743119266,0.055045871559633,AI/ML
1293121942,GiMi-Xiaomi/gimi-illustration-skill,GiMi-Xiaomi,gimi-illustration-skill,https://github.com/GiMi-Xiaomi/gimi-illustration-skill,配图 skill,2026-07-08 05:58:21+00:00,2026-07-08 09:15:55+00:00,217,14,217,0,Unknown,13336,MIT,6,36.16666666666666,0.064516129032258,0.0,Other
1275151507,y5-snowies/nourish,y5-snowies,nourish,https://github.com/y5-snowies/nourish,Nourish OS. The modern way of using a computer.,2026-06-20 10:14:04+00:00,2026-07-13 05:41:11+00:00,217,6,217,4,Rust,210322,Apache-2.0,24,9.041666666666666,0.0276497695852534,0.0184331797235023,Other
1284180721,Jia-Ethan/claude-keysmith,Jia-Ethan,claude-keysmith,https://github.com/Jia-Ethan/claude-keysmith,Claude Code CLAUDE.md import-block installer for local instruction files,2026-06-29 15:48:02+00:00,2026-07-04 02:55:12+00:00,215,40,215,1,Python,16,MIT,15,14.333333333333334,0.1860465116279069,0.0046511627906976,AI/ML
1299966529,TobiasLee/Rebuttal-Skill,TobiasLee,Rebuttal-Skill,https://github.com/TobiasLee/Rebuttal-Skill,,2026-07-14 03:31:47+00:00,2026-07-14 03:34:22+00:00,215,9,215,0,Unknown,14,,1,215.0,0.041860465116279,0.0,Other
1273038999,mindmuxai/brain.md,mindmuxai,brain.md,https://github.com/mindmuxai/brain.md,"A persistent, file-based memory layer for coding agents — give Claude Code, Codex & others a project brain (durable decisions, requirements, constraints) via a zero-dependency CLI.",2026-06-18 06:45:01+00:00,2026-07-07 03:03:41+00:00,215,17,215,2,JavaScript,153,Apache-2.0,26,8.26923076923077,0.0790697674418604,0.0093023255813953,AI/ML
1289724268,Neeeophytee/finding-unknowns-skills,Neeeophytee,finding-unknowns-skills,https://github.com/Neeeophytee/finding-unknowns-skills,"8 installable skills for Claude Code and OpenAI Codex, for finding your unknowns before they get expensive: blindspot pass, brainstorms, interviews, references, plans, notes, pitches, and a merge quiz. Community distillation, not official Anthropic.",2026-07-05 05:51:40+00:00,2026-07-09 12:13:40+00:00,214,17,214,0,Unknown,20,NOASSERTION,9,23.77777777777778,0.0794392523364486,0.0,AI/ML
1283937710,kocasariumut/FaceAnything,kocasariumut,FaceAnything,https://github.com/kocasariumut/FaceAnything,,2026-06-29 11:24:35+00:00,2026-06-29 11:42:41+00:00,213,26,213,2,Python,56231,NOASSERTION,15,14.2,0.1220657276995305,0.0093896713615023,Other
1277918666,HuiyuLi-2000/Chinese-Grant-Writer-Skills,HuiyuLi-2000,Chinese-Grant-Writer-Skills,https://github.com/HuiyuLi-2000/Chinese-Grant-Writer-Skills,面向 NSFC、NSSFC、省部级自/社科申请书的 AI 写作技能集。从近 20 本管理口申请书中提炼写作范式，覆盖核心撰写环节。,2026-06-23 09:53:34+00:00,2026-06-25 10:50:23+00:00,213,29,213,0,Python,204,MIT,21,10.142857142857142,0.136150234741784,0.0,AI/ML
1271372403,yolfinance/yolfi-agent,yolfinance,yolfi-agent,https://github.com/yolfinance/yolfi-agent,"Yolfi Agent Kit SDK, CLI, and MCP server for AI coding agents.",2026-06-16 15:43:27+00:00,2026-07-14 19:36:38+00:00,213,1,213,0,JavaScript,245,MIT,28,7.607142857142857,0.0046948356807511,0.0,AI/ML
1275718468,tianjiangqiji/nova-image-studio,tianjiangqiji,nova-image-studio,https://github.com/tianjiangqiji/nova-image-studio,自托管的 AI 图像生成工作台 · 自定义模型 · 多模式 · PWA · 实时任务 支持Agent模式，工作台模式，无限画布，反推提示词，提示词广场，GIF生成。前后端任务机制轻量后端；三端兼容 UI：桌面端、平板端、移动端自适应布局,2026-06-21 03:50:26+00:00,2026-07-10 05:49:38+00:00,212,56,212,1,TypeScript,10754,AGPL-3.0,23,9.217391304347826,0.2641509433962264,0.0047169811320754,AI/ML
1297656513,BryanLunduke/LCOS,BryanLunduke,LCOS,https://github.com/BryanLunduke/LCOS,The Lunduke Computer Operating System,2026-07-11 17:39:07+00:00,2026-07-14 18:34:29+00:00,211,12,211,25,Unknown,2213,GPL-3.0,3,70.33333333333333,0.0568720379146919,0.1184834123222748,Other
1286274231,JimLiu/science-skills,JimLiu,science-skills,https://github.com/JimLiu/science-skills,,2026-07-01 15:59:32+00:00,2026-07-01 16:11:40+00:00,211,53,211,0,HTML,8626,,13,16.23076923076923,0.2511848341232227,0.0,Web
1277530987,dreiachse-cyber/image-cockpit-for-codex-workflows,dreiachse-cyber,image-cockpit-for-codex-workflows,https://github.com/dreiachse-cyber/image-cockpit-for-codex-workflows,"Local cockpit for Codex imagegen, pixel art, image editing, animation, and sprite-sheet workflows.",2026-06-23 01:23:39+00:00,2026-07-15 07:15:22+00:00,210,29,210,0,TypeScript,322876,MIT,21,10.0,0.1380952380952381,0.0,AI/ML
1275076041,lishuangqiang/backend-agent-resume-scout,lishuangqiang,backend-agent-resume-scout,https://github.com/lishuangqiang/backend-agent-resume-scout,一个Skill，主要目标是为后端和 AI Agent 求职者，从 GitHub 里筛出真正能写进简历、能经得起面试追问的项目，并基于源码证据生成简历项目包,2026-06-20 08:09:48+00:00,2026-06-22 09:09:47+00:00,210,11,210,0,Python,73,Apache-2.0,24,8.75,0.0523809523809523,0.0,AI/ML
1276689592,Aspirin0000/zhouli-translator,Aspirin0000,zhouli-translator,https://github.com/Aspirin0000/zhouli-translator,"合乎周礼：DeepSeek-powered Zhouli-style Chinese translator, web app, and distributable Skill package.",2026-06-22 07:51:35+00:00,2026-07-15 06:21:06+00:00,209,17,209,1,TypeScript,17876,MIT,22,9.5,0.0813397129186602,0.0047846889952153,AI/ML
1282159694,Ray-Code-Svg/SuperNovaAgent,Ray-Code-Svg,SuperNovaAgent,https://github.com/Ray-Code-Svg/SuperNovaAgent,"SuperNova is a Windows-first desktop AI Workbench that turns chat into traceable tasks. It combines a Tauri + React Workbench, Rust Product Runtime, typed protocol, and Process Kernel so actions can produce visible artifacts, runtime receipts, replayable evidence, and controlled workspace execution.",2026-06-27 11:58:48+00:00,2026-07-02 05:50:33+00:00,209,105,209,0,Rust,14283,Apache-2.0,17,12.294117647058824,0.5023923444976076,0.0,AI/ML
1269857498,joeseesun/qiaomu-app-review-insights,joeseesun,qiaomu-app-review-insights,https://github.com/joeseesun/qiaomu-app-review-insights,"把 App Store 评价变成产品研究证据，发现痛点、机会和版本风险 | Turn App Store reviews into product research evidence: pain points, opportunities, and version risks.",2026-06-15 06:55:04+00:00,2026-06-15 12:57:46+00:00,209,37,209,1,TypeScript,1785,MIT,29,7.206896551724138,0.1770334928229665,0.0047846889952153,Web
1285615371,Pridebencommand1/spotifynoad,Pridebencommand1,spotifynoad,https://github.com/Pridebencommand1/spotifynoad,,2026-07-01 01:41:55+00:00,2026-07-10 16:52:00+00:00,209,0,209,0,Unknown,2,MIT,13,16.076923076923077,0.0,0.0,Other
1281002336,Vanszs/qwencloud-generator,Vanszs,qwencloud-generator,https://github.com/Vanszs/qwencloud-generator," Automated QwenCloud account registration & API key harvester with multi-threading, TUI dashboard, proxy rotation, and Gmail OAuth",2026-06-26 06:17:28+00:00,2026-06-27 13:18:41+00:00,209,71,209,0,Python,513,,18,11.61111111111111,0.3397129186602871,0.0,Security
1285614822,Phantomclufurnish/office-enhancer,Phantomclufurnish,office-enhancer,https://github.com/Phantomclufurnish/office-enhancer,,2026-07-01 01:40:54+00:00,2026-07-13 13:50:10+00:00,208,0,208,0,JavaScript,4,MIT,13,16.0,0.0,0.0,Other
1278596602,jianweiweng05/qsx-strategy-score,jianweiweng05,qsx-strategy-score,https://github.com/jianweiweng05/qsx-strategy-score,"Free strategy scorecard for trading backtests. Detect overfitting, weak edge, drawdown risk, and random-timing luck from returns, equity curves, or trade logs.",2026-06-24 00:18:50+00:00,2026-07-14 05:28:03+00:00,208,11,208,4,Python,3552,MIT,20,10.4,0.0528846153846153,0.0192307692307692,Finance/Trading
