id,full_name,owner,name,html_url,description,created_at,pushed_at,stars,forks,watchers,open_issues,primary_language,size,license,age_days,stars_per_day,fork_star_ratio,issue_star_ratio,category
1245212201,zzzhhh1/mg-Koyeb,zzzhhh1,mg-Koyeb,https://github.com/zzzhhh1/mg-Koyeb,基于 Koyeb + Cloudflare Argo 隧道的 VLESS 安全单兵节点，详细纯小白视频教程，点击下方视频链接,2026-05-21 02:41:43+00:00,2026-05-21 10:06:37+00:00,273,383,273,0,Shell,51,,11,24.818181818181817,1.4029304029304028,0.0,CLI/Tooling
1240421258,yoheinakajima/activegraph,yoheinakajima,activegraph,https://github.com/yoheinakajima/activegraph,,2026-05-16 05:39:44+00:00,2026-06-01 04:46:13+00:00,272,20,272,4,Python,1168,Apache-2.0,16,17.0,0.0735294117647058,0.0147058823529411,Other
1234675179,tidwall/btype,tidwall,btype,https://github.com/tidwall/btype,B-tree based collection types for Go,2026-05-10 13:52:32+00:00,2026-05-22 13:09:05+00:00,272,2,272,0,Go,284,MIT,22,12.363636363636363,0.0073529411764705,0.0,Other
1233786405,6-robot/jie_3d_nav,6-robot,jie_3d_nav,https://github.com/6-robot/jie_3d_nav,一套基于 ROS 2 Humble 的 3D 导航系统，通过 Web 界面交互。本系统已在智元科技 D1 机器狗以及留形科技 Odin 1 空间定位模组上测试通过。,2026-05-09 11:03:47+00:00,2026-05-24 13:44:17+00:00,272,60,272,0,Python,2028,,23,11.826086956521738,0.2205882352941176,0.0,Web
1246541082,ziplab/TriSplat,ziplab,TriSplat,https://github.com/ziplab/TriSplat,TriSplat: Simulation-Ready Feed-Forward 3D Scene Reconstruction,2026-05-22 09:44:38+00:00,2026-06-01 07:10:53+00:00,270,15,270,0,Python,3929,MIT,10,27.0,0.0555555555555555,0.0,Other
1241273478,phuryn/pm-brain,phuryn,pm-brain,https://github.com/phuryn/pm-brain,"PM Brain OS: The Second Brain for Product Managers, Made of Markdown",2026-05-17 07:07:46+00:00,2026-05-20 18:26:38+00:00,270,63,270,1,Python,697,MIT,15,18.0,0.2333333333333333,0.0037037037037037,AI/ML
1237255761,GordenSun/LearningCell,GordenSun,LearningCell,https://github.com/GordenSun/LearningCell,细胞3D模型展示,2026-05-13 02:43:29+00:00,2026-05-13 07:12:07+00:00,270,74,270,3,TypeScript,43937,,19,14.210526315789474,0.2740740740740741,0.0111111111111111,Other
1233701259,mobileAiDev/ai-app-bridge,mobileAiDev,ai-app-bridge,https://github.com/mobileAiDev/ai-app-bridge,"AI App Bridge is a runtime bridge for AI agents to close the loop on mobile app iteration: inspect the running app, operate UI and WebView surfaces, collect structured runtime state, verify results, and continue improving the app.",2026-05-09 08:49:45+00:00,2026-06-01 01:12:39+00:00,268,5,268,0,JavaScript,641,Apache-2.0,23,11.652173913043478,0.0186567164179104,0.0,AI/ML
1237521012,PlaceNL2026/best-of-algorithmic-trading,PlaceNL2026,best-of-algorithmic-trading,https://github.com/PlaceNL2026/best-of-algorithmic-trading,algorithmic trading curated list quant finance trading bots backtesting technical analysis crypto open-source freqtrade hummingbot fintech Python TypeScript resources MCP quantopian-style rankings,2026-05-13 09:00:07+00:00,2026-05-13 09:01:03+00:00,268,2056,268,1,TypeScript,2888,CC-BY-SA-4.0,19,14.105263157894736,7.671641791044776,0.003731343283582,AI/ML
1232824274,stormzhang/token-tracker,stormzhang,token-tracker,https://github.com/stormzhang/token-tracker,"Track token usage across local AI agents (Claude Code, Codex) — Custom StatusLine, CLI Dashboard with cost analysis, rate limit monitoring, and session tracking",2026-05-08 10:03:52+00:00,2026-05-24 22:52:07+00:00,267,23,267,1,Python,1348,,24,11.125,0.0861423220973782,0.0037453183520599,AI/ML
1235711875,laravel/moat,laravel,moat,https://github.com/laravel/moat,"Moat reviews the security posture of your GitHub organization and repositories, then surfaces recommendations to consider.",2026-05-11 15:25:34+00:00,2026-06-02 07:22:18+00:00,267,9,267,2,Rust,1937,MIT,21,12.714285714285714,0.0337078651685393,0.0074906367041198,Security
1235401698,StarDxxx/ai-frame,StarDxxx,ai-frame,https://github.com/StarDxxx/ai-frame,"Frame your AI conversations as beautiful, shareable image cards.",2026-05-11 09:38:46+00:00,2026-05-20 06:23:34+00:00,267,19,267,0,TypeScript,3094,MIT,21,12.714285714285714,0.0711610486891385,0.0,AI/ML
1241825396,ajsai47/backdoor,ajsai47,backdoor,https://github.com/ajsai47/backdoor,"Run Claude Code against any AI provider. DeepSeek, Groq, Ollama, OpenRouter — your call.",2026-05-17 21:29:22+00:00,2026-05-22 15:11:15+00:00,266,29,266,4,Python,172,MIT,15,17.733333333333334,0.1090225563909774,0.0150375939849624,AI/ML
1233761415,recomby-ai/recomby-geo,recomby-ai,recomby-geo,https://github.com/recomby-ai/recomby-geo,GEO 领域 AI 员工开源方案 · Open-source GEO AI-employee solution (MIT). GEO Skills package + curated lists of agents and office CLIs that make up the AI-employee stack.,2026-05-09 10:22:20+00:00,2026-06-01 14:39:22+00:00,266,39,266,0,Python,319,MIT,23,11.565217391304348,0.1466165413533834,0.0,AI/ML
1233495945,LYiHub/OpenClaw-AWD-Arena,LYiHub,OpenClaw-AWD-Arena,https://github.com/LYiHub/OpenClaw-AWD-Arena,An automated Attack-with-Defense platform where LLM-powered agents compete in real-time.,2026-05-09 02:55:42+00:00,2026-05-09 03:22:36+00:00,264,61,264,2,Python,256,Apache-2.0,23,11.478260869565217,0.231060606060606,0.0075757575757575,AI/ML
1234008446,hsr88/mouzi,hsr88,mouzi,https://github.com/hsr88/mouzi,"A free, privacy-first automatic file organizer that quietly sorts your Downloads folder from the system tray.",2026-05-09 16:22:54+00:00,2026-05-31 08:50:46+00:00,264,13,264,4,Rust,332123,,23,11.478260869565217,0.0492424242424242,0.0151515151515151,CLI/Tooling
1243176585,hypnguyen1209/offensive-claude,hypnguyen1209,offensive-claude,https://github.com/hypnguyen1209/offensive-claude,"Offensive security toolkit for Claude Code covering red team, exploit dev, AD attacks, EDR bypass, mobile pentest",2026-05-19 05:45:30+00:00,2026-05-28 07:28:45+00:00,263,43,263,0,Shell,381,MIT,13,20.23076923076923,0.1634980988593156,0.0,AI/ML
1233572903,ProjectKumo/KumoApp,ProjectKumo,KumoApp,https://github.com/ProjectKumo/KumoApp,"A calm, native macOS client for the Mihomo proxy core, built with SwiftUI and a shared agent-friendly CLI.",2026-05-09 05:29:55+00:00,2026-05-23 04:38:44+00:00,263,7,263,3,Swift,6845,AGPL-3.0,23,11.434782608695652,0.026615969581749,0.0114068441064638,AI/ML
1237544917,walkingddd/CPA-Helper,walkingddd,CPA-Helper,https://github.com/walkingddd/CPA-Helper,"CPA-Helper is a local, self-hosted multi-user management panel designed for CLIProxyAPI users. It features independent API keys per user, isolated usage statistics, detailed request tracking, model pricing maintenance, available model querying, administrator account management, and Codex account inspection.",2026-05-13 09:27:53+00:00,2026-06-02 07:55:31+00:00,263,22,263,1,Go,3746,MIT,19,13.842105263157896,0.0836501901140684,0.0038022813688212,AI/ML
1244733782,POWER-PILL/ASCII-Aquarium,POWER-PILL,ASCII-Aquarium,https://github.com/POWER-PILL/ASCII-Aquarium,"ASCII Aquarium turns your Cheap Yellow Display into an tiny animated ASCII fish tank. It renders a live aquarium scene with animated fish, bubbles, swaying seaweed, tap-to-feed food flakes, occasional octopus & seahorse visitors, selectable backgrounds, preferences, optional Wi-Fi clock sync, & More!",2026-05-20 14:44:01+00:00,2026-06-01 16:05:11+00:00,261,20,261,7,C++,33114,,12,21.75,0.0766283524904214,0.0268199233716475,Other
1238374602,zLanqing/codex-claude-academic-skills,zLanqing,codex-claude-academic-skills,https://github.com/zLanqing/codex-claude-academic-skills,本仓库包含三个面向学术科研人员的Skills，覆盖从文献阅读、论文写作到科学计算的完整研究工作流。office-academic-skill 负责论文阅读报告与学术 PPT/Word 文档生成；research-writing-skill 提供论文写作、润色与审稿回复辅助；scientific-toolkit-skill 整合 MATLAB/Python 科学计算与期刊级图表生成。三个 Skill 专为中文科研用户设计，可在 Claude Code 和 codex 中一键调用。,2026-05-14 04:13:15+00:00,2026-05-14 09:08:48+00:00,261,20,261,0,Python,2674,MIT,18,14.5,0.0766283524904214,0.0,AI/ML
1242997674,edgenuitybot/exodusbot,edgenuitybot,exodusbot,https://github.com/edgenuitybot/exodusbot,"Exodus | The # 1 Edgenuity Bot for Quizes, Tests, and Exams. Includes Auto Answers, Auto delays, built in AI Answers, Auto Submit, EdgeEX support and MORE! | About: Exodus is an online course tool designed for online middle and high school classes (K-8 curriculum). Join the Discord: https://discord.gg/exodusbot",2026-05-19 00:45:04+00:00,2026-05-19 01:22:51+00:00,260,0,260,0,JavaScript,125,NOASSERTION,13,20.0,0.0,0.0,AI/ML
1232668091,Michael-Jetson/Robotics_Tutorial,Michael-Jetson,Robotics_Tutorial,https://github.com/Michael-Jetson/Robotics_Tutorial,体系化的机器人教学文档，涵盖数学基础、C++进阶、规划控制、SLAM等,2026-05-08 06:38:27+00:00,2026-05-25 14:34:58+00:00,259,19,259,0,Unknown,9102,NOASSERTION,24,10.791666666666666,0.0733590733590733,0.0,Other
1230718069,chAng-L19/codex-redteam-mode,chAng-L19,codex-redteam-mode,https://github.com/chAng-L19/codex-redteam-mode,针对于红队攻击思维做出的red team模式(让你的codex像红队一样思考！)，可在单对话使用（目前只支持5.4，5.5需要过cyber认证，可自行适配其他AI）,2026-05-06 08:53:51+00:00,2026-05-21 13:01:24+00:00,258,23,258,0,Python,20961,MIT,26,9.923076923076923,0.0891472868217054,0.0,AI/ML
1245033804,kouhxp/yapsnap,kouhxp,yapsnap,https://github.com/kouhxp/yapsnap,Snap any video URL or audio file into plaintext. No GPU. No cloud. One command.,2026-05-20 21:01:24+00:00,2026-05-27 04:21:14+00:00,257,8,257,0,Python,61,Apache-2.0,12,21.416666666666668,0.0311284046692607,0.0,Other
1233488832,liuzhengming/ccswitch-deepseek,liuzhengming,ccswitch-deepseek,https://github.com/liuzhengming/ccswitch-deepseek,ccswitch deepseek 转发,2026-05-09 02:41:51+00:00,2026-05-26 13:29:51+00:00,257,62,257,7,JavaScript,479,,23,11.173913043478262,0.2412451361867704,0.0272373540856031,Other
1248262230,aurorascharff/ClickLight,aurorascharff,ClickLight,https://github.com/aurorascharff/ClickLight,"A macOS menu bar app that highlights your clicks for demos, recordings, UX reviews, and better click visibility.",2026-05-24 12:09:24+00:00,2026-06-01 17:59:22+00:00,257,12,257,1,Swift,97321,MIT,8,32.125,0.046692607003891,0.0038910505836575,Mobile
1250579204,5-m0cftvuvif/stake-monthly,5-m0cftvuvif,stake-monthly,https://github.com/5-m0cftvuvif/stake-monthly,"Stake Monthly is one of the most discussed topics in online platform communities, loyalty systems, and crypto entertainment ecosystems. This educational guide explains how monthly reward structures, VIP progression, recurring engagement systems, and community participation models work across modern digital platforms.",2026-05-26 19:16:05+00:00,2026-05-26 19:20:01+00:00,256,44,256,0,HTML,9,Apache-2.0,6,42.66666666666666,0.171875,0.0,Finance/Trading
1247712932,Mclisterjoeh2o/yellowkey-bitlocker,Mclisterjoeh2o,yellowkey-bitlocker,https://github.com/Mclisterjoeh2o/yellowkey-bitlocker,yellowkey  bitlocker github vulnerability  bypass  cve-2026-45585 windows 11 security zero day exploit winre recovery mode poc nightmare eclipse chaotic eclipse exploit tool usb attack encryption hack script mitigation guide fstx winpeshl shell unpatched fix tool,2026-05-23 17:19:03+00:00,2026-05-23 17:24:38+00:00,256,21,256,4,TypeScript,13,MIT,9,28.444444444444443,0.08203125,0.015625,Security
1231745656,Sayhi-bzb/AIEden,Sayhi-bzb,AIEden,https://github.com/Sayhi-bzb/AIEden,an LLM-native world and civilization,2026-05-07 08:44:58+00:00,2026-05-08 08:41:40+00:00,255,6,255,0,TypeScript,140,AGPL-3.0,25,10.2,0.0235294117647058,0.0,AI/ML
1233680465,cosmicstack-labs/mercury-agent-skills,cosmicstack-labs,mercury-agent-skills,https://github.com/cosmicstack-labs/mercury-agent-skills,"A curated registry of reusable Mercury Agent, Open Claw or Hermes Agent skills designed for real developer workflows, persistent memory, and token-efficient execution.",2026-05-09 08:16:53+00:00,2026-06-01 12:14:57+00:00,255,29,255,1,JavaScript,2145,MIT,23,11.08695652173913,0.1137254901960784,0.0039215686274509,AI/ML
1244468619,scheidydude/codeindex,scheidydude,codeindex,https://github.com/scheidydude/codeindex,Repo dependency analyzer with **blast-radius impact scoring** for AI-assisted development.,2026-05-20 09:42:57+00:00,2026-05-28 03:21:53+00:00,255,35,255,3,Python,171,NOASSERTION,12,21.25,0.1372549019607843,0.0117647058823529,AI/ML
1237855132,SebReyWriter/TheBLUEForum,SebReyWriter,TheBLUEForum,https://github.com/SebReyWriter/TheBLUEForum,"The B.L.U.E. System General Discussion Board - For the community who believes in the idea of a ""universal education"" system, to discuss the their ideas regarding the B.L.U.E. System and it's implementation",2026-05-13 15:14:44+00:00,2026-05-26 00:10:23+00:00,255,5,255,0,Unknown,3,,19,13.421052631578949,0.0196078431372549,0.0,Other
1230413282,rihebty/flow-kit,rihebty,flow-kit,https://github.com/rihebty/flow-kit,一套融合了bmad、spec-kit、OpenSpec、GSD、claude-task-master、superpowers、gstack、skills的 AI 编程规范化流程,2026-05-06 01:17:53+00:00,2026-05-13 07:25:34+00:00,255,59,255,0,Unknown,266,MIT,26,9.807692307692308,0.2313725490196078,0.0,AI/ML
1235572541,MaxiFan/TunnelX,MaxiFan,TunnelX,https://github.com/MaxiFan/TunnelX,TunnelX - Windows split-tunneling VPN manager | مدیریت تونل و Split Tunneling برای ویندوز,2026-05-11 13:01:26+00:00,2026-05-30 15:33:18+00:00,253,23,253,5,C#,48985,NOASSERTION,21,12.047619047619047,0.0909090909090909,0.0197628458498023,Other
1254038692,zgwl/chinese-buy-us-stock-guide,zgwl,chinese-buy-us-stock-guide,https://github.com/zgwl/chinese-buy-us-stock-guide,美股指南,2026-05-30 04:27:25+00:00,2026-05-31 20:27:01+00:00,253,68,253,1,Unknown,400,,2,126.5,0.2687747035573122,0.0039525691699604,Other
1239545724,skydoves/android-testing-skills,skydoves,android-testing-skills,https://github.com/skydoves/android-testing-skills,"⚡️ A set of skills for Android testing: Compose UI, AndroidX Test, JVM unit tests, and ADB.",2026-05-15 07:38:44+00:00,2026-05-25 09:21:58+00:00,252,8,252,0,Shell,495,Apache-2.0,17,14.823529411764708,0.0317460317460317,0.0,Mobile
1229989330,HELPMEEADICE/BANDORI-PET-REV,HELPMEEADICE,BANDORI-PET-REV,https://github.com/HELPMEEADICE/BANDORI-PET-REV,BandoriPet 是一个基于 Live2D 和 PySide6 的开源桌面宠物项目，支持 50+ 位 BanG Dream! 角色、300+ 套服装，让你的桌面一秒变成 CiRCLE 排练室,2026-05-05 15:13:08+00:00,2026-06-02 09:54:05+00:00,250,17,250,0,Python,11649,GPL-3.0,27,9.25925925925926,0.068,0.0,Other
1243106323,vincelele/ai-fomo-skills,vincelele,ai-fomo-skills,https://github.com/vincelele/ai-fomo-skills,"Personal superalignment skills for turning AI information overload into reusable knowledge, signals, and digests.",2026-05-19 03:51:56+00:00,2026-05-29 04:43:17+00:00,250,0,250,1,Python,70,MIT,13,19.23076923076923,0.0,0.004,AI/ML
1245299074,zqbxdev/webchat2api,zqbxdev,webchat2api,https://github.com/zqbxdev/webchat2api,OpenAI-compatible Web Chat API proxy with GPT/Grok account management,2026-05-21 05:12:52+00:00,2026-06-01 00:43:29+00:00,250,54,250,1,Python,6852,MIT,11,22.727272727272727,0.216,0.004,AI/ML
1242473355,OpenBMB/MiniCPM-Desk-Pet,OpenBMB,MiniCPM-Desk-Pet,https://github.com/OpenBMB/MiniCPM-Desk-Pet,a local-first desktop pet powered by MiniCPM5,2026-05-18 13:08:37+00:00,2026-05-28 14:08:05+00:00,248,29,248,6,JavaScript,77925,AGPL-3.0,14,17.714285714285715,0.1169354838709677,0.0241935483870967,Other
1228512936,ShringarStudio/Tulasi,ShringarStudio,Tulasi,https://github.com/ShringarStudio/Tulasi,"A pixel art icon pack for Linux, by Shringar Studio.",2026-05-04 05:07:38+00:00,2026-06-01 10:01:13+00:00,248,0,248,3,Shell,2404,,28,8.857142857142858,0.0,0.0120967741935483,CLI/Tooling
1243638600,jackson-video-resources/markov-hedge-fund-method,jackson-video-resources,markov-hedge-fund-method,https://github.com/jackson-video-resources/markov-hedge-fund-method,Markov regime detection skill + one-shot install prompt + Pine indicator. Companion to Quant Series video 1. Framework by Roan (@RohOnChain).,2026-05-19 14:22:02+00:00,2026-05-20 11:21:27+00:00,248,149,248,4,Python,71,NOASSERTION,13,19.07692307692308,0.6008064516129032,0.0161290322580645,Other
1241219539,tuchg/Lucarne,tuchg,Lucarne,https://github.com/tuchg/Lucarne,"Stop babysitting local AI agents. Just notifications, approve, and resume your Codex,Pi, or Claude code sessions anywhere. 0-Intrusion mobile control bridge via Telegram/Wechat/飞书.   No hooks, no skills, no MCP.",2026-05-17 05:23:22+00:00,2026-06-01 06:58:09+00:00,247,13,247,16,Rust,4482,MIT,15,16.466666666666665,0.0526315789473684,0.0647773279352226,AI/ML
1249635932,cclank/lanshu-awesome-ai-video-kit,cclank,lanshu-awesome-ai-video-kit,https://github.com/cclank/lanshu-awesome-ai-video-kit,做企业 AI 视频项目逼出来的工具包 · 411 prompt · 15 模型 · 7 Claude Skill · 14 篇方法论,2026-05-25 22:55:46+00:00,2026-06-01 06:00:09+00:00,246,68,246,1,HTML,719,MIT,7,35.142857142857146,0.2764227642276423,0.0040650406504065,AI/ML
1239226792,rockorager/comview,rockorager,comview,https://github.com/rockorager/comview,the best diff viewer ever made,2026-05-14 22:17:40+00:00,2026-06-01 14:20:56+00:00,245,17,245,0,Go,1903,MIT,18,13.61111111111111,0.0693877551020408,0.0,Other
1231471576,CristianOlivera1/openhero,CristianOlivera1,openhero,https://github.com/CristianOlivera1/openhero,"The free, open collection of cinematic video hero sections Browse, preview, copy & download production-ready backgrounds - instantly.",2026-05-07 01:55:32+00:00,2026-05-23 02:17:22+00:00,245,22,245,0,TypeScript,303309,MIT,25,9.8,0.0897959183673469,0.0,Web
1250235788,kepengxu/PRISM-VL,kepengxu,PRISM-VL,https://github.com/kepengxu/PRISM-VL,"PRISM-VL studies measurement-grounded VLM learning with RAW-derived Meas.-XYZ inputs, camera-conditioned grounding, and exposure-bracketed supervision transfer.",2026-05-26 12:40:07+00:00,2026-05-27 14:27:55+00:00,244,14,244,1,Python,21521,Apache-2.0,6,40.66666666666666,0.0573770491803278,0.0040983606557377,Other
1250283885,Yeachan-Heo/gajae-code,Yeachan-Heo,gajae-code,https://github.com/Yeachan-Heo/gajae-code,Gajae Code MVP,2026-05-26 13:33:33+00:00,2026-06-02 10:50:41+00:00,244,28,244,7,TypeScript,40021,MIT,6,40.66666666666666,0.1147540983606557,0.0286885245901639,Other
1250434340,Voxybuns/at-icons,Voxybuns,at-icons,https://github.com/Voxybuns/at-icons,Open source icons for custom Godot nodes,2026-05-26 16:17:04+00:00,2026-05-30 13:51:01+00:00,243,1,243,0,HTML,621,MIT,6,40.5,0.0041152263374485,0.0,Web
1247923238,SMCGames/Paper-Mario-ReCut,SMCGames,Paper-Mario-ReCut,https://github.com/SMCGames/Paper-Mario-ReCut,A PC Port of Paper Mario for N64,2026-05-24 00:47:21+00:00,2026-06-01 20:31:42+00:00,243,5,243,0,C++,89589,MIT,8,30.375,0.0205761316872428,0.0,Other
1243242191,redteamfortress/PhantomKiller,redteamfortress,PhantomKiller,https://github.com/redteamfortress/PhantomKiller,Another BYOVD process killer. works on all EDR's. fully signed.,2026-05-19 07:00:59+00:00,2026-05-19 07:16:42+00:00,242,50,242,0,C++,1139,,13,18.615384615384617,0.2066115702479339,0.0,Other
1239969496,harmony-on-android/HOA,harmony-on-android,HOA,https://github.com/harmony-on-android/HOA,Run OpenHarmony hap on Android,2026-05-15 16:22:46+00:00,2026-06-01 17:44:46+00:00,242,13,242,2,Kotlin,16676,,17,14.235294117647058,0.0537190082644628,0.0082644628099173,Mobile
1231603094,wojtczyk/trust,wojtczyk,trust,https://github.com/wojtczyk/trust,TRUST – Coding Rust like it's 1989,2026-05-07 05:43:49+00:00,2026-05-27 04:06:12+00:00,241,6,241,0,Rust,1396,MIT,25,9.64,0.0248962655601659,0.0,CLI/Tooling
1252592714,BlackCandleLab/polymarket-trading-bot,BlackCandleLab,polymarket-trading-bot,https://github.com/BlackCandleLab/polymarket-trading-bot,"polymarket trading bot, polymarket trading bot, polymarket trading bot, polymarket trading bot, polymarket trading bot, polymarket trading bot, polymarket trading bot, polymarket arbitrage bot, polymarket trading bot, polymarket arbitrage bot, polymarket trading bot, polymarket arbitrage bot, polymarket trading bot, polymarket arbitrage bot, ",2026-05-28 17:14:14+00:00,2026-06-01 21:49:45+00:00,241,1821,241,0,JavaScript,1177,,4,60.25,7.556016597510373,0.0,Finance/Trading
1233662684,williamcachamwri/zalo-tg,williamcachamwri,zalo-tg,https://github.com/williamcachamwri/zalo-tg,"A bidirectional message bridge between Zalo and Telegram, implemented in TypeScript on Node.js",2026-05-09 07:49:40+00:00,2026-05-31 10:20:28+00:00,240,132,240,0,TypeScript,323,,23,10.434782608695652,0.55,0.0,Other
1238775512,alchaincyf/codex-orange-book,alchaincyf,codex-orange-book,https://github.com/alchaincyf/codex-orange-book,OpenAI Codex: The Complete Guide · 橙皮书系列 · GPT-5.5 时代的 AI 编程实战手册,2026-05-14 12:49:01+00:00,2026-05-15 16:07:49+00:00,240,18,240,0,HTML,43831,,18,13.333333333333334,0.075,0.0,AI/ML
1240701554,feicaiclub/video-spec-builder,feicaiclub,video-spec-builder,https://github.com/feicaiclub/video-spec-builder,"video-spec-builder —— 把我想做个视频逼成一份精确到秒的分镜脚本 video-spec.md,交给 HyperFrames 渲染。一条命令装到 Claude Code / Cursor / Codex:npx skills add feicaiclub/video-spec-builder",2026-05-16 13:10:41+00:00,2026-05-18 06:21:03+00:00,240,30,240,1,JavaScript,247,MIT,16,15.0,0.125,0.0041666666666666,AI/ML
1233345211,ReikanYsora/Helios,ReikanYsora,Helios,https://github.com/ReikanYsora/Helios,"☀️ 3D solar card for Home Assistant: live sun, clouds, PV production + forecast, battery, and LiDAR-cast shadows on your home.",2026-05-08 21:27:43+00:00,2026-06-02 09:51:32+00:00,240,5,240,3,TypeScript,96959,NOASSERTION,24,10.0,0.0208333333333333,0.0125,Other
1229388030,dpejoh/specter,dpejoh,specter,https://github.com/dpejoh/specter,Unified Play Integrity and root hiding stack for Android,2026-05-05 01:52:29+00:00,2026-06-01 22:11:15+00:00,239,13,239,2,TypeScript,9527,GPL-3.0,27,8.851851851851851,0.0543933054393305,0.00836820083682,Mobile
1242164545,whx-prog/SubspaceHunter-SAO,whx-prog,SubspaceHunter-SAO,https://github.com/whx-prog/SubspaceHunter-SAO,"一个开源可商用的XR动作游戏开源框架以及美术资产，灵感来源于SAO ；An open-source and commercially viable framework for XR action games, along with art assets, inspired by SAO.",2026-05-18 07:22:52+00:00,2026-06-02 02:56:55+00:00,239,66,239,0,C#,18627,MIT,14,17.071428571428573,0.2761506276150627,0.0,Game
1233332479,earthtojake/step.parts,earthtojake,step.parts,https://github.com/earthtojake/step.parts,"12,000+ open source STEP parts for your next CAD project",2026-05-08 21:02:57+00:00,2026-05-29 21:34:50+00:00,239,30,239,1,TypeScript,7687,MIT,24,9.958333333333334,0.1255230125523012,0.00418410041841,AI/ML
1236147743,entropyvortex/meta-llm-charter,entropyvortex,meta-llm-charter,https://github.com/entropyvortex/meta-llm-charter,Compact operational charter that turns LLM coding agents into disciplined principal engineers. Eleven rules + one meta-rule.,2026-05-12 01:51:04+00:00,2026-05-31 22:00:23+00:00,238,19,238,0,TypeScript,69,MIT,20,11.9,0.0798319327731092,0.0,AI/ML
1248795924,GU-Cryptography/anykb,GU-Cryptography,anykb,https://github.com/GU-Cryptography/anykb,AnyKB — 私有 RAG 知识库 + 透明 Agent,2026-05-25 04:02:27+00:00,2026-05-25 11:22:38+00:00,238,6,238,0,Python,331,,7,34.0,0.0252100840336134,0.0,AI/ML
1236315300,VirtualLUOUCAS/Chronicles-OCR,VirtualLUOUCAS,Chronicles-OCR,https://github.com/VirtualLUOUCAS/Chronicles-OCR,"Chronicles-OCR: A Cross-Temporal Perception Benchmark for the Evolutionary Trajectory of Chinese Characters (Seven Chinese Scripts, 2800 images)",2026-05-12 06:22:17+00:00,2026-06-02 03:51:24+00:00,238,12,238,0,Python,2743,,20,11.9,0.0504201680672268,0.0,Other
1249703818,hieunc229/mailflare,hieunc229,mailflare,https://github.com/hieunc229/mailflare,Email client with custom domain based on Cloudflare,2026-05-26 01:06:12+00:00,2026-05-27 02:57:58+00:00,237,36,237,1,TypeScript,488,NOASSERTION,6,39.5,0.1518987341772152,0.0042194092827004,Other
1235812056,ahalpha/Snowbreak-AnitAmend,ahalpha,Snowbreak-AnitAmend,https://github.com/ahalpha/Snowbreak-AnitAmend,尘白禁区反和谐模组 Snowbreak: Containment Zone Anti Amend / Censorship Mod,2026-05-11 17:19:17+00:00,2026-05-16 16:21:38+00:00,236,13,236,5,Lua,492468,,21,11.238095238095235,0.0550847457627118,0.0211864406779661,Other
1249401892,lceminecraft-launcher/LCE-Emerald-Launcher,lceminecraft-launcher,LCE-Emerald-Launcher,https://github.com/lceminecraft-launcher/LCE-Emerald-Launcher,lce emerald launcher minecraft  github Download minecraft legacy console edition,2026-05-25 16:58:07+00:00,2026-05-25 17:08:30+00:00,236,0,236,1,TypeScript,9,MIT,7,33.714285714285715,0.0,0.0042372881355932,Other
1235452828,QuanjianSong/FashionChameleon,QuanjianSong,FashionChameleon,https://github.com/QuanjianSong/FashionChameleon,"Official Pytorch Code of the Paper ""FashionChameleon: Towards Real-Time and Interactive Human-Garment Video Customization""",2026-05-11 10:41:01+00:00,2026-05-31 09:17:10+00:00,234,10,234,2,Python,22579,Apache-2.0,21,11.142857142857142,0.0427350427350427,0.0085470085470085,AI/ML
1241163667,lwwywang/AW4SR-academic-website-4-senior-researcher,lwwywang,AW4SR-academic-website-4-senior-researcher,https://github.com/lwwywang/AW4SR-academic-website-4-senior-researcher,"Conventional academic websites work well for basic information, but lack a structured way for senior researchers to present their work. **AW4SR** fills that gap.",2026-05-17 03:15:51+00:00,2026-05-21 16:16:44+00:00,234,21,234,0,TypeScript,1562,,15,15.6,0.0897435897435897,0.0,Other
